Tune,Title,Part,Structure
1,Shandon bells,A,"ab, cd; ab, ef."
1,Shandon bells,A1,"ab, cd; ab, ef."
1,Shandon bells,B,"A1f1a, bc; A1f1a, AeAf."
2,The piper's picnic,A,"ab, ac; ab, de."
2,The piper's picnic,B,"ab, cd; Aa1e, fAe."
3,Hartigan's fancy,A,"ab, ac; ab, de."
3,Hartigan's fancy,B,"Ab1Ac, Ab2a; Ad1Ac, bAe."
4,The yellow flail,A,"ab, b1c; de, fb1."
4,The yellow flail,B,"Ab3Ab3, Ab4a; Ab3Ab6, AfAb1."
4,The yellow flail,C,"ab, cAc; AdAe, AfAb1."
5,Kitty's rambles,A,"ab, cd; ab, ca1."
5,Kitty's rambles,B,"ab, cAa2; de, AcAa1."
5,Kitty's rambles,C,"ab, cd; ee1, AcAa1."
5,Kitty's rambles,D,"ab, cd; ef, AcAa1."
6,Doctor O'Neill,A,"ab, cd; ab, ce."
6,Doctor O'Neill,B,"AaAc1, Ab1Ad; AaAc1, Ab1Ae."
6,Doctor O'Neill,C,"Ba1a, a1b; Ba1a, a1c."
6,Doctor O'Neill,D,"Aa1a, bc; Aa1a, Ab1Ae."
6,Doctor O'Neill,E,"Ae1Ae2, Ae1Dc; Ae1Ae2, AcAe."
7,Denis Delaney,A,"ab, ac; ab, de."
7,Denis Delaney,B,"ab, cAc; ab, cAe."
7,Denis Delaney,C,"ab, ac; BaBb, BcAe."
8,The walls of Liscarroll,A,"ab, bc; ab, bd."
8,The walls of Liscarroll,B,"aa, Ab1Ad1; bc, AbAd."
9,The pipe on the hob,A,"ab, ca1; ad, ef."
9,The pipe on the hob,B,"ab, Acc; b1Ab1, AeAf."
9,The pipe on the hob,C,"Aaa, Aab; Aac, AeAf."
10,Guiry's favorite,A,"ab, cd; ae, fg."
10,Guiry's favorite,B,"ab, cd; ab, AfAg."
11,Malowney's wife,A,"ab, cd; ae, c1f."
11,Malowney's wife,B,"aAf1, AcAd; aAd1, Ac1Af."
11,Malowney's wife,C,"Ba1a, bAd; Ba1a, bAf."
12,The gold ring,A,"ab, ac; ad, eb."
12,The gold ring,B,"aAb, aAc; aAd, AeAb."
12,The gold ring,C,"ab, cd; ab, eAb."
12,The gold ring,D,"aa, aAb; aa, Ba1Ab."
12,The gold ring,E,"aAb, bAc; bb, AeAb."
12,The gold ring,F,"ab, cAb; ab, cAb."
12,The gold ring,G,"ab, FcAb; ab, FcAb."
13,The humors of Bantry,A,"ab, cd; ab, ce."
13,The humors of Bantry,B,"aa, bc; AaAb, dAe."
13,The humors of Bantry,B1,"aa, bc; ec1, fAe."
14,Off to the hunt,A,"ab, cd; ae, fg."
14,Off to the hunt,B,"Ae1Ae2, ab; Ac1b1, AfAg."
15,The highway to Dublin,A,"ab, ac; de, fg."
15,The highway to Dublin,B,"Ae1Ab, Ae1Ac; Ae1a, AfAg."
16,When sick is it tea you want?,A,"ab, cd; ab, ef."
16,When sick is it tea you want?,B,"ab, cd; AaAb, AeAf."
17,The eavesdropper,A,"ab, a1c; ab, a1d."
17,The eavesdropper,B,"aAc1, Aa1b; cd, Aa1Ad."
18,Saddle the pony,A,"ab, ac; ad, ef."
18,Saddle the pony,B,"ab, aAf; aAd, AeAf."
19,Humors of Glendart,A,"ab, ac; ab, de."
19,Humors of Glendart,B,"ab, ac; de, AdAe."
20,Have a drink with me,A,"ab, ac; ab, ad."
20,Have a drink with me,B,"ab, ac; de, AaAd."
21,The hag with the money,A,"ab, cd; eb, fg."
21,The hag with the money,B,"ab, ac; ac, dAg."
22,I know what you like,A,"aa1, bc; aa1, bd."
22,I know what you like,B,"ab, cd; c1e, AbAd."
23,The night cap,A,"ab, cd; ab, ef."
23,The night cap,B,"ab, cd; ae, Af1Af."
24,The maid at the well,A,"ab, cd; ab, ce."
24,The maid at the well,B,"ab, AcAd; ab, AcAe."
25,Sergt. Early's jig,A,"ab, cd; ef, gh."
25,Sergt. Early's jig,B,"aa1, AcAd; aa1, AgAh."
26,Castle Donovan,A,"ab, cd; ab, ce."
26,Castle Donovan,B,"ab, ac; AaAb, AcAe."
27,Jackson's frieze coat,A,"ab, ac; ab, dc."
27,Jackson's frieze coat,B,"ab, aa1; ab, aa1."
27,Jackson's frieze coat,C,"Ac1a, bb; Ac1a, cBa1."
28,Contentment is wealth,A,"aa1, bc; de, fg."
28,Contentment is wealth,B,"aAa1, AfAc; ab, cAg."
28,Contentment is wealth,C,"aAg, bc; de, c1Ag."
29,Cherish the ladies,A,"ab, cd; ae, fg."
29,Cherish the ladies,B,"ab, AcAd; ab, AfAg."
29,Cherish the ladies,C,"BaBb, aAd; bc, dAg."
29,Cherish the ladies,D,"Aa1Ac1, ab; cd, eAd."
29,Cherish the ladies,E,"aAa3, bDb; DcDd, DeAd."
29,Cherish the ladies,F,"ab, aAd; cd, DeAd."
30,Welcome to Cork,A,"ab, cd; ef, gh."
30,Welcome to Cork,B,"ab, cd; ab, eAh."
31,The widow Brady,A,"ab, ac; ab, de."
31,The widow Brady,B,"ab, cAa1; de, fAe."
32,The basket of Turf,A,"ab, cd; ab, ed."
32,The basket of Turf,B,"ab, cd; cb, AeAd."
33,Do you want anymore?,A,"ab, cd; eb, fg."
33,Do you want anymore?,B,"ab, ac; dAb1, AfAg."
34,Galway Tom,A,"ab, ac; ab, de."
34,Galway Tom,B,"ab, cd; ea1, AdAe."
34,Galway Tom,B1,"ab, cd; ea1, Adf."
34,Galway Tom,C,"aAb1, ab; aAb2, cb."
34,Galway Tom,D,"aBb, bBd; BeBa1, AdAe."
34,Galway Tom,D1,"aBb, bBd; BeBa1, AdB1f."
34,Galway Tom,E,"Ba5a, Ba5Ac; Ba5Bd1, AdB1f."
35,Money in both pockets,A,"ab, ac; ab, dd1."
35,Money in both pockets,B,"ab, aAa1; cd, eAd1."
36,Father Dollard's favorite,A,"ab, ac; ab, de."
36,Father Dollard's favorite,B,"ab, ac; aa1, dAe."
37,Tell her I am,A,"ab, cd; ab, ef."
37,Tell her I am,B,"ab, cAd; db, AeAf."
38,The mountain boy,A,"ab, cd; ab, ed."
38,The mountain boy,B,"ab, b1c; ab, AeAd."
39,A visit to Ireland,A,"ab, cd; ab, a1e."
39,A visit to Ireland,B,"ab, AcAd; ab, Aa1Ae."
40,Jerry's beaver hat,A,"ab, cd; ab, ef."
40,Jerry's beaver hat,B,"ab, ac; ab, dAf."
41,The tempelhouse jig,A,"ab, cd; ae, fg."
41,The tempelhouse jig,B,"ab, Ab1Ab2; ac, AfAg."
41,The tempelhouse jig,B1,"ab, Ab1Ab2; de, AfAg."
42,Move up to me,A,"ab, cd; ab, ef."
42,Move up to me,B,"Ac1Ab, Ac1Ae1; Ac1Ab, AeAf."
43,Paddy whack,A,"ab, cd; ef, gh."
43,Paddy whack,B,"ab, AcAd; ab, AgAh."
43,Paddy whack,B1,"ab, AcAd; AeAf, AgAh."
44,Nell Flaherty's drake,A,"ab, cd; ae, cf."
44,Nell Flaherty's drake,B,"ab, cAd; AaAb, AcAf."
45,Out with the boys,A,"ab, cd; ab, ce."
45,Out with the boys,B,"aa, ab; ac, de."
45,Out with the boys,C,"aa, bc; da, BdBe."
46,Katie's fancy,A,"ab, cd; ab, ce."
46,Katie's fancy,B,"ab, cd; AaAb, AcAe."
46,Katie's fancy,C,"ab, cAe1; Ad1Ae2, dAe."
47,Paddy from Portlaw,A,"ab, ac; ad, eb."
47,Paddy from Portlaw,B,"aAe1, ab; cd, eAb."
48,The miller of Glanmire,A,"ab, cc1; de, fg."
48,The miller of Glanmire,B,"Af1Ae, AcAc1; Af2Ae, AfAg."
49,The hare in the corn,A,"aa, bc; aa, bd."
49,The hare in the corn,B,"Ad1Ab, AbAc; Ad1Ab, AbAd."
49,The hare in the corn,C,"ab, AbAc; ac, db."
50,Daniel O'Rourke,A,"ab, ac; ad, c1e."
50,Daniel O'Rourke,B,"aAc2, ab; aAc2, cb."
50,Daniel O'Rourke,B1,"aAc2, ab; aAc2, dAe."
50,Daniel O'Rourke,C,"ab, cd; ae, B1dAe."
51,O'Sullivan's march,A,"ab, ac; ab, de."
51,O'Sullivan's march,B,"ab, cd; eAb, AdAe."
52,Tobin's favorite,A,"ab, cd; ae, fg."
52,Tobin's favorite,B,"ab, AcAd; AaAe, AfAg."
53,Banish misfortune,A,"ab, a1b1; ab, cd."
53,Banish misfortune,B,"ab, cd; ab, eAd."
53,Banish misfortune,B1,"ab, cd; fg, hAd."
53,Banish misfortune,C,"ab, AaAb; Aa1Ac, B1hAd."
54,The wheels of the world,A,"ab, cd; eb, cf."
54,The wheels of the world,B,"aAf1, AcAd; aAf1, AcAf."
54,The wheels of the world,B1,"aAf1, AcAd; AeAb, AcAf."
55,Kitty come over,A,"ab, cd; ab, ce."
55,Kitty come over,B,"ab, ac; AaAb, AcAe."
56,The humors of Cappa,A,"aa, bc; aa, de."
56,The humors of Cappa,B,"aAc, AbAc; aAc, AdAe."
57,The blazing turf fire,A,"ab, cd; ae, e1f."
57,The blazing turf fire,B,"ab, ac; ad, Ae1Af."
58,All covered with moss,A,"ab, ac; bd, eb1."
58,All covered with moss,A1,"ab, ac; bd, eb1."
58,All covered with moss,B,"Ae1Ae2, Ae1Ab1; Ae1Ae5, aAb1."
58,All covered with moss,B1,"Ae1Ae2, Ae1Ab1; bc, dAb1."
59,The priest's leap,A,"ab, ac; ad, ef."
59,The priest's leap,B,"aAb, aAc; aAd, AeAf."
60,The book of rights,A,"ab, cd; ab, ce."
60,The book of rights,B,"ab, cd; ed, AcAe."
61,The humors of whiskey,A,"ab, cd; ae, fg."
61,The humors of whiskey,B,"ab, cd; ab, eAg."
62,Fiddler's heaven,A,"ab, ac; ad, ef."
62,Fiddler's heaven,B,"ab, Aec; ad, eb."
63,A night at the fair,A,"ab, cd; ab, ef."
63,A night at the fair,B,"aAd1, bc; aAd1, dAf."
64,Darby the driver,A,"ab, cd; eb, cb."
64,Darby the driver,B,"aa, Ac1b; ac, dAb."
65,John White's mother,A,"ab, cc; de, ff."
65,John White's mother,B,"aAa1, bb; aAf1, cd."
66,The humors of Tralibane,A,"ab, cd; ab, ef."
66,The humors of Tralibane,B,"ab, ac; aAb1, dAf."
67,Connie the soldier,A,"ab, cd; ab, ef."
67,Connie the soldier,B,"Ab1a, bc; Ab1d, AeAf."
67,Connie the soldier,B1,"Ab1a, bc; ed, Af"
68,Out on the ocean,A,"ab, cd; ab, ce."
68,Out on the ocean,B,"Ab1Ab1, Ae1Aa1; ab, AcAe."
69,Philip O'Neill,A,"ab, cd; ad1, ec."
69,Philip O'Neill,B,"ab, Ad2c; ab, Aec1."
70,The besom in bloom,A,"ab, ac; ad, ef."
70,The besom in bloom,B,"Aa1Ab1, AaAb; Aa1Aa3, AeAf."
71,Courtney's favorite,A,"ab, ac; de, fc."
71,Courtney's favorite,A1,"ab, ac; de, gc."
71,Courtney's favorite,B,"aAb, ab; cd, Ae1b."
72,The merry old woman,A,"ab, cd; ef, gh."
72,The merry old woman,B,"AcAd, ab; AcAd, cAb."
72,The merry old woman,B1,"AcAd, ab; de, cAh."
73,Con Casey's jig,A,"ab, ac; ab, de."
73,Con Casey's jig,B,"ab, ac; aAb, AdAe."
74,A trip to the cottage,A,"ab, cd; ab, ce."
74,A trip to the cottage,B,"aAe1, bc; aAe1, dAb1."
75,Old man Dillon,A,"ab, cd; ae, c1f."
75,Old man Dillon,B,"Af1Af1, aAd; Af1Af1, Ac1Af."
75,Old man Dillon,B1,"Af1Af1, aAd; AaAe, Ac1Af."
76,Julia McMahon,A,"ab, cd; ab, ea."
76,Julia McMahon,B,"ab, cAd; aAb, AeAa."
76,Julia McMahon,B1,"ae1, cAd; Aee2, AeAa."
77,Drive the cows home,A,"ab, cd; eb1, fg."
77,Drive the cows home,B,"aAb1, Ab3b; aAb1, AfAg."
77,Drive the cows home,B1,"aAb1, Ab3b; cAd1, AfAg."
78,Happy to meet and sorry to part,A,"ab, b1c; de, fg."
78,Happy to meet and sorry to part,B,"ab, aAe1; cb1, AdAe."
78,Happy to meet and sorry to part,B1,"ab, aAe1; cb1, de."
79,The joy of my life,A,"ab, cd; ab, ce."
79,The joy of my life,B,"ab, Abc; b1b, AcAe."
79,The joy of my life,B1,"b2b, Abc; b3Ad2, AcAe."
80,The grumbling rustic,A,"ab, cc; ab, dd."
80,The grumbling rustic,B,"aAc1, AcAc; aAc1, AdAd."
80,The grumbling rustic,B1,"aAc1, AcAc; Ac1b, AdAd."
81,The humors of Ballycastle,A,"ab, ac; ab, de."
81,The humors of Ballycastle,B,"ab, cd; eAb, AdAe."
82,Doherty's fancy,A,"ab, cd; eb, fg."
82,Doherty's fancy,B,"ab, cd; eAg1, AfAg."
83,The girls of Banbridge,A,"ab, cd; ab, ef."
83,The girls of Banbridge,B,"ab, cd; ab, AeAf."
84,Wellington's advance,A,"ab, b1c; ab, de."
84,Wellington's advance,B,"ab, cAc; de, AdAe."
85,The old man's delight,A,"ab, cd; ab, eb1."
85,The old man's delight,B,"ab, AaAb; ab, Ab2Ab1."
86,Blackeyed Biddy,A,"ab, cd; ab, ce."
86,Blackeyed Biddy,B,"aAc1, bc; dAb, AcAe."
87,The jolly Corkonian,A,"ab, cd; ae, fg."
87,The jolly Corkonian,B,"ab, cAg1; ad, eAg."
88,Willy Walsh's jig,A,"ab, ac; ab, de."
88,Willy Walsh's jig,B,"ab, cd; ab, AdAe."
89,The boys of the town,A,"ab, ac; ad, ef."
89,The boys of the town,B,"ab, aAb1; ab, AeAf."
89,The boys of the town,B1,"ab, aAb1; cd, AeAf."
90,Petticoat loose,A,"ab, aa1; ac, de."
90,Petticoat loose,A1,"ab, aa1; ac, df."
90,Petticoat loose,B,"Ac1Aa3, ab; cAa3, dA1f."
91,The tailor's thimble,A,"ab, cb1; ab, de."
91,The tailor's thimble,A1,"ab, cb1; ab, df."
91,The tailor's thimble,B,"aAc1, Ad1b; cAc2, AdAe."
91,The tailor's thimble,B1,"aAc1, Ad1b; cAc2, AdA1f."
92,The humors of Ballingarry,A,"ab, cd; ab, ed."
92,The humors of Ballingarry,B,"aAd1, bc; aAd1, dAd."
93,Palm Sunday,A,"aa, bc; de, e1a1."
93,Palm Sunday,B,"aa, Ac1b; cAe, Ae1Aa1."
94,The road to Lurgan,A,"aa1, bc; aa1, da."
94,The road to Lurgan,B,"ab, aAc; ab, Ac1b1."
95,The sheep on the mountains,A,"ab, cc; aa1, dd."
95,The sheep on the mountains,B,"AaAb, AcAc; AaAb, Ada."
95,The sheep on the mountains,C,"ab, AcAc; ab, AdAd."
95,The sheep on the mountains,D,"CaCb, AcAc; Ca1Cb, AdAd."
96,Our own little isle,A,"ab, cd; ab, ce."
96,Our own little isle,B,"ab, ac; db, eAd."
97,The straw seat,A,"ab, ac; ab, de."
97,The straw seat,B,"aa, bb; aa, AdAe."
98,The flaxdresser,A,"ab, cd; ab, ef."
98,The flaxdresser,B,"Ab1a, Ab1b; a1c, dAc."
98,The flaxdresser,C,"aBa, bc; aBa, BdAc."
99,The races at Carrick,A,"ab, cd; ae, cf."
99,The races at Carrick,B,"ab, AdAb; ac, Add."
100,Condon's frolics,A,"ab, cd; ab, ef."
100,Condon's frolics,B,"Ada, bc; Ada, AeAf."
101,The idle road,A,"aa, bc; aa, bd."
101,The idle road,B,"Aa1a, Aa2Ab1; AaAa, AbAd."
102,Billy Barlow,A,"ab, cd; ef, gh."
102,Billy Barlow,B,"aAb, bAd; AeAf, AgAh."
103,A merry christmas,A,"ab, ac; ab, de."
103,A merry christmas,B,"ab, cd; a1e, AdAe."
104,Will you come home with me?,A,"ab, cc; ab, dd."
104,Will you come home with me?,B,"aAc1, AcAc; aAc1, AdAd."
105,The gobby o,A,"ab, cd; ae, fg."
105,The gobby o,B,"Ab1Aa1, ab; Ab1c, AfAg."
106,The humors of Mullinafauna,A,"ab, cc; bd, ef."
106,The humors of Mullinafauna,B,"Ad1a, Ac1Ac1; bAc1, AeAf."
107,Father O'Carroll,A,"ab, cd; b1b, eb2."
107,Father O'Carroll,B,"Ab3a, bAd; ca, AeAb2."
108,The rakes of Kildare,A,"ab, cd; ab, ea."
108,The rakes of Kildare,B,"aAb1, AcAd; aAb1, AeAa."
109,The tailor's wedding,A,"ab, cd; ab, ed."
109,The tailor's wedding,B,"ab, ac; ad, AeAd."
110,My former wife,A,"ab, cd; ae, e1f."
110,My former wife,B,"ab, Ae2c; ab, Ae1Af."
111,The sporting bachelor,A,"ab, cd; ab, ef."
111,The sporting bachelor,B,"aa, bc; Ae1d, ef."
112,The first night in America,A,"ab, cd; ab, ce."
112,The first night in America,B,"aAe1, bc; aAe1, Ab1Ae."
113,The best in the bag,A,"ab, ac; ab, de."
113,The best in the bag,B,"ab, ac; de, Ae1Ae."
114,The maid on the green,A,"ab, cd; ab, ef."
114,The maid on the green,B,"ab, cAc1; dAa, AbAf."
115,Stagger the buck,A,"ab, ac; ad, ef."
115,Stagger the buck,B,"aAb, aAc; aAd, AeAf."
116,Rory O'Moore,A,"ab, cd; ae, fg."
116,Rory O'Moore,B,"ab, cAd1; ab, cAb1."
116,Rory O'Moore,B1,"ab, cAd1; ab, cAd1."
117,The highlander,A,"aa, ab; aa, cd."
117,The highlander,B,"Aa1Aa2, Aa1Ad; Aa1Aa2, Aa1Ad."
118,Lannigan's ball,A,"ab, ca1; ab, de."
118,Lannigan's ball,B,"ab, ac; ab, AdAe."
119,Hide and go seek,A,"ab, cd; ae, fg."
119,Hide and go seek,B,"aAf1, bc; aAf2, de."
119,Hide and go seek,B1,"aAf1, bc; fg, hAa."
120,Fasten the leg in her,A,"ab, cd; ae, fg."
120,Fasten the leg in her,B,"Af1Aa1, AcAd; Af1Aa1, aAg."
121,The cliffs of Moher,A,"ab, cd; b1b, ce."
121,The cliffs of Moher,B,"aa, bc; aa, bb1."
122,Charley the prayermaster,A,"ab, cd; ab, ae."
122,Charley the prayermaster,B,"Ab1a, bc; Ab1d, AaAe."
123,Young Francis Mooney,A,"aa1, bc; aa1, de."
123,Young Francis Mooney,B,"aa, bc; ad, Ad1e."
124,Grandfather's pet,A,"aa, bc; aa, da1."
124,Grandfather's pet,B,"ab, ac; ad, ef."
125,Wasn't she fond of me?,A,"ab, ac; ab, de."
125,Wasn't she fond of me?,B,"Ada, AdAe; Adb, cd."
126,Wise Nora,A,"ab, ac; ad, c1c."
126,Wise Nora,B,"Ad1Ab, Ad1Ac; Ad1Ad, Ac1Ac."
126,Wise Nora,C,"aAd, bb; aAd, Ac1Ac."
126,Wise Nora,D,"aa, aAc; aa, aAc."
126,Wise Nora,E,"ab, cAc; ab, dAc."
126,Wise Nora,F,"ab, aAc; ab, DaAc."
127,The butcher's march,A,"ab, ab; ac, db."
127,The butcher's march,B,"aAb, aAb; aAb, AdAb."
128,Larry O'Gaff,A,"ab, cd; ab, ce."
128,Larry O'Gaff,B,"ab, cd; eAb, AcAe."
128,Larry O'Gaff,B1,"ab, cd; ef, AcAe."
129,The cat in the corner,A,"ab, cc; ab, de."
129,The cat in the corner,B,"ab, Aa1c; de, Ac1f."
130,Ballyhooley,A,"ab, cd; eb, fg."
130,Ballyhooley,B,"ab, ac; de, fAg."
131,The bow-legged tailor,A,"ab, cd; ae, fg."
131,The bow-legged tailor,B,"ab, cd; ae, fAg."
132,Larry Grogan,A,"ab, cd; ae, cf."
132,Larry Grogan,B,"ab, cd; ab, eAf."
133,The Killashandra lasses,A,"ab, cd; ab, ef."
133,The Killashandra lasses,B,"ab, AcAd; ab, AeAf."
133,The Killashandra lasses,B1,"ab, AcAd; cd, AeAf."
134,Young Tim Murphy,A,"ab, cd; ab, ef."
134,Young Tim Murphy,B,"ab, Ad1c; de, AeAf."
135,Boiled goat's milk,A,"ab, cd; ab, ef."
135,Boiled goat's milk,B,"ab, ac; ab, AeAf."
136,(Tatter Jack Walsh),A,"ab, cd; eb, cf."
136,(Tatter Jack Walsh),B,"aa, bc; AeAb, AcAf."
136,(Tatter Jack Walsh),C,"Bf1Ba, aBc; AeAb, AcAf."
137,The victor's return,A,"aa, bc; aa, de."
137,The victor's return,B,"aAe1, ab; ac, dAe."
138,Snug in the blanket,A,"ab, cd; ab, ed."
138,Snug in the blanket,B,"ab, ac; ad, AeAd."
138,Snug in the blanket,C,"Baa, BaAd; Bab, AeAd."
139,How are you Kitty?,A,"ab, ac; ab, de."
139,How are you Kitty?,B,"ab, Aac; b1b, AdAe."
139,How are you Kitty?,C,"Bb2a, Aab; Bb2a, cAe."
140,The silken wallet,A,"ab, ca1; ab, da2."
140,The silken wallet,B,"ab, ac; ab, de."
140,The silken wallet,B1,"ab, ac; fg, hAa3."
141,Behind the haystack,A,"ab, cc; ab, de."
141,Behind the haystack,B,"ab, AcAc; ab, AdAe."
141,Behind the haystack,C,"aa, AcAc; aa, AdAe."
142,The jolly old man,A,"ab, cd; ab, ef."
142,The jolly old man,B,"aAb1, bAd; cAb1, dAf."
142,The jolly old man,B1,"aAb1, bAd; AaAb, AeAf."
143,Handy with the stick,A,"ab, cd; ab, ce."
143,Handy with the stick,B,"ab, Ab1c; de, AcAe."
144,The house in the glen,A,"ab, cd; ab, ef."
144,The house in the glen,B,"ab, ac; ad, eAf."
145,Jackson's bottle of brandy,A,"ab, ac; ad, ec."
145,Jackson's bottle of brandy,B,"ab, cd; ab, AeAc."
146,Jackson's morning brush,A,"ab, cd; ab, ef."
146,Jackson's morning brush,B,"aAc1, bAd; aAc1, cAf."
146,Jackson's morning brush,C,"aBb1, bAd; aBb1, cAf."
146,Jackson's morning brush,D,"CaBb1, CbAd; ab, CcAf."
146,Jackson's morning brush,E,"Baa, BaAd; Baa, bAf."
147,Jackson's cravat,A,"ab, ac; ab, de."
147,Jackson's cravat,B,"ab, cAc; ab, cAe."
148,The Kinnegad slashers,A,"ab, ac; ad, ef."
148,The Kinnegad slashers,B,"aAb1, aa1; ab, AeAf."
148,The Kinnegad slashers,C,"aAb, aAc; aAb, AeAf."
149,The rakes of Clonmel,A,"ab, cd; ef, gb."
149,The rakes of Clonmel,B,"ab, cAd; Af1Af, AgAb."
149,The rakes of Clonmel,B1,"ab, cAd; dAd1, AgAb."
149,The rakes of Clonmel,C,"aAb1, B1d1b; B1dAa1, AgAb."
150,Nancy Hynes,A,"aa, bc; ab1, da1."
150,Nancy Hynes,B,"ab, Aa1c; ab, dAa1."
150,Nancy Hynes,B1,"ab, Aa1c; ef, Aag."
150,Nancy Hynes,C,"Aa1Ab2, AbAc; AaAb1, B1eAa1."
151,The pretty brown girl,A,"ab, ac; ad, ac."
151,The pretty brown girl,B,"Aa1a, bAb1; ba, AaAc."
152,Jackson's fancy,A,"ab, cd; ab, ae."
152,Jackson's fancy,B,"aAb1, ab; aAb1, cAe."
153,Young Tom Ennis,A,"ab, cd; ab, ef."
153,Young Tom Ennis,B,"ab, ac; ab, Acd."
154,The Antrim lasses,A,"ab, cd; ae, fg."
154,The Antrim lasses,B,"Ab1Ab1, Ad1Ad1; Aa1Ae, AfAg."
155,Jackson's rambles,A,"ab, cd; ab, ef."
155,Jackson's rambles,B,"ab, cd; ab, ef."
155,Jackson's rambles,B1,"ab, cd; gh, ef."
156,A draught of ale,A,"ab, ac; ad, ef."
156,A draught of ale,B,"aAb, aAc; aAd, AeAf."
157,The redhaired hag,A,"ab, cd; ae, fg."
157,The redhaired hag,B,"aAe, bAd; ac, AfAg."
158,The fairhaired boy,A,"ab, cd; ab, d1e."
158,The fairhaired boy,B,"ab, AcAd; ab, Ad1Ae."
158,The fairhaired boy,B1,"ab, AcAd; AaAb, Ad1Ae."
159,My darling asleep,A,"ab, cd; ab, ce."
159,My darling asleep,B,"ab, AcAd; AaAb, AcAe."
160,The kneebuckle,A,"ab, cd; ab, ed."
160,The kneebuckle,B,"Ad1a, Ad1b; Ad1a, AeAd1."
160,The kneebuckle,C,"BaAd1, BbAd1; BaAe, Ad"
161,The sod of turf,A,"ab, ac; ab, de."
161,The sod of turf,B,"ab, Adc; ab, AdAe."
162,The tenpenny bit,A,"ab, cd; eb, fg."
162,The tenpenny bit,B,"Ab1Ab2, Ab1a; bc, dAg."
163,The fisherman's widow,A,"ab, cd; ab, ef."
163,The fisherman's widow,B,"ab, ac; aAf1, AeAf."
163,The fisherman's widow,B1,"ab, ac; Ad1d, eAf."
164,The ladies of Carrick,A,"ab, ac; ad, ec."
164,The ladies of Carrick,B,"ab, aAc; ab, AeAc."
165,Charlie Stewart,A,"ab, cd; ef, gh."
165,Charlie Stewart,B,"Ad1Ag, Ad1Ad; Ad1Ag, aAh."
166,Jack-of-all-trades,A,"ab, cd; ab, cd1."
166,Jack-of-all-trades,B,"aAa1, bc; Ac1d, Ac2Ad1."
167,The boys of Ballinamore,A,"ab, ac; ab, aa1."
167,The boys of Ballinamore,B,"ab, ac; ab, dAc."
168,Miss Blair's fancy,A,"ab, cd; ab, ef."
168,Miss Blair's fancy,B,"Af1a, bc; Af1a, AeAf."
168,Miss Blair's fancy,B1,"Af1a, bc; Af3d, AeAf."
169,Easter Sunday,A,"ab, cd; ab, ef."
169,Easter Sunday,B,"ab, ac; ad, ea."
170,Jackson's rolling jig,A,"ab, aa1; ab, cd."
170,Jackson's rolling jig,B,"aAb, ab; aAb, AcAd."
171,The runaway bride,A,"ab, cd; ab, a1e."
171,The runaway bride,B,"aAb1, Ad1Ad; AaAb, Aa1Ae."
172,Black Donald the piper,A,"ab, ac; db, ec."
172,Black Donald the piper,B,"ab, aAc; ab, AeAc."
173,The dandy bonnet,A,"ab, cd; ea1, fg."
173,The dandy bonnet,B,"ab, cd; ae, fAg."
174,The humors of Trim,A,"ab, ac; ab, dc."
174,The humors of Trim,B,"AbAa1, aAc; Abb, AdAc."
175,The end of the day,A,"ab, cd; ab, ef."
175,The end of the day,B,"Ab1Af1, Ab1Af2; Ab1Ab1, AeAf."
176,Owen Malone,A,"aa, bc; aa, de."
176,Owen Malone,B,"ab, aAa1; ab, AdAe."
177,Bessy Murphy,A,"ab, cc; ab, de."
177,Bessy Murphy,B,"ab, AcAc; ab, AdAe."
178,Paddy O'Rafferty,A,"ab, ac; ad, ec."
178,Paddy O'Rafferty,B,"aAb, aAc; aAd, AeAc."
178,Paddy O'Rafferty,C,"ab, aAc; ac, Aca."
178,Paddy O'Rafferty,D,"CbCa, AcCa; CcAc, ab."
178,Paddy O'Rafferty,E,"DaAc, Daa; AeAc, DaDb."
178,Paddy O'Rafferty,E1,"DaAc, Daa; AeAc, bc."
178,Paddy O'Rafferty,F,"E1cAc, aEa; AeAc, E1bE1c."
178,Paddy O'Rafferty,F1,"E1cAc, aEa; AeAc, "
179,I do not incline,A,"ab, cd; ab, ef."
179,I do not incline,B,"ab, cAd; AaAb, AeAf."
180,The Gaelic club,A,"ab, cd; ae, fg."
180,The Gaelic club,B,"ab, ac; AaAe, AfAg."
181,The market town,A,"ab, cd; ab, ef."
181,The market town,B,"Aca, AcAd; Aca, AeAf."
181,The market town,B1,"Aca, AcAd; bc, AeAf."
182,The humors of Castlelyons,A,"aa1, bc; aa1, bd."
182,The humors of Castlelyons,B,"aa, AbAc; aa, AbAd."
182,The humors of Castlelyons,B1,"aa, AbAc; Aab, AbAd."
183,The dancingmaster,A,"aa, bc; ad, ca."
183,The dancingmaster,B,"ab, ac; ab, AcAa."
184,Farewell to my troubles,A,"ab, cd; ab, ce."
184,Farewell to my troubles,B,"ab, cd; Ac1Ab, AcAe."
185,The tongs by the fire,A,"ab, cd; ab, ec1."
185,The tongs by the fire,B,"ab, cd; Ae1e, fg."
186,The thief of Lough Erne,A,"ab, cd; ab, ee."
186,The thief of Lough Erne,B,"aa, bc; aa, Ac1Ae."
186,The thief of Lough Erne,B1,"aa, bc; ad, Ac1a."
187,Scatter the mud,A,"ab, ac; ad, ef."
187,Scatter the mud,B,"aAf, aAc; bc, AeAf."
188,The priest and his boots,A,"ab, cd; eb, fg."
188,The priest and his boots,B,"aAd1, AcAd; bc, AfAg."
189,The three little drummers,A,"ab, ac; ab, de."
189,The three little drummers,B,"ab, aAd; ab, AdAe."
189,The three little drummers,C,"ab, ab; ab, AdAe."
190,O'Mahony's frolics,A,"ab, cd; ab, ef."
190,O'Mahony's frolics,B,"ab, Aa1c; ad, ef."
190,O'Mahony's frolics,B1,"ab, Aa1c; bg, AeAf."
191,The Limerick tinker,A,"ab, ac; ad, ec."
191,The Limerick tinker,B,"Ac1a, Ac1Ab1; Ac1b, AeAc."
191,The Limerick tinker,C,"aBb, ab; cd, AeAc."
192,The boy from the mountain,A,"aa1, ab; ac, db."
192,The boy from the mountain,A1,"aa1, ab; ac, db."
192,The boy from the mountain,B,"aAd, ab; aAd, AdAb."
192,The boy from the mountain,C,"BaAd, BaBb; Baa, AdAb."
193,The woodcock,A,"ab, ac; ab, de."
193,The woodcock,A1,"ab, ac; ab, df."
193,The woodcock,B,"Ae1a, Aab; Ae1a, Adc."
193,The woodcock,C,"aBa, AaBb; aBa, AdA1f."
194,Dunmanway lasses,A,"ab, ac; ab, de."
194,Dunmanway lasses,B,"ab, ac; de, fAe."
195,The boys of Ballinafad,A,"ab, cd; ae, fg."
195,The boys of Ballinafad,B,"Aaa, Aab; Aaa, AdAg."
196,Let it be so,A,"ab, ac; ad, ec."
196,Let it be so,B,"aAa1, bc; dAb1, AaAc."
197,The short grass,A,"ab, ac; ab, de."
197,The short grass,B,"ab, cd; ab, ef."
197,The short grass,B1,"ab, cd; gh, AdAe."
198,Miss Monroe's jig,A,"ab, ac; ab, de."
198,Miss Monroe's jig,B,"aAe1, bc; bd, AdAe."
199,The spotted cow,A,"ab, ac; ab, de."
199,The spotted cow,B,"aa, bAe; cc, a1Ae."
199,The spotted cow,C,"ab, ac; ab, Add."
200,Daniel of the sun,A,"ab, cc; ab, dd."
200,Daniel of the sun,B,"aAb, bAc; cAb, AdAd."
200,Daniel of the sun,C,"aAb, AcAc; AaAb, AdAd."
201,Biddy's wedding,A,"ab, ac; ab, dc."
201,Biddy's wedding,B,"Aaa, AaAc; Aab, AdAc."
202,Paddy O'Carroll,A,"ab, cd; ab, ce."
202,Paddy O'Carroll,B,"ab, cd; ab, AcAe."
203,Haste to the wedding,A,"ab, cd; ab, ea1."
203,Haste to the wedding,B,"ab, Ab1c; dAb, AeAa1."
204,The little house under the hill,A,"ab, ac; ad, a1c."
204,The little house under the hill,B,"aAb, aAc; ab, cAc."
204,The little house under the hill,C,"ab, aAc; ab, BcAc."
205,Breeches Mary,A,"ab, cd; ab, ef."
205,Breeches Mary,B,"ab, aAd; ab, AeAf."
206,Jimmy O'Brien's jig,A,"ab, cb; ab, de."
206,Jimmy O'Brien's jig,B,"aAe1, ab; aAe1, AdAe."
206,Jimmy O'Brien's jig,C,"ab, aBb; ab, AdAe."
207,I will if I can,A,"ab, ac; ad, ef."
207,I will if I can,B,"aAb, aAc; aAd, bAf."
208,Miss Wiseman's fancy,A,"ab, cd; ab, d1e."
208,Miss Wiseman's fancy,B,"ab, cd; ab, Ad1Ae."
208,Miss Wiseman's fancy,C,"aAb, Bcb; cAb, Ad1Ae."
209,Green sleeves,A,"ab, cd; ab, ed1."
209,Green sleeves,B,"ab, cb1; aAb, AeAd1."
210,The miners of Wicklow,A,"ab, cd; ae, fg."
210,The miners of Wicklow,A1,"ab, cd; ae, hb1."
210,The miners of Wicklow,B,"ab, cd; eb1, A1hAb1."
210,The miners of Wicklow,B1,"ab, cd; eb1, AfAg."
211,My brother Tom,A,"ab, ac; ab, dc."
211,My brother Tom,B,"ab, cd; ab, AbAc."
211,My brother Tom,B1,"ab, cd; ef, gAc."
212,Paddy's resource,A,"ab, ca1; ab, ca2."
212,Paddy's resource,B,"Aba, Aba; Abb, cd."
213,Before I was married,A,"ab, ac; ab, dc."
213,Before I was married,B,"ab, cd; ab, cd."
214,The old grey goose,A,"ab, cd; ef, gb."
214,The old grey goose,B,"aa, bc; ad, AgAb."
214,The old grey goose,C,"aBc1, Ba1b; cBa1, AgAb."
214,The old grey goose,D,"Ad1Ab, Ad1a; Ad1b, AgAb."
214,The old grey goose,E,"ab, ac; aBd, AgAb."
214,The old grey goose,F,"aAb, bAd; Aec, Agd."
215,Hinchy's delight,A,"ab, cd; ab, ce."
215,Hinchy's delight,B,"aa, bc; dAe1, eAe."
215,Hinchy's delight,C,"ab, AcAd; ac, AcAe."
216,Come now or stay,A,"ab, cd; ab, ea1."
216,Come now or stay,B,"ab, cd; ab, ec1."
217,Buttermilk Mary,A,"ab, cd; ef, gh."
217,Buttermilk Mary,B,"ab, cAh1; Ac1Ad1, dAh."
218,The Connachtman's rambles,A,"ab, cd; ae, fg."
218,The Connachtman's rambles,B,"aAd1, ab; cd, Ag1Ag."
219,Father Fielding's favorite,A,"ab, cd; ae, fg."
219,Father Fielding's favorite,B,"aAb1, ab; ac, dAg."
220,Father Tom's wager,A,"ab, cd; ab, ce."
220,Father Tom's wager,B,"ab, cd; ae, d1Ae."
221,Bryan O'Lynn,A,"ab, ac; ab, de."
221,Bryan O'Lynn,B,"Aa1a, bc; Aa1a, dAc."
222,O'Gallagher's frolics,A,"ab, cd; ab, ef."
222,O'Gallagher's frolics,B,"ab, Ab1c; Ac1Ac2, AeAf."
223,The rambler from Clare,A,"ab, cd; ab, ef."
223,The rambler from Clare,B,"ab, cb; ad, AeAd."
224,Biddy Maloney,A,"ab, cd; ae, fg."
224,Biddy Maloney,B,"Ag1Ac2, ab; Ac3c, dAg."
224,Biddy Maloney,C,"ab, BaBb; cb, BdAg."
224,Biddy Maloney,D,"ab, cd; eCb1, AfAg."
224,Biddy Maloney,E,"Aa2Aa2, BaBb; Aa2Aa2, aCb."
224,Biddy Maloney,F,"ab, cAf1; ad, Bd1Cb."
224,Biddy Maloney,G,"Af2a, BaBb; Af2a, AfAg."
225,The newmarried couple,A,"ab, cd; ab, ef."
225,The newmarried couple,B,"AcAa1, AcAd; aAb, AeAf."
226,Tim Hogan's jig,A,"ab, ac; ab, dc."
226,Tim Hogan's jig,B,"ab, cAc1; aAc1, AdAc."
226,Tim Hogan's jig,C,"ab, ac; ab, AdAc."
227,Dick Sullivan's favorite,A,"ab, ac; ab, dc."
227,Dick Sullivan's favorite,B,"ab, cd; ae, AdAc."
