Tune,Title,Part,Structure
227,Dick Sullivan's favorite,C,"ab, ac; aBe, AdAc."
228,Come to dinner,A,"ab, cd; ae, fa."
228,Come to dinner,B,"ab, cd; ab, cAa."
229,The jolly jocker,A,"ab, ac; ad, ef."
229,The jolly jocker,B,"ab, ac; ab, dAf."
230,Mixing the punch,A,"ab, cd; ef, gh."
230,Mixing the punch,B,"ab, cd; ec1, AgAh."
231,Finerty's frolic,A,"ab, cd; ae, fd."
231,Finerty's frolic,B,"ab, cAd1; dAb, AfAd."
232,Old as the hills,A,"ab, ac; db, ef."
232,Old as the hills,B,"aAa1, Acb; cb, da."
232,Old as the hills,C,"Aa1Ac, BbBc; BbBd, a"
233,Long John's wedding,A,"ab, ac; ab, ad."
233,Long John's wedding,B,"aAd1, Acb; Aa1c, AaAd."
234,Kit O'Mahoney's jig,A,"ab, cd; ef, gh."
234,Kit O'Mahoney's jig,B,"aAg, ab; cAc1, AgAf."
234,Kit O'Mahoney's jig,C,"ab, cd; ae, AgAh."
234,Kit O'Mahoney's jig,D,"aAg, BaAc2; bAg1, AgAh."
235,The humors of Drinagh,A,"ab, ac; ab, da1."
235,The humors of Drinagh,B,"ab, ab; bc, AdAa1."
235,The humors of Drinagh,C,"ab, ac; aAb, AdAa1."
235,The humors of Drinagh,D,"Bc1Cb1, Bc1a; BbBc, bAa1."
236,The gallowglass,A,"ab, cd; ae, fb."
236,The gallowglass,B,"aAb, AcAd; ab, AfAb."
236,The gallowglass,C,"BaAb, AcAd; aAf1, bAb."
237,The Fardown farmer,A,"ab, ac; ab, de."
237,The Fardown farmer,B,"ab, aa1; ab, AdAe."
238,The old horned sheep,A,"ab, ac; ab, de."
238,The old horned sheep,B,"aa, ab; ac, Ac1d."
239,The Laccarue boys,A,"ab, cd; ab, ef."
239,The Laccarue boys,B,"aAb, bc; dAb, AeAf."
240,The lark in the morning,A,"ab, cd; ef, gh."
240,The lark in the morning,B,"ab, cd; de, AgAh."
241,Sergt. Stack's favorite,A,"ab, ac; ab, de."
241,Sergt. Stack's favorite,B,"ab, ac; ad, AaAa1."
242,The ruins of Killmallock,A,"ab, cd; ae, fg."
242,The ruins of Killmallock,B,"ab, cAd1; ab, Ad2d."
243,The Mountaineers' march,A,"ab, cb; ab, cd."
243,The Mountaineers' march,B,"Ab1a, Ab1b; Ab1c, dAd."
244,The top of Cork road,A,"ab, b1c; ab, b1d."
244,The top of Cork road,B,"ab, cd; eAb1, Ada."
244,The top of Cork road,C,"BbBc, BdBe; Ab1Ad, "
245,The Monaghan jig,A,"ab, ac; ab, de."
245,The Monaghan jig,B,"ab, cAe; ab, AdAe."
245,The Monaghan jig,C,"aBc1, ab; aBc1, AdAe."
246,The mooncoin jig,A,"ab, cd; ab, ed."
246,The mooncoin jig,B,"ab, ac; aAd1, dAd."
246,The mooncoin jig,C,"ab, cAd; ad, eAd."
247,The bashful maid,A,"ab, cd; ab, ef."
247,The bashful maid,B,"Af1a, AcAd; Af1b, cAf."
248,The Barrowstown races,A,"ab, cd; ae, fg."
248,The Barrowstown races,B,"ab, cb; Ad1Ae, AfAg."
248,The Barrowstown races,C,"ab, cAg1; dd1, AfAg."
248,The Barrowstown races,D,"aBc1, Ae1b; cBg1, AfAg."
249,The flitch of Bacon,A,"ab, ac; ab, dc."
249,The flitch of Bacon,B,"ab, ac; ab, AdAc."
250,Paddy in London,A,"ab, cd; ab, ef."
250,Paddy in London,B,"ab, AcAd; ab, AeAf."
250,Paddy in London,B1,"ab, AcAd; AaAb, AeAf."
250,Paddy in London,C,"Ad1a, AcAd; bAb, AeAf."
251,The angry peeler,A,"ab, cb1; ab, cd."
251,The angry peeler,B,"aAa1, Acb; aAa1, cd."
252,The cook in the kitchen,A,"ab, ac; ab, de."
252,The cook in the kitchen,B,"aAb1, AaAc; ab, AdAe."
252,The cook in the kitchen,C,"Ba1a, AdAc; Ba1a, AdAe."
253,The humors of Dingle,A,"ab, cd; ae, fg."
253,The humors of Dingle,B,"ab, cd; ae, e1Ag."
254,The absent-minded man,A,"ab, cd; ab, ef."
254,The absent-minded man,B,"aa, bb; cAd1, de."
255,Felix the wrestler,A,"ab, cc1; ab, c2d."
255,Felix the wrestler,B,"Aaa, bc; Aaa, Ac2Ad."
255,Felix the wrestler,B1,"Aaa, bc; dAc4, eAd."
256,The night dance,A,"ab, ac; c1d, ef."
256,The night dance,B,"ab, ac; ad, eAc."
256,The night dance,C,"ab, aAc; Ac1Ad, AeAf."
257,Morgan Rattler,A,"ab, ac; ab, dc."
257,Morgan Rattler,B,"ab, cd; ab, eAc."
257,Morgan Rattler,C,"ab, aAc; ac, AaAc."
257,Morgan Rattler,D,"BcBe1, BcBd; BcBe1, BeAc."
257,Morgan Rattler,E,"BcBe1, BcBd; ab, BeAc."
257,Morgan Rattler,F,"Ac2Be1, Ac2Bd; Be2a, bAc."
257,Morgan Rattler,G,"Ab1a, Ab1Ac; Ab1b, AdAc."
257,Morgan Rattler,H,"EaAd1, EaAa1; EaEb, BeAc."
257,Morgan Rattler,I,"ab, aAa1; aCc, AaAc."
257,Morgan Rattler,J,"Aba, AbAc; Aba, AdAc."
257,Morgan Rattler,K,"ab, aAc; ac, dAc."
258,Wallop the potlid,A,"ab, ac; ab, bd."
258,Wallop the potlid,B,"Aca, bc; de, fg."
258,Wallop the potlid,C,"ab, ac; ad, ef."
258,Wallop the potlid,D,"Cda, CdCc; Cda, bCd1."
258,Wallop the potlid,E,"BbBa, BbBf1; BdBe, BfBg."
258,Wallop the potlid,F,"AcBa, BbBf2; aAd1, DaBg."
259,Paddy's whiskers,A,"ab, cd; ab, ef."
259,Paddy's whiskers,B,"ab, cd; Aae, AeAf."
260,The Frieze Breeches,A,"aa1, bc; aa1, de."
260,The Frieze Breeches,B,"aAb1, AbAc; aAb1, AdAe."
260,The Frieze Breeches,C,"BaAb1, Be1Ab1; Ab3Ab1, AdAe."
260,The Frieze Breeches,D,"Aea, bAb1; Aea, AdAe."
260,The Frieze Breeches,E,"Da1a, bAc2; Da1a, cDa3."
260,The Frieze Breeches,F,"Ac2Ab1, aAc; Ac2Ab1, AdAe."
260,The Frieze Breeches,G,"aEb, BaAb1; ab, AdAe."
260,The Frieze Breeches,H,"GaEb, BaAb1; EaFa2, AdAe."
261,The humors of Ayle House,A,"ab, cd; cc1, b1d."
261,The humors of Ayle House,B,"aAb, aAd; aAc1, Ab1Ad."
262,Bold John O'Leary,A,"ab, cd; ef, gh."
262,Bold John O'Leary,B,"aAh1, Ah2Aa; bc, AeAh."
263,The humors of Cavan,A,"ab, cd; ab, ce."
263,The humors of Cavan,B,"ab, aAa; ac, dAa."
264,The banks of Lough Gowna,A,"ab, ac; ab, de."
264,The banks of Lough Gowna,B,"ab, ac; ab, de."
265,The twopenny jig,A,"ab, ac; ad, ef."
265,The twopenny jig,A1,"ab, ac; ad, eg."
265,The twopenny jig,B,"ab, AaAc; ab, AeA1g."
265,The twopenny jig,B1,"ab, AaAc; cd, AeAf."
266,The green meadow,A,"ab, ac; ab, dc."
266,The green meadow,B,"ab, ac; ad, eAd1."
266,The green meadow,B1,"ab, ac; Ac1f, eAc."
267,The merry maiden,A,"ab, ac; ab, de."
267,The merry maiden,B,"ab, cd; ab, eAe."
268,Blue bonnets jig,A,"ab, cd; ab, ef."
268,Blue bonnets jig,B,"ab, cd; ab, eAf."
269,The field of flowers,A,"ab, ac; ad, ae."
269,The field of flowers,B,"aAe1, bc; dAd, AaAe."
270,The glens of Mayo,A,"ab, cd; ae, af."
270,The glens of Mayo,B,"ab, Ac1c; ad, Aa1e."
271,I'll neither spin nor weave,A,"ab, b1a1; ab, ac."
271,I'll neither spin nor weave,B,"ab, cAa; ab, AaAc."
272,Jackson's maid,A,"ab, cd; ab, ce."
272,Jackson's maid,B,"aAd1, bc; dAb, AcAe."
273,The Kilfinane jig,A,"ab, cd; ef, gh."
273,The Kilfinane jig,B,"Ae1a, Ae1b; Ae1c, AgAh."
274,Walk out of it Hogan,A,"ab, ac; ad, ec."
274,Walk out of it Hogan,B,"AaAa, AaAc; AaAb1, AaAc."
274,Walk out of it Hogan,C,"ab, cd; eAe1, Ac1f."
274,Walk out of it Hogan,D,"AaAa, Aaa; Aab, AaAc."
274,Walk out of it Hogan,E,"ab, ac; aCb, AaAc."
275,The boys of Comanore,A,"ab, ac; db, ef."
275,The boys of Comanore,B,"ab, cd; ab, eAf."
276,The barefoot boy,A,"ab, ac; ad, eb1."
276,The barefoot boy,B,"Aea, AeAd1; Aea, AeAb1."
276,The barefoot boy,B1,"Aea, AeAd1; bc, dAb3."
277,The onehorned cow,A,"ab, ac; ab, de."
277,The onehorned cow,B,"ab, ac; ab, AdAe."
278,Sweet Biddy Daly,A,"ab, cd; ab, ce."
278,Sweet Biddy Daly,B,"ab, cd; ab, AcAe."
279,The geese in the bogs,A,"ab, ac; ad, ef."
279,The geese in the bogs,B,"ab, Adc; ad, AeAf."
279,The geese in the bogs,B1,"ab, Adc; ad, AeAc."
280,Going to Donnybrook,A,"ab, cd; ab, ce."
280,Going to Donnybrook,B,"ab, ac; ad, eAe."
280,Going to Donnybrook,B1,"ab, ac; ad, fg."
281,Wallop the spot,A,"ab, ac; ab, c1c."
281,Wallop the spot,B,"ab, aAc; ac, dAc."
281,Wallop the spot,C,"ab, aAc; ac, dAc."
281,Wallop the spot,D,"ab, AbAc; ab, Ac2Ac."
282,Take it easy,A,"ab, ac; ab, de."
282,Take it easy,B,"Ab1a, Ab1Ad1; Ab1a, Ad2Ae."
282,Take it easy,C,"ab, ac; ab, dAe."
283,The man who died and rose again,A,"ab, ac; ad, c1e."
283,The man who died and rose again,B,"ab, ac; dAd, Ac1Ae."
284,Kitty of Oulart,A,"aa, bc; aa, de."
284,Kitty of Oulart,B,"ab, Ae1c; ab, AdAe."
284,Kitty of Oulart,C,"Baa, bc; Baa, bAe."
285,Strop the razor 1st setting,A,"ab, ac; ad, ec."
285,Strop the razor 1st setting,B,"ab, cAc; ab, AeAc."
286,Strop the razor 2nd setting,A,"ab, ac; ab, dc."
286,Strop the razor 2nd setting,B,"ab, aAc; ab, cAc."
286,Strop the razor 2nd setting,C,"ab, BcAc; ab, BcAc."
286,Strop the razor 2nd setting,D,"ab, aAc; aAd, AdAc."
287,Gillan's apples,A,"ab, cd; ae, fd1."
287,Gillan's apples,B,"ab, Ac2c; ad, AfAd1."
287,Gillan's apples,C,"ab, ac; aAe, AfAd1."
287,Gillan's apples,D,"aCa1, Ac3b; ac, a1Ad1."
288,The Gudgeon of Maurice's Car,A,"aa1, ab; aa1, cd."
288,The Gudgeon of Maurice's Car,B,"aAa1, aAb; bAa1, AcAd."
289,The humors of Ballydehob,A,"ab, bc; ab, de."
289,The humors of Ballydehob,B,"ab, Abc; ab, AdAe."
290,The luck penny,A,"ab, cd; ae, a1f."
290,The luck penny,B,"ab, cd; ef, gAf."
290,The luck penny,C,"ab, cd; aBf, d1Af."
291,The Blarney pilgrim,A,"aa1, bc; aa1, bd."
291,The Blarney pilgrim,B,"ab, ac; db, Abe."
291,The Blarney pilgrim,C,"aAa1, AbAc; aAa1, Ad1Ad."
292,The dairy maid,A,"ab, cd; a1e, fg."
292,The dairy maid,B,"Af1Aa2, aAd; Aa1Ae, AfAg."
293,How much has she got?,A,"ab, ac; ad, ef."
293,How much has she got?,B,"ab, cd; aAd, AeAf."
294,The rivals,A,"ab, ac; de, b1f."
294,The rivals,B,"aAd, bc; ad, Ab1Af."
294,The rivals,C,"BaAd, BbBc; BbBd, Ab1Af."
295,All alive,A,"ab, cd; d1e, fb."
295,All alive,B,"ab, cd; ae, Ad2Ab."
296,Barney O'Neill,A,"ab, cd; ab, be."
296,Barney O'Neill,B,"ab, cd; ef, AbAe."
297,Johnny the jumper,A,"ab, cd; aa, ed."
297,Johnny the jumper,B,"ab, cAd; ad, AeAd."
298,Paddy "go easy",A,"ab, ac; ad, ec."
298,Paddy "go easy",B,"ab, cd; ef, gAc."
298,Paddy "go easy",C,"aAb, aAc; aAd, AeAc."
299,Be easy you rogue!,A,"aa1, ab; ac, da."
299,Be easy you rogue!,B,"aAa1, aAb; Aab, AdAa."
299,Be easy you rogue!,C,"ab, AdAb; cd, AdAa."
299,Be easy you rogue!,D,"Ad1Aa1, Ad1Ab; Ad1Bb, AdAa."
300,Apples in winter,A,"ab, cd; ef, gh."
300,Apples in winter,B,"Ae1a, Ae2b; Ae1c, de."
300,Apples in winter,B1,"Ae1a, Ae2b; fg, AgAh."
301,The humors of Castle Comer,A,"ab, ca1; ab, da."
301,The humors of Castle Comer,B,"Ab1a, AcAa1; Ab1a, AdAa."
302,The black rogue,A,"ab, ac; aa, dc."
302,The black rogue,B,"ab, ac; dAa1, AaAc."
303,The ranting rake,A,"ab, cd; ab, ca."
303,The ranting rake,B,"Ad1Aa1, ab; Aa1c, dAa."
304,The blooming meadows,A,"ab, a1a1; ac, de."
304,The blooming meadows,B,"ab, cc; ab, AdAe."
304,The blooming meadows,B1,"ab, cc; Ab1Ac1, AdAe."
305,Delaney's drummers,A,"aa1, bc; de, fg."
305,Delaney's drummers,B,"ab, cd; eb, AfAg."
305,Delaney's drummers,B1,"ab, cd; fg, AfAg."
306,Crabs in the skillet,A,"ab, cd; ab, ef."
306,Crabs in the skillet,A1,"ab, cd; ab, ee."
306,Crabs in the skillet,B,"Ac1a, bAe; Ac1a, bAe."
306,Crabs in the skillet,B1,"Ac1a, bAe; Ac1a, bAf."
306,Crabs in the skillet,C,"AbAa1, AcAd; AbAa2, AeAf."
306,Crabs in the skillet,C1,"AbAa1, AcAd; AbAa2, AeAe."
307,The woeful widow,A,"ab, cd; ab, ce."
307,The woeful widow,B,"aAa1, bAb; aAa1, Abc."
308,The cat and the bacon,A,"ab, ac; ab, de."
308,The cat and the bacon,B,"ab, cAa1; AaAb, de."
309,The galloping young thing,A,"ab, ac; ad, ef."
309,The galloping young thing,B,"aAd, ab; aAd, AeAf."
310,The bridal jig,A,"ab, cd; ab, ce."
310,The bridal jig,B,"aa1, Ac1b; aa1, Ac1b."
310,The bridal jig,B1,"aa1, Ac1b; aa1, Ac1b."
311,The man in the moon,A,"ab, cd; ae, fg."
311,The man in the moon,B,"aAe1, bc; ac, AfAg."
312,Come with me now,A,"ab, cd; aa1, ef."
312,Come with me now,B,"ab, ac; aAa1, AeAf."
313,The frost is all over,A,"ab, cd; ab, ce."
313,The frost is all over,B,"aAa1, ab; aAa1, cc."
313,The frost is all over,C,"BaAa1, BaBb; aAa4, Bcb."
314,Sally Magee,A,"ab, a1c; ad, ef."
314,Sally Magee,B,"aAc1, aAc2; aAc1, AeAf."
315,The red rose,A,"ab, cd; ab, ce."
315,The red rose,B,"ab, AcAd; aAb, AcAe."
316,The humors of Glynn,A,"ab, cd; ae, fb."
316,The humors of Glynn,B,"ab, cd; AaAe, AfAe."
317,The Irishwoman,A,"ab, cd; ab, ef."
317,The Irishwoman,B,"aAb1, Ab2b; cd, AeAf."
318,The merry huntsman,A,"ab, ac; ad, ec."
318,The merry huntsman,B,"aAc1, ab; aAc1, Aeb."
318,The merry huntsman,B1,"aAc1, ab; aAc1, Aec."
319,The fairy jig,A,"ab, cd; ae, fg."
319,The fairy jig,B,"aa1, AcAd; aa1, AcAg."
320,The piper's welcome,A,"ab, cd; d1b, ed."
320,The piper's welcome,B,"ab, ac; ab, Ad2Ad."
320,The piper's welcome,C,"BaAe1, BaAd; BaAe2, aAd."
321,Oh! Hag you have killed me,A,"aa1, bc; ac1, dd."
321,Oh! Hag you have killed me,B,"aAb1, AbAc; Ab2Ab1, AdAd."
322,The full moon,A,"aa, bc; aa, de."
322,The full moon,B,"aAa, Ae1Ae1; AaAa, AdAe."
323,Yesterday morning,A,"ab, cd; ab, ef."
323,Yesterday morning,B,"Ab1a, AcAd; AaAb, AeAf."
324,Castletown Conners,A,"ab, cd; ab, ef."
324,Castletown Conners,B,"ab, aAf1; ab, AeAf."
325,Martin's onehorned cow,A,"ab, ac; ab, de."
325,Martin's onehorned cow,B,"Ad1Ad2, Ad1a; Ad1Ad2, AdAe."
326,Ollistrun jig,A,"ab, ab; ac, de."
326,Ollistrun jig,B,"aAb1, ab; aAb1, cb."
327,Stay where you are,A,"ab, cb; a1b, cd."
327,Stay where you are,A1,"d1b, cb; a1b, cd."
327,Stay where you are,B,"Ad1a, ba; ca, dAd."
327,Stay where you are,B1,"Ad1a, ba; ca, dAd."
327,Stay where you are,C,"Ad1Ac, AcAc; Aa1Ac, aAd."
327,Stay where you are,C1,"Ad1Ac, AcAc; Aa1Ac, aAd."
327,Stay where you are,D,"Ad1"
328,Miss Walsh's fancy,A,"ab, ac; ab, de."
328,Miss Walsh's fancy,B,"Ada, Adb; Ada, AdAe."
328,Miss Walsh's fancy,C,"aAe1, ab; aAe1, AdAe."
329,Humors of Clare,A,"ab, ac; ab, de."
329,Humors of Clare,A1,"ab, ac; ab, df."
329,Humors of Clare,B,"Ae1a, Ae1Ac; Ae1a, AdAe."
329,Humors of Clare,B1,"Ae1a, Ae1Ac; Ae1a, AdA1f."
329,Humors of Clare,C,"aAb, bAc; aAb, AdAe."
329,Humors of Clare,C1,"aAb, bAc; aAb, AdA1f."
330,The queen of the fair,A,"ab, cd; ab, ef."
330,The queen of the fair,B,"ab, AbAe; ab, cAf."
330,The queen of the fair,C,"ab, cBa; de, fAf."
330,The queen of the fair,C1,"ab, cBa; gBa, fAf."
331,The foot of the mountain,A,"ab, ac; ab, de."
331,The foot of the mountain,B,"AdAd, Ada; aAd, AdAd."
331,The foot of the mountain,C,"AeAd, AdAd; BaBa, AdAd."
331,The foot of the mountain,D,"AdAe, "
332,The maids of Ballinacarty,A,"ab, ca; db, cb."
332,The maids of Ballinacarty,B,"aa, ab; aa, aa."
333,Miss Downing's fancy,A,"aa1, ab; ac, de."
333,Miss Downing's fancy,A1,"aa1, ab; ac, df."
333,Miss Downing's fancy,B,"aAc1, bc; aAc1, de."
333,Miss Downing's fancy,B1,"aAc1, bc; aAc1, dAe."
334,When you go home,A,"ab, ac; aa1, dc."
334,When you go home,B,"ab, aAc; aAa1, AdAc."
335,Friends of my heart,A,"ab, cd; ae, fg."
335,Friends of my heart,B,"ab, cd; ef, gAg."
336,Down the river,A,"ab, cd; ae, fg."
336,Down the river,B,"ab, cd; ef, gAg."
337,Come along with me,A,"ab, cd; ef, gh."
337,Come along with me,B,"aAg1, ab; cd, Ah1Ah."
338,Cronin's Frolics,A,"ab, cb; ad, ce."
338,Cronin's Frolics,B,"aAb1, a1Ab; AaAd, bAe."
338,Cronin's Frolics,C,"Ba2a, Ba3b; Ba4b1, AcAe."
338,Cronin's Frolics,D,"ab, cd; eAd, BbAe."
339,The belles of Liscarroll,A,"ab, ac; ad, ef."
339,The belles of Liscarroll,A1,"ab, ac; ad, eg."
339,The belles of Liscarroll,B,"ab, cd; ae, d1f."
339,The belles of Liscarroll,B1,"ab, cd; ae, d1g."
339,The belles of Liscarroll,C,"ab, cd; Ab1e, fBa1."
340,Munster Bacon,A,"ab, cd; ef, gh."
340,Munster Bacon,B,"ab, cd; eAe1, fAh."
341,Billy McCormick,A,"ab, cd; ae, fg."
341,Billy McCormick,B,"aa, bc; Ae1Ag1, AfAg."
342,The chorus jig,A,"aa1, bc; aa1, de."
342,The chorus jig,B,"ab, aAc; ab, Aa3Ae."
342,The chorus jig,C,"BaBb, Baa; bc, AdAe."
342,The chorus jig,D,"ab, aAc; ab, AdAe."
342,The chorus jig,E,"DaDb, DaDa1; Db1a, AdAe."
343,Church Hill,A,"ab, ac; ab, dc."
343,Church Hill,B,"ab, aAc; cd, eAc."
344,The stolen purse,A,"ab, cd; ab, ef."
344,The stolen purse,B,"aa1, AcAd; ba2, AeAf."
344,The stolen purse,C,"aBa3, Acb; ac, AeAf."
345,The trip to Galway,A,"ab, cd; ae, fg."
345,The trip to Galway,B,"ab, cd; Afe, ff1."
346,Miss Douglas,A,"ab, cd; ab, ce."
346,Miss Douglas,B,"ab, cd; ab, ce."
346,Miss Douglas,B1,"ab, cd; AaAb, AcAe."
347,The maid of Kinsale,A,"ab, cd; eb, fg."
347,The maid of Kinsale,B,"aAe1, bc; de, fAg."
348,The flowers of Dungarvan,A,"ab, cd; ef, gh."
348,The flowers of Dungarvan,B,"ab, cd; ef, gAh."
349,Miss Grant's jig,A,"ab, cd; ae, b1f."
349,Miss Grant's jig,B,"ab, cAc1; Ad1d, c1Af."
350,Don't be teasing,A,"ab, ac; ad, ee1."
350,Don't be teasing,B,"ab, ac; ad, eAe1."
351,Clancy's frolics,A,"ab, cd; eb, fg."
351,Clancy's frolics,B,"ab, ac; ab, AfAg."
352,The powers of punch,A,"ab, cd; ef, gh."
352,The powers of punch,B,"ab, ac; AeAf, AgAh."
352,The powers of punch,C,"ab, cd; c1Ae, eAh."
352,The powers of punch,D,"ab, cd; Be1e, CeAh."
353,The yellow wattle,A,"ab, cd; cb, ef."
353,The yellow wattle,B,"ab, ac; ab, dAf."
353,The yellow wattle,C,"ab, ac; ab, aAf."
353,The yellow wattle,D,"ab, aCa1; ab, CaAf."
354,The lads of Dunse,A,"ab, cd; ab, ce."
354,The lads of Dunse,B,"ab, AcAd; ab, AcAe."
354,The lads of Dunse,C,"BaBb, AcAd; Ac1Bb, aAe."
355,The lasses of Dunse,A,"ab, cd; ab, ef."
355,The lasses of Dunse,B,"aa, AcAd; bAc1, cAc2."
356,Portpatrick,A,"ab, ac; ab, de."
356,Portpatrick,B,"aa, bAc; cAb, AdAe."
357,The Hibernian jig,A,"aa, ba1; cd, a2b1."
357,The Hibernian jig,B,"ab, aAd; cd, eAb1."
358,Go to the Devil and shake yourself,A,"ab, cd; ab, ef."
358,Go to the Devil and shake yourself,B,"ab, Ad1c; AaAb, AeAf."
359,May be I will,A,"ab, cd; ae, fg."
359,May be I will,B,"ab, cAb1; dAc1, eAg."
360,The market girl,A,"ab, cd; ae, fg."
360,The market girl,B,"ab, cAg; dAg1, eAg."
361,The Drogheda weavers,A,"ab, ac; ab, dc."
361,The Drogheda weavers,B,"ab, cAc; ab, dAc."
362,The Hollyford jig,A,"ab, cd; ab, ef."
362,The Hollyford jig,B,"Aa1a, AcAd; ba, AeAf."
362,The Hollyford jig,C,"Aaa, bAd1; cd, eAf."
363,Nell Kennedy,A,"ab, ac; b1b, de."
363,Nell Kennedy,B,"ab, ac; ab, AdAe."
363,Nell Kennedy,B1,"ab, ac; de, fAe."
364,Three halfpence a day,A,"ab, cd; ab, ed."
364,Three halfpence a day,B,"ab, ac; de, AeAd."
365,Merry Mary,A,"ab, cd; ac1, ec2."
365,Merry Mary,B,"aAc3, AcAd; aAc4, AeAc2."
366,Bolt the door,A,"ab, cc1; db, cc1."
366,Bolt the door,A1,"eb, cc1; db, cc1."
366,Bolt the door,B,"A1ea, A1e1Ac1; AdAb, A1e1Ac1."
366,Bolt the door,C,"ab, A1e1Ac1; AdAb, cBa1."
366,Bolt the door,D,"a"
367,Ask my father,A,"ab, cd; eb, cf."
367,Ask my father,A1,"fb, cd; eb, cf."
367,Ask my father,B,"Afa, aAd; Aea, aAf."
367,Ask my father,B1,"Afa, aAd; Aea, aAf."
367,Ask my father,C,"Af"
368,With all my heart,A,"ab, ac; ab, dc."
368,With all my heart,B,"AbAb, AbAc; AbAb, AdAc."
369,Get up early,A,"aa1, bc; aa1, bd."
369,Get up early,B,"ab, AbAb; ab, AbAd."
369,Get up early,B1,"ab, AbAb; aAb1, AbAd."
370,Dan Rogers' jig,A,"ab, ac; ab, ac."
370,Dan Rogers' jig,B,"ab, aAc; ab, aAc."
371,Tie the petticoat tighter,A,"aa, bb; aa, cc."
371,Tie the petticoat tighter,B,"aAb1, Aa1Aa1; aAb1, bb."
371,Tie the petticoat tighter,B1,"aAb1, Aa1Aa1; cd, AcAc."
372,Trip it up stairs,A,"ab, a1a1; ab1, cc."
372,Trip it up stairs,B,"Ab1a, bb; Aa1b1, AcAc."
372,Trip it up stairs,C,"ab, cd; ef, AcAc."
373,Sergt. Cahill's favorite,A,"ab, ca1; ab, ca1."
373,Sergt. Cahill's favorite,B,"aa, AcAa1; AaAb, AcAa1."
374,Moll in the wad,A,"ab, ac; ab, dc."
374,Moll in the wad,B,"aa, AdAc; aAd, bAc."
375,Tim the thatcher,A,"ab, ac; ad, ef."
375,Tim the thatcher,B,"Ac1Ac2, Ac1Af; Ac1Aa1, aAf."
376,Is it the priest you want?,A,"ab, ac; ab, de."
376,Is it the priest you want?,B,"Aa1a, bc; Aa1a, AdAe."
377,Whiskey and water,A,"ab, aa; ab, ca1."
377,Whiskey and water,B,"ab, ac; de, dAa1."
377,Whiskey and water,B1,"ab, ac; dAa, AcAa1."
378,The humors of Limerick,A,"ab, ac; ab, bc."
378,The humors of Limerick,B,"ab, ac; ab, AbAc."
379,Stack the rags,A,"ab, ac; ab, dd1."
379,Stack the rags,B,"ab, cAc; ac1, dAc."
379,Stack the rags,C,"BcBc2, BcAc; ab, AaAc."
380,Tip the Cruiskeen,A,"ab, cc; ab, dd."
380,Tip the Cruiskeen,B,"Aa1Aa2, AcAc; Aa1Aa2, AdAd."
381,Tatter the road,A,"ab, cd; ab, ef."
381,Tatter the road,B,"aa, bb; b1a, cAb."
382,Huish the cat,A,"ab, ac; ab, dc."
382,Huish the cat,B,"Ada, AdAc; Ada, AaAc."
383,The bucks of Westmeath,A,"ab, ac; ab, dc."
383,The bucks of Westmeath,B,"Ada, AdAc; Add1, AdAc."
383,The bucks of Westmeath,C,"aa, aAc; aa, AdAc."
384,The beauties of Ireland,A,"ab, ac; ab, ac."
384,The beauties of Ireland,A1,"c1d, c1c; ab, ac."
384,The beauties of Ireland,A2,"ab, ac; c1A1d, c1c."
385,Off she goes!,A,"ab, ac; ab, de."
385,Off she goes!,B,"aAe1, ab; aAe1, AdAe."
386,Smash the windows,A,"ab, cd; ab, ef."
386,Smash the windows,B,"aAb1, Ab2b; ca, dAf."
386,Smash the windows,C,"ab, cd; BdBa, BdAf."
387,Ellis' jig,A,"aa1, ab; a2c, ba."
387,Ellis' jig,B,"aAa1, aAa2; Aa2Ac, AbAa."
388,Lock the door,A,"ab, ac; ab, de."
388,Lock the door,B,"aAc1, ab; ac, AdAe."
388,Lock the door,C,"AeAe, AeAc; AeAe, aAe."
389,Maguire's kick,A,"ab, ac; ab, aa1."
389,Maguire's kick,B,"ab, aAc; ac, AaAc."
389,Maguire's kick,C,"AaAb, AaAc; Aaa, bAa1."
390,The bunch of roses,A,"ab, cd; d1b, ed2."
390,The bunch of roses,B,"Aa1a, bc; dAb1, eAd2."
391,The humors of Ballinafauna,A,"ab, cd; ad1, ea1."
391,The humors of Ballinafauna,B,"ab, cd; ac1, eAa1."
392,Kiss me sweetheart,A,"ab, ac; ab, de."
392,Kiss me sweetheart,B,"ab, cAc; ab, dAe."
393,What ails you?,A,"ab, cd; ab, ce."
393,What ails you?,B,"aAd, Aa1Aa; aAd, bAe."
394,Get up old woman and shake yourself,A,"ab, cd; ae, fb."
394,Get up old woman and shake yourself,B,"AfAf, AfAb; AfAe, AfAb."
395,Child of my heart,A,"ab, ac; ab, dc."
395,Child of my heart,B,"ab, ac; ad, AdAc."
396,The northern road,A,"ab, ab1; ac, db2."
396,The northern road,B,"ab, aAa1; cd, eAb2."
396,The northern road,B1,"ab, aAa1; fg, AdAb2."
397,Come in from the rain,A,"ab, cd; ab, b1a2."
397,Come in from the rain,B,"aa, Ab2Ab1; aa, Ab2Aa2."
398,Behind the bush in the garden,A,"aa, bb; ca1, ad."
398,Behind the bush in the garden,B,"Ab1Ad1, Ab1Ac1; Ab1Ad1, AaAd."
398,Behind the bush in the garden,B1,"Ab1Ad1, Ab1Ac1; AcAa1, AaAd."
399,The runaway jig,A,"aa1, bc; aa1, da1."
399,The runaway jig,A1,"aa1, bc; aa1, da1."
399,The runaway jig,B,"Aa6a, bb; Aa6a, cAa1."
399,The runaway jig,B1,"Aa6a, bb; Aa6a, cAa1."
400,The mariner's frock,A,"ab, cd; d1e, fg."
400,The mariner's frock,B,"ab, cd; Ad1Ae, AfAg."
401,The humors of Castleoliver,A,"ab, ac; de, fg."
401,The humors of Castleoliver,B,"ab, cd; eb, cf."
401,The humors of Castleoliver,B1,"ab, cd; eb, cg."
402,The lady of the lake,A,"ab, ac; ab, da."
402,The lady of the lake,B,"ab, Aa1c; ab, dAa2."
403,A morning in summer,A,"ab, cd; ab, ef."
403,A morning in summer,B,"aAa1, AdAd1; bAa1, AcAd."
404,I'm a silly old man,A,"ab, cd; ab, d1d2."
404,I'm a silly old man,B,"Aa1a, bc; de, Ad2Ad2."
405,Good night,A,"aa, ab; aa, cb."
405,Good night,B,"aAa, aAb; aAa, AcAb."
406,The lovely lad,A,"ab, cd; b1b1, bb."
406,The lovely lad,B,"Aa1Aa1, aa; Aa1a1, Aa1Aa1."
407,Carbray's frolics,A,"ab, cc; ab, de."
407,Carbray's frolics,B,"Ac1Ae1, AcAc; Ac1Ae1, AdAe."
408,Cahill's workshop,A,"ab, ac; ab, de."
408,Cahill's workshop,A1,"ab, d1c; ab, db1."
408,Cahill's workshop,B,"AeAb, Ab1Ac; AeAb, AdAe."
408,Cahill's workshop,B1,"AeAb, Ab1Ac; AeAb, AdAb1."
409,The shady lane,A,"ab, cd; ab, cd1."
409,The shady lane,B,"aa, ab; aa, Acc."
409,The shady lane,B1,"aa, ab; aa, AcAd1."
410,Barrack hill,A,"ab, ac; ab, bd."
410,Barrack hill,B,"AbAa1, aa; AbAa1, aAd."
410,Barrack hill,B1,"AbAa1, aa; Aba1, a1b."
411,The rocky road to Dublin,A,"ab, ac; c1b, c2c."
411,The rocky road to Dublin,B,"Ac3Ac3, Ac3Ac; Ac3Ac3, aAc."
411,The rocky road to Dublin,C,"aa, aAc; aa, BaAc."
412,Hardy man the fiddler,A,"aa, ab; aa, ab."
412,Hardy man the fiddler,B,"aAb, ab; aAb, Ab1b."
413,The swaggering jig,A,"ab, ac; ab, ac."
413,The swaggering jig,B,"ab, aAc; ab, cAc."
414,Tea in the morning,A,"ab, ac; ab, ac."
414,Tea in the morning,B,"aAb, aAc; aAb, aAc."
415,Will you come down to Limerick,A,"aa, ab; aa, ab."
415,Will you come down to Limerick,B,"aAb1, Ab1b; aAb1, cb."
415,Will you come down to Limerick,C,"ab, aAb; ab, Aa1Ab."
416,The rakes of Westmeath,A,"aa, bc; aa, bc."
416,The rakes of Westmeath,B,"Ab1Ab1, Ab1Ac; Ab1Ab1, aAc."
417,The humors of Ballymanus,A,"aa, ab; aa, ab."
417,The humors of Ballymanus,B,"aa, aAb; aa, aAb."
417,The humors of Ballymanus,C,"aa, aAb; aa, aAb."
418,Roudledum,A,"ab, cd; ab, ce."
418,Roudledum,B,"ab, ac; ab, ad."
419,Yellow legs,A,"aa, ab; aa, ab."
419,Yellow legs,B,"aa, aAb; aa, aAb."
419,Yellow legs,C,"aa, bAa1; aa, bAa1."
419,Yellow legs,D,"aa, aAb; aa, aAb."
420,Give us a drink of water,A,"ab, ac; ab, ac."
420,Give us a drink of water,B,"aa, aAb1; aa, bAb1."
421,My mind will never be "aisy",A,"ab, ac; ab, ac."
421,My mind will never be "aisy",B,"aAb, bAc; aAb, Aa1Ac."
422,The fox hunters' jig,A,"aa, ab; aa, ab."
422,The fox hunters' jig,B,"ab, cAb; ab, cAb."
422,The fox hunters' jig,C,"aa, aBb1; aa, aBb1."
422,The fox hunters' jig,D,"Bb3Bb, BcAb; Bb3Bb, BcAb."
423,The boys of Ballysadare,A,"ab, ac; ab, dc."
423,The boys of Ballysadare,B,"aa, aAc; aa, AdAc."
424,A whack at the wigs,A,"aa, aa; aa, aa."
424,A whack at the wigs,A1,"bb, a1a; aa, aa."
424,A whack at the wigs,A2,"aa, aa; A1bA1b, a1a."
425,The Irish girl,A,"ab, ac; ab, ac."
425,The Irish girl,B,"aa, ab; aa, ab."
426,Sir Philip McHugh,A,"ab, ab; ab, ab."
426,Sir Philip McHugh,B,"aa, aAb; aa, aAb."
427,Terry heigh ho the grinder,A,"aa, ab; aa, ab."
427,Terry heigh ho the grinder,B,"ab, aAa; ab, cAa."
428,Top the candle!,A,"ab, ac; ab, ac."
428,Top the candle!,B,"Aa1a, bAc; Aa1a, bc."
429,Barney Brallaghan,A,"aa, ab; aa, ab."
429,Barney Brallaghan,B,"Ab1Ab1, Ab1Ab; Ab1Ab1, Ab1Ab."
429,Barney Brallaghan,C,"Ab1Ab, Ab1Aa1; Ab1Ab, Ab1Aa1."
430,Tipperary Hills,A,"ab, ac; ab, ac."
430,Tipperary Hills,B,"Aca, AcAc; Aca, AcAc."
431,Dever the dancer,A,"aa, ab; aa, ab."
431,Dever the dancer,B,"ab, aAb; ab, cAb."
432,I'm the boy for bewitching them,A,"ab, ac; ab, ac."
432,I'm the boy for bewitching them,B,"aAb1, ab; aAb1, cd."
433,Hunting the hare,A,"ab, ac; ab, ac."
433,Hunting the hare,B,"ab, aAc; ab, aAc."
434,The kid on the mountain,A,"ab, ac; ab, ac."
434,The kid on the mountain,B,"ab, aAc; ab, aAc."
434,The kid on the mountain,C,"Ac1a, Ac1b; Ac1a, Ac1b."
434,The kid on the mountain,D,"ab, aCb; ab, aCb."
434,The kid on the mountain,E,"ab, aAc; ab, aAc."
434,The kid on the mountain,F,"ab, aAc; ab, aAc."
435,The hawthorn,A,"aa, ab; aa, ab."
435,The hawthorn,B,"aa, aAb; aa, bAa."
436,Up and down again,A,"aa, ab; aa, ab."
436,Up and down again,B,"Aa1Aa, Aa1Aa3; Aa1Aa, Aa1Aa3."
437,Another jig will do,A,"aa, ab; aa, ab."
437,Another jig will do,B,"aa, aAb; aa, AaAb."
438,Dublin streets,A,"ab, ac; ab, ac."
438,Dublin streets,B,"ab, ac; ab, c1Ac."
