Tune,Title,Part,Structure
697,The jolly seven,A,"aa, ab; aa, cd."
697,The jolly seven,B,"ab, aAb; ab, AcAc1."
698,The Skibbereen lasses,A,"ab, ac; ab, dc."
698,The Skibbereen lasses,B,"aAb, bAc; aAb, cAc."
699,The humors of Schull,A,"ab, cd; ab, ef."
699,The humors of Schull,B,"ab, Ab1c; ab, dAf."
700,After the sun goes down,A,"ab, ac; ac1, bc."
700,After the sun goes down,B,"ab, aAc; ab, cAc."
701,Farewell to Erin,A,"ab, ac; ab, dc."
701,Farewell to Erin,B,"aAa, aAc; bc, de."
702,On the river bank,A,"ab, ab; ab, ac."
702,On the river bank,B,"ab, cd; ab, ce."
703,Fair-haired Mary,A,"ab, ac; ab, ad."
703,Fair-haired Mary,B,"Aa1a, Aa1Ac; Aa1a, bAd."
704,Pretty Peggy,A,"aa, ab; aa, cd."
704,Pretty Peggy,B,"ab, ac; de, fg."
705,More power to your elvow,A,"ab, ac; ab, ad."
705,More power to your elvow,B,"Ab1a, Ab1b; cAb, AaAd."
706,Green garters,A,"aa, ab; aa, ac."
706,Green garters,B,"aAc1, aAb; aAc1, bc."
707,Jenny's wedding,A,"ab, cc1; de, fg."
707,Jenny's wedding,B,"ab, ac; ad, b1e."
708,The maid of Athlone,A,"ab, ac; ab, ac."
708,The maid of Athlone,B,"ab, ac; ab, de."
709,Keeper Hill,A,"ab, ac; ab, de."
709,Keeper Hill,B,"ab, Ae1c; ab, de."
710,Good morning to your night cap,A,"ab, ac; ab, ad."
710,Good morning to your night cap,B,"ab, aAc; aAb, cAd."
711,I'm waiting for you,A,"ab, cd; ef, gh."
711,I'm waiting for you,B,"ab, cd; ab, ef."
712,O'Reilly's greyhound,A,"ab, cd; ab, cd."
712,O'Reilly's greyhound,B,"ab, ac; ad, eAb."
713,Courting them all,A,"ab, cd; ab, cd."
713,Courting them all,B,"AbAc1, AbAd1; AbAc1, AcAd."
714,The green jacket,A,"ab, cd; cb, ce."
714,The green jacket,B,"ab, aAe; ab, a1Ad."
715,My honey in the house,A,"ab, ac; ab, de."
715,My honey in the house,B,"aa, bAc; aa, AdAe."
716,McFadden's favorite,A,"ab, cd; ab, ce."
716,McFadden's favorite,B,"ab, ac; ab, de."
717,The Callan lasses,A,"ab, ac; ab, dc."
717,The Callan lasses,B,"aa, aAc; aa, bAc."
718,Are you willing,A,"ab, ac; ab, de."
718,Are you willing,B,"aAa1, aAe; aAa1, bAe."
719,The traveller,A,"ab, cd; ab, ce."
719,The traveller,B,"ab, aAd; ab, cAb1."
720,Kiss the bride,A,"ab, cd; ab, cb."
720,Kiss the bride,B,"ab, AcAd; ab, AcAb."
721,Duffy the dancer,A,"ab, ac; ab, dc."
721,Duffy the dancer,B,"aAb, aAc; aAb, AdAc."
722,Welcome home,A,"ab, cd; ab, ce."
722,Welcome home,B,"ab, ac; ab, AcAe."
723,The linen cap,A,"ab, ac; ab, dc."
723,The linen cap,B,"aAb, aAc; aAb, AdAc."
724,The contradiction reel,A,"ab, ac; ab, ad."
724,The contradiction reel,B,"ab, ac; ad, ef."
724,The contradiction reel,C,"ab, cd; ef, gd."
724,The contradiction reel,D,"ab, ac; ad, ee1."
725,The smoky house,A,"ab, ac; ab, de."
725,The smoky house,B,"ab, ac; db, eAe."
726,Mollie McCarthy,A,"ab, ac; ab, ac."
726,Mollie McCarthy,B,"aAc1, aAb1; aAc1, bAc."
727,Rolling down the hill,A,"ab, cd; ae, cf."
727,Rolling down the hill,B,"Ac1a, Ac1Aa1; Ac1a, Ab1b."
728,The merry blacksmith,A,"ab, cd; ab, ce."
728,The merry blacksmith,B,"aAa, AcAd; aAa, AcAe."
729,Scotch Mary,A,"ab, ac; ab, ac."
729,Scotch Mary,B,"ab, aAc; ab, Ac1Ac."
730,Within a mile of Dublin,A,"ab, ac; ab, aa."
730,Within a mile of Dublin,B,"ab, aAa; ab, cd."
731,The Cameronian reel,A,"ab, cd; ab, cd."
731,The Cameronian reel,B,"ab, cd; c1e, fAc1."
732,Winter apples,A,"ab, cd; ab, cd."
732,Winter apples,B,"ab, ac; ab, dAc1."
733,The primrose lass,A,"ab, cd; ab, ed."
733,The primrose lass,B,"ab, ac; ab, Ad1d."
734,Shearing the sheep,A,"ab, ac; ab, ad."
734,Shearing the sheep,B,"ab, ac; ab, dc."
735,Paddy's surprise,A,"ab, ac; aa1, da1."
735,Paddy's surprise,B,"ab, ac; ab, AdAa1."
736,Captain Byng,A,"ab, ac; ab, de."
736,Captain Byng,B,"ab, aAc; ab, AdAe."
737,The wind that shakes the barley,A,"ab, ac; ab, ac."
737,The wind that shakes the barley,B,"Ab1Ab1, Ab1a; Ab1Ab1, Ab1a."
738,The piper's son,A,"ab, ca1; ab, cc1."
738,The piper's son,B,"ab, aAc1; ab, cd."
739,Turkeys in the straw,A,"ab, cd; ab, ec."
739,Turkeys in the straw,B,"AeAe, ab; Ac1c, de."
740,William White's reel,A,"ab, cd; ab, cd."
740,William White's reel,B,"ab, ac; ab, dc."
741,Murtough Molly,A,"ab, cd; ab, ce."
741,Murtough Molly,B,"ab, ac; ab, dAd."
742,The field of oats,A,"ab, ac; ab, de."
742,The field of oats,B,"ab, aAe; ab, ac."
743,The humors of Newcastle,A,"ab, ac; ab, ac."
743,The humors of Newcastle,B,"Ab1a, Ab1b; Ab1a, cd."
744,Paddy Murphy's wife,A,"ab, ac; ab, ac."
744,Paddy Murphy's wife,B,"ab, ac; ab, de."
745,The girl with the laughing eyes,A,"ab, ac; ab, ad."
745,The girl with the laughing eyes,B,"ab, ac; ad, AaAd."
746,Give us another,A,"ab, cd; ab, ce."
746,Give us another,B,"ab, ac; ab, AcAd."
747,The northern lasses,A,"ab, cd; ae, cf."
747,The northern lasses,B,"ab, ac; a1d, ef."
747,The northern lasses,B1,"ab, ac; a1d, eg."
748,Clarkson's reel,A,"ab, cd; ad1, ef."
748,Clarkson's reel,B,"ab, ac; db, eAd."
749,Rakish Paddy,A,"ab, cd; ef, gh."
749,Rakish Paddy,B,"aAh1, bAa1; ac, dAh."
750,The Mullingar races 1,A,"ab, cd; ab, ef."
750,The Mullingar races 1,B,"ab, ac; ab, dAf."
751,The jolly tinker,A,"aa, ab; aa, ac."
751,The jolly tinker,B,"aAc1, bc; aAc1, bc."
751,The jolly tinker,C,"ab, bAc; ab, bAc."
751,The jolly tinker,D,"CaCa, aAc; CaCa, aAc."
751,The jolly tinker,E,"ab, cAc; Cab, dAb."
752,The queen's shilling,A,"ab, ac; ab, ad."
752,The queen's shilling,B,"ab, ac; ac, dAc."
753,Little Katie Kearney,A,"ab, ac; ab, ac."
753,Little Katie Kearney,B,"ab, aAc; ab, cAc."
754,The maid in the sherry tree,A,"ab, ac; ab, ac."
754,The maid in the sherry tree,B,"ab, aAa1; ac, de."
755,The watchmaker,A,"ab, ac; ab, ac."
755,The watchmaker,B,"ab, aAb1; cd, eAc."
756,The same old story,A,"ab, cd; ef, gh."
756,The same old story,B,"ab, cd; ef, gh."
756,The same old story,C,"ab, "
757,The fourpenny bit,A,"ab, cd; ac1, ef."
757,The fourpenny bit,B,"ab, cAe; ab, cd."
758,The jug of punch,A,"ab, cd; ef, gh."
758,The jug of punch,B,"ab, cd; ab, eAh."
759,The grey plover,A,"ab, ac; ad, ef."
759,The grey plover,B,"Aa1a, Aa1a; Aa1b, AeAf."
760,My sweetheart Jane,A,"ab, ac; ab, ad."
760,My sweetheart Jane,B,"ab, ac; ab, c1Ad."
761,Kiss your partner,A,"ab, ab1; ab, ab1."
761,Kiss your partner,B,"Aa1a, Aa1b; Aa1a, cAb1."
762,Corney is coming,A,"ab, cd; ab, cd."
762,Corney is coming,B,"ab, cAd; de, fAd."
763,The mountain rose,A,"ab, ac; ab, b1d."
763,The mountain rose,B,"ab, cd; ab, Ab1Ad."
764,The green gates,A,"aa, bc; aa, cd."
764,The green gates,B,"ab, AbAc; ab, AcAd."
765,The western lasses,A,"ab, ac; ab, de."
765,The western lasses,B,"ab, ac; ab, b1d."
765,The western lasses,C,"ab, cBb1; ab, cBd."
766,Rolling on the ryegrass,A,"ab, cd; eb, fd."
766,Rolling on the ryegrass,B,"ab, ac; ab, dc."
766,Rolling on the ryegrass,C,"Ab1a, bc; ba, dBc."
767,The four-hand reel,A,"ab, ac; ad, ae."
767,The four-hand reel,B,"ab, aAe; cd, eAc."
768,The flowers of Limerick,A,"ab, cd; ae, fa."
768,The flowers of Limerick,B,"Aa1Ab1, ab; Aa2Ae, AfAa."
768,The flowers of Limerick,C,"ab, cd; ef, AfAa."
768,The flowers of Limerick,D,"ab, cd; CeCf, AfAa."
769,The piper's despair,A,"ab, cb; ab, cd."
769,The piper's despair,B,"Ac1a, bAc2; Ac1a, cAb1."
770,The Edenderry reel,A,"aa, ab; aa, ab."
770,The Edenderry reel,B,"ab, aAb; ac, dAb."
771,The old bog ground,A,"ab, ac; ab, ac."
771,The old bog ground,B,"ab, cAc; ab, dAc."
772,The absent-minded woman,A,"ab, ac; ad, ef."
772,The absent-minded woman,B,"Ad1Ad1, Ad1a; Ad1Ad1, bc."
773,The hag by the fire,A,"ab, ac; ab, ac."
773,The hag by the fire,B,"aAc, aAc; bAc, cAc."
774,Johnny Allen's reel,A,"ab, ac; ad, ef."
774,Johnny Allen's reel,B,"Ab1Aa1, Ab1Af; Ab1Ad, AeAf."
775,The maid of Feakle,A,"ab, ac; ab, de."
775,The maid of Feakle,B,"ab, aAe; ab, cd."
776,The humors of Scarriff,A,"ab, ac; ab, ac."
776,The humors of Scarriff,B,"ab, ac; ab, dAc."
777,The rambler in Cork,A,"aa1, ab; aa1, ac."
777,The rambler in Cork,B,"Ac1a, Ac1Ab; Ac1a, bAb."
778,The maids of Kilmallock,A,"ab, cd; ab, cb1."
778,The maids of Kilmallock,B,"ab, aAb1; cb, dAd."
779,The heather breeze,A,"ab, ac; ab, de."
779,The heather breeze,B,"ab, aAe; ab, aAe."
779,The heather breeze,C,"Bb1a, bAe; ba, cd."
780,Cooleen bridge,A,"ab, cd; ef, gh."
780,Cooleen bridge,B,"ab, cAh1; AgAa, Ah1d."
781,Captain Rock,A,"ab, ac; de, fc."
781,Captain Rock,B,"Ac1Ac1, Ac3Ac; Ac1Ac1, Ac3Ac."
782,The tinker's reel,A,"ab, ac; ab, ad."
782,The tinker's reel,B,"ab, ac; ad, ef."
783,The maids of Tulla,A,"ab, cd; ab, ef."
783,The maids of Tulla,B,"ab, cd; ab, AeAf."
784,The Gaelic revival,A,"ab, cd; be, fg."
784,The Gaelic revival,B,"ab, cd; eb, fg."
784,The Gaelic revival,C,"aAb, ab; ac, AfAg."
784,The Gaelic revival,D,"ab, cc1; de, Be1Cb1."
785,A ha'porth of tea,A,"ab, ac; ab, ac."
785,A ha'porth of tea,B,"ab, aAc; ab, cAc."
786,Over the moor to Maggie,A,"ab, cd; ab, ef."
786,Over the moor to Maggie,B,"ab, cd; eb, fg."
786,Over the moor to Maggie,C,"aAa1, Acb; cd, AeAf."
787,Bunker Hill,A,"ab, cd; ab, ed."
787,Bunker Hill,B,"ab, cd; ef, AeAd."
787,Bunker Hill,C,"ab, cd; ae, AeAd."
788,The king of the clans,A,"ab, cd; ef, gh."
788,The king of the clans,B,"Aa1a, AcAd; Aa1Ab, bAh."
789,Boil the breakfast early,A,"ab, ab; ab, cb."
789,Boil the breakfast early,B,"ab, aAb; aAb1, AcAb."
790,The maid I ne'er forgot,A,"aa1, bc; aa1, de."
790,The maid I ne'er forgot,B,"ab, Abc; dAa1, AbAe."
791,The honeymoon reel,A,"ab, ac; ad, ef."
791,The honeymoon reel,B,"aAb, AaAc; aAd, AeAf."
792,The cup of tea,A,"ab, ac; ab, dc."
792,The cup of tea,B,"aa, aAc; ab, cAc."
792,The cup of tea,C,"ab, aAc; ab, Ba1c."
793,Come west along the road,A,"ab, ac; ab, ac."
793,Come west along the road,B,"ab, ac; ab, de."
794,The long strand,A,"ab, ac; ad, ef."
794,The long strand,B,"ab, cd; ae, Aef."
795,The teetotaler's fancy,A,"ab, cd; ab, ce."
795,The teetotaler's fancy,B,"Ae1Ab1, aAd1; Ae1Ab1, bc."
796,Kitty in the lane,A,"ab, ac; ab, de."
796,Kitty in the lane,B,"ab, ac; ad, ef."
797,The Chicago reel,A,"ab, ca1; ab, a2d."
797,The Chicago reel,B,"ab, ac; ad, eAd."
798,Mrs. Delaney,A,"ab, ac; ad, ef."
798,Mrs. Delaney,B,"Ab1a, Ab1b; Ab1c, Ac1d."
799,Mayor Harrison's fedora,A,"ab, cd; ae, df."
799,Mayor Harrison's fedora,B,"ab, cd; ae, AdAf."
800,Miss Fahey's fancy,A,"ab, cd; ae, fg."
800,Miss Fahey's fancy,B,"Ad1a, Ad1b; cd, ef."
801,Clancy's fancy reel,A,"ab, cd; ab, de."
801,Clancy's fancy reel,B,"ab, cd; ae, AdAe."
802,The shaskeen reel,A,"ab, cd; ac1, c2e."
802,The shaskeen reel,B,"ab, Ad1Ad; ab, Ac2Ae."
803,Peter Street,A,"ab, cd; ab, ef."
803,Peter Street,B,"ab, AaAb; cc, de."
804,Pay the girl her fourpence,A,"ab, ac; ad, ec."
804,Pay the girl her fourpence,B,"ab, ac; ab, dc."
805,Farewell to Ireland,A,"ab, cd; ae, fg."
805,Farewell to Ireland,B,"ab, ac; de, fg."
805,Farewell to Ireland,C,"ab, cd; aBe, BfBg."
806,Chief O'Neill's favorite,A,"ab, cd; ab, ef."
806,Chief O'Neill's favorite,B,"Aca, bAd; AaAb, AeAf."
807,The Greencastle hornpipe,A,"ab, ac; ab, de."
807,The Greencastle hornpipe,B,"Ac1a, bc; dAe1, eAe."
808,The Cloone hornpipe,A,"ab, cd; ef, gh."
808,The Cloone hornpipe,B,"ab, cd; ef, gAh."
809,The Kildare fancy,A,"ab, cd; ef, gh."
809,The Kildare fancy,B,"ab, cd; ef, gAh."
810,Dunphy's hornpipe,A,"ab, cd; ef, gh."
810,Dunphy's hornpipe,B,"ab, cd; ef, gh."
811,The rights of man,A,"ab, cd; ab, d1e."
811,The rights of man,B,"ab, cd; ef, Ad1Ae."
812,Slievenamon,A,"ab, cd; a1b, cc1."
812,Slievenamon,B,"aa, a1b; aa, Ac3Ac1."
813,Hennessy's hornpipe,A,"ab, cd; ab, ef."
813,Hennessy's hornpipe,B,"aAb, bc; de, AeAf."
814,The quarrelsome piper,A,"ab, cd; ef, gh."
814,The quarrelsome piper,B,"ab, cd; ef, gh."
815,The Devil's dream,A,"ab, cd; ab, ef."
815,The Devil's dream,B,"ab, Acc; ab, AeAf."
815,The Devil's dream,C,"ab, cd; aBb, AeAf."
816,The Liverpool hornpipe,A,"ab, cd; ab, ef."
816,The Liverpool hornpipe,B,"ab, AcAd; AaAb, AeAf."
816,The Liverpool hornpipe,C,"Aea, bc; Aad, Ba1Af."
817,The Tinware lass,A,"ab, cd; ef, gh."
817,The Tinware lass,B,"ab, cd; ef, gh."
818,Hillside cottage,A,"ab, cd; ab, ef."
818,Hillside cottage,B,"ab, cd; ef, gh."
819,The heather glen,A,"ab, cd; ab, ce."
819,The heather glen,B,"ab, cd; Aaa1, d1Ae."
820,Limerick Junction,A,"ab, cd; ab, ef."
820,Limerick Junction,B,"ab, cc1; ab, dAa1."
821,The top of the morning,A,"ab, cd; ef, gh."
821,The top of the morning,B,"Aa1a, bc; de, fAa."
822,Hick's hornpipe,A,"ab, b1c; ab, de."
822,Hick's hornpipe,B,"Add1, ad2; Add1, ba."
823,Bantry Bay,A,"ab, cd; d1e, ab."
823,Bantry Bay,B,"aAe1, bc; dAe, AaAb."
824,The boys from Scart,A,"ab, cd; ab, ce."
824,The boys from Scart,B,"ab, cd; ab, ef."
825,Fisher's hornpipe,A,"ab, cd; ab, ef."
825,Fisher's hornpipe,B,"ab, cd; Ab1e, fAf."
826,No.1 The sailor's hornpipe,A,"aa, bb; aa, cd."
826,No.1 The sailor's hornpipe,B,"ab, cd; ab, AcAd."
827,No.2 The sailor's hornpipe,A,"ab, cb; ab, de."
827,No.2 The sailor's hornpipe,B,"Ab1a, Ae1Ab; AaAb, AdAe."
828,The Wicklow hornpipe,A,"ab, cd; ab, cd1."
828,The Wicklow hornpipe,B,"ab, cd; ef, AcAd1."
829,Miss Brown's fancy,A,"ab, cd; ae, fg."
829,Miss Brown's fancy,B,"ab, cd; ab, eAg."
830,The men from Mallow,A,"ab, cd; ab, ef."
830,The men from Mallow,B,"AbAb, ab; AbAb, AeAf."
830,The men from Mallow,C,"AbAb, BaBb; ab, AeAf."
831,McCarty's hornpipe,A,"ab, bb; ca, de."
831,McCarty's hornpipe,B,"AaAa, AbAb; AbAc, AaAd."
831,McCarty's hornpipe,C,"AeAa, ab; AbAc, AaAd."
831,McCarty's hornpipe,C1,"AeAa, ab; AbAc, AaAd."
831,McCarty's hornpipe,D,"AeAa, "
832,Big Dan O'Mahony,A,"ab, a1b; ab, cd."
832,Big Dan O'Mahony,B,"Ac1a, Aa1Ab; Aa1b, cAd."
832,Big Dan O'Mahony,C,"Aa1Bb, Aa1Ab; Ada, bAd."
833,The trumpet hornpipe,A,"ab, cd; ed1, fg."
833,The trumpet hornpipe,A1,"hd2, ij; kd3, la1."
833,The trumpet hornpipe,B,"Ab1a, bc; de, fAc1."
834,The Mullingar races 2,A,"ab, cd; ef, gh."
834,The Mullingar races 2,B,"ab, cd; ef, Ac1Ah."
835,The Kilkenny hornpipe,A,"ab, cd; ab, eb."
835,The Kilkenny hornpipe,B,"Ab1Ab1, ab; AaAb, AeAb."
836,Jerry Daly's hornpipe,A,"ab, cd; ab, ce."
836,Jerry Daly's hornpipe,B,"ab, cb; de, AcAe."
837,The banks of the Ilen,A,"ab, ac; ab, ac."
837,The banks of the Ilen,B,"ab, ac; de, AaAc."
838,Kit O'Mahony's hornpipe,A,"ab, cd; ab, ed."
838,Kit O'Mahony's hornpipe,B,"aAa1, ab; bc, AeAd."
839,The boys of Ballysimon,A,"ab, cd; eb, cd."
839,The boys of Ballysimon,B,"ab, ab; AaAb, AcAd."
839,The boys of Ballysimon,C,"ab, cAd; de, cAd."
839,The boys of Ballysimon,D,"Baa, Bab; Bb1c, AcAd."
840,Fair and forty,A,"ab, cd; ab, ce."
840,Fair and forty,B,"ab, ac; ab, dAe."
841,The slipper hornpipe,A,"ab, cd; ab, ea."
841,The slipper hornpipe,B,"Ab1Ab1, aAd; AaAb, bAe."
842,O'Dwyer's hornpipe,A,"ab, ac; ab, de."
842,O'Dwyer's hornpipe,B,"ab, Acc; db, AcAa."
842,O'Dwyer's hornpipe,C,"Ab1a, Ab1Ac; Ab1a, AdAe."
842,O'Dwyer's hornpipe,D,"aa, bb; cc1, dAa."
843,The Groves hornpipe,A,"ab, cd; ef, gh."
843,The Groves hornpipe,B,"ab, cd; ef, gAc1."
843,The Groves hornpipe,C,"aBf1, bBf2; cBf3, de."
843,The Groves hornpipe,D,"ab, cd; ef, gf1."
843,The Groves hornpipe,E,"ab, cDb1; de, fg."
844,The first of June,A,"ab, cd; ad, b1d."
844,The first of June,B,"Aa1Aa1, ab; Aa1b1, cAd."
845,The last of the twins,A,"ab, cb1; ab, cd."
845,The last of the twins,B,"Ada, AcAb1; Ada, AcAd."
846,Kitty's wedding,A,"ab, cd; ab, ce."
846,Kitty's wedding,B,"ab, cd; ab, ce."
847,The harvest home,A,"ab, cd; ab, ea1."
847,The harvest home,B,"aa, Acb; AaAb, AeAa1."
848,The echo,A,"ab, cd; ab, ef."
848,The echo,B,"Ac1a, AcAd; Ac1a, AeAf."
849,Murray's hornpipe,A,"ab, cd; ef, gh."
849,Murray's hornpipe,A1,"ij, kl; mn, op."
849,Murray's hornpipe,B,"ab, cd; Ab1Ab2, Ab3Ah1."
849,Murray's hornpipe,B1,"ef, gh; Ab4Ab5, Ab6Ah2."
850,McDermott's hornpipe,A,"ab, cd; ef, gh."
850,McDermott's hornpipe,B,"Aa1a, Aa2b; Aa3c, Ad1Ad."
851,Glengariff hornpipe,A,"ab, cd; ef, gh."
851,Glengariff hornpipe,B,"ab, cd; ef, gAd1."
852,The Sweep's hornpipe,A,"ab, cd; ef, gh."
852,The Sweep's hornpipe,B,"ab, cd; ef, gh."
852,The Sweep's hornpipe,C,"aAd1, bc; c1Ad2, de."
853,Galway Bay,A,"ab, cd; ef, ge1."
853,Galway Bay,B,"Aba, Aab; Aec, dd."
854,Coming from the wedding,A,"ab, cd; ab, ec1."
854,Coming from the wedding,B,"ab, aAb; ac, dAc2."
855,Cronin's rambles,A,"ab, cd; ab, ef."
855,Cronin's rambles,B,"aAd1, AcAd; ab, AeAf."
856,Murphy's hornpipe,A,"ab, cd; ab, ce."
856,Murphy's hornpipe,B,"aAa1, a1Ad; AaAb, AcAe."
857,The fair maidens,A,"ab, cd; ab, ce."
857,The fair maidens,B,"ab, Ae1c; AaAb, AcAe."
858,The little stack of barley,A,"ab, ca; db, ef."
858,The little stack of barley,B,"aAa1, bAa; Ab1c, AeAf."
859,Off to California,A,"ab, cd; ef, gh."
859,Off to California,B,"ab, cd; ef, gh."
860,Thirty years ago,A,"ab, cd; ef, gh."
860,Thirty years ago,B,"ab, cd; ef, gh."
861,Youghal harbor,A,"ab, cd; ef, gh."
861,Youghal harbor,B,"ab, cd; ef, gAd1."
862,Rogers O'Neill,A,"ab, cd; ab, ef."
862,Rogers O'Neill,B,"ab, cd; ae, fAf."
862,Rogers O'Neill,C,"ab, b1c; ad, ea1."
862,Rogers O'Neill,D,"Aa1a, bc; Aa1Cd, CeCa2."
863,The night we made the match,A,"ab, cd; ae, fg."
863,The night we made the match,B,"ab, cc; bd, eAg."
864,The pleasures of hope,A,"ab, cd; ec, fg."
864,The pleasures of hope,B,"Afa, aAb1; AeAc, AfAg."
865,Byrne's hornpipe,A,"ab, cb; ab, db."
865,Byrne's hornpipe,B,"aAb1, Ab1Aa1; AaAb, AdAb."
866,Whiskey you're the devil!,A,"ab, cd; ab, cd."
866,Whiskey you're the devil!,B,"Aa1Aa1, AcAd; AaAb, AcAd."
867,The scholar,A,"ab, cd; ef, gh."
867,The scholar,A1,"ij, kl; mn, op."
867,The scholar,B,"ab, cd; ef, gh."
867,The scholar,B1,"ij, kl; mn, op."
868,The Soldier's joy,A,"ab, ac; ab, dc1."
868,The Soldier's joy,B,"ab, ab; cb, AdAc1."
869,The clover blossom,A,"ab, cd; ab, ef."
869,The clover blossom,B,"ab, ac; ad, eAf."
870,The Glasgow hornpipe,A,"ab, cd; ef, gh."
870,The Glasgow hornpipe,B,"ab, cd; ea1, fAh."
871,Old man Quinn,A,"ab, ab; ab, cd."
871,Old man Quinn,B,"ab, cAb; AcAc, AcAd."
871,Old man Quinn,C,"AdAa2, Ac1Ab; AcAc, AcAd."
872,The green banner,A,"ab, ca1; ab, dc."
872,The green banner,B,"Ab1Ac1, AdAa1; aAa2, Ad1Ac."
873,The golden vale,A,"ab, cd; ab, b1e."
873,The golden vale,B,"aAd, Ab1Ab2; aAd, Ab1Ae."
874,The honeysuckle,A,"ab, cd; ab, ef."
874,The honeysuckle,B,"ab, cAd; AaAb, AeAf."
875,The star hornpipe,A,"ab, cb1; de, fg."
875,The star hornpipe,B,"aa1, bc; de, fg."
876,O'Connor's fancy,A,"ab, b1c; ab, b1a."
876,O'Connor's fancy,B,"aAa1, bc; dAa1, eAa."
877,Sault's own hornpipe,A,"ab, cc1; ad, ef."
877,Sault's own hornpipe,B,"Af1a, aAf2; Af1b, cAf3."
878,Tomorrow morning,A,"ab, cd; ab, ce."
878,Tomorrow morning,B,"aAe1, AcAd; AaAb, AcAe."
879,Clark's hornpipe,A,"ab, cd; ef, gh."
879,Clark's hornpipe,B,"ab, cd; ef, gAb1."
880,The peacemaker,A,"ab, cd; ef, gh."
880,The peacemaker,B,"aAh1, bAg1; cd, ef."
881,Father Dollard's hornpipe,A,"ab, cd; ab, ca."
881,Father Dollard's hornpipe,B,"ab, cd; ee, fAa1."
882,The sea captain,A,"ab, cd; ab, ef."
882,The sea captain,B,"ab, cAe1; bd, AeAf."
883,The humors of Ballyconnell,A,"ab, cd; ae, fg."
883,The humors of Ballyconnell,B,"Ada, bc; dAe, AfAg."
884,Early in the morning,A,"ab, cd; ab, ce."
884,Early in the morning,B,"Ae1a, bc; AaAb, AcAe."
885,Julia's wedding,A,"ab, cd; eb, cf."
885,Julia's wedding,B,"Ae1a, bAd1; Ae1a, ba."
886,Bill Black's hornpipe,A,"ab, ac; ab, de."
886,Bill Black's hornpipe,B,"Ae1Ad1, Ad1a; bc, AdAe."
887,Whistling Mike,A,"ab, cd; ec1, fg."
887,Whistling Mike,B,"ab, cd; eAc2, Ag1f."
888,The spring garden,A,"ab, cd; b1e, fg."
888,The spring garden,B,"ab, cd; Ab2e, fAf1."
889,O'Donnell's hornpipe,A,"ab, cd; ab, ca1."
889,O'Donnell's hornpipe,B,"ab, ab; cAc1, dAa."
890,Ballincollig in the morning,A,"ab, cd; ef, gh."
890,Ballincollig in the morning,B,"ab, cd; ef, gAh."
891,The flowers of spring,A,"ab, ca1; ab, de."
891,The flowers of spring,B,"ab, cd; ab, eAe."
892,The woods of Kilkenny,A,"ab, cb; ab, de."
892,The woods of Kilkenny,B,"ab, cd; eAb, AdAe."
893,O'Donovan's hornpipe,A,"ab, cd; ab, b1e."
893,O'Donovan's hornpipe,B,"Aa1a, bAd; AaAb, Ab1Ae."
894,The friendly visit,A,"ab, cd; ab, ea1."
894,The friendly visit,B,"ab, Ab1c; Aab1, AeAa1."
895,Tim the turncoat,A,"ab, cd; ab, ef."
895,Tim the turncoat,B,"ab, cd; ab, cAf."
896,The old vest and cravat,A,"ab, cd; ab, ce."
896,The old vest and cravat,B,"ab, ac; de, fAe."
897,The Lakeside road,A,"ab, cd; ef, gh."
897,The Lakeside road,B,"ab, cd; ef, gh."
898,The boys of Bluehill,A,"ab, cd; ef, gh."
898,The boys of Bluehill,B,"ab, cd; ef, gAd1."
899,The first of May,A,"ab, cd; ef, gh."
899,The first of May,B,"ab, cd; ef, gh."
900,Autumn woods,A,"ab, cd; ef, gh."
900,Autumn woods,B,"ab, cAd1; dAb1, ef."
901,The fiddler's contest,A,"ab, ac; ab, c1d."
901,The fiddler's contest,B,"ab, Abc; ad, eAd."
902,Bonaparte's defeat,A,"ab, cd; ab, ce."
902,Bonaparte's defeat,B,"AcAc, aAb1; AaAb, AcAe."
903,Corney Drew's hornpipe,A,"ab, cd; ef, gh."
903,Corney Drew's hornpipe,B,"ab, cAd1; de, fg."
904,O'Connor's favorite,A,"ab, cd; ab, ef."
904,O'Connor's favorite,B,"ab, cd; ef, gAc."
905,The hunter's hornpipe,A,"ab, cd; ef, gh."
905,The hunter's hornpipe,B,"ab, cd; ef, gAh."
906,The fairies' hornpipe,A,"ab, cd; ef, gh."
906,The fairies' hornpipe,B,"ab, cd; d1e, fg."
907,The handsome plowboy,A,"ab, cd; ef, gh."
907,The handsome plowboy,B,"ab, cd; ef, gh."
907,The handsome plowboy,C,"ab, cd; ef, gh."
907,The handsome plowboy,D,"Bha, "
908,The pet of the house,A,"ab, a1c; ab, a1a."
908,The pet of the house,B,"Aba, Abb; Aba, AaAa."
909,The Queen of May,A,"ab, cd; ef, gh."
909,The Queen of May,B,"ab, cd; ef, gh."
910,The man from Newry,A,"ab, cd; ef, gh."
910,The man from Newry,B,"Ah1a, bc; Ah2d, ef."
911,Spellan the fiddler,A,"ab, cd; ab, ef."
911,Spellan the fiddler,B,"AbAd1, Ad2a; AaAb, AeAf."
912,The widow Catwell's fancy,A,"ab, cd; ef, gh."
912,The widow Catwell's fancy,B,"ab, cAg1; de, fg."
913,The cuckoo's nest,A,"ab, cd; ef, gh."
913,The cuckoo's nest,B,"ab, cd; ef, gh."
913,The cuckoo's nest,C,"ab, Ba1Bb1; cd, eBh."
914,Higgin's hornpipe,A,"aa1, a1b; aa1, a1c."
914,Higgin's hornpipe,B,"ab, cAb; AaAa1, Aa1Ac."
915,Jacks the lad,A,"ab, cd; ef, gh."
915,Jacks the lad,B,"Aba, bc; AeAf, dAh."
916,Cooney's hornpipe,A,"ab, cd; ef, gh."
916,Cooney's hornpipe,B,"ab, a1c; de, a2f."
917,Gillespie's hornpipe,A,"ab, cd; ef, gh."
917,Gillespie's hornpipe,B,"ab, cAa1; de, fg."
918,Back of the haggard,A,"ab, cd; ef, gh."
918,Back of the haggard,B,"ab, cd; ef, gAa."
919,The mountains of Kerry,A,"aa, bc; aa, de."
919,The mountains of Kerry,B,"aAc1, bc; de, dAe."
920,The flowers of Edinburgh,A,"ab, cd; ef, gh."
920,The flowers of Edinburgh,B,"ab, cd; ef, gh."
921,The redhaired boy,A,"ab, cd; ef, gh."
921,The redhaired boy,B,"ab, cd; ef, gh."
922,The fancy fair,A,"ab, cd; ef, gh."
922,The fancy fair,B,"aAe1, Acb; cd, eAd1."
922,The fancy fair,C,"aAe2, Af1b; Ah1Ae2, Af1c."
922,The fancy fair,D,"aa1, a1a1; bCc1, cAd."
922,The fancy fair,C1,"Ac2Ae2, Af1b; Ah1Ae2, Af1c."
922,The fancy fair,E,"a"
923,The wily old bachelor,A,"ab, cd; ef, gh."
923,The wily old bachelor,B,"ab, cd; ef, gh."
924,The old story-teller,A,"aa1, bc; da2, ef."
924,The old story-teller,B,"aAa3, bc; de, fAa."
925,The Londonderry hornpipe,A,"ab, ac; ab, db1."
925,The Londonderry hornpipe,B,"Ad1a, Ad1b; Ad1a, AdAb1."
925,The Londonderry hornpipe,C,"aAb1, ab; aAb1, cAb1."
925,The Londonderry hornpipe,D,"aBa, aBb; aBa, CcAb1."
925,The Londonderry hornpipe,E,"Ad1Ba, Cb1Bb; Ad1Ba, aAb1."
925,The Londonderry hornpipe,F,"aAc1, bBb; aAc1, AdAb1."
926,Hawk's hornpipe,A,"ab, cd; eb1, fg."
926,Hawk's hornpipe,A1,"ab, cd; eb1, fg."
926,Hawk's hornpipe,B,"ab, cAg1; de, AfAg."
926,Hawk's hornpipe,B1,"ab, cAg1; de, AfAg."
927,Always welcome,A,"ab, cd; ef, gh."
927,Always welcome,B,"aAb1, bc; dAb2, ef."
927,Always welcome,C,"ab, cd; ef, gh."
928,Jim Boulton's fancy,A,"ab, cd; ef, gh."
928,Jim Boulton's fancy,B,"ab, cd; ef, gh."
929,John Carey's daughter,A,"ab, ac; ab, de."
929,John Carey's daughter,B,"aAb, bAb; b1c, dAe."
930,Where did you find her?,A,"aa, bc; aa, da1."
930,Where did you find her?,B,"ab, Abc; ab, AdAa1."
931,Roger was a plowboy,A,"ab, cd; ab, ef."
931,Roger was a plowboy,B,"ab, cd; AaAb, Af1a."
931,Roger was a plowboy,C,"BbBc, BdAa; AbAe, Af"
932,The Kilfinane hornpipe,A,"ab, cd; ae, fg."
932,The Kilfinane hornpipe,B,"aAe, bc; aAe, da1."
932,The Kilfinane hornpipe,C,"ab, Be1c; ab, db1."
933,Whitney's fancy,A,"ab, cd; ae, cf."
933,Whitney's fancy,B,"Aca, AeAc; Aca, AeAc."
934,The seaman's club,A,"aa, ba1; aa, bc."
934,The seaman's club,B,"aAa1, bAb1; Ab2Ab2, AbAb4."
935,The humors of Castle Bernard,A,"ab, ac; ab, de."
935,The humors of Castle Bernard,B,"ab, a1Ac; ab, Ae1Ae."
936,Durang's hornpipe,A,"ab, ac; ab, b1a1."
936,Durang's hornpipe,B,"ab, cd; ef, Ab1Aa1."
937,The Bantry hornpipe,A,"ab, cd; ab, ef."
937,The Bantry hornpipe,B,"aAb, AcAd; bc, Ad1Af."
937,The Bantry hornpipe,C,"aAe1, bc; de, Ad1Af."
937,The Bantry hornpipe,D,"aBc, bBb1; aBc, Ad1Af."
938,Caroline O'Neill's hornpipe,A,"ab, cd; ef, gh."
938,Caroline O'Neill's hornpipe,B,"ab, cd; ef, gAh."
938,Caroline O'Neill's hornpipe,C,"ab, cb1; de, fAh."
938,Caroline O'Neill's hornpipe,D,"Ae1Ah1, aBd; Cc1Cc, CfAh."
939,The new century,A,"ab, cd; ef, gh."
939,The new century,B,"ab, aAb1; cd, eAh."
940,Rick's rambles,A,"ab, a1b1; cd, a1e."
940,Rick's rambles,B,"ab, cd; eAd, Aa1Ae."
941,The horse and jockey,A,"ab, cd; ef, ga."
941,The horse and jockey,B,"ab, cAd; de, fAa."
942,The humors of Ballinlass,A,"ab, cd; eb, fe1."
942,The humors of Ballinlass,B,"Ad1Ab1, Ae2a; Ad1Ab1, AfAe1."
942,The humors of Ballinlass,C,"Ad1Ab1, Ae4Ad; AeAb, AfAe1."
943,Beside a rath,A,"ab, cd; ae, fg."
943,Beside a rath,B,"aAc1, bc; AaAe, AfAg."
944,Madam if you please,A,"ab, cd; eb, fg."
944,Madam if you please,B,"ab, cAd; dd1, AcAe."
945,The wren hornpipe,A,"ab, cd; ae, fg."
945,The wren hornpipe,B,"Ad1Ab1, aAf1; AaAe, AfAg."
946,Biddy early,A,"ab, cd; ab, ea."
946,Biddy early,B,"Ae1a, bAc1; cd, eAa."
947,Swinging around the circle,A,"ab, cd; ad1, d2e."
947,Swinging around the circle,B,"Ad3a, bc; Ad3a, bc."
948,The drunken sailor,A,"ab, cd; ab, ea."
948,The drunken sailor,B,"AbAc, AdAa; AbAe, Aa1a."
948,The drunken sailor,C,"ab, cBa; aAa, Aa1Ba."
948,The drunken sailor,C1,"ab, cBa; aAa, Aa1Ba1."
948,The drunken sailor,D,"ab, cCa1; ad, Aa1Ba1."
948,The drunken sailor,D1,"ab, cCa1; ad, Aa1e."
