Tune,Title,Part,Structure
214,The old grey goose,A,"ab, cb1; dd1, eb."
214,The old grey goose,B,"aa1, a2a3; a1Aa1, AeAb."
214,The old grey goose,C,"ab, Ab1a1; Aa2b1, AeAb."
214,The old grey goose,D,"Ab2Ab, Ab2Ab3; Ab2Ab4, AeAb."
214,The old grey goose,E,"Aa3Ab5, Aa3Ab6; Aa3Aa1, AeAb."
214,The old grey goose,F,"Ae1Ab, aAb1; Ad2b, Aec."
215,Hinchy's delight,A,"ab, a1c; ab, a1c1."
215,Hinchy's delight,B,"Aa2Aa2, Aa3a; bc, Aa4Ac1."
215,Hinchy's delight,C,"Bb1Bb2, Aa1Ac; Bb1a, Aa1Ac1."
216,Come now or stay,A,"ab, cd; ab, c1a1."
216,Come now or stay,B,"ab, b1c; ab, de."
217,Buttermilk Mary,A,"ab, cd; ec1, fg."
217,Buttermilk Mary,B,"Ad1Aa1, aAg1; Ac2Ac3, bAg."
218,The Connachtman's rambles,A,"ab, a1c; ab1, b2c1."
218,The Connachtman's rambles,B,"Aa2a, Aa2b; cd, a1Ac1."
219,Father Fielding's favorite,A,"ab, cd; ab1, d1d2."
219,Father Fielding's favorite,B,"aa1, aa2; a3b, a4Ad2."
220,Father Tom's wager,A,"ab, cd; a1b, ce."
220,Father Tom's wager,B,"Ac1a, bc; Ac1a1, c1Ae."
221,Bryan O'Lynn,A,"ab, ac; ab, de."
221,Bryan O'Lynn,B,"Aa1Aa2, Ac1a; Aa1Aa2, bAc."
222,O'Gallagher's frolics,A,"aa1, bc; aa1, de."
222,O'Gallagher's frolics,B,"Aa2Aa3, ab; Aa4Ac1, AdAe."
223,The rambler from Clare,A,"ab, cb1; ab, b2d."
223,The rambler from Clare,B,"aAa1, Ab3Aa1; ab, Ab2Ad."
224,Biddy Maloney,A,"ab, b1c; ab2, dc1."
224,Biddy Maloney,B,"Ac2Ac3, Ad1Ac4; Ac5a, a1Ac1."
224,Biddy Maloney,C,"aBa2, Ad1Ac4; Ba3Ba2, Ba1Ac1."
224,Biddy Maloney,D,"Ac6Ab3, Ac7a; a1a2, AdAc1."
224,Biddy Maloney,E,"aa, Ad1Ac4; aa, bBa4."
224,Biddy Maloney,F,"aa1, Ca1Ab4; aa2, Ba5Ba4."
224,Biddy Maloney,G,"Ad2Ba6, Ad1Ac4; Ad2Ba6, AdAc1."
225,The newmarried couple,A,"ab, cc1; ab, da1."
225,The newmarried couple,B,"AcAc2, AcAc1; Ac3Ab1, AdAa1."
226,Tim Hogan's jig,A,"ab, ac; ab, dc."
226,Tim Hogan's jig,B,"Ad1Ac1, Ad2Ac2; Ad1Ac3, AdAc."
226,Tim Hogan's jig,C,"ab, ab1; ab, AdAc."
227,Dick Sullivan's favorite,A,"ab, ac; ab, dc."
227,Dick Sullivan's favorite,B,"ab, b1c; ad, AdAc."
227,Dick Sullivan's favorite,C,"aa1, a2Ac1; a2Bd, AdAc."
228,Come to dinner,A,"ab, a1c; ab1, da."
228,Come to dinner,B,"ab, Ad1c; ab, Ad1Aa."
229,The jolly jocker,A,"ab, ac; a1d, ef."
229,The jolly jocker,B,"ab, a1Ae1; ab, Ad1Af1."
230,Mixing the punch,A,"ab, cd; ee1, fd1."
230,Mixing the punch,B,"Ac1Ad2, ab; Aa1a1, AfAd1."
231,Finerty's frolic,A,"ab, cd; ae, fd."
231,Finerty's frolic,B,"ab, cd; eAb, AfAd."
232,Old as the hills,A,"ab, ac; c1b, de."
232,Old as the hills,B,"Ab1Aa1, Ac2a; Ab2a1, Ad1Ab1."
232,Old as the hills,C,"Aa1Ac2, BaAb2; Ba1Ad1, a"
233,Long John's wedding,A,"ab, aa1; ab, a1c."
233,Long John's wedding,B,"aAc1, Aa1Aa2; a1Aa3, Aa1Ac."
234,Kit O'Mahoney's jig,A,"aa1, bc; b1d, ec1."
234,Kit O'Mahoney's jig,B,"aAe, aAe1; Ae2Ab2, AeAc1."
234,Kit O'Mahoney's jig,C,"Ba1a, bc; Ba1a1, AeAc1."
234,Kit O'Mahoney's jig,D,"Ae3Ae, BaAb3; Ab4Ae4, AeAc1."
235,The humors of Drinagh,A,"ab, ac; ab, b1d."
235,The humors of Drinagh,B,"Ab1Ab2, Ab1Ab2; Ab2a, Ab1Ad."
235,The humors of Drinagh,C,"aAb3, aAc1; aAb, Ab1Ad."
235,The humors of Drinagh,D,"aBa1, ab; cBa2, Ab4Ad."
236,The gallowglass,A,"ab, a1b1; aa2, a3b."
236,The gallowglass,B,"aAb, Aa1Ab1; aAb2, Aa3Ab."
236,The gallowglass,C,"BaAb, Aa1Ab1; ab, cAb."
237,The Fardown farmer,A,"ab, ac; ab, de."
237,The Fardown farmer,B,"Ab1Ad1, Ab1Ab2; Ab1Ad1, AdAe."
238,The old horned sheep,A,"ab, ac; ab, b1d."
238,The old horned sheep,B,"Ab2Ab2, Ab2Ad1; Ab2Ab3, ab."
239,The Laccarue boys,A,"ab, cd; ab, c1d1."
239,The Laccarue boys,B,"aAb, Aa1Ad2; Ac2Ab, Ac1Ad1."
240,The lark in the morning,A,"ab, cd; d1e, fg."
240,The lark in the morning,B,"aa1, ab; b1c, AfAg."
241,Sergt. Stack's favorite,A,"aa1, a2b; aa1, cd."
241,Sergt. Stack's favorite,B,"ab, aAd1; aAd2, Aa3c."
242,The ruins of Killmallock,A,"ab, cd; d1b1, ef."
242,The ruins of Killmallock,B,"aAe1, Ac1b; aAe1, cd."
243,The Mountaineers' march,A,"aa1, ba1; aa1, bc."
243,The Mountaineers' march,B,"Aa2Aa3, Aa4a; Aa4Aa5, bAc."
244,The top of Cork road,A,"ab, cd; ab, ce."
244,The top of Cork road,B,"aAb1, Ae1a1; a2Ac, Aea."
244,The top of Cork road,C,"Ab1Ae1, Ba1Ba2; AcAe, "
245,The Monaghan jig,A,"aa1, aa2; aa1, a3b."
245,The Monaghan jig,B,"ab, a1Ab; ab, Aa3Ab."
245,The Monaghan jig,C,"aAb1, aAb2; aAb1, Aa3Ab."
246,The mooncoin jig,A,"ab, a1c; ab, dc."
246,The mooncoin jig,B,"ab, ab1; aAc1, Ac2Ac."
246,The mooncoin jig,C,"Aa2a, Aa3Ac; Aa2b, Ad1Ac."
247,The bashful maid,A,"ab, a1c; ab, b1d."
247,The bashful maid,B,"Ad1Ad2, Aa1Ac; Ad1a, Ab1Ad."
248,The Barrowstown races,A,"ab, cd; ac1, ef."
248,The Barrowstown races,B,"Aa1a, Aa2a; Aa3Ac1, AeAf."
248,The Barrowstown races,C,"Aa1a, ba1; Ac2c, AeAf."
248,The Barrowstown races,D,"Cb1Cb2, Cc1a; Cc2Cc3, AeAf."
249,The flitch of Bacon,A,"ab, ac; ab, dc."
249,The flitch of Bacon,B,"aAd1, aAd2; aAd1, AdAc."
250,Paddy in London,A,"ab, cd; ab, c1e."
250,Paddy in London,B,"Aa1Ac2, AcAd; Aa1Ac2, Ac1Ae."
250,Paddy in London,B1,"Aa1Ac2, AcAd; AaAb, Ac1Ae."
250,Paddy in London,C,"Ad1Ac3, AcAd; Ac4Ab, Ac1Ae."
251,The angry peeler,A,"ab, cb1; ab, cb2."
251,The angry peeler,B,"Aa1a, Acb; Aa1a, Aa2b1."
252,The cook in the kitchen,A,"ab, ac; ab, de."
252,The cook in the kitchen,B,"Aa1Aa2, Aa3Ac; Aa1Aa1, AdAe."
252,The cook in the kitchen,C,"ab, AdAc; ab, AdAe."
253,The humors of Dingle,A,"ab, cb1; ad, ee1."
253,The humors of Dingle,B,"Ab2a, a1Ae2; Ab2Ae3, Ae4Ae1."
254,The absent-minded man,A,"ab, cd; ab, ef."
254,The absent-minded man,B,"Ad1Ad1, Ad2Ad2; Ad3Ad4, Ad5a."
255,Felix the wrestler,A,"ab, a1b1; ab, cb2."
255,Felix the wrestler,B,"Aa2Ac1, Aa3Ac2; Aa2Ac1, AcAb2."
255,Felix the wrestler,B1,"Aa2Ac1, Aa3Ac2; Aa4Aa5, Aa6Ab2."
256,The night dance,A,"ab, ac; de, fg."
256,The night dance,B,"aAf1, aAg1; a1b, cAc."
256,The night dance,C,"ab, aAc; Ad1Ae, AfAg."
257,Morgan Rattler,A,"ab, ac; ab, dc."
257,Morgan Rattler,B,"aa1, a2Aa1; aa3, a4Ac."
257,Morgan Rattler,C,"Aa2a, Aa2Ac; Aa2a1, AaAc."
257,Morgan Rattler,D,"Ba5a, bAa1; Ba5a, Ad1Ac."
257,Morgan Rattler,E,"Ba5Da, DbAa1; ab, Ad1Ac."
257,Morgan Rattler,F,"Db1Da, Db1Aa1; aa1, a2Ac."
257,Morgan Rattler,G,"Aa1Ac1, Aa1Ac; Aa1a, AdAc."
257,Morgan Rattler,H,"Ea1a, Ea2Aa3; Ea1Eb, Ba4Ac2."
257,Morgan Rattler,I,"ab, aAa3; aCa1, AaAc2."
257,Morgan Rattler,J,"Ab1a, Ab1Ac; Ab1Ga1, AdAc."
257,Morgan Rattler,K,"aa1, aAc; aa2, bAc."
258,Wallop the potlid,A,"ab, ac; ab, a1c1."
258,Wallop the potlid,B,"Ac2a, ba1; Ab1c, dd1."
258,Wallop the potlid,C,"Aa2Ab2, Aa2Ac3; Aa2Bd2, Aa3Ac4."
258,Wallop the potlid,D,"Bd2Bd3, Bd2Ac3; Bd2Bd3, ab."
258,Wallop the potlid,E,"BbBa, Bb1Ba1; Ab1Bc, Bd4Bd1."
258,Wallop the potlid,F,"Ac5Ba, Bb1Ba2; Bd5a, Db1Bd1."
259,Paddy's whiskers,A,"ab, cd; ab, c1e."
259,Paddy's whiskers,B,"Ac2Ab1, Ac3Ab2; AaAb3, Ac1Ae."
260,The Frieze Breeches,A,"ab, b1c; ab, a1d."
260,The Frieze Breeches,B,"Ab2a, Ab1Ac; Ab2a, Aa1Ad."
260,The Frieze Breeches,C,"Ab2Ba, Bd1Ad1; Ab3Ad1, Aa1Ad."
260,The Frieze Breeches,D,"Ad2Ab4, aBa; Ad2Ab4, Aa1Ad."
260,The Frieze Breeches,E,"Ab5a, Ab6b; Ab5a, b1Ad3."
260,The Frieze Breeches,F,"EbAd1, Ad4Ac; EbAd1, Aa1Ad."
260,The Frieze Breeches,G,"Ab7a, Ab2Ba; Ab7Ea1, Aa1Ad."
260,The Frieze Breeches,H,"Ga1Ga, Ab2Ba; Aa2Ad1, Aa1Ad."
261,The humors of Ayle House,A,"ab, a1b1; a1c, db1."
261,The humors of Ayle House,B,"Ab2Ab3, Ab2Ab1; Ab2Ac, AdAb1."
262,Bold John O'Leary,A,"ab, cd; ea1, fg."
262,Bold John O'Leary,B,"ab, b1Aa; Ac1Ae1, Aec."
263,The humors of Cavan,A,"ab, cd; ab, ce."
263,The humors of Cavan,B,"Ab1Aa1, Ab1Aa2; Ab1Ac1, Ab2Aa3."
264,The banks of Lough Gowna,A,"ab, ac; ab, de."
264,The banks of Lough Gowna,B,"Ad1Aa1, Ad1a; Ad1Aa1, Adb."
265,The twopenny jig,A,"ab, a1b1; ab2, cb3."
265,The twopenny jig,A1,"ab, a1b1; ab2, cb4."
265,The twopenny jig,B,"aa1, Aa1Ab1; aa2, AcAb4."
265,The twopenny jig,B1,"aa1, Aa1Ab1; a3b, AcAb3."
266,The green meadow,A,"ab, ab1; ab, cb1."
266,The green meadow,B,"ab, ac; ab1, dAb1."
266,The green meadow,B1,"ab, ac; ef, dAb1."
267,The merry maiden,A,"ab, ac; ab, de."
267,The merry maiden,B,"aa1, bAa1; aa1, cAe."
268,Blue bonnets jig,A,"aa1, a2b; aa1, cd."
268,Blue bonnets jig,B,"aAc1, a1b; aAc1, Ac2Ad."
269,The field of flowers,A,"ab, ab1; ac, ad."
269,The field of flowers,B,"ab, a1c; a2Ac, AaAd."
270,The glens of Mayo,A,"ab, a1c; ad, ab1."
270,The glens of Mayo,B,"Ab2a, a1Ab3; Ab2Ab4, a2b."
271,I'll neither spin nor weave,A,"ab, cd; ab, ab1."
271,I'll neither spin nor weave,B,"Ab2Aa1, aAa; Ab2Aa1, AaAb1."
272,Jackson's maid,A,"ab, cc1; ab, c2d."
272,Jackson's maid,B,"aa1, a2Ad1; bAb, Ac2Ad."
273,The Kilfinane jig,A,"ab, b1b2; cd, c1e."
273,The Kilfinane jig,B,"aAa1, ab; aAa2, Ac1Ae."
274,Walk out of it Hogan,A,"ab, ac; ac1, dc."
274,Walk out of it Hogan,B,"Ab1Ab1, Ab1Ac; ab, Ab1Ac."
274,Walk out of it Hogan,C,"Ab2Bc1, ab; Bb1Ad1, cc1."
274,Walk out of it Hogan,D,"Aa1Ab1, Aa1Cc2; Aa1Bb2, Ab1Ac."
274,Walk out of it Hogan,E,"Ca1Aa2, Ca1Aa3; Ca1Bc1, Ab1Ac."
275,The boys of Comanore,A,"ab, ac; a1b, c1d."
275,The boys of Comanore,B,"ab, cAc2; ab, Ac3Ad."
276,The barefoot boy,A,"ab, aa1; ab1, cd."
276,The barefoot boy,B,"Ac1a, AcAc2; Ac1a, AcAd."
276,The barefoot boy,B1,"Ac1a, AcAc2; bAb2, cAb3."
277,The onehorned cow,A,"ab, ac; ab, a1d."
277,The onehorned cow,B,"Aa2Ab1, Aa2Ac1; Aa2Ab1, Aa1Ad."
278,Sweet Biddy Daly,A,"aa1, bc; aa1, bd."
278,Sweet Biddy Daly,B,"aa1, a2Aa2; aa1, AbAd."
279,The geese in the bogs,A,"ab, ab1; ab, ca1."
279,The geese in the bogs,B,"Ab1a, AbAb2; Ab1a1, AcAa1."
279,The geese in the bogs,B1,"Ab1a, AbAb2; Ab1a1, AcAb1."
280,Going to Donnybrook,A,"ab, cd; ab, cb1."
280,Going to Donnybrook,B,"Ad1Ac1, Ad1a; Ad1Ab2, ba1."
280,Going to Donnybrook,B1,"Ad1Ac1, Ad1a; Ad1Ab2, ca2."
281,Wallop the spot,A,"ab, aa1; ab, ca1."
281,Wallop the spot,B,"ab, aAa1; ab1, cAa1."
281,Wallop the spot,C,"aAa2, a1Aa1; aAc1, bAa1."
281,Wallop the spot,D,"Ba1a, bAa1; Ba1a, Bc1Aa1."
282,Take it easy,A,"ab, ac; ab, de."
282,Take it easy,B,"aa1, aAd1; aa1, Ad2Ae."
282,Take it easy,C,"Aa1Ba2, Aa1Ae1; Aa1Ba2, Ad3Ae."
283,The man who died and rose again,A,"ab, ac; ad, ec."
283,The man who died and rose again,B,"Aa1Ac1, Aa1Ac2; aAd, AeAc."
284,Kitty of Oulart,A,"aa, bb1; aa, cd."
284,Kitty of Oulart,B,"aAc1, Ad1Aa1; aAc1, AcAd."
284,Kitty of Oulart,C,"aAc2, bAd2; aAc2, bAd."
285,Strop the razor 1st setting,A,"ab, aa1; ab1, ca1."
285,Strop the razor 1st setting,B,"Aa2a, Aa3Aa1; Aa2a, AcAa1."
286,Strop the razor 2nd setting,A,"ab, a1c; ab, dc."
286,Strop the razor 2nd setting,B,"Ad1Ad2, Ad1Ac; Ad1Ad2, Ab1Ac."
286,Strop the razor 2nd setting,C,"ab, Ab1Ac; ab, Ab1Ac."
286,Strop the razor 2nd setting,D,"Ac1a, Aa2Ac; Aa2Ad, AdAc."
287,Gillan's apples,A,"ab, cb1; ad, c1b2."
287,Gillan's apples,B,"Ac2a, a1a2; Ac2a3, Ac1Ab2."
287,Gillan's apples,C,"aAa1, aAc3; aAd, Ac1Ab2."
287,Gillan's apples,D,"Ba4a, Ba5Ab3; Ba4b, Ac1Ab2."
288,The Gudgeon of Maurice's Car,A,"ab, ac; ab, de."
288,The Gudgeon of Maurice's Car,B,"aAb, aAc; Aa1Ab, AdAe."
289,The humors of Ballydehob,A,"ab, bc; ab, b1a1."
289,The humors of Ballydehob,B,"Ac1Aa2, Aba; Ac1Aa2, Ab1Aa1."
290,The luck penny,A,"ab, a1c; ad, a2e."
290,The luck penny,B,"ab, Aa3a1; Aa4Aa5, a2Ae."
290,The luck penny,C,"Ac1a, Ac2a1; Ac1Aa5, Ba2Ae."
291,The Blarney pilgrim,A,"aa1, bc; aa1, bd."
291,The Blarney pilgrim,B,"Aa2a, Aa2a1; ba, Ab1Aa3."
291,The Blarney pilgrim,C,"aAa1, AbAc; aAa1, AbAd."
292,The dairy maid,A,"ab, cd; c1c2, ef."
292,The dairy maid,B,"Af1Aa1, Ac3Ad; Ac1Ac2, AeAf."
293,How much has she got?,A,"ab, ab1; ac, db2."
293,How much has she got?,B,"aAa1, a1b; aAc, AdAb2."
294,The rivals,A,"ab, aa1; b1a2, b2a3."
294,The rivals,B,"aAb1, a1Aa4; a2b, Ab2Aa3."
294,The rivals,C,"Ba3Ab3, Ba1Aa4; aBb, Ab2Aa3."
295,All alive,A,"ab, a1b1; a2c, db2."
295,All alive,B,"ab, cb1; ad, c1Ab2."
296,Barney O'Neill,A,"ab, a1c; ab, b1d."
296,Barney O'Neill,B,"Ac1a, Ac2Ab2; bAc3, Ab1Ad."
297,Johnny the jumper,A,"aa1, a2a3; aa4, ba3."
297,Johnny the jumper,B,"aa1, bAa3; aa2, AbAa3."
298,Paddy "go easy",A,"ab, ac; ad, ec."
298,Paddy "go easy",B,"aa1, a2a3; a4a5, a6Ac."
298,Paddy "go easy",C,"aAb, aAc; aAd, AeAc."
299,Be easy you rogue!,A,"ab, a1b1; ac, db2."
299,Be easy you rogue!,B,"Ad1Ab3, Ad1Ab1; Aa2a, AdAb2."
299,Be easy you rogue!,C,"Ad2a, AdAb4; bc, Ad3Ab2."
299,Be easy you rogue!,D,"aAb5, aAc1; aBa, AdAb2."
300,Apples in winter,A,"ab, cd; a1d1, ef."
300,Apples in winter,B,"Ac1a, Ac2b; Ac1Ac3, cd."
300,Apples in winter,B1,"Ac1a, Ac2b; Af1e, AeAf."
301,The humors of Castle Comer,A,"aa1, a2a3; aa4, bc."
301,The humors of Castle Comer,B,"Aa5a, Aa2Aa3; Aa5a, AbAc."
302,The black rogue,A,"aa1, aa2; aa, ba2."
302,The black rogue,B,"Ab1a, Ab1a1; bAa3, AaAa2."
303,The ranting rake,A,"aa1, ba2; aa1, ba."
303,The ranting rake,B,"aAa3, Ab1b; cd, eAa."
304,The blooming meadows,A,"ab, b1c; ad, d1e."
304,The blooming meadows,B,"aAc1, Ab2Ac2; aAc1, Ad1Ae."
304,The blooming meadows,B1,"aAc1, Ab2Ac2; Ad2a1, Ad1Ae."
305,Delaney's drummers,A,"ab, a1c; ab1, b2d."
305,Delaney's drummers,B,"ab, a1b1; a2b, Ab2Ad."
305,Delaney's drummers,B1,"ab, a1b1; Ac1b2, Ab2Ad."
306,Crabs in the skillet,A,"ab, cd; ab, ef."
306,Crabs in the skillet,A1,"ab, cd; ab, ee1."
306,Crabs in the skillet,B,"Ac1Ac2, Ae2Ae1; Ac1Ac2, Ae2Af1."
306,Crabs in the skillet,B1,"Ac1Ac2, Ae2Ae1; Ac1Ac2, Ae2Af."
306,Crabs in the skillet,C,"aa1, AcAd; aAb1, AeAf."
306,Crabs in the skillet,C1,"aa1, AcAd; aAb1, AeAe1."
307,The woeful widow,A,"ab, a1c; ab, a1c1."
307,The woeful widow,B,"ab, b1Ab; ab, Abc."
308,The cat and the bacon,A,"ab, ab1; ab, cd."
308,The cat and the bacon,B,"ab, cd; AaAb, Aa1b1."
309,The galloping young thing,A,"ab, a1c; ab1, de."
309,The galloping young thing,B,"Ab2Ab1, Ab2Aa2; Ab2Ab1, AdAe."
310,The bridal jig,A,"ab, cd; a1b, ce."
310,The bridal jig,B,"aAb1, Ac1Ac2; aAb1, Ac1Ac3."
310,The bridal jig,B1,"aAb1, Ac1Ac2; aAb1, Ac1Ac4."
311,The man in the moon,A,"ab, a1c; ab1, de."
311,The man in the moon,B,"ab, a1b1; a2b2, AdAe."
312,Come with me now,A,"aa1, bb1; aa2, cd."
312,Come with me now,B,"aAb2, aAb3; aAa2, AcAd."
313,The frost is all over,A,"ab, a1c; ab, a1d."
313,The frost is all over,B,"Aa2Aa3, Aa2a; Aa2Aa3, bb1."
313,The frost is all over,C,"Aa2Aa3, Aa2Ba; Aa4Aa5, BbBb2."
314,Sally Magee,A,"ab, cd; ac1, ec2."
314,Sally Magee,B,"ab, aAb1; ab, AeAc2."
315,The red rose,A,"ab, ca1; ab, cd."
315,The red rose,B,"ab, AcAa1; aAb, AcAd."
316,The humors of Glynn,A,"ab, cd; ab1, eb."
316,The humors of Glynn,B,"ab, cAb2; AaAb1, AeAb1."
317,The Irishwoman,A,"ab, a1b1; ab, b2a2."
317,The Irishwoman,B,"Ab3Ab4, Ab5Ab6; ab, Ab2Aa2."
318,The merry huntsman,A,"aa1, ab; aa2, a3b."
318,The merry huntsman,B,"aAb1, aAb2; aAb1, Aa3Ab2."
318,The merry huntsman,B1,"aAb1, aAb2; aAb1, Aa3Ab3."
319,The fairy jig,A,"ab, cd; ab1, ea1."
319,The fairy jig,B,"aa1, AcAd; aa1, AcAa1."
320,The piper's welcome,A,"ab, a1a2; ab, ca2."
320,The piper's welcome,B,"ab, a1b1; ab, AaAa2."
320,The piper's welcome,C,"aAb, aAa2; a1Ab, Ba2Aa2."
321,Oh! Hag you have killed me,A,"ab, cd; ad1, ee."
321,Oh! Hag you have killed me,B,"aAb1, AcAd; a1Ab1, AeAe."
322,The full moon,A,"aa, bb1; aa, cd."
322,The full moon,B,"Ab2a, Ad1Ad1; AaAa, AcAd."
323,Yesterday morning,A,"ab, cd; ab, c1e."
323,Yesterday morning,B,"Ab1Ae1, AcAd; AaAb, Ac1Ae."
324,Castletown Conners,A,"ab, ca1; ab, de."
324,Castletown Conners,B,"ab, ac; ab, AdAe."
325,Martin's onehorned cow,A,"ab, ac; ab, dc1."
325,Martin's onehorned cow,B,"aAb1, a1Ac2; aAb1, AdAc1."
326,Ollistrun jig,A,"ab, ab1; ab2, cc1."
326,Ollistrun jig,B,"ab, ac; ab, a1c."
327,Stay where you are,A,"ab, cb; a1b, cd."
327,Stay where you are,A1,"eb, cb; a1b, cd."
327,Stay where you are,B,"A1eA1e1, aA1e1; bA1e1, a1Ad."
327,Stay where you are,B1,"A1eA1e1, aA1e1; bA1e1, a1Ad."
327,Stay where you are,C,"A1eAc1, Ab1Ac1; Aa1Ac1, aAd."
327,Stay where you are,C1,"A1eAc1, Ab1Ac1; Aa1Ac1, aAd."
327,Stay where you are,D,"A1e2"
328,Miss Walsh's fancy,A,"ab, ac; ab, de."
328,Miss Walsh's fancy,B,"Ada, AdAe1; Ada, AdAe."
328,Miss Walsh's fancy,C,"Aa1a, Aa1Ae2; Aa1a, AdAe."
329,Humors of Clare,A,"ab, b1c; ab, de."
329,Humors of Clare,A1,"ab, b1c; ab, de1."
329,Humors of Clare,B,"Ae2Ac1, Ae2Ac; Ae2Ac1, AdAe."
329,Humors of Clare,B1,"Ae2Ac1, Ae2Ac; Ae2Ac1, AdAe1."
329,Humors of Clare,C,"aAb, a1Ac; aAb, AdAe."
329,Humors of Clare,C1,"aAb, a1Ac; aAb, AdAe1."
330,The queen of the fair,A,"ab, cd; ab, a1e."
330,The queen of the fair,B,"Ad1a, AbAa1; Ad1a, bAe."
330,The queen of the fair,C,"ab, cAd1; db1, eAe."
330,The queen of the fair,C1,"ab, cAd1; fAd1, eAe."
331,The foot of the mountain,A,"ab, ac; ab, b1d."
331,The foot of the mountain,B,"Ab2Ab2, Ab3a; aAb2, Ab2Ab1."
331,The foot of the mountain,C,"AdAb2, Ab2Ab3; BaBa, Ab2Ab2."
331,The foot of the mountain,D,"Ab1Ad, "
332,The maids of Ballinacarty,A,"ab, ca; db, c1b1."
332,The maids of Ballinacarty,B,"Ad1Ad1, ab; Ad1Ad1, a1Aa1."
333,Miss Downing's fancy,A,"ab, ac; ab1, de."
333,Miss Downing's fancy,A1,"ab, ac; ab1, dc1."
333,Miss Downing's fancy,B,"Aa1Ab2, aAc2; Aa1Ab2, Ae1Ab3."
333,Miss Downing's fancy,B1,"Aa1Ab2, aAc2; Aa1Ab2, Ae1b."
334,When you go home,A,"ab, ab1; aa1, cb2."
334,When you go home,B,"Ab3a, Ab3Ab2; Ab3Aa1, AcAb2."
335,Friends of my heart,A,"ab, ca1; ad, c1d1."
335,Friends of my heart,B,"ab, a1b1; a2Aa2, Ab1c."
336,Down the river,A,"aa1, bc; aa2, de."
336,Down the river,B,"ab, a1Ad1; a2Aa3, Ac1Ae."
337,Come along with me,A,"ab, a1a2; ac, de."
337,Come along with me,B,"aa1, aAa3; a2Ad1, AdAe."
338,Cronin's Frolics,A,"ab, b1b; ab2, b1c."
338,Cronin's Frolics,B,"aAb3, a1Ab4; AaAb4, Ab5b."
338,Cronin's Frolics,C,"Ba2Ba, Ba2a; a1Aa1, Ab1Bb."
338,Cronin's Frolics,D,"Ca2Aa1, Ca3a; bAb4, Ab5Bb."
339,The belles of Liscarroll,A,"ab, a1c; ab1, de."
339,The belles of Liscarroll,A1,"ab, a1c; ab1, de1."
339,The belles of Liscarroll,B,"Aa2a, Ae2Ab2; Aa3Aa4, Aba1."
339,The belles of Liscarroll,B1,"Aa2a, Ae2Ab2; Aa3Aa4, AbAe3."
339,The belles of Liscarroll,C,"Aa5Aa6, aa1; bb1, Ba2a2."
340,Munster Bacon,A,"ab, cd; c1c2, ed1."
340,Munster Bacon,B,"Ad2a, Ac3a1; bc, dAd1."
341,Billy McCormick,A,"ab, a1c; ab1, dd1."
341,Billy McCormick,B,"Aa2Aa2, Ad2a; Aa3Ab2, AdAd1."
342,The chorus jig,A,"ab, a1c; ab, c1c2."
342,The chorus jig,B,"ab, aAc; ab, Ac3Ac2."
342,The chorus jig,C,"BaBb, Baa; bb1, Ac1Ac2."
342,The chorus jig,D,"Aa2Aa3, Aa2Ac; Aa2Aa3, Ac1Ac2."
342,The chorus jig,E,"Aa2Aa3, Aa2Ca1; Ab1Cb2, Ac1Ac2."
343,Church Hill,A,"ab, aa1; ab, a2a1."
343,Church Hill,B,"aa1, aAa1; a2a3, bAa1."
344,The stolen purse,A,"aa1, bc; aa1, de."
344,The stolen purse,B,"Ac1Aa1, AbAc; AaAa1, AdAe."
344,The stolen purse,C,"aAa1, AbAc2; aa1, AdAe."
345,The trip to Galway,A,"ab, cd; ad1, ef."
345,The trip to Galway,B,"Ae1a, Ae2a1; AeAb1, Ad2Af."
346,Miss Douglas,A,"ab, cd; ab, cd1."
346,Miss Douglas,B,"ab, Ac1Ad2; ab, Ac1Ad3."
346,Miss Douglas,B1,"ab, Ac1Ad2; AaAb, AcAd1."
347,The maid of Kinsale,A,"ab, cd; ab, c1d1."
347,The maid of Kinsale,B,"aAa1, bc; Ab1Ab2, Ab3Ad1."
348,The flowers of Dungarvan,A,"ab, cb1; b2d, d1b3."
348,The flowers of Dungarvan,B,"aa1, Aa1Ad2; Ab4b, Ac1Ab3."
349,Miss Grant's jig,A,"ab, a1b1; ac, b2d."
349,Miss Grant's jig,B,"ab, Ab3c; Ab4Ac1, a1Ad."
350,Don't be teasing,A,"ab, ac; ab1, de."
350,Don't be teasing,B,"Aa1Ac1, Aa1Ac2; Aa1a, bAe."
351,Clancy's frolics,A,"ab, b1b2; a1b, cd."
351,Clancy's frolics,B,"Aa2a, Aa2b; Aa2a, AcAd."
352,The powers of punch,A,"ab, a1c; db1, ef."
352,The powers of punch,B,"aa1, aAa2; AdAb1, AeAf."
352,The powers of punch,C,"ab, cAa3; c1Ad, Aa4Af."
352,The powers of punch,D,"Bd1a, bb1; Ad1c, Aa4Af."
353,The yellow wattle,A,"ab, cb1; cb, c1c2."
353,The yellow wattle,B,"aAb2, ab; aAb2, a1Ac2."
353,The yellow wattle,C,"aa, aa1; aa, a1Ac2."
353,The yellow wattle,D,"aAa1, aAb3; aAa1, Ca1Ac2."
354,The lads of Dunse,A,"ab, ca1; ab, cd."
354,The lads of Dunse,B,"Ad1Ac1, AcAa1; Ad1Ac1, AcAd."
354,The lads of Dunse,C,"Ad1Ac1, AcAa1; Ac2Ac1, Ac3Ad."
355,The lasses of Dunse,A,"ab, cd; ab, c1d1."
355,The lasses of Dunse,B,"Ac2Ac3, AcAd2; Ac4Ac5, aAd3."
356,Portpatrick,A,"ab, ac; ab, db1."
356,Portpatrick,B,"Aa1a, bAc; cb1, AdAb1."
357,The Hibernian jig,A,"aa1, a2b; cd, a3e."
357,The Hibernian jig,B,"Aa4Aa5, Aa6Ae1; Ae2Ae3, Ac1Ae4."
358,Go to the Devil and shake yourself,A,"ab, a1c; ab, de."
358,Go to the Devil and shake yourself,B,"aAe1, a1Ae2; AaAb, AdAe."
359,May be I will,A,"ab, a1c; ad, ef."
359,May be I will,B,"ab, cAb1; dc1, Ae1Af."
360,The market girl,A,"ab, a1c; a1b1, dc1."
360,The market girl,B,"ab, a1Ac1; a2Ac2, Ad1Ac1."
361,The Drogheda weavers,A,"aa1, aa2; aa1, ba2."
361,The Drogheda weavers,B,"ab, Ab1Aa2; ab, cAa2."
362,The Hollyford jig,A,"ab, cb1; a1b, c1d."
362,The Hollyford jig,B,"Aa2a, AcAb1; ba, Ac1Ad."
362,The Hollyford jig,C,"ab, Ac2c; Bd1d, Ab2Ad."
363,Nell Kennedy,A,"ab, a1c; ab, a2d."
363,Nell Kennedy,B,"ab, aAd1; ab, Aa2Ad."
363,Nell Kennedy,B1,"ab, aAd1; cd, c1Ad."
364,Three halfpence a day,A,"ab, a1c; ab, dc."
364,Three halfpence a day,B,"ab, aAd1; Aa2Aa3, AdAc."
365,Merry Mary,A,"ab, cd; ab, ef."
365,Merry Mary,B,"aAb, AcAd; aAb, AeAf."
366,Bolt the door,A,"ab, cc1; db, cc1."
366,Bolt the door,A1,"eb, cc1; db, cc1."
366,Bolt the door,B,"A1ea, bAc1; AdAb, bAc1."
366,Bolt the door,C,"Bb1Ab1, BbAc1; AdAb, aBa1."
366,Bolt the door,D,"Aa1"
367,Ask my father,A,"ab, cd; d1b, cd2."
367,Ask my father,A1,"d3b, cd; d1b, cd2."
367,Ask my father,B,"Aa1Ab1, Ab2Ad; Ad1Ab1, Ab2Ad2."
367,Ask my father,B1,"Aa1Ab1, Ab2Ad; Ad1Ab1, Ab2Ad2."
367,Ask my father,C,"Aa2"
368,With all my heart,A,"ab, ab1; ab2, cb1."
368,With all my heart,B,"aAb, aAb1; aAb2, AcAb1."
369,Get up early,A,"aa1, bc; aa1, b1d."
369,Get up early,B,"Ad1a, Ad2Ab1; Ad1a, bAd."
369,Get up early,B1,"Ad1a, Ad2Ab1; Ad1Ab2, Ab1Ad."
370,Dan Rogers' jig,A,"ab, ac; ab, ac."
370,Dan Rogers' jig,B,"ab, ac; ab, ac1."
371,Tie the petticoat tighter,A,"aa, bb; aa, b1b1."
371,Tie the petticoat tighter,B,"aAa1, Aa2Aa2; aAa1, Aa3Aa3."
371,Tie the petticoat tighter,B1,"aAa1, Aa2Aa2; a1Aa4, Ab1Ab1."
372,Trip it up stairs,A,"aa1, bb; ab1, cc."
372,Trip it up stairs,B,"Ab2a, Ac1Ac1; bc, AcAc."
372,Trip it up stairs,C,"Aa2Aa3, aAb3; Bb1Bc1, AcAc."
373,Sergt. Cahill's favorite,A,"ab, cb1; ab, c1d."
373,Sergt. Cahill's favorite,B,"aa, Ac1Ab1; AaAb, Ac1Ad."
374,Moll in the wad,A,"ab, ac; ab, a1c."
374,Moll in the wad,B,"Ab1Ab1, Aa1Ac; Ab1a, bAc."
375,Tim the thatcher,A,"ab, ac; ad, ef."
375,Tim the thatcher,B,"aAb1, aAf1; aAa1, bAf."
376,Is it the priest you want?,A,"ab, cd; ab, c1c2."
376,Is it the priest you want?,B,"aAd1, a1b; aa2, Ac1Ac2."
377,Whiskey and water,A,"ab, aa1; ab, cd."
377,Whiskey and water,B,"ab, ab1; cb2, cAa2."
377,Whiskey and water,B1,"ab, ab1; cAa3, AcAd."
378,The humors of Limerick,A,"ab, ac; ab, bc."
378,The humors of Limerick,B,"aAc1, aAc2; aAc1, AbAc."
379,Stack the rags,A,"ab, ac; ab, dc1."
379,Stack the rags,B,"ab, Ab1Ac; ab, cd."
379,Stack the rags,C,"Ab1Bb, Ab1Ac2; aBb1, AaAc."
380,Tip the Cruiskeen,A,"ab, cc; ab, c1c1."
380,Tip the Cruiskeen,B,"Ab1Ab2, AcAc; Ab1Ab2, Ac1Ac1."
381,Tatter the road,A,"ab, b1c; ab, da1."
381,Tatter the road,B,"aa1, a2a3; a4a1, a5Ab2."
382,Huish the cat,A,"ab, ac; ab, dc."
382,Huish the cat,B,"Ad1a, Ad1Ac; Ad1a, Aa1Ac."
383,The bucks of Westmeath,A,"ab, ac; ab, db1."
383,The bucks of Westmeath,B,"Ada, AdAb1; d1Ad1, AdAb1."
383,The bucks of Westmeath,C,"aa, aAb1; aa, AdAb1."
384,The beauties of Ireland,A,"ab, ac; ab, ac1."
384,The beauties of Ireland,A1,"db1, de; ab, ac."
384,The beauties of Ireland,A2,"ab, ac1; A1db1, A1dA1e1."
385,Off she goes!,A,"ab, ac; ab, a1d."
385,Off she goes!,B,"aa1, aAc1; aa1, Aa1Ad."
386,Smash the windows,A,"ab, b1c; ab, de."
386,Smash the windows,B,"Ab2Ac1, Ab3Ac2; Ab4Ab5, aAe1."
386,Smash the windows,C,"Ba1a, Ba2b; Ba3Ba4, BaAe."
387,Ellis' jig,A,"ab, ac; a1b1, a2d."
387,Ellis' jig,B,"aAb, aAa3; Aa1Ab1, Aa2Ad."
388,Lock the door,A,"ab, ac; ab, de."
388,Lock the door,B,"aAc1, ab; aAc2, AdAe."
388,Lock the door,C,"Ae1Aa1, Ae1Ac; Ae1Aa1, Ac3Ae."
389,Maguire's kick,A,"ab, a1c; ab, ac1."
389,Maguire's kick,B,"ab, aAc2; a1c, dAc3."
389,Maguire's kick,C,"AaAb, Aa1a; AaAb1, Bd1Ac1."
390,The bunch of roses,A,"ab, b1b2; ab, ca1."
390,The bunch of roses,B,"Ab3a, bc; da1, d1Aa1."
391,The humors of Ballinafauna,A,"ab, cc1; a1b1, b2d."
391,The humors of Ballinafauna,B,"Ad1a, Ad2Ab3; Ad1a, bAd."
392,Kiss me sweetheart,A,"ab, ac; ab, dc1."
392,Kiss me sweetheart,B,"Ab1Ad1, Aa1Ac; Ab1Ad1, aAc1."
393,What ails you?,A,"ab, a1a2; ab, b1a3."
393,What ails you?,B,"Ab2Aa4, Ab3Aa5; Ab2Aa4, ab."
394,Get up old woman and shake yourself,A,"ab, a1b1; ac, db."
394,Get up old woman and shake yourself,B,"Ad1Ab2, Ad1Ab; Ad1Ac, AdAb."
395,Child of my heart,A,"ab, ac; ab, dc."
395,Child of my heart,B,"Ac1a, Ac1Ac2; Ac1a1, AdAc."
396,The northern road,A,"ab, ac; ab1, b2d."
396,The northern road,B,"aa1, aAd1; a2Aa1, a3Ad."
396,The northern road,B1,"aa1, aAd1; bc, Ab2Ad."
397,Come in from the rain,A,"aa1, bc; ad, b1d1."
397,Come in from the rain,B,"Ab2Ab2, Ab3Ac1; Ab2Ab2, Aa2Ad1."
398,Behind the bush in the garden,A,"aa, ba1; ca2, a3b1."
398,Behind the bush in the garden,B,"Ab2Ab3, Ab2Aa4; Ab2Ab3, aAb1."
398,Behind the bush in the garden,B1,"Ab2Ab3, Ab2Aa4; AcAa2, Aa3Ab1."
399,The runaway jig,A,"ab, a1c; ab, db1."
399,The runaway jig,A1,"ab, a1c; ab, db2."
399,The runaway jig,B,"Aa2Ab3, aa; Aa2Ab3, a1Ab2."
399,The runaway jig,B1,"Aa2Ab3, aa; Aa2Ab3, a1Ab1."
400,The mariner's frock,A,"ab, cd; ea1, fb1."
400,The mariner's frock,B,"Ae1Ae2, Ae3a; Ab2Aa1, AfAb1."
401,The humors of Castleoliver,A,"ab, ab1; cd, a1e."
401,The humors of Castleoliver,B,"aAd1, Aa1Ab2; bAd1, Aa1Ab3."
401,The humors of Castleoliver,B1,"aAd1, Aa1Ab2; bAd1, Aa1Aa2."
402,The lady of the lake,A,"ab, ac; ab, c1a1."
402,The lady of the lake,B,"ab, Aa1c; ab, dAa2."
403,A morning in summer,A,"ab, b1b2; ab, cb3."
403,A morning in summer,B,"Ac1a, Ab4a1; Ab5a2, Ab1Ab2."
404,I'm a silly old man,A,"ab, b1c; ab, b2a1."
404,I'm a silly old man,B,"Ab3Ac1, aAc2; bc, b1Aa1."
405,Good night,A,"aa1, ab; ac, db."
405,Good night,B,"ab, a1Ab; aAc, AdAb."
406,The lovely lad,A,"ab, cb1; b2b3, b4b."
406,The lovely lad,B,"Ab5Ab6, Ab7Ab8; Ab9Ab10, aAb11."
407,Carbray's frolics,A,"ab, cc; ab, a1c1."
407,Carbray's frolics,B,"aAb1, AcAc; aAb1, Aa1Ac1."
408,Cahill's workshop,A,"ab, a1c; ab1, db2."
408,Cahill's workshop,A1,"ab, a1c; ab1, de."
408,Cahill's workshop,B,"aAb, A1e1Ac; a1Ab1, AdAb2."
