Tune,Title,Part,Structure
650,The maids of Mitchellstown,A,"ab, ab1; ab, ac."
650,The maids of Mitchellstown,B,"aa1, bAc1; aa1, bAb2."
651,Erin's hope,A,"ab, ac; ab, a1d."
651,Erin's hope,B,"ab, a1Ab; ab, cd."
652,Molly what ails you?,A,"ab, a1c; a2b1, a1c1."
652,Molly what ails you?,B,"ab, ab1; ab, Aa1Ac2."
653,Tady's wattle,A,"ab, a1c; ab, a1c."
653,Tady's wattle,B,"aAb1, aAc1; ba1, cAc."
654,The old maids of Galway,A,"ab, a1b1; ab, a1b1."
654,The old maids of Galway,B,"Ab2Ab3, Ab2Ab1; Ab2Ab3, aAb1."
655,Miss McLeod's reel,A,"ab, ab1; ab2, b3c."
655,Miss McLeod's reel,B,"aAb, aAb4; Ab5Ab6, bAc1."
656,Sergt. Early's dream,A,"ab, cd; a1b, ef."
656,Sergt. Early's dream,B,"Ad1Ad, Ac1a; Ad1Ad, bc."
657,Push about the jorum,A,"ab, ac; ab, ac1."
657,Push about the jorum,B,"ab, ab1; ab, cd."
658,Maurice Casey's fancy,A,"ab, ca; ab, ca1."
658,Maurice Casey's fancy,B,"ab, Ac1Aa1; ab, cd."
659,Young Arthur Daly,A,"ab, cb1; ab, cb1."
659,Young Arthur Daly,B,"ab, ac; Ab2Ab3, AcAb1."
660,Considine's grove,A,"ab, ab1; ab, ab1."
660,Considine's grove,B,"aa1, aAb2; aa1, bc."
661,Sleepy Maggie,A,"aa1, bc; aa1, bc."
661,Sleepy Maggie,B,"Aa2Ac1, Aa2Ac; Aa2Ac1, Aa3a."
661,Sleepy Maggie,C,"Aa2Ac2, aAc2; AaAa1, AbAc."
661,Sleepy Maggie,D,"AaAa1, AbAc; Aa2Ac1, Aa2Ac."
661,Sleepy Maggie,E,"Aa2Ac1, Aa3Ba; Aa2Ac2, CaAc2."
662,Drowsy Maggie,A,"aa1, ab; aa1, ab."
662,Drowsy Maggie,B,"ab, aAb; ab, cAb."
663,The plaid mantle,A,"ab, cd; ab, cd1."
663,The plaid mantle,B,"Ad2Ab, AdAd1; Ad2Ab, AcAd3."
664,The humors of Ballinacarrig,A,"ab, b1c; ab, b1d."
664,The humors of Ballinacarrig,B,"ab, Ac1Ad; ab, cAd."
665,The harvest field,A,"ab, b1c; ab2, de."
665,The harvest field,B,"ab, ac; dd1, Aa1e."
666,The green groves of Erin,A,"aa1, ab; aa1, a2b1."
666,The green groves of Erin,B,"ab, ac; a1b1, dc1."
667,The scolding wife,A,"aa1, ab; aa1, a2c."
667,The scolding wife,B,"Aa3Aa4, Aa3Ac1; Aa3Aa4, aAc."
668,The mooncoin reel,A,"ab, cb; ab, cc1."
668,The mooncoin reel,B,"aa1, a2a3; aa1, bc."
669,Kiss me Kate,A,"ab, ac; ab, ad."
669,Kiss me Kate,B,"aa1, ab; ca, db1."
670,Lord Gordon's reel,A,"ab, cd; d1e, fc1."
670,Lord Gordon's reel,B,"ab, Ac2Ad; Ad1Ae, AfAc3."
671,Five miles away,A,"ab, a1c; ab, a1d."
671,Five miles away,B,"aa1, ab; aa1, cd."
672,Within a mile of Clonbur,A,"ab, a1c; ab, b1c."
672,Within a mile of Clonbur,B,"aa1, ab; aa1, Ab1Ac."
673,The Drummond lasses,A,"aa1, ab; ac, a2d."
673,The Drummond lasses,B,"aa1, a2Ab; aa1, Ab1Ab."
674,Johnny has gone to France,A,"ab, cb1; ab, cb2."
674,Johnny has gone to France,B,"Ac1a, Ac1a1; ba2, ca1."
675,The bonnie boy,A,"ab, ab1; ab, cd."
675,The bonnie boy,B,"aa1, aAb2; aAb, Acb."
676,Dooley's fancy,A,"ab, cd; ab, cb1."
676,Dooley's fancy,B,"aAb2, ab; cAb, de."
677,The second wedding,A,"ab, ac; ab, ad."
677,The second wedding,B,"ab, ac; ab, de."
678,The old schoolmaster,A,"ab, cd; a1b1, cd."
678,The old schoolmaster,B,"ab, cd; c1b, Ab2Ad."
679,Around the world for sport,A,"ab, ab1; ab2, cd."
679,Around the world for sport,B,"ab, a1c; a2d, a3c1."
680,Mickey by the fireside,A,"aa1, a2b; aa1, a2b1."
680,Mickey by the fireside,B,"aa1, ab; aa2, cAb2."
681,The sailor's cravat,A,"aa1, ab; aa1, ac."
681,The sailor's cravat,B,"ab, a1Ac1; ab, a2c."
682,Coming over the hills,A,"ab, a1b1; ab, a1b1."
682,Coming over the hills,B,"aAb2, bc; aAb2, b1c."
683,The reel of bogie,A,"ab, ac; ab, c1d."
683,The reel of bogie,B,"ab, aAd1; ac, Ab1Ad2."
684,The Limerick lasses,A,"ab, ac; ab, ac1."
684,The Limerick lasses,B,"Ab1a, bAb2; Ab1a1, cAb2."
684,The Limerick lasses,C,"aa1, aBa2; ab, cd."
685,Miss Wallace,A,"ab, cd; ab1, cd1."
685,Miss Wallace,B,"Ac1a, Ac2Aa1; Ac1b, cAd1."
686,The hornless cow,A,"ab, a1c; ab, a1d."
686,The hornless cow,B,"Ad1Ad2, Ad1Ad3; Ad1Ad2, aAd3."
687,Jenny's welcome to Charley,A,"ab, a1c; ab, a1c1."
687,Jenny's welcome to Charley,B,"ab, cd; a1b, ed."
687,Jenny's welcome to Charley,C,"Bc1Bb1, Bc2a; Bc1Bb1, Be1Bd."
687,Jenny's welcome to Charley,D,"Bb2Bb3, Bc3Bc4; aBb4, bBb1."
688,Tit for tat,A,"ab, cd; ab, ce."
688,Tit for tat,B,"aa1, bAd1; aa1, cd."
689,The lightning flash,A,"ab, a1c; ab1, a2d."
689,The lightning flash,B,"aAb2, ab; aAb3, cb1."
690,Tim the market man,A,"ab, cd; ab, ce."
690,Tim the market man,B,"ab, AcAe; a1b, AcAe1."
691,The ladies of Leinster,A,"ab, ac; ab, ad."
691,The ladies of Leinster,B,"ab, cAd; b1Ab1, Aa1d."
692,Comely Jane Doowning,A,"aa1, ab; ac, db1."
692,Comely Jane Doowning,B,"Aa2Ac1, Aa2Ac2; Ad1Ac1, Aca."
693,The maid at the churn,A,"ab, a1c; ab, a1c1."
693,The maid at the churn,B,"aa1, aAc2; ab, cAc."
694,A moonlight ramble,A,"ab, cb1; ab, cb1."
694,A moonlight ramble,B,"ab, ab1; ab, cd."
695,Girls wil you take him?,A,"ab, ac; ab, ac."
695,Girls wil you take him?,B,"ab, a1Ac; ab1, cAc."
696,Bill Clancy's delight,A,"aa1, ab; aa1, ac."
696,Bill Clancy's delight,B,"aa1, aAb1; aa1, bc."
697,The jolly seven,A,"aa1, ab; aa1, cd."
697,The jolly seven,B,"aa1, aAb; aa1, AcAd1."
698,The Skibbereen lasses,A,"ab, ac; ab, dc."
698,The Skibbereen lasses,B,"Ad1Ab, aAc; Ad1Ab, bAc."
699,The humors of Schull,A,"ab, cd; ab, a1e."
699,The humors of Schull,B,"Aa2a, Ab1Ae1; Aa2a, Ae2Ae."
700,After the sun goes down,A,"ab, ac; ab, b1c."
700,After the sun goes down,B,"Ac1a, Ac1Ac; Ac1a1, bAc."
701,Farewell to Erin,A,"ab, ac; ab, dc."
701,Farewell to Erin,B,"aAa1, a1Ac; bc, Ac1d."
702,On the river bank,A,"ab, a1b; ab, a1c."
702,On the river bank,B,"ab, cb1; ab, cAc1."
703,Fair-haired Mary,A,"ab, a1c; ab, a1c1."
703,Fair-haired Mary,B,"ab, a1Ac2; a2b, b1Ac1."
704,Pretty Peggy,A,"aa1, a2b; aa1, cd."
704,Pretty Peggy,B,"aa1, ab; a2c, dAb1."
705,More power to your elvow,A,"ab, ac; ab, ac1."
705,More power to your elvow,B,"aAb1, a1b; cAb, AaAc2."
706,Green garters,A,"ab, ac; ab, ad."
706,Green garters,B,"Ac1a, Ac1Ac; Ac1a, Ad1b."
707,Jenny's wedding,A,"ab, cd; ec1, fg."
707,Jenny's wedding,B,"Aa1Af1, Aa1a; Aa1b, Af2c."
708,The maid of Athlone,A,"ab, a1c; ab, a1c."
708,The maid of Athlone,B,"ab, ac; ab, de."
709,Keeper Hill,A,"ab, ac; ab, c1d."
709,Keeper Hill,B,"ab, a1b1; ab, Aa1c."
710,Good morning to your night cap,A,"ab, ac; ab, ac1."
710,Good morning to your night cap,B,"aAb1, a1Ac; a2b, cAc1."
711,I'm waiting for you,A,"ab, cd; ef, gh."
711,I'm waiting for you,B,"aAe1, bc; ad, ef."
712,O'Reilly's greyhound,A,"ab, a1c; ab, a1c."
712,O'Reilly's greyhound,B,"aa1, ab; ac, dAb."
713,Courting them all,A,"ab, cb1; ab, cb1."
713,Courting them all,B,"Ab2a, Ab2Ab3; Ab2a, AcAb1."
714,The green jacket,A,"ab, cd; c1b, cd1."
714,The green jacket,B,"aa1, a2Ad1; a3b, cAd."
715,My honey in the house,A,"ab, ac; ab, de."
715,My honey in the house,B,"Ac1Ac2, aAc; Ac1Ac2, AdAe."
716,McFadden's favorite,A,"ab, cd; a1b, cd1."
716,McFadden's favorite,B,"aAb1, a1b; aAb1, cd."
717,The Callan lasses,A,"ab, ac; ab, ac."
717,The Callan lasses,B,"aa1, a2Ac; aa1, bAc."
718,Are you willing,A,"ab, ac; ab, dc1."
718,Are you willing,B,"aa1, a2Ac1; a3a1, bAc1."
719,The traveller,A,"ab, cd; ab, ce."
719,The traveller,B,"aAb1, Aa1Ad; bAb1, cd."
720,Kiss the bride,A,"ab, cd; ab, cd1."
720,Kiss the bride,B,"ab, AcAd; ab, AcAd2."
721,Duffy the dancer,A,"ab, ab1; ab, cb2."
721,Duffy the dancer,B,"Ab3Ab, Ab3Ab2; Ab3Ab, AcAb2."
722,Welcome home,A,"ab, a1c; ab, a1c1."
722,Welcome home,B,"Ab1a, Ab1b; Ab1a1, Aa1Ac2."
723,The linen cap,A,"ab, ac; ab1, dc."
723,The linen cap,B,"aAb, aAc; aAb1, AdAc."
724,The contradiction reel,A,"ab, a1c; ab, a1d."
724,The contradiction reel,B,"ab, ab1; ab, cd."
724,The contradiction reel,C,"ab, cd; Ba1e, fd1."
724,The contradiction reel,D,"Bb2Bc1, Bb2a; Bb2b, ca1."
725,The smoky house,A,"aa1, aa2; aa1, bc."
725,The smoky house,B,"aAc1, ab; a1Ac1, cAc2."
726,Mollie McCarthy,A,"aa1, ab; aa1, ab."
726,Mollie McCarthy,B,"ab, ab1; ab, cAb."
727,Rolling down the hill,A,"ab, cd; a1e, cd1."
727,Rolling down the hill,B,"ab, aAe1; ab, Ae2c."
728,The merry blacksmith,A,"ab, cd; a1b, ce."
728,The merry blacksmith,B,"Aa2Aa1, AcAd1; aAa, AcAe1."
729,Scotch Mary,A,"ab, ac; ab, ac1."
729,Scotch Mary,B,"ab, aAc1; ab, Ac2Ac3."
730,Within a mile of Dublin,A,"ab, ac; ab, ac1."
730,Within a mile of Dublin,B,"ab, aAc1; ab1, cd."
731,The Cameronian reel,A,"ab, a1c; ab, a1c1."
731,The Cameronian reel,B,"ab, cd; ef, gh."
732,Winter apples,A,"ab, cd; ab, cd1."
732,Winter apples,B,"aa1, aa2; a3a4, bAc1."
733,The primrose lass,A,"ab, cb1; ab, db1."
733,The primrose lass,B,"aa1, ab; aa1, Ab2Ac1."
734,Shearing the sheep,A,"ab, ac; db, a1c1."
734,Shearing the sheep,B,"ab, a1c; ab, dc1."
735,Paddy's surprise,A,"ab, ac; ab1, dc1."
735,Paddy's surprise,B,"ab, aa1; ab, AdAc2."
736,Captain Byng,A,"ab, ac; ab1, de."
736,Captain Byng,B,"aa1, aAc; aa1, AdAe."
737,The wind that shakes the barley,A,"aa1, ab; aa1, ab1."
737,The wind that shakes the barley,B,"aa1, a2b; aa1, a3b."
738,The piper's son,A,"ab, cd; ab1, ce."
738,The piper's son,B,"ab, Ad1Ae; a1b, cd."
739,Turkeys in the straw,A,"ab, cd; ab, c1e."
739,Turkeys in the straw,B,"Ac1Ad1, ab; Ac2Ae1, cd."
740,William White's reel,A,"ab, a1c; ab, a1c."
740,William White's reel,B,"ab, cd; eb, Ac1d1."
741,Murtough Molly,A,"ab, cd; ab, ce."
741,Murtough Molly,B,"Ac1Ab1, Ac1Ac2; Ac1Ab1, Ac3Ad."
742,The field of oats,A,"ab, a1c; ab, a2a3."
742,The field of oats,B,"aAb1, a1Ac1; aAb1, a1Ac2."
743,The humors of Newcastle,A,"ab, ac; ab, ac."
743,The humors of Newcastle,B,"aa1, ab; aa1, cAb1."
744,Paddy Murphy's wife,A,"ab, ac; ab, ac."
744,Paddy Murphy's wife,B,"Ab1Ab2, Ab1a; Ab1Ab2, bc."
745,The girl with the laughing eyes,A,"ab, a1c; ab, a2d."
745,The girl with the laughing eyes,B,"aAb1, aAc1; aAb, Aa2Ad1."
746,Give us another,A,"ab, cd; ab, cd1."
746,Give us another,B,"ab, ac; ab1, AcAd."
747,The northern lasses,A,"ab, cd; ae, cf."
747,The northern lasses,B,"aAd1, ab; cd, ef."
747,The northern lasses,B1,"aAd1, ab; cd, eg."
748,Clarkson's reel,A,"ab, cd; ab, c1e."
748,Clarkson's reel,B,"aAd1, aAc2; Ab1Ad1, bb1."
749,Rakish Paddy,A,"ab, cb1; a1b2, db3."
749,Rakish Paddy,B,"aAa2, bb1; aa1, Ab4Ab3."
750,The Mullingar races 1,A,"ab, cc1; a1b, c2d."
750,The Mullingar races 1,B,"Aa2a, Aa2b; Aa2a, cAd1."
751,The jolly tinker,A,"ab, a1c; ab, a1c1."
751,The jolly tinker,B,"ab, cb1; ab, cb1."
751,The jolly tinker,C,"ab, b1Ac1; ab, b1Ac1."
751,The jolly tinker,D,"Ca1Ca1, aAc1; Ca1Ca1, aAc1."
751,The jolly tinker,E,"Ca2Ba1, Da1Ac1; CaBa1, Da2Ac."
752,The queen's shilling,A,"ab, a1c; ab, ac1."
752,The queen's shilling,B,"aa1, ab; a2b1, cAc."
753,Little Katie Kearney,A,"ab, ac; ab, ac."
753,Little Katie Kearney,B,"aa1, a2Ac; aa1, bAc1."
754,The maid in the sherry tree,A,"ab, a1c; ab, a1c."
754,The maid in the sherry tree,B,"ab, ac; ad, Ac1e."
755,The watchmaker,A,"ab, ac; ab, ac."
755,The watchmaker,B,"aa1, ab; Aa1c, dAc."
756,The same old story,A,"ab, cb; c1b, cb."
756,The same old story,B,"Ac2Aa1, ab; ac, ab."
756,The same old story,C,"ab, "
757,The fourpenny bit,A,"ab, cd; ab1, ef."
757,The fourpenny bit,B,"aAc1, bAe1; ab1, bc."
758,The jug of punch,A,"ab, cd; ef, d1g."
758,The jug of punch,B,"Ae1a, bAa1; Ae1a, Af1Ag."
759,The grey plover,A,"ab, ac; a1d, ef."
759,The grey plover,B,"Aa2a, Aa2b; Aa3c, AeAf."
760,My sweetheart Jane,A,"ab, ac; ab, ac1."
760,My sweetheart Jane,B,"Aa1Ab1, Aa1Ac2; Aa1Ab1, aAc1."
761,Kiss your partner,A,"ab, ab1; ab, ab2."
761,Kiss your partner,B,"ab, ac; ab, dAb3."
762,Corney is coming,A,"ab, cd; ab, cd1."
762,Corney is coming,B,"aa1, a2Ad1; Ad2Ad3, a3Ad1."
763,The mountain rose,A,"ab, ac; a1b, dc1."
763,The mountain rose,B,"ab, cd; ab, AdAc1."
764,The green gates,A,"aa1, bc; aa1, cd."
764,The green gates,B,"ab, AbAc; ab1, AcAd."
765,The western lasses,A,"aa1, ab; aa1, cd."
765,The western lasses,B,"aAa2, aAd1; a1b, cd."
765,The western lasses,C,"aBc1, bBc2; aBc1, bBd."
766,Rolling on the ryegrass,A,"ab, b1c; db, ec."
766,Rolling on the ryegrass,B,"aAe1, a1b; aAe1, a2b."
766,Rolling on the ryegrass,C,"Aa1a, a1Bb1; a2a, a3Bb."
767,The four-hand reel,A,"ab, ac; ad, ac1."
767,The four-hand reel,B,"ab, aAc1; b1c, c1Ac."
768,The flowers of Limerick,A,"ab, cd; ae, fg."
768,The flowers of Limerick,B,"aAb1, Ae1b; Aa1Ae, AfAg."
768,The flowers of Limerick,C,"Aa2a, bAd1; Ae2Ae3, AfAg1."
768,The flowers of Limerick,D,"aAe4, Ae5Bg1; Ac1Ae3, AfAg2."
769,The piper's despair,A,"ab, cb; ab, c1d."
769,The piper's despair,B,"Ac2a, Ac3a1; Ac2a, Aa1b."
770,The Edenderry reel,A,"aa1, ab; aa1, ab."
770,The Edenderry reel,B,"Ab1a, Ab1Ab2; Ab1a1, bAb2."
771,The old bog ground,A,"ab, ac; ab, ac."
771,The old bog ground,B,"ab, a1Ac; ab, cAc1."
772,The absent-minded woman,A,"ab, ac; ab1, de."
772,The absent-minded woman,B,"Aa1a, Aa1b; Aa1a, cAe1."
773,The hag by the fire,A,"aa1, ab; aa1, ab1."
773,The hag by the fire,B,"aAb2, a1Ab1; bAb2, cAb1."
774,Johnny Allen's reel,A,"ab, ac; ab1, de."
774,Johnny Allen's reel,B,"aAe1, aAe; aAb1, AdAe2."
775,The maid of Feakle,A,"ab, ab1; ab, cd."
775,The maid of Feakle,B,"aa1, aAd; aa1, bc."
776,The humors of Scarriff,A,"ab, ac; ab, ac."
776,The humors of Scarriff,B,"aa1, ab; aa1, cAc."
777,The rambler in Cork,A,"ab, a1c; ab, a1c1."
777,The rambler in Cork,B,"ab, aAc2; ab, cAc."
778,The maids of Kilmallock,A,"ab, b1c; ab, b1c1."
778,The maids of Kilmallock,B,"ab, aAc1; a1b, cAc."
779,The heather breeze,A,"ab, ac; ab, de."
779,The heather breeze,B,"aa1, aAe; aa1, a2Ae."
779,The heather breeze,C,"aa1, a2Ae; a2a1, bc."
780,Cooleen bridge,A,"ab, a1b1; a2c, de."
780,Cooleen bridge,B,"Ab2Ab3, aAe1; Ad1Aa3, Ae1b."
781,Captain Rock,A,"ab, a1c; a2b1, dc1."
781,Captain Rock,B,"aa1, a2Ac1; a3b, a2Ac1."
782,The tinker's reel,A,"ab, a1c; ab, a2c1."
782,The tinker's reel,B,"aAb1, ab; aAb2, cd."
783,The maids of Tulla,A,"ab, cd; ab, d1e."
783,The maids of Tulla,B,"Ac1a, Ac2a1; Ac1a2, Ad1Ae."
784,The Gaelic revival,A,"ab, cd; b1e, c1f."
784,The Gaelic revival,B,"ab, Ac2b1; a1b2, Ac3c."
784,The Gaelic revival,C,"aAb, ab; aAe1, Ac1Af."
784,The Gaelic revival,D,"Ba2Bc1, Ba3Ad1; ab, cd."
785,A ha'porth of tea,A,"ab, a1c; ab, a1c."
785,A ha'porth of tea,B,"aa1, a2Ac; aa1, bAc."
786,Over the moor to Maggie,A,"ab, cd; ab, ea1."
786,Over the moor to Maggie,B,"ab, Ac1Ad1; cb, Ae1Aa2."
786,Over the moor to Maggie,C,"Ba1Ba2, Aca; Ab1b, AeAa3."
787,Bunker Hill,A,"ab, cd; ab, ed."
787,Bunker Hill,B,"aa1, a2b; Ab1c, AeAd1."
787,Bunker Hill,C,"aAa1, a1b; aAa2, AeAd."
788,The king of the clans,A,"ab, cd; ee1, fg."
788,The king of the clans,B,"ab, AcAd; a1Ab1, cAg."
789,Boil the breakfast early,A,"ab, ab1; ab, cb1."
789,Boil the breakfast early,B,"ab, aAb1; ab1, AcAb1."
790,The maid I ne'er forgot,A,"aa1, bc; a2a1, b1d."
790,The maid I ne'er forgot,B,"ab, Abc; de, AbAd."
791,The honeymoon reel,A,"ab, a1c; ad, a2e."
791,The honeymoon reel,B,"aAb, Aa1Ac1; a1Ad1, Aa2Ae1."
792,The cup of tea,A,"ab, ab1; ab, a1c."
792,The cup of tea,B,"aa1, aAc; ab, Aa2Ac."
792,The cup of tea,C,"aa1, a2Ac; aa1, Aa3b."
793,Come west along the road,A,"ab, ac; ab, ac1."
793,Come west along the road,B,"ab, ac; ab, a1d."
794,The long strand,A,"ab, a1c; ab1, de."
794,The long strand,B,"ab, cd; a1e, Adc1."
795,The teetotaler's fancy,A,"ab, cd; ab1, cd1."
795,The teetotaler's fancy,B,"ab, cd; ab, ec1."
796,Kitty in the lane,A,"ab, ac; ab, a1d."
796,Kitty in the lane,B,"ab, ac; ab1, Ac1Ad1."
797,The Chicago reel,A,"ab, cb1; a1b, de."
797,The Chicago reel,B,"ab, a1c; a2b1, c1Ae1."
798,Mrs. Delaney,A,"ab, a1c; ab1, dc1."
798,Mrs. Delaney,B,"ab, a1Ac2; ac, de."
799,Mayor Harrison's fedora,A,"ab, a1c; a2b1, c1d."
799,Mayor Harrison's fedora,B,"aAb2, bc; aAc2, Ac1Ad1."
800,Miss Fahey's fancy,A,"ab, cd; a1b1, ef."
800,Miss Fahey's fancy,B,"ab, ab1; Ae1c, de."
801,Clancy's fancy reel,A,"ab, a1c; a2b1, cd."
801,Clancy's fancy reel,B,"ab, Aa3Ac1; ab1, AcAd1."
802,The shaskeen reel,A,"ab, cb1; a1b, de."
802,The shaskeen reel,B,"ab, AcAb2; ab, AdAe1."
803,Peter Street,A,"ab, b1b2; ab, cd."
803,Peter Street,B,"Aa1Ab3, AaAb; Ac1Ac1, ab."
804,Pay the girl her fourpence,A,"ab, a1c; ad, ec."
804,Pay the girl her fourpence,B,"aAc1, aAc1; a1b, cd."
805,Farewell to Ireland,A,"ab, cb1; a1b2, c1d."
805,Farewell to Ireland,B,"ab, a1Ab3; cd, eAb4."
805,Farewell to Ireland,C,"aa1, a2b; aBd, BeAd1."
806,Chief O'Neill's favorite,A,"ab, cd; ab, c1e."
806,Chief O'Neill's favorite,B,"Aca, bAd; AaAb, Ac1Ae1."
807,The Greencastle hornpipe,A,"ab, ac; ab, de."
807,The Greencastle hornpipe,B,"Ac1a, a1a2; a3b, cAe1."
808,The Cloone hornpipe,A,"ab, cd; ab1, eb2."
808,The Cloone hornpipe,B,"Aca, bc; dAe1, AeAb2."
809,The Kildare fancy,A,"ab, cd; ab, ce."
809,The Kildare fancy,B,"ab, cAd1; ab, dAe."
810,Dunphy's hornpipe,A,"ab, cd; ab1, ef."
810,Dunphy's hornpipe,B,"ab, Ad1Ab2; cd, eAf1."
811,The rights of man,A,"ab, cc1; ab, c2d."
811,The rights of man,B,"aa1, Ad1b; cAc3, Ac2Ad2."
812,Slievenamon,A,"ab, cd; eb1, fg."
812,Slievenamon,B,"ab, cd; ae, fAg."
813,Hennessy's hornpipe,A,"ab, a1b1; ab, cd."
813,Hennessy's hornpipe,B,"aAb2, bc; dAc1, AcAd1."
814,The quarrelsome piper,A,"ab, cd; ab, ce."
814,The quarrelsome piper,B,"aa1, a2b; AaAb, AcAe1."
815,The Devil's dream,A,"aa1, bb1; aa1, cd."
815,The Devil's dream,B,"Ab2Ab3, AbAb1; Ab2Ab3, AcAd."
815,The Devil's dream,C,"ab, a1Aa2; ab1, AcAd."
816,The Liverpool hornpipe,A,"ab, cd; ab, ef."
816,The Liverpool hornpipe,B,"Ac1Ad1, AcAd; AaAb, AeAf."
816,The Liverpool hornpipe,C,"aAd2, a1Ad3; AaAb1, bAf."
817,The Tinware lass,A,"ab, cd; a1b, c1d1."
817,The Tinware lass,B,"ab, cAd; Aa1Ab, Ac1d."
818,Hillside cottage,A,"ab, cc1; ab, c2d."
818,Hillside cottage,B,"ab, ac; de, Ac2Ad1."
819,The heather glen,A,"aa1, bc; aa1, bd."
819,The heather glen,B,"Aa2Ac1, Aa3Ad1; Aa4Aa1, AbAd2."
820,Limerick Junction,A,"ab, cd; a1b, ea2."
820,Limerick Junction,B,"ab, b1Ad1; ab2, cAa3."
821,The top of the morning,A,"ab, cd; ab, c1a1."
821,The top of the morning,B,"Aa2Aa3, Aa4a; AaAb, Ac1Aa5."
822,Hick's hornpipe,A,"ab, a1c; a2b, de."
822,Hick's hornpipe,B,"aAd1, Ae1Ac1; aAd1, Ad2Ae2."
823,Bantry Bay,A,"ab, cd; c1e, ab1."
823,Bantry Bay,B,"Aa1Ab2, aAb3; bAe, AaAb1."
824,The boys from Scart,A,"ab, cd; ab, cd1."
824,The boys from Scart,B,"aAd2, a1b; aAd2, cd."
825,Fisher's hornpipe,A,"ab, cd; ab, ef."
825,Fisher's hornpipe,B,"aa1, a2a3; a4a5, bAf1."
826,No.1 The sailor's hornpipe,A,"aa, bb; aa, cd."
826,No.1 The sailor's hornpipe,B,"aa1, bc; aa1, AcAd1."
827,No.2 The sailor's hornpipe,A,"aa1, ba1; aa1, cd."
827,No.2 The sailor's hornpipe,B,"Ab1Ab2, AbAa1; AaAa1, AcAd1."
828,The Wicklow hornpipe,A,"ab, cd; ab, c1e."
828,The Wicklow hornpipe,B,"ab, cAd1; Aa1d, Ac1Ae1."
829,Miss Brown's fancy,A,"ab, cd; ab1, ef."
829,Miss Brown's fancy,B,"ab, a1c; ab1, dAf1."
830,The men from Mallow,A,"ab, a1c; ab, de."
830,The men from Mallow,B,"Ab1Ab2, aa1; Ab1Ab, AdAe."
830,The men from Mallow,C,"Ab1Ab2, BaBa1; aa1, AdAe1."
831,McCarty's hornpipe,A,"ab, bb1; ca, de."
831,McCarty's hornpipe,B,"aAa, AbAb; Ab1Ac, AaAd."
831,McCarty's hornpipe,C,"AeBa1, ab; Ab2Ac, AaAd."
831,McCarty's hornpipe,C1,"AeBa1, ab; Ab2Ac, AaAd."
831,McCarty's hornpipe,D,"AeBa2, "
832,Big Dan O'Mahony,A,"ab, a1b1; ab, cd."
832,Big Dan O'Mahony,B,"Aa2a, Aa3Ab; a1a2, bAd1."
832,Big Dan O'Mahony,C,"Ba1a, Aa3Ab1; Ac1b, Bb1Ad2."
833,The trumpet hornpipe,A,"ab, a1b1; ab2, cd."
833,The trumpet hornpipe,A1,"ab, a1b1; ab2, ca2."
833,The trumpet hornpipe,B,"Aa3a, Aa4b; cc1, Ac1Aa5."
834,The Mullingar races 2,A,"ab, ca1; ab, b1d."
834,The Mullingar races 2,B,"Ab1Ac1, aAb2; Ac2Ac3, Ab2Ad."
835,The Kilkenny hornpipe,A,"ab, cd; ab, a1e."
835,The Kilkenny hornpipe,B,"aa1, a2a3; AaAb, Aa1Ae."
836,Jerry Daly's hornpipe,A,"ab, cd; ab, ce."
836,Jerry Daly's hornpipe,B,"ab, a1b1; cd, AcAe."
837,The banks of the Ilen,A,"ab, ac; ab, ac."
837,The banks of the Ilen,B,"ab, aa1; b1c, AaAc1."
838,Kit O'Mahony's hornpipe,A,"ab, cd; ab1, ed."
838,Kit O'Mahony's hornpipe,B,"Ab2a, Ab3Ae1; Aa1b, cAd1."
839,The boys of Ballysimon,A,"ab, cd; a1b, cd."
839,The boys of Ballysimon,B,"ab, ac; AaAb, AcAd1."
839,The boys of Ballysimon,C,"Bc1a, bAd; Ac1c, bAd."
839,The boys of Ballysimon,D,"BaBb1, BaBc2; Aa2Ca1, AcAd1."
840,Fair and forty,A,"ab, cc1; ab, cd."
840,Fair and forty,B,"aa1, aAc2; aa1, bAd1."
841,The slipper hornpipe,A,"ab, cd; ab, ef."
841,The slipper hornpipe,B,"ab, cAd; AaAb, dAf1."
842,O'Dwyer's hornpipe,A,"aa1, a2a3; a4a1, bc."
842,O'Dwyer's hornpipe,B,"aa1, bAa5; Ab1a1, cAa6."
842,O'Dwyer's hornpipe,C,"Aa7a, a1Bc1; Aa7a, AbAc."
842,O'Dwyer's hornpipe,D,"aa, a1a2; bb1, cAa8."
843,The Groves hornpipe,A,"ab, a1c; ab, de."
843,The Groves hornpipe,B,"Aa2a, bc; Aa2d, AdAe1."
843,The Groves hornpipe,C,"Aa3a, Aa4a1; Aa3a1, Ad1Ae2."
843,The Groves hornpipe,D,"aa1, a2Ad1; aa3, Ad1Ae3."
843,The Groves hornpipe,E,"aa1, ab; Ad2c, AdAe2."
844,The first of June,A,"ab, cd; ae, fg."
844,The first of June,B,"aAa1, bc; a1d, eAg1."
845,The last of the twins,A,"ab, cd; ab, ce."
845,The last of the twins,B,"aa1, AcAd1; aa1, Aca2."
846,Kitty's wedding,A,"ab, cd; ab, cc1."
846,Kitty's wedding,B,"ab, Ac1c; ab, Ac1d."
847,The harvest home,A,"ab, cd; ab, ef."
847,The harvest home,B,"aa, Acb; AaAb, AeAf1."
848,The echo,A,"ab, cd; ab, ef."
848,The echo,B,"ab, AcAd; ab, AeAf1."
849,Murray's hornpipe,A,"ab, cb1; ab, de."
849,Murray's hornpipe,A1,"ab, cb1; ab, de1."
849,Murray's hornpipe,B,"ab, a1b1; Ab2Ab2, Ab3Ae2."
849,Murray's hornpipe,B1,"ab, a1b1; Ab2Ab2, Ab3Ae3."
850,McDermott's hornpipe,A,"ab, cd; ab, ef."
850,McDermott's hornpipe,B,"aa1, ab; aa1, cAd1."
851,Glengariff hornpipe,A,"ab, b1c; ab2, da1."
851,Glengariff hornpipe,B,"ab, Ab3b1; AaAb2, AdAa2."
852,The Sweep's hornpipe,A,"ab, cd; ab, ef."
852,The Sweep's hornpipe,B,"ab, cc1; ab, dAd1."
852,The Sweep's hornpipe,C,"aa1, a2a3; aa4, Ba1Af."
853,Galway Bay,A,"aa1, bc; a2a3, de."
853,Galway Bay,B,"Aa4a, Aab; a1c, de."
854,Coming from the wedding,A,"ab, cd; ab, eb1."
854,Coming from the wedding,B,"Ac1Ac2, Ac1Ab2; Ac1a, bb1."
855,Cronin's rambles,A,"aa1, bc; aa1, b1d."
855,Cronin's rambles,B,"aAc1, AbAc; ab, Ab1Ad1."
856,Murphy's hornpipe,A,"aa1, ba2; aa1, bc."
856,Murphy's hornpipe,B,"Aa3a, bAa2; AaAa1, AbAc1."
857,The fair maidens,A,"ab, cd; ab, ce."
857,The fair maidens,B,"ab, cb1; AaAb, AcAe1."
858,The little stack of barley,A,"ab, cd; eb, c1f."
858,The little stack of barley,B,"ab, cAd1; de, Ac2Af1."
859,Off to California,A,"ab, cd; ab, cd1."
859,Off to California,B,"aa1, AcAd; Aa1Ab, Acb."
860,Thirty years ago,A,"ab, cd; ab1, ef."
860,Thirty years ago,B,"Ab2Ad1, Ab2a; Ab2Ad2, AeAf1."
861,Youghal harbor,A,"ab, cc1; ab, c2d."
861,Youghal harbor,B,"aAa1, AcAc1; AaAb, Ac2Ad1."
862,Rogers O'Neill,A,"ab, cd; ab, c1e."
862,Rogers O'Neill,B,"ab, b1b2; ab3, cAe1."
862,Rogers O'Neill,C,"Aa1a, bAd1; Aa2Aa3, cAe."
862,Rogers O'Neill,D,"Aa4Bc1, ab; Aa4Aa3, CcAe."
863,The night we made the match,A,"ab, a1b1; a2c, de."
863,The night we made the match,B,"aa1, a2a2; a3Ae1, bAe2."
864,The pleasures of hope,A,"ab, cd; ec1, fg."
864,The pleasures of hope,B,"Afa, a1b; AeAc1, AfAg."
865,Byrne's hornpipe,A,"ab, cb1; ab, dc1."
865,Byrne's hornpipe,B,"aAb2, a1b; AaAb, AdAc2."
866,Whiskey you're the devil!,A,"ab, cd; ab, ce."
866,Whiskey you're the devil!,B,"aa1, AcAd1; AaAb, AcAe1."
867,The scholar,A,"ab, cd; ab, cd1."
867,The scholar,A1,"ab, cd; ab, cd2."
867,The scholar,B,"aAa1, a1Aa2; a2Aa1, bAd2."
867,The scholar,B1,"aAa1, a1Aa2; a2Aa1, bAd3."
868,The Soldier's joy,A,"ab, ac; ab1, de."
868,The Soldier's joy,B,"Aa1a, Aa1a1; a2a3, AdAe1."
869,The clover blossom,A,"ab, cd; ab, ef."
869,The clover blossom,B,"aa1, ab; ac, dAf."
870,The Glasgow hornpipe,A,"ab, cd; ab, ef."
870,The Glasgow hornpipe,B,"aa1, AcAd; bc, dAf1."
871,Old man Quinn,A,"ab, ab1; ab, cd."
871,Old man Quinn,B,"aa1, bAd1; Ab2c, AcAd2."
871,Old man Quinn,C,"aa1, bAd1; Ab2Bc, AcAd."
872,The green banner,A,"ab, cd; ab, ef."
872,The green banner,B,"aAd1, Ae1Af1; bc, a1Af2."
873,The golden vale,A,"ab, cd; ab, ef."
873,The golden vale,B,"aAd1, Ae1b; aAd1, AeAf1."
874,The honeysuckle,A,"ab, cd; ab, ef."
874,The honeysuckle,B,"ab, cAd; AaAb, AeAf."
875,The star hornpipe,A,"aa1, ba2; aa1, cd."
875,The star hornpipe,B,"Ab1Ab2, ab; AaAa1, AcAd1."
876,O'Connor's fancy,A,"ab, cd; ab, ca1."
876,O'Connor's fancy,B,"ab, Aa2Aa3; b1c, Ab1Aa4."
877,Sault's own hornpipe,A,"ab, cd; ae, fg."
877,Sault's own hornpipe,B,"Ag1a, ba1; cd, ee1."
878,Tomorrow morning,A,"aa1, bc; aa1, bd."
878,Tomorrow morning,B,"Ab1Ab2, AbAc; AaAa1, AbAd."
879,Clark's hornpipe,A,"ab, cd; ab, ed1."
879,Clark's hornpipe,B,"aa1, bAd2; AaAb, AeAd3."
880,The peacemaker,A,"ab, ac; ab1, db2."
880,The peacemaker,B,"Ab3Ab4, Ab5a; Ab3Ab1, AdAb6."
881,Father Dollard's hornpipe,A,"ab, cd; ab, c1a1."
881,Father Dollard's hornpipe,B,"aa1, bc; dd, eAa2."
882,The sea captain,A,"ab, cd; ab, c1e."
882,The sea captain,B,"ab, Ac2Ad1; b1b2, Ac1Ae."
883,The humors of Ballyconnell,A,"ab, cd; ae, c1f."
883,The humors of Ballyconnell,B,"Ad1Aa1, Ad2Af1; aAe, Ac1Af2."
884,Early in the morning,A,"ab, cd; ab, c1e."
884,Early in the morning,B,"ab, cd; AaAb, Ac1Ae1."
885,Julia's wedding,A,"ab, cd; eb, c1f."
885,Julia's wedding,B,"aAb1, bc; aAb1, bAd1."
886,Bill Black's hornpipe,A,"ab, a1c; ab, de."
886,Bill Black's hornpipe,B,"ab, a1b1; cd, AdAe1."
887,Whistling Mike,A,"ab, cd; ab, c1e."
887,Whistling Mike,B,"Ab1Ab1, Ad1a; AaAb, Ac1Ae1."
888,The spring garden,A,"aa1, bc; aa1, b1d."
888,The spring garden,B,"aa1, bc; AaAa1, Ab1Ad1."
889,O'Donnell's hornpipe,A,"ab, cd; a1b, ce."
889,O'Donnell's hornpipe,B,"ab, ab; cc1, Ac1d."
890,Ballincollig in the morning,A,"ab, cd; ab, c1e."
890,Ballincollig in the morning,B,"Ac1Ac2, AcAd1; Ab1Ab, Ac1Ae."
891,The flowers of spring,A,"ab, cd; a1b, ef."
891,The flowers of spring,B,"aAd1, bAd2; a1Ad1, cAf1."
892,The woods of Kilkenny,A,"ab, cb; ab, de."
892,The woods of Kilkenny,B,"ab, cAd1; Ad2Ab, AdAe."
893,O'Donovan's hornpipe,A,"aa1, bc; aa1, de."
893,O'Donovan's hornpipe,B,"Aa2a, Ab1Ac; AaAa1, AdAe1."
894,The friendly visit,A,"ab, cd; ab, ef."
894,The friendly visit,B,"ab, cd; AaAb, AeAf1."
895,Tim the turncoat,A,"aa1, bc; aa1, de."
895,Tim the turncoat,B,"ab, Ad1c; ab, Ad1d."
896,The old vest and cravat,A,"ab, cd; ab, c1e."
896,The old vest and cravat,B,"ab, ac; Aa1d, eAe."
897,The Lakeside road,A,"ab, cd; ab, ea1."
897,The Lakeside road,B,"aa1, aAc1; aAb, AeAa2."
898,The boys of Bluehill,A,"ab, cc1; ab, cd."
898,The boys of Bluehill,B,"ab, AcAc1; AaAb, AcAd1."
