Tune,Title,Part,Structure
1,Shandon bells,A,"ab, a1c; ab, dc1."
1,Shandon bells,A1,"ab, a1c; ab, dc2."
1,Shandon bells,B,"ab, Aa2c; ab, AdAc2."
2,The piper's picnic,A,"aa1, ab; aa1, cd."
2,The piper's picnic,B,"aAd1, a1Ad2; Ad3Ac1, bAd."
3,Hartigan's fancy,A,"aa1, ab; aa1, cd."
3,Hartigan's fancy,B,"Aa2Ab, Aa3Ab1; aAb, Ac1Ad."
4,The yellow flail,A,"ab, b1c; dd1, ef."
4,The yellow flail,B,"aa1, a2Ac1; ab, AeAf."
4,The yellow flail,C,"Ab2Ad2, aa1; AdAd1, AeAf."
5,Kitty's rambles,A,"ab, a1c; db, a1e."
5,Kitty's rambles,B,"aa1, a2a3; Ab1b, Aa1Ae."
5,Kitty's rambles,C,"Bb1Bb2, Bb3a; Ab2Ab, Aa1Ae."
5,Kitty's rambles,D,"aBa4, a1Ca1; Bb4Aa2, Aa1Ae."
6,Doctor O'Neill,A,"ab, cd; ab, ce."
6,Doctor O'Neill,B,"Aa1a, Ac1Ad; Aa1a, Ac1Ae."
6,Doctor O'Neill,C,"aAc2, Ac3Ad1; aAc2, Ac3b."
6,Doctor O'Neill,D,"ab, Ac4Ad2; aAd3, Ac1Ae."
6,Doctor O'Neill,E,"aBa1, aAd2; aBa1, AcAe."
7,Denis Delaney,A,"ab, ac; ab, ad."
7,Denis Delaney,B,"aAa1, Ad1Ad2; aAa1, Ad1Ad."
7,Denis Delaney,C,"Ad3Ad4, Ad3Ad5; BaAa1, Ad1Ad."
8,The walls of Liscarroll,A,"aa1, bc; aa1, bd."
8,The walls of Liscarroll,B,"aa, Ad1Ab1; bc, AbAd."
9,The pipe on the hob,A,"ab, cd; ab1, ec1."
9,The pipe on the hob,B,"Aa1Ab2, AcAc2; Aa1Ae1, AeAc1."
9,The pipe on the hob,C,"ab, ab1; aAa2, AeAc1."
10,Guiry's favorite,A,"aa1, bc; aa2, c1c2."
10,Guiry's favorite,B,"ab, cAb1; ab, Ac1Ac2."
11,Malowney's wife,A,"ab, cd; ab1, a1d1."
11,Malowney's wife,B,"Ad2Ad3, AcAd; Ad2Ad4, Aa1Ad1."
11,Malowney's wife,C,"Ab2a, Ac1Ad; Ab2a, Ac1Ad1."
12,The gold ring,A,"aa1, aa2; aa3, ba1."
12,The gold ring,B,"aAa1, aAa2; aAa3, AbAa1."
12,The gold ring,C,"ab, a1b1; ab, a2Aa1."
12,The gold ring,D,"Aa4Aa4, Aa4Aa1; Aa4Aa4, aAa1."
12,The gold ring,E,"aAa1, bAa2; bb, AbAa1."
12,The gold ring,F,"Ca3Ca4, aAa2; Ca3Ca4, aAa1."
12,The gold ring,G,"aCa5, FaAa2; aCa5, FaAa1."
13,The humors of Bantry,A,"ab, cd; ab, ce."
13,The humors of Bantry,B,"aa, bc; AaAb, Ac1Ae."
13,The humors of Bantry,B1,"aa, bc; Aa1c1, Aa2Ae."
14,Off to the hunt,A,"ab, a1c; a2a3, dc1."
14,Off to the hunt,B,"aa1, bc; c1Aa3, AdAc1."
15,The highway to Dublin,A,"ab, ab1; a1c, a2d."
15,The highway to Dublin,B,"aAb, aAb1; a1b, Aa2Ad."
16,When sick is it tea you want?,A,"ab, a1c; ab, de."
16,When sick is it tea you want?,B,"Ac1Ae1, Ac2Ae2; AaAb, AdAe."
17,The eavesdropper,A,"aa1, a2b; aa1, a2c."
17,The eavesdropper,B,"aAb1, Aa2Ab2; a1b, Aa2Ac."
18,Saddle the pony,A,"ab, ac; ac1, db1."
18,Saddle the pony,B,"aAc2, aAb1; aAc1, AdAb1."
19,Humors of Glendart,A,"ab, ab1; ab, a1b2."
19,Humors of Glendart,B,"aa1, aAb3; a2Ab4, Aa1Ab2."
20,Have a drink with me,A,"ab, ac; ab, ad."
20,Have a drink with me,B,"ab, aAc1; Aa1Aa2, AaAd."
21,The hag with the money,A,"ab, cb1; a1b, de."
21,The hag with the money,B,"ab, aAe1; ac, b1Ae."
22,I know what you like,A,"ab, cd; ab, cd1."
22,I know what you like,B,"ab, Ab1b1; ac, AcAd1."
23,The night cap,A,"aa1, a2a3; aa1, bc."
23,The night cap,B,"aa1, a2Aa4; aa3, AbAc."
24,The maid at the well,A,"ab, a1c; ab, a1c1."
24,The maid at the well,B,"Aa2Ac2, Aa1Ac; Aa2Ac2, Aa1Ac1."
25,Sergt. Early's jig,A,"ab, cd; a1e, c1f."
25,Sergt. Early's jig,B,"Aa2Af1, AcAd; Aa2Af2, Ac1Af."
26,Castle Donovan,A,"ab, cd; a1b, ce."
26,Castle Donovan,B,"Ac1a, Ac1Ae1; Aa1Ab, AcAe."
27,Jackson's frieze coat,A,"ab, ac; ab, a1c."
27,Jackson's frieze coat,B,"ab, a1a2; ab, a1c."
27,Jackson's frieze coat,C,"Ac1Ba3, aa1; Ac1Ba3, a2Bc."
28,Contentment is wealth,A,"ab, a1b1; cd, b2e."
28,Contentment is wealth,B,"aAb3, a1Ab4; ab, Ac1Ae."
28,Contentment is wealth,C,"aAe, a1Ae1; Ac2Ac3, Ac1Ae."
29,Cherish the ladies,A,"ab, cd; ab1, ef."
29,Cherish the ladies,B,"aAa1, AcAd; aAa1, AeAf."
29,Cherish the ladies,C,"BaAa1, Ac1Ad; Ba1Ac2, aAf."
29,Cherish the ladies,D,"aAc3, bBa2; cd, d1Ad1."
29,Cherish the ladies,E,"aDc1, a1Ba2; DcDd, Dd2Ad1."
29,Cherish the ladies,F,"Ab2Ab3, Ab2Ad1; Ab4Ab5, Dd2Ad1."
30,Welcome to Cork,A,"ab, cd; a1b1, ef."
30,Welcome to Cork,B,"aAa2, a1Aa3; aAa2, Ab2Af."
31,The widow Brady,A,"ab, aa1; ab, cd."
31,The widow Brady,B,"Ad1Aa2, Ad2Aa3; ab, Ac1Ad."
32,The basket of Turf,A,"ab, a1c; ab, dc."
32,The basket of Turf,B,"aAc1, bAb1; bAc1, AdAc."
33,Do you want anymore?,A,"ab, cd; eb, c1f."
33,Do you want anymore?,B,"Ab1Ac2, Ab1Ac3; aa1, Ac1Af."
34,Galway Tom,A,"ab, ac; ab, c1d."
34,Galway Tom,B,"Ab1Ab2, Ab3Aa1; Ab4a, Ac1Ad."
34,Galway Tom,B1,"Ab1Ab2, Ab3Aa1; Ab4a, Ac1Ad1."
34,Galway Tom,C,"Aa2a, Aa2b; Aa3a1, cb."
34,Galway Tom,D,"Ad2Ab2, Ad3Aa1; Ab4Ba, Ac1Ad."
34,Galway Tom,D1,"Ad2Ab2, Ad3Aa1; Ab4Ba, Ac1Ad1."
34,Galway Tom,E,"aAb5, a1Ac; aAb6, Ac1Ad1."
35,Money in both pockets,A,"ab, ac; ab, b1b2."
35,Money in both pockets,B,"ab, ac; de, e1Ab2."
36,Father Dollard's favorite,A,"ab, ab1; ab, b2c."
36,Father Dollard's favorite,B,"Ab3Ac1, Ab3Aa1; Ab3Ab2, aAc."
37,Tell her I am,A,"ab, b1c; ab, a1c1."
37,Tell her I am,B,"ab, Ab2Ac; a1c, Aa1Ac1."
38,The mountain boy,A,"ab, a1c; ab, dc."
38,The mountain boy,B,"aa1, bc; aa1, AdAc."
39,A visit to Ireland,A,"ab, cd; ab, a1d1."
39,A visit to Ireland,B,"aAc1, AcAd; aAc1, Aa1Ad1."
40,Jerry's beaver hat,A,"ab, cc1; ab, c2c3."
40,Jerry's beaver hat,B,"Aa1a, Aa1b; Aa1a, a1Ac3."
41,The tempelhouse jig,A,"ab, a1c; ab1, db2."
41,The tempelhouse jig,B,"Ab3Ab4, Ab5Ab6; Ab3Ab7, AdAb2."
41,The tempelhouse jig,B1,"Ab3Ab4, Ab5Ab6; Ab8Ad1, AdAb2."
42,Move up to me,A,"ab, a1b1; ab, cd."
42,Move up to me,B,"Ab2Ab, Ab2Ab3; Ab2Ab, AcAd."
43,Paddy whack,A,"ab, cd; ee1, fd1."
43,Paddy whack,B,"Ac1a, AcAd; ba, AfAd1."
43,Paddy whack,B1,"Ac1a, AcAd; AeAe1, AfAd1."
44,Nell Flaherty's drake,A,"ab, a1c; ab1, a1c1."
44,Nell Flaherty's drake,B,"Aa2a, bAc; AaAb, Aa1Ac1."
45,Out with the boys,A,"ab, cd; ab, cd1."
45,Out with the boys,B,"aa, aAb1; aAd2, bAb2."
45,Out with the boys,C,"Aa1Aa1, ab; Aa2Aa1, BbAb2."
46,Katie's fancy,A,"ab, cd; ab, ce."
46,Katie's fancy,B,"aa1, ba2; AaAb, AcAe."
46,Katie's fancy,C,"Ab1Ba3, Bb1Ae1; Ad1a, Ac1Ae."
47,Paddy from Portlaw,A,"aa1, ab; ac, a2a1."
47,Paddy from Portlaw,B,"Aa3Aa4, Aa3Ab1; ab, Aa5Ab2."
48,The miller of Glanmire,A,"ab, a1c; a2d, a3e."
48,The miller of Glanmire,B,"Aa2Ad, Aa1Ac; Aa2Ad, Aa3Ae."
49,The hare in the corn,A,"aa, bc; aa, bc1."
49,The hare in the corn,B,"aAb, AbAc; aAb, AbAc1."
49,The hare in the corn,C,"Bb1a, AbAc; Bb1a1, ba."
50,Daniel O'Rourke,A,"aa1, ab; aa2, a3c."
50,Daniel O'Rourke,B,"aAb1, aAb2; aAb1, Aa4Ab2."
50,Daniel O'Rourke,B1,"aAb1, aAb2; aAb1, bAc."
50,Daniel O'Rourke,C,"ab, B1c1b1; ab2, B1bAc."
51,O'Sullivan's march,A,"ab, ab1; ab, a1b2."
51,O'Sullivan's march,B,"ab, Aa2a1; cAb, Aa1Ab2."
52,Tobin's favorite,A,"ab, cb1; ab2, de."
52,Tobin's favorite,B,"Aa1Ad1, AcAb1; AaAb2, AdAe."
53,Banish misfortune,A,"ab, cb1; ab, dc1."
53,Banish misfortune,B,"Aa1a, Aa2b; Aa3a, cAc1."
53,Banish misfortune,B1,"Aa1a, Aa2b; Ab2d, eAc1."
53,Banish misfortune,C,"Bc1a, AaAb; Bb1Ad, B1eAc1."
54,The wheels of the world,A,"ab, cd; eb, cf."
54,The wheels of the world,B,"Ac1Af1, AcAd; Ac1Af1, AcAf."
54,The wheels of the world,B1,"Ac1Af1, AcAd; AeAb, AcAf."
55,Kitty come over,A,"aa1, bc; aa1, bd."
55,Kitty come over,B,"ab, ac; AaAa1, AbAd."
56,The humors of Cappa,A,"aa, bc; aa, de."
56,The humors of Cappa,B,"Ac1Ac, AbAc; Ac1Ac, AdAe."
57,The blazing turf fire,A,"ab, a1c; ad, ef."
57,The blazing turf fire,B,"aa1, ab; ac, AeAf."
58,All covered with moss,A,"ab, ac; bd, c1b1."
58,All covered with moss,A1,"ab, ac; bd, c1b1."
58,All covered with moss,B,"aAc2, aAb1; aAc3, Ad1b."
58,All covered with moss,B1,"aAc2, aAb1; cAd2, Ad3Ab2."
59,The priest's leap,A,"ab, ac; ab1, de."
59,The priest's leap,B,"Ab2Ab, Ab2Ac; Ab2Ab1, AdAe."
60,The book of rights,A,"ab, cd; ab, ce."
60,The book of rights,B,"aAa1, bAd1; a1Ad1, AcAe."
61,The humors of whiskey,A,"ab, cd; ab1, eb2."
61,The humors of whiskey,B,"aa1, a2Ad1; aa1, Aa1Ab2."
62,Fiddler's heaven,A,"ab, ac; ab1, c1d."
62,Fiddler's heaven,B,"Ac2a, Ac1Ac3; Ac2a1, a2b."
63,A night at the fair,A,"ab, cd; ab, d1c1."
63,A night at the fair,B,"Ab1Ab2, aAd2; Ab1Ab2, bAc1."
64,Darby the driver,A,"ab, cd; a1b, cb."
64,Darby the driver,B,"aa, bc; ad, eAb."
65,John White's mother,A,"ab, cc1; dd1, c2c3."
65,John White's mother,B,"Ad2Aa1, aa1; Ad2b, cd."
66,The humors of Tralibane,A,"aa1, bc; aa1, b1d."
66,The humors of Tralibane,B,"Ac1a, Ac1b; Ac1c, Ab2Ad."
67,Connie the soldier,A,"ab, a1a2; ab, a3c."
67,Connie the soldier,B,"Ab1a, ba1; Ab1Ab2, Aa3Ac."
67,Connie the soldier,B1,"Ab1a, ba1; cAb2, Ac"
68,Out on the ocean,A,"ab, cd; ab, ce."
68,Out on the ocean,B,"aa, a1Aa1; Ad1Ac1, AcAe."
69,Philip O'Neill,A,"ab, b1c; ab, db2."
69,Philip O'Neill,B,"ab, Ac1c; ab, AdAb2."
70,The besom in bloom,A,"ab, aa1; ac, da2."
70,The besom in bloom,B,"Ad1Aa3, AaAb; Ad1Ad2, AdAa2."
71,Courtney's favorite,A,"ab, ac; ad, b1c1."
71,Courtney's favorite,A1,"ab, ac; ad, ec2."
71,Courtney's favorite,B,"aAb, ab; a1c, db."
72,The merry old woman,A,"ab, cb1; db2, c1e."
72,The merry old woman,B,"AcAb1, Ab3Ae1; AcAb1, Aa1Ae."
72,The merry old woman,B1,"AcAb1, Ab3Ae1; Ad1a, bAe."
73,Con Casey's jig,A,"ab, ac; ab1, c1d."
73,Con Casey's jig,B,"Ac2a, Ac2a1; Ac2Ab2, Ac1Ad."
74,A trip to the cottage,A,"aa1, bc; aa1, bd."
74,A trip to the cottage,B,"aa1, bc; aa1, dAd1."
75,Old man Dillon,A,"ab, cd; ae, c1f."
75,Old man Dillon,B,"aa, Ac2Ad; aa, Ac3Af1."
75,Old man Dillon,B1,"aa, Ac2Ad; AaAe, Ac1Af."
76,Julia McMahon,A,"ab, cd; ab, a1a2."
76,Julia McMahon,B,"Aa3a, bAd; Aa3Ab1, a1Aa2."
76,Julia McMahon,B1,"Aa3a, bAd; cAb2, Aa1Aa2."
77,Drive the cows home,A,"ab, a1c; c1b1, a2d."
77,Drive the cows home,B,"aAb1, a1a2; aAb1, Aa2Ad."
77,Drive the cows home,B1,"aAb1, a1a2; a3a4, Aa2Ad."
78,Happy to meet and sorry to part,A,"ab, cc1; a1d, c2e."
78,Happy to meet and sorry to part,B,"aAc3, aAd1; a1Ad2, Aa1Ad."
78,Happy to meet and sorry to part,B1,"aAc3, aAd1; a1Ad2, bb1."
79,The joy of my life,A,"ab, a1c; ab, a1c1."
79,The joy of my life,B,"Ac2Ac3, Abb1; Ac2Ac3, Aa1Ac1."
79,The joy of my life,B1,"Ac2Ac3, Abb1; aa1, Aa1Ac1."
80,The grumbling rustic,A,"ab, cc; ab, dd."
80,The grumbling rustic,B,"Aa1Ac1, AcAc; Aa1Ac1, AdAd."
80,The grumbling rustic,B1,"Aa1Ac1, AcAc; Ac1Ac2, AdAd."
81,The humors of Ballycastle,A,"ab, ac; ab, b1d."
81,The humors of Ballycastle,B,"aAd1, bb1; a1Ab, Ab1Ad."
82,Doherty's fancy,A,"ab, cb1; db, eb2."
82,Doherty's fancy,B,"ab, ac; c1c2, AeAb2."
83,The girls of Banbridge,A,"ab, cd; ab, ec1."
83,The girls of Banbridge,B,"Aa1Ab1, Ac2Ad1; Aa1Ab1, AeAc1."
84,Wellington's advance,A,"ab, cd; ab, c1e."
84,Wellington's advance,B,"ab, cAd; Aa1Ac2, Ac1Ae."
85,The old man's delight,A,"aa1, a2b; aa1, cd."
85,The old man's delight,B,"aa1, AaAa1; aa1, Aa3Ad."
86,Blackeyed Biddy,A,"ab, cd; ab, cd1."
86,Blackeyed Biddy,B,"Ac1a, a1Ab1; Ac2Ab, AcAd1."
87,The jolly Corkonian,A,"ab, a1b1; ab2, cd."
87,The jolly Corkonian,B,"Ad1Ab3, Ad2a; Ad1Ab4, bAd."
88,Willy Walsh's jig,A,"ab, ac; ab, de."
88,Willy Walsh's jig,B,"aa1, Ae1Aa1; aa1, AdAe."
89,The boys of the town,A,"ab, ab1; ab2, b3c."
89,The boys of the town,B,"ab, ab1; ab, Ab3Ac."
89,The boys of the town,B1,"ab, ab1; a1c, Ab3Ac."
90,Petticoat loose,A,"ab, ac; ad, ef."
90,Petticoat loose,A1,"ab, ac; ad, ef1."
90,Petticoat loose,B,"Ac1Aa1, Af2Ab1; aAa1, bAf1."
91,The tailor's thimble,A,"aa1, a2a3; aa1, bc."
91,The tailor's thimble,A1,"aa1, a2a3; aa1, bc1."
91,The tailor's thimble,B,"Ac2Aa4, Ac3a; Ac4Ab1, AbAc."
91,The tailor's thimble,B1,"Ac2Aa4, Ac3a; Ac4Ab1, AbAc1."
92,The humors of Ballingarry,A,"aa1, a2a3; aa1, ba3."
92,The humors of Ballingarry,B,"Ab1a, bc; Ab2a, dAa3."
93,Palm Sunday,A,"ab, cb1; db2, ea1."
93,Palm Sunday,B,"Ae1Aa2, ab; cAb2, AeAa1."
94,The road to Lurgan,A,"ab, ca1; a2b, da3."
94,The road to Lurgan,B,"Ad1Aa4, Ad1Aa5; Ad1Aa4, aAa3."
95,The sheep on the mountains,A,"ab, a1a1; ac, a2a2."
95,The sheep on the mountains,B,"AaAb, aa; bAb, Aa2c."
95,The sheep on the mountains,C,"Bc1a, Aa1Aa1; Bc1a, Aa2Aa2."
95,The sheep on the mountains,D,"Bc1Ca, Aa1Aa1; Aa3a, Aa2Aa2."
96,Our own little isle,A,"ab, cd; ab, ce."
96,Our own little isle,B,"Aa1a, Aa1b; a1a, Ac1Ad."
97,The straw seat,A,"ab, ac; ab, de."
97,The straw seat,B,"Aa1Aa1, Aa2Aa2; Aa1Aa1, AdAb1."
98,The flaxdresser,A,"ab, a1a2; ab, ca3."
98,The flaxdresser,B,"Ab1a, Ab1b; a1c, db1."
98,The flaxdresser,C,"aBa, bAa4; aBa, BdBb1."
99,The races at Carrick,A,"aa1, bc; aa1, ba2."
99,The races at Carrick,B,"aAc1, Ac2Aa1; aAc1, Acb."
100,Condon's frolics,A,"ab, cd; ab, c1a1."
100,Condon's frolics,B,"Ad1a, Ad2Ad3; Ad1a, Ac1Aa1."
101,The idle road,A,"aa1, bc; aa1, bc1."
101,The idle road,B,"ab, aAb1; AaAa1, AbAc1."
102,Billy Barlow,A,"aa1, a2a3; bc, de."
102,Billy Barlow,B,"aAa1, Ab1Aa3; AbAc, AdAe."
103,A merry christmas,A,"ab, ac; ab, a1d."
103,A merry christmas,B,"ab, Aa2Ab1; cd, Aa1Ad."
104,Will you come home with me?,A,"ab, cc; ab, dd1."
104,Will you come home with me?,B,"aAb1, AcAc; aAb1, AdAd1."
105,The gobby o,A,"ab, a1a2; ac, de."
105,The gobby o,B,"aa1, bc; ad, AdAe."
106,The humors of Mullinafauna,A,"ab, cc1; bb1, a1b2."
106,The humors of Mullinafauna,B,"ab, Ac2b1; b2b1, Aa1Ab2."
107,Father O'Carroll,A,"aa1, bc; da1, b1e."
107,Father O'Carroll,B,"ab, Ae1Ac; Ae2b, Ab1Ae."
108,The rakes of Kildare,A,"ab, cd; a1b, ef."
108,The rakes of Kildare,B,"aAc1, AcAd; aAc1, AeAf."
109,The tailor's wedding,A,"ab, a1c; ab, dc."
109,The tailor's wedding,B,"aa1, aAc1; aAb1, bAc."
110,My former wife,A,"ab, cd; ae, e1f."
110,My former wife,B,"Aa1Af1, Ae2a; Aa1Af1, Ae1Af."
111,The sporting bachelor,A,"ab, cd; ab, b1d1."
111,The sporting bachelor,B,"Ac1Ac1, Ad2Ab2; aa1, bc."
112,The first night in America,A,"aa1, bc; aa1, bc1."
112,The first night in America,B,"Aa2Aa3, aAc2; Aa2Aa3, a1Ac1."
113,The best in the bag,A,"ab, ac; ab, da1."
113,The best in the bag,B,"Aa1a, Aa1Ac1; bb1, AdAa1."
114,The maid on the green,A,"ab, cd; ab, b1c1."
114,The maid on the green,B,"Aa1Aa2, aAa3; bAa, AbAc1."
115,Stagger the buck,A,"ab, ac; ad, ec1."
115,Stagger the buck,B,"Ac2Ab, Ac2Ac; Ac2Ad, AeAc1."
116,Rory O'Moore,A,"aa1, a2b; aa3, b1c."
116,Rory O'Moore,B,"ab, Ab2c; ab, Ab2d."
116,Rory O'Moore,B1,"ab, Ab2c; ab, Ab2c."
117,The highlander,A,"aa1, ab; a2a1, cb1."
117,The highlander,B,"ab, a1Ab1; a2b, Ac1Ab1."
118,Lannigan's ball,A,"ab, a1a2; ab, cd."
118,Lannigan's ball,B,"Ab1a, Ab1Ad1; Ab1a, AcAd."
119,Hide and go seek,A,"ab, a1b1; ab2, a2c."
119,Hide and go seek,B,"aAa3, a1Aa4; aAa5, a1Aa6."
119,Hide and go seek,B1,"aAa3, a1Aa4; bc, c1Aa6."
120,Fasten the leg in her,A,"ab, a1c; ab1, de."
120,Fasten the leg in her,B,"Ac1Aa2, Aa3Ac; Ac1Aa2, Ad1Ae."
121,The cliffs of Moher,A,"aa1, bc; aa1, bc1."
121,The cliffs of Moher,B,"aa, bb1; aa, bAb1."
122,Charley the prayermaster,A,"ab, a1c; ab, ad."
122,Charley the prayermaster,B,"Aa2a, Aa3b; Aa2Ac1, AaAd."
123,Young Francis Mooney,A,"aa1, bb1; aa1, cc1."
123,Young Francis Mooney,B,"Aa2Aa2, Aa3Ab2; Aa2Aa4, Ac2a."
124,Grandfather's pet,A,"aa, bb1; aa, cd."
124,Grandfather's pet,B,"aAb2, ab; aAb3, cd."
125,Wasn't she fond of me?,A,"ab, ab1; ab, cd."
125,Wasn't she fond of me?,B,"AcAa1, AcAd; AcAb2, Ad1Aa2."
126,Wise Nora,A,"ab, ab1; ac, b2b3."
126,Wise Nora,B,"Aa1Ab, Aa1Ab3; Aa1Ac, Ab2Ab3."
126,Wise Nora,C,"Ab4Ac1, Ab5Ab6; Ab4Ac, Ab2Ab3."
126,Wise Nora,D,"aa1, aAb3; aa1, a2Ab3."
126,Wise Nora,E,"Da3Ac2, aAb3; Da3Ac2, Ac3Ab3."
126,Wise Nora,F,"aAb7, aAb3; aAb7, Da2Ab3."
127,The butcher's march,A,"ab, ab1; aa1, cb1."
127,The butcher's march,B,"aAb, aAb1; aAb, AcAb1."
128,Larry O'Gaff,A,"ab, cd; ab, cc1."
128,Larry O'Gaff,B,"aAb1, a1b; cAb, AcAc1."
128,Larry O'Gaff,B1,"aAb1, a1b; cAb2, AcAc1."
129,The cat in the corner,A,"ab, a1a1; ab, cc1."
129,The cat in the corner,B,"Aa2Ac2, Aa3a; bAb1, b1Aa4."
130,Ballyhooley,A,"aa1, a2b; ca1, de."
130,Ballyhooley,B,"Ab1a, Ab1Ad1; Ac1Ad2, Ac2Ae."
131,The bow-legged tailor,A,"ab, a1c; ad, ef."
131,The bow-legged tailor,B,"Ad1Ad2, aAf1; Ad1b, cAf."
132,Larry Grogan,A,"aa1, bc; aa2, b1a3."
132,Larry Grogan,B,"ab, a1Aa4; ab, cAa3."
133,The Killashandra lasses,A,"ab, a1b1; ab, cb2."
133,The Killashandra lasses,B,"Ac1Ac2, Aa1Ab1; Ac1Ac2, AcAb2."
133,The Killashandra lasses,B1,"Ac1Ac2, Aa1Ab1; aa1, AcAb2."
134,Young Tim Murphy,A,"ab, b1c; ab, de."
134,Young Tim Murphy,B,"Ac1a, Ac2Ac3; bAe1, AdAe."
135,Boiled goat's milk,A,"ab, cd; ab, ef."
135,Boiled goat's milk,B,"ab, a1b1; ab, AeAf."
136,(Tatter Jack Walsh),A,"ab, cd; c1b, ce."
136,(Tatter Jack Walsh),B,"aa, a1b; Ac1Ab, AcAe1."
136,(Tatter Jack Walsh),C,"BaBa, aBb; Ac1Ab, AcAe."
137,The victor's return,A,"aa, a1b; aa, cb1."
137,The victor's return,B,"ab, ac; ab1, c1Ab1."
138,Snug in the blanket,A,"ab, ca1; ab, da2."
138,Snug in the blanket,B,"ab, aa1; ab1, AdAa2."
138,Snug in the blanket,C,"BaAb1, BaAa1; BaAb2, AdAa2."
139,How are you Kitty?,A,"ab, ac; db, ec1."
139,How are you Kitty?,B,"Ad1Ad2, AaAc2; Ad1Ad3, AeAc1."
139,How are you Kitty?,C,"Ac3a, Adb; Ac3a, Ad4Ac1."
140,The silken wallet,A,"aa1, a2b; aa1, cc1."
140,The silken wallet,B,"ab, a1c; a1b1, de."
140,The silken wallet,B1,"ab, a1c; d1f, f1c1."
141,Behind the haystack,A,"ab, cc; ab, dd1."
141,Behind the haystack,B,"aa1, AcAc; aa1, AdAd1."
141,Behind the haystack,C,"aa, AcAc; aa, AdAd1."
142,The jolly old man,A,"ab, a1b1; ab, cd."
142,The jolly old man,B,"aAb2, bAb1; Aa2Ab2, Ad1Ad."
142,The jolly old man,B1,"aAb2, bAb1; AaAb, AcAd."
143,Handy with the stick,A,"ab, cd; ab, ca1."
143,Handy with the stick,B,"ab, Ab1c; Aa2c1, AcAa1."
144,The house in the glen,A,"ab, cb1; ab, da1."
144,The house in the glen,B,"ab, ac; ab1, dAa1."
145,Jackson's bottle of brandy,A,"ab, ac; ad, ec1."
145,Jackson's bottle of brandy,B,"Ab1a, a1a2; Ab1a, AeAc1."
146,Jackson's morning brush,A,"aa1, bb1; aa1, b2c."
146,Jackson's morning brush,B,"Aa2Ab3, aAb1; Aa2Ab3, a1Ac."
146,Jackson's morning brush,C,"Ba2Ba3, aAb1; Ba2Ba3, a1Ac."
146,Jackson's morning brush,D,"Ba2Ba3, CaAb1; ab, Ca1Ac."
146,Jackson's morning brush,E,"Aa2a, Aa2Ab1; Aa2a, Bc1Ac."
147,Jackson's cravat,A,"ab, ac; ab, dc1."
147,Jackson's cravat,B,"ab, cAc; ab, c1d."
148,The Kinnegad slashers,A,"aa1, ab; aa2, cd."
148,The Kinnegad slashers,B,"ab, aAd1; a1b1, AcAd."
148,The Kinnegad slashers,C,"Aa3Aa1, Aa3Ab; Aa3Aa4, AcAd."
149,The rakes of Clonmel,A,"ab, a1c; dd1, eb."
149,The rakes of Clonmel,B,"aAc1, a1Ac; bAd1, AeAb."
149,The rakes of Clonmel,B1,"aAc1, a1Ac; Ad2Aa2, AeAb."
149,The rakes of Clonmel,C,"aAe1, Ad3Ae2; Ad2b, AeAb."
150,Nancy Hynes,A,"aa1, bb1; ac, de."
150,Nancy Hynes,B,"Ae1Ae2, Ae3a; Ae1Ae2, bAe."
150,Nancy Hynes,B1,"Ae1Ae2, Ae3a; Ad1Ae4, Aa1c."
150,Nancy Hynes,C,"Ae5Bb1, AbAb1; AaAc, Ad2Ae."
151,The pretty brown girl,A,"aa1, ab; ac, ab."
151,The pretty brown girl,B,"Ab1a, a1a2; a1a3, AaAb."
152,Jackson's fancy,A,"ab, a1b1; ab, ac."
152,Jackson's fancy,B,"Ab2a, Ab2Ac1; Ab2a, Ab3Ac."
153,Young Tom Ennis,A,"aa1, a2a3; aa1, bc."
153,Young Tom Ennis,B,"Aa4a, Aa4Ab1; Aa4a, Aa2Ac1."
154,The Antrim lasses,A,"ab, a1b1; a2c, de."
154,The Antrim lasses,B,"Ab2Ab2, Ab3Ab3; aAc, AdAe."
155,Jackson's rambles,A,"ab, a1b1; ab, a2c."
155,Jackson's rambles,B,"Ac1a, bAc2; Ac1a, b1Ac3."
155,Jackson's rambles,B1,"Ac1a, bAc2; Ab2Ab3, b1Ac3."
156,A draught of ale,A,"ab, ac; ab1, dc1."
156,A draught of ale,B,"Ab2Ab, Ab2Ac; Ab2Ab1, AdAc1."
157,The redhaired hag,A,"ab, cb1; ab2, a1a2."
157,The redhaired hag,B,"aAb2, Ac1Ab1; aAb3, Aa1Aa2."
158,The fairhaired boy,A,"ab, cd; ab, ce."
158,The fairhaired boy,B,"Aa1Ab1, AcAd; Aa1Ab1, AcAe."
158,The fairhaired boy,B1,"Aa1Ab1, AcAd; AaAb, AcAe."
159,My darling asleep,A,"aa1, bc; aa1, ba2."
159,My darling asleep,B,"Ab1Ab2, AbAc; AaAa1, AbAa2."
160,The kneebuckle,A,"ab, a1c; ab, dc."
160,The kneebuckle,B,"aa1, aAc1; aa1, Ada."
160,The kneebuckle,C,"Ba1Ba, Ac1Ba; Ba1Ad, Ac"
161,The sod of turf,A,"ab, ac; ab, a1d."
161,The sod of turf,B,"Aa2a, Aa1Ad1; Aa2a, Aa1Ad."
162,The tenpenny bit,A,"ab, cd; eb, fg."
162,The tenpenny bit,B,"Ab1Ab2, Ab1Ae1; ab, b1Ag."
163,The fisherman's widow,A,"ab, cd; ab, c1e."
163,The fisherman's widow,B,"Aa1Ab1, Aa1Ae1; Aa1Ae2, Ac1Ae."
163,The fisherman's widow,B1,"Aa1Ab1, Aa1Ae1; Ad1Ab2, Aa2Ae."
164,The ladies of Carrick,A,"aa1, aa2; aa3, ba2."
164,The ladies of Carrick,B,"Ab1a, Ab1Aa2; Ab1a, AbAa2."
165,Charlie Stewart,A,"ab, b1a1; cd, ef."
165,Charlie Stewart,B,"aAe, aAa1; aAe, Ad1Af."
166,Jack-of-all-trades,A,"ab, ca1; ab, cd."
166,Jack-of-all-trades,B,"ab, Ad1Ad2; Ac1c, Ac2Ad."
167,The boys of Ballinamore,A,"ab, ac; ab, ad."
167,The boys of Ballinamore,B,"ab, ac; ab, de."
168,Miss Blair's fancy,A,"aa1, bc; aa1, b1d."
168,Miss Blair's fancy,B,"Ad1Ac1, aAa2; Aa3Ac1, Ab1Ad."
168,Miss Blair's fancy,B1,"Ad1Ac1, aAa2; a1b, Ab1Ad."
169,Easter Sunday,A,"ab, b1a1; a2b, ca3."
169,Easter Sunday,B,"ab, aAb2; ac, a1d."
170,Jackson's rolling jig,A,"ab, aa1; ab, cd."
170,Jackson's rolling jig,B,"aAb, ab; aAb, AcAd."
171,The runaway bride,A,"aa1, bc; a2a1, da3."
171,The runaway bride,B,"Ad1Aa4, aAc; AaAa1, AdAa3."
172,Black Donald the piper,A,"aa1, ab; a2a1, cb1."
172,Black Donald the piper,B,"ab, aAb; ab, AcAb1."
173,The dandy bonnet,A,"ab, a1c; c1c2, de."
173,The dandy bonnet,B,"Ad1a, Ad2b; Ad1a1, cAe."
174,The humors of Trim,A,"ab, ac; ab, dc."
174,The humors of Trim,B,"AbAc1, aAc; Abb, AdAc."
175,The end of the day,A,"ab, cd; ab1, c1e."
175,The end of the day,B,"aAe1, aAe2; aAe3, Ac1Ae."
176,Owen Malone,A,"aa, bc; aa, de."
176,Owen Malone,B,"aAc1, aAa1; aAc1, AdAe."
177,Bessy Murphy,A,"ab, cc1; ab, c2d."
177,Bessy Murphy,B,"aa1, AcAc1; aa1, Ac2Ad."
178,Paddy O'Rafferty,A,"ab, aa1; ab1, ca1."
178,Paddy O'Rafferty,B,"aAb, aAa1; aAb1, AcAa1."
178,Paddy O'Rafferty,C,"aAa2, aAa1; aAc1, Aa1a."
178,Paddy O'Rafferty,D,"Aa2Ca, Aa1Ca; Ac1Aa1, ab."
178,Paddy O'Rafferty,E,"DaAa1, DaDb1; AcAa1, DaDb."
178,Paddy O'Rafferty,E1,"DaAa1, DaDb1; AcAa1, aDb2."
178,Paddy O'Rafferty,F,"Db2Aa1, Db3Db1; AcAa1, E1aDb2."
178,Paddy O'Rafferty,F1,"Db2Aa1, Db3Db1; AcAa1, "
179,I do not incline,A,"ab, cc1; ab, c2d."
179,I do not incline,B,"aa1, Ad1Ac1; AaAb, Ac2Ad."
180,The Gaelic club,A,"ab, a1c; ab1, b2a2."
180,The Gaelic club,B,"Ac1Ac2, Ac1Aa3; AaAb1, Ab2Aa2."
181,The market town,A,"ab, cd; ab, c1e."
181,The market town,B,"Aa1a, AcAd1; Aa1a, Ac1Ae."
181,The market town,B1,"Aa1a, AcAd1; bb1, Ac1Ae."
182,The humors of Castlelyons,A,"ab, a1b1; ab, a1c."
182,The humors of Castlelyons,B,"aa, Aa1Ab1; aa, Aa1Ac."
182,The humors of Castlelyons,B1,"aa, Aa1Ab1; AaAb2, Aa1Ac."
183,The dancingmaster,A,"aa, a1a1; aa2, a1a2."
183,The dancingmaster,B,"ab, ac; ab, Aa1Aa2."
184,Farewell to my troubles,A,"aa1, bc; aa1, de."
184,Farewell to my troubles,B,"Ae1Aa2, aAc1; bAa1, AdAe."
185,The tongs by the fire,A,"ab, cd; ab, ef."
185,The tongs by the fire,B,"aa1, Af1b; Ac1Ae1, a2b1."
186,The thief of Lough Erne,A,"ab, cc1; ab, c2c2."
186,The thief of Lough Erne,B,"Ac3Ac3, Ac4a; Ac3Ac3, bAc2."
186,The thief of Lough Erne,B1,"Ac3Ac3, Ac4a; Ac3c, b1Ac2."
187,Scatter the mud,A,"aa1, aa2; aa3, bc."
187,Scatter the mud,B,"aAc, aAa2; bAc1, AbAc."
188,The priest and his boots,A,"ab, a1c; a2b, c1d."
188,The priest and his boots,B,"Ac2Ac3, Aa1Ac; aa1, Ac1Ad."
189,The three little drummers,A,"ab, ac; ab, c1d."
189,The three little drummers,B,"aAc2, aAc1; aAc2, Ac1Ad."
189,The three little drummers,C,"Ba1Ab1, Ba1Ab1; Ba1Ab1, Ac1Ad."
190,O'Mahony's frolics,A,"ab, cb1; ab, c1d."
190,O'Mahony's frolics,B,"Aa1Ad1, Aa2Ad2; Aa1Ad3, Ad4Aa3."
190,O'Mahony's frolics,B1,"Aa1Ad1, Aa2Ad2; Ad5a, Ac1Ad."
191,The Limerick tinker,A,"ab, a1c; ab1, dc1."
191,The Limerick tinker,B,"Ad1a, Ad1Ac2; Ad1a1, AdAc1."
191,The Limerick tinker,C,"ab, aAc3; Ab2Ab3, AdAc1."
192,The boy from the mountain,A,"ab, ac; aa1, dc."
192,The boy from the mountain,A1,"ab, ac; aa1, dc1."
192,The boy from the mountain,B,"ab, ac; ab1, dAc2."
192,The boy from the mountain,C,"BaBb, BaBc; Ba1a, Bb2Ac."
193,The woodcock,A,"ab, ac; ab, a1b1."
193,The woodcock,A1,"ab, ac; ab, a1d."
193,The woodcock,B,"A1d1a, AaAc1; A1d1a, Aa1A1d2."
193,The woodcock,C,"Ac2Ba, AaAc1; Ac2Ba, Aa1A1d."
194,Dunmanway lasses,A,"ab, ac; ab, b1d."
194,Dunmanway lasses,B,"Ab2a, Ab2a1; Ad1b, Ab3Ad."
195,The boys of Ballinafad,A,"aa1, bc; ad, d1d2."
195,The boys of Ballinafad,B,"Aaa, Aa2Aa3; Aaa, Ac1b."
196,Let it be so,A,"ab, ac; aa1, dc."
196,Let it be so,B,"ab, a1c; dAb1, AaAc."
197,The short grass,A,"ab, ac; ab, de."
197,The short grass,B,"aAe1, a1b; aAe1, cd."
197,The short grass,B1,"aAe1, a1b; c1e, AdAe."
198,Miss Monroe's jig,A,"ab, a1c; ab, dc1."
198,Miss Monroe's jig,B,"aa1, Aa2Ac2; Aa2Ac3, AdAc1."
199,The spotted cow,A,"ab, ac; ab, de."
199,The spotted cow,B,"aa, a1Ae; a2a2, Ad1Ae."
199,The spotted cow,C,"Ba3a, Ba3Ae1; Ba3a, Adb."
200,Daniel of the sun,A,"ab, cc; ab, dd."
200,Daniel of the sun,B,"aAb1, Ac1Ac; bAb1, AdAd."
200,Daniel of the sun,C,"Ba1Ab2, Ac2Ac2; AaAb, AdAd."
201,Biddy's wedding,A,"ab, ac; ab, dc."
201,Biddy's wedding,B,"Aa1Ac1, Aa1Ac; Aa1Ac2, AdAc."
202,Paddy O'Carroll,A,"aa1, a2b; aa3, a2b1."
202,Paddy O'Carroll,B,"aAb2, a1b; aAb2, Aa2Ab1."
203,Haste to the wedding,A,"ab, a1a2; ab, cb1."
203,Haste to the wedding,B,"Aa3Aa4, Aa5Aa6; aAb, AcAb1."
204,The little house under the hill,A,"aa1, ab; aa2, cb."
204,The little house under the hill,B,"Aa3Aa1, Aa3Ab; Aa3Ab1, Ac1Ab."
204,The little house under the hill,C,"Ac2a, Ac2Ab; Ac2a, Ac1Ab."
205,Breeches Mary,A,"ab, b1c; ab, de."
205,Breeches Mary,B,"ab, aAc; ab, AdAe."
206,Jimmy O'Brien's jig,A,"ab, cb; a1b, c1d."
206,Jimmy O'Brien's jig,B,"Ab1a, Ab1b; Ab1a, Ac1Ad."
206,Jimmy O'Brien's jig,C,"aa1, aBb1; aa1, Ac1Ad."
207,I will if I can,A,"ab, ab1; ac, db2."
207,I will if I can,B,"Ad1Ab3, Ad1Ab1; Ad1Ac1, aAb4."
208,Miss Wiseman's fancy,A,"ab, cc1; ab, dd1."
208,Miss Wiseman's fancy,B,"aa1, bAd2; aa1, AdAd1."
208,Miss Wiseman's fancy,C,"aAb, Bb1b; Aa1Ab, AdAd1."
209,Green sleeves,A,"ab, cb1; ab, c1a1."
209,Green sleeves,B,"Aa2Ab2, Aa3Ac2; Aa2Ab, Ac1Aa1."
210,The miners of Wicklow,A,"ab, cc1; ab1, de."
210,The miners of Wicklow,A1,"ab, cc1; ab1, d1f."
210,The miners of Wicklow,B,"A1f1a, A1f2b; cAe1, Ad1A1f."
210,The miners of Wicklow,B1,"A1f1a, A1f2b; cAe1, AdAe."
211,My brother Tom,A,"ab, ac; ab, c1c."
211,My brother Tom,B,"Ab1a, Ab2a1; Ab1a, AbAc."
211,My brother Tom,B1,"Ab1a, Ab2a1; a2a3, Ab3Ac."
212,Paddy's resource,A,"ab, cc1; ab, ca1."
212,Paddy's resource,B,"Ab1a, Ab2a1; Ab3b, Aa2a2."
213,Before I was married,A,"ab, ab1; ab, a1b1."
213,Before I was married,B,"ab, a1c; ab, a1c."
