Tune,Title,Part,Structure
408,Cahill's workshop,B1,"aAb, A1e1Ac; a1Ab1, AdA1e."
409,The shady lane,A,"ab, b1c; ab, da1."
409,The shady lane,B,"Ad1Ad2, Ad3Ad4; Ad1Ad2, AdAb2."
409,The shady lane,B1,"Ad1Ad2, Ad3Ad4; Ad1Ad2, AdAa1."
410,Barrack hill,A,"ab, ac; ab, b1d."
410,Barrack hill,B,"Ab2Aa1, Ad1Ad1; Ab2Aa1, aAd."
410,Barrack hill,B1,"Ab2Aa1, Ad1Ad1; Ad2Ac1, Ab3b."
411,The rocky road to Dublin,A,"ab, ac; ab, ac."
411,The rocky road to Dublin,B,"aa1, ab; aa1, cb."
411,The rocky road to Dublin,C,"aa1, a2Bb; aa1, BcBb."
412,Hardy man the fiddler,A,"ab, a1c; ab, a1c."
412,Hardy man the fiddler,B,"aAc, ab; aAc, cb."
413,The swaggering jig,A,"ab, ac; ab, ac."
413,The swaggering jig,B,"aAb1, a1Ac; aAb1, bAc."
414,Tea in the morning,A,"ab, ac; ab, ac."
414,Tea in the morning,B,"aAb, aAc; aAb, a1Ac."
415,Will you come down to Limerick,A,"aa1, ab; aa1, ab."
415,Will you come down to Limerick,B,"aAb1, a1b; aAb1, cb."
415,Will you come down to Limerick,C,"ab, aAb; ab, a1Ab."
416,The rakes of Westmeath,A,"ab, cd; ab, cd."
416,The rakes of Westmeath,B,"aa1, aAd; aa1, bAd."
417,The humors of Ballymanus,A,"aa1, aa2; aa1, aa2."
417,The humors of Ballymanus,B,"aa1, aAa2; aa1, aAa2."
417,The humors of Ballymanus,C,"aa1, aAa2; aa1, aAa2."
418,Roudledum,A,"ab, cc1; ab, cd."
418,Roudledum,B,"ab, ac; ab, ad."
419,Yellow legs,A,"aa1, ab; aa1, ab."
419,Yellow legs,B,"aa1, a2Ab; aa1, a2Ab."
419,Yellow legs,C,"Aa2Aa3, ab; Aa2Aa3, ab."
419,Yellow legs,D,"aa1, aa2; aa1, aa2."
420,Give us a drink of water,A,"ab, ac; ab, ac."
420,Give us a drink of water,B,"aa1, a2b; aa1, cb."
421,My mind will never be "aisy",A,"ab, ac; ab, ac."
421,My mind will never be "aisy",B,"Ac1Ab, aAc2; Ac1Ab, bAc2."
422,The fox hunters' jig,A,"aa1, ab; aa1, ab."
422,The fox hunters' jig,B,"Aa2a, bc; Aa2a, bc."
422,The fox hunters' jig,C,"Aa3Aa4, Aa3Ab1; Aa3Aa4, Aa3Ab1."
422,The fox hunters' jig,D,"aBa, BbBc; aBa, BbBc."
423,The boys of Ballysadare,A,"ab, a1c; ab, dc."
423,The boys of Ballysadare,B,"ab, cAc1; ab, AdAc."
424,A whack at the wigs,A,"aa1, ab; aa1, ab."
424,A whack at the wigs,A1,"cd, eb1; aa1, ab."
424,A whack at the wigs,A2,"aa1, ab; A1cA1d, A1eb1."
425,The Irish girl,A,"ab, ac; ab, ac."
425,The Irish girl,B,"aa1, a2b; aa1, a2b1."
426,Sir Philip McHugh,A,"ab, ab1; ab, ab1."
426,Sir Philip McHugh,B,"aa1, aAb1; aa1, aAb1."
427,Terry heigh ho the grinder,A,"aa1, ab; aa1, ab."
427,Terry heigh ho the grinder,B,"ab, aAa1; ab, cd."
428,Top the candle!,A,"ab, ac; ab, ac."
428,Top the candle!,B,"ab, a1Ac; ab, a2c."
429,Barney Brallaghan,A,"aa1, ab; aa1, ab."
429,Barney Brallaghan,B,"aa1, ab; aa1, ab."
429,Barney Brallaghan,C,"aBb, bc; aBb, b1c1."
430,Tipperary Hills,A,"aa1, a2b; aa1, a2b."
430,Tipperary Hills,B,"Ab1a, Ab1b; Ab1a, Ab1b."
431,Dever the dancer,A,"aa1, ab; aa1, ab."
431,Dever the dancer,B,"ab, aAb; ab, cAb."
432,I'm the boy for bewitching them,A,"aa1, a2b; aa1, a2b."
432,I'm the boy for bewitching them,B,"ab, a1c; ab, dAb1."
433,Hunting the hare,A,"ab, ac; ab, ac."
433,Hunting the hare,B,"ab, a1c; ab, a1c."
434,The kid on the mountain,A,"ab, ac; ab, ac."
434,The kid on the mountain,B,"ab, aAc; ab, aAc."
434,The kid on the mountain,C,"Ac1a, Ac1Ac2; Ac1a, Ac1Ac2."
434,The kid on the mountain,D,"ab, aAc2; ab, aAc2."
434,The kid on the mountain,E,"ab, aAc; ab, aAc."
434,The kid on the mountain,F,"ab, aAc; ab, aAc."
435,The hawthorn,A,"aa1, a2b; aa1, a2b."
435,The hawthorn,B,"aa1, aAb1; aa1, bAa1."
436,Up and down again,A,"aa1, ab; aa1, ab."
436,Up and down again,B,"aa1, ab; aa1, ab."
437,Another jig will do,A,"ab, ac; ab, ac."
437,Another jig will do,B,"ab, aAc; ab, cAc."
438,Dublin streets,A,"aa1, ab; aa1, ab."
438,Dublin streets,B,"Aa2a, Aa2b; Aa2a, cAb."
439,Dress her out in fine clothes,A,"ab, ac; ab, ac."
439,Dress her out in fine clothes,B,"Aa1Aa2, Aa1a; Aa1Aa3, ba1."
440,Jerry Houlihan,A,"aa1, ab; aa1, ab."
440,Jerry Houlihan,B,"aa1, aAb; aa1, aAb."
440,Jerry Houlihan,C,"ab, cAb; ab, cAb."
440,Jerry Houlihan,D,"Ba2Cb1, Ba2Ab1; Ba2Cb1, Ba2Ab1."
440,Jerry Houlihan,E,"aa1, aAb; aa1, aAb."
440,Jerry Houlihan,F,"aa1, aAb; aa1, aAb."
441,Moll Roe,A,"ab, ab1; ab, cb1."
441,Moll Roe,B,"AcAc1, AcAb1; AcAc1, ab."
442,Come up stairs with me,A,"ab, ac; ab, ac."
442,Come up stairs with me,B,"aAb, aAc; aAb, AaAc."
443,A fig for a kiss,A,"aa1, ab; aa1, ab."
443,A fig for a kiss,B,"ab, ac; ab, a1Ab1."
444,Gurty's Frolics,A,"ab, ac; ab, ac."
444,Gurty's Frolics,B,"aa1, aAc; aa1, aAc."
444,Gurty's Frolics,C,"Ab1Ab2, Ab1Ac1; Ab1Ab2, Ab1Ac1."
444,Gurty's Frolics,D,"Ba2Ba3, Ba2Ac1; Ba2Ba3, Ba2Ac1."
444,Gurty's Frolics,E,"aa1, aAc1; aa1, aAc1."
444,Gurty's Frolics,F,"aa1, a2Ac1; aa1, a2Ac1."
444,Gurty's Frolics,G,"ab, a1Ac1; ab, a1Ac1."
444,Gurty's Frolics,H,"Ea2a, bc; Ea2a, bc."
444,Gurty's Frolics,I,"aEa3, Ba4Ac; aEa3, Ba4Ac."
445,Cahiramee,A,"ab, cc1; ab, c2c3."
445,Cahiramee,B,"Ab1Ab2, Ac4Ac1; Ab1Ab2, Ac2Ac3."
446,Spatter the dew,A,"aa1, ab; aa1, ab."
446,Spatter the dew,B,"Aa2a, Aa2Ab; Aa2a, bAb."
446,Spatter the dew,C,"ab, a1c; ab, de."
446,Spatter the dew,D,"Ab1Aa1, Ab1Ab; Ab1a, Cd1Ab."
447,Comb your hair and curl it,A,"ab, ac; ab, ac1."
447,Comb your hair and curl it,B,"Aa1a, bc; Aa1a1, dc."
448,Drops of brandy,A,"aa1, aa2; aa1, a3a2."
448,Drops of brandy,B,"aa1, aAa2; aa1, a2Aa2."
449,Open the door for three,A,"aa1, bc; aa1, bc1."
449,Open the door for three,B,"ab, AbAc1; ab, AbAc1."
450,I have a wife of my own,A,"ab, a1c; ab1, a1c."
450,I have a wife of my own,B,"aAa2, bAc; aAa2, cAc."
451,The highway to Kilkenny,A,"aa1, ab; aa1, ac."
451,The highway to Kilkenny,B,"aa1, bb1; AaAa1, AaAb."
451,The highway to Kilkenny,C,"AaAa1, AaAc; BaBa1, aAc."
452,Last night's fun,A,"ab, ac; ab, ad."
452,Last night's fun,B,"aa1, aAc; ab, cAc."
453,Ride a mill,A,"ab, ac; ab, da1."
453,Ride a mill,B,"ab, aAa1; ab, a1Ad1."
453,Ride a mill,C,"aa1, ab; aa1, cd."
454,The rakes of Sollohod,A,"ab, ac; ab, ac."
454,The rakes of Sollohod,B,"aa1, ab; aa1, cb1."
455,The dusty miller,A,"ab, a1b1; ab, ab1."
455,The dusty miller,B,"Ab2a, Ab2a1; Ab2a, Ab3b."
456,The girl who broke my heart,A,"ab, cd; ab, cb1."
456,The girl who broke my heart,B,"aa1, ab; aa2, cAb2."
457,The humors of Westport,A,"aa1, a2b; aa1, cb1."
457,The humors of Westport,B,"aa1, aAb2; aa1, bAb."
458,The broken pledge,A,"aa1, bc; a2a3, bd."
458,The broken pledge,B,"ab, a1c; Aa2b, dAd1."
459,Repeal of the union,A,"ab, a1c; ab1, a2c1."
459,Repeal of the union,B,"ab, aAc; ab, cAc1."
460,The Milliner's daughter,A,"aa1, ab; aa1, ab."
460,The Milliner's daughter,B,"ab, ac; a1c1, Ab1c."
461,Paddy Ryan's dream,A,"ab, cd; ab, cd1."
461,Paddy Ryan's dream,B,"aa1, a2b; aa1, cb1."
462,Music in the glen,A,"ab, a1c; ab, de."
462,Music in the glen,B,"aAa2, Aa2a; ba, cAc1."
462,Music in the glen,C,"Ac"
463,The peeler's jacket,A,"ab, cd; ab, ed1."
463,The peeler's jacket,B,"ab, aAd2; ab, cAd."
464,The silver tip,A,"ab, ac; ab, ac."
464,The silver tip,B,"ab, Aa1a1; ab, ca1."
465,The bank of Ireland,A,"ab, cd; ab, cd1."
465,The bank of Ireland,B,"ab, a1Ad2; cb, Ad3d."
466,Take your choice,A,"ab, ac; ab, a1b1."
466,Take your choice,B,"ab, a1c; db, Ac1Ab1."
467,All hands around,A,"ab, ac; ab, de."
467,All hands around,B,"aa1, ab; aa2, AdAe."
468,The avonmore,A,"ab, a1c; ab1, dc."
468,The avonmore,B,"aAb, a1Ac; aAb1, AdAc."
469,The Bantry lasses,A,"aa1, bc; aa1, bc."
469,The Bantry lasses,B,"ab, aAc; ab1, Ab1Ac."
470,The merry days of easter,A,"ab, ab1; ab, ab2."
470,The merry days of easter,B,"ab, ac; db1, a1e."
471,My Maryanne,A,"ab, ac; ab, ad."
471,My Maryanne,B,"aAb1, a1b; aAb2, cb1."
472,Leave my way,A,"ab, cb1; db2, c1e."
472,Leave my way,B,"ab, a1c; db1, eAe1."
473,A rainy day,A,"ab, cd; a1e, fg."
473,A rainy day,B,"Aa2a, bc; da, ef."
474,Miss Crawford,A,"aa1, ab; aa1, ab1."
474,Miss Crawford,B,"ab, aAb1; cb, de."
475,The morning star,A,"ab, ac; ab, ac."
475,The morning star,B,"aAa1, ab; aAa1, cd."
476,The bucks of Oranmore,A,"ab, a1c; ab, de."
476,The bucks of Oranmore,B,"Aa2Ab1, aAc; Aa2Ab2, AdAe1."
476,The bucks of Oranmore,C,"Ab1a, Ab1Ac1; Ab1a, Ab1b."
476,The bucks of Oranmore,D,"Ab3Ab4, Ab3Ac1; Ab3Ab4, aAc."
477,The Mourne Mountains,A,"ab, cd; ab, ce."
477,The Mourne Mountains,B,"Ab1Ab2, Ac1Ad1; Ab1Ab2, Ac1a."
478,The bunch of green rushes,A,"ab, a1c; ab, a1c."
478,The bunch of green rushes,B,"aAa2, aAa3; a1a2, Ac1b."
479,The spinning wheel,A,"ab, cb1; ab, cb1."
479,The spinning wheel,B,"ab, ac; ab, ac."
479,The spinning wheel,C,"ab, ab1; ab2, cb1."
479,The spinning wheel,D,"BcCb3, Bca; BcCb3, Bca."
480,Maude Miller,A,"ab, ac; ab, ac1."
480,Maude Miller,B,"ab, ab1; ab2, cd."
481,The green mountain,A,"ab, cd; ab, ce."
481,The green mountain,B,"aAa1, a1b; cd, AcAe1."
482,The flogging reel,A,"aa1, a2b; aa1, a2b."
482,The flogging reel,B,"ab, a1Ab; aa1, b1Ab."
482,The flogging reel,C,"aa1, a2a3; ab, Bb1Ab."
483,Kate Kelly's fancy,A,"ab, a1a2; a3c, de."
483,Kate Kelly's fancy,B,"AdAb1, AdAe; Ad1Ac1, "
484,The new demesne,A,"ab, ac; ab, ac1."
484,The new demesne,B,"aa1, ab; aa1, cb1."
485,The college grove,A,"ab, cd; c1b, c2d1."
485,The college grove,B,"aa1, bc; dd1, ef."
485,The college grove,C,"aa1, ab; aa1, BeBf."
485,The college grove,D,"BdBd1, BdCb; Bd2Bd3, BeBf."
486,Miss McDonald,A,"aa1, bc; aa1, bc."
486,Miss McDonald,B,"aa1, ab; AaAa1, AbAc."
486,Miss McDonald,C,"AaAa1, AbAc; BaBa1, BaBb."
486,Miss McDonald,D,"aBa2, ab; cBa2, db1."
486,Miss McDonald,E,"Bb1a, bc; b1a, b1c1."
487,Buckley's fancy,A,"ab, ac; ab1, de."
487,Buckley's fancy,B,"Ac1Aa1, aAc2; Ac1Aa1, Ac1Ae1."
488,Craig's reel,A,"ab, ac; ab, dc."
488,Craig's reel,B,"ab, ac; bd, e"
489,The new mail-coach,A,"ab, ab1; ab, ab2."
489,The new mail-coach,B,"ab, a1c; ab, dAb1."
490,Sheehan's reel,A,"ab, cb1; ad, ef."
490,Sheehan's reel,B,"Aa1a, Aa2a; Aa1b, cAf1."
491,The first month of summer,A,"ab, cb1; ab2, de."
491,The first month of summer,B,"aAc1, ab; ac, db1."
492,The bloom of youth,A,"aa1, a2b; aa1, ab1."
492,The bloom of youth,B,"ab, aAb1; ab, cAb1."
493,Johnny's wedding,A,"aa1, ab; aa1, cd."
493,Johnny's wedding,B,"ab, aAd; ab, AcAd."
494,The youngest daughter,A,"ab, ab1; ab, ab1."
494,The youngest daughter,B,"ab, ab1; ab, b2Ab1."
495,The star of Munster,A,"ab, cd; a1b, c1e."
495,The star of Munster,B,"Ad1a, ba1; Ad1a, cd."
496,The Macroom lasses,A,"ab, ac; ab, ac1."
496,The Macroom lasses,B,"ab, a1c; db1, Aa1Ac2."
497,My love is fair and handsome,A,"ab, ac; ab, ad."
497,My love is fair and handsome,B,"ab, ac; a1d, ef."
498,Kitty Losty's reel,A,"ab, cd; ab, cd."
498,Kitty Losty's reel,B,"aAc1, bAd; aAc1, cAd."
499,Captain O'Neill,A,"ab, ac; ab, ac1."
499,Captain O'Neill,B,"aa1, a2b; aa3, Ac2b1."
500,The chorus reel,A,"aa1, ab; aa1, ab1."
500,The chorus reel,B,"aa1, aAb1; aa2, bAb2."
500,The chorus reel,C,"aa1, ab; aa1, ab1."
500,The chorus reel,D,"Bb1a, BbAb2; Bb1a, BbAb2."
501,A bright May morning,A,"ab, ac; ab, ac."
501,A bright May morning,B,"ab, cd; ab, eAc1."
502,Toss the feathers,A,"ab, cd; ab, ef."
502,Toss the feathers,B,"ab, Ab1b; cAd1, Ac1Ad."
503,The boys of Ballinchalla,A,"aa1, a2a3; aa1, bc."
503,The boys of Ballinchalla,B,"aa, a1a1; aa2, bc."
504,The ewe reel,A,"ab, a1c; ab, a1c1."
504,The ewe reel,B,"Ab1Ab2, Ab1a; bc, dAc."
505,The templehouse,A,"aa1, a2b; aa1, a2b."
505,The templehouse,B,"aa1, a2Aa3; a2a1, Aa4Ab."
506,The messenger,A,"ab, cd; ab, cd1."
506,The messenger,B,"Ab1Ab2, Ab3a; Ab1b, a1a2."
507,The day we paid the rent,A,"aa1, ab; aa1, ab1."
507,The day we paid the rent,B,"ab, ac; ab, dc1."
508,Over the bridge to Peggy,A,"aa1, a2b; aa2, cd."
508,Over the bridge to Peggy,B,"ab, cd; cAb1, Ab2e."
509,The ladie's pantalettes,A,"ab, a1c; ab, a1c1."
509,The ladie's pantalettes,B,"Ab1a, Ab2Ac1; Ab1a, bAc2."
510,Jim Moore's fancy,A,"aa1, bc; aa1, de."
510,Jim Moore's fancy,B,"aAc1, a1a2; a3Ac1, bAe."
511,The new policeman,A,"ab, cd; ab, cd."
511,The new policeman,B,"ab, ac; db, a1a2."
512,The flower of the flock,A,"ab, a1c; ab, a1c1."
512,The flower of the flock,B,"ab, ac; a1Ab, Aa1Ac2."
513,The green fields of America,A,"ab, cb; ab1, cd."
513,The green fields of America,B,"aAc1, AaAb; Ab2b, AcAd."
514,The boyne hunt,A,"ab, ac; ab, ac."
514,The boyne hunt,B,"ab, aAc; ab, cAc."
514,The boyne hunt,C,"aa1, aAc; aa1, BcAc."
515,The bush in bloom,A,"ab, ac; ab, ad."
515,The bush in bloom,B,"aa1, ab; cd, ef."
516,The mountain lark,A,"ab, ac; ab, ad."
516,The mountain lark,B,"ab, ac; ab, dAc."
517,The steam packet,A,"ab, cd; ab, cd."
517,The steam packet,B,"ab, ab1; ab2, cb1."
518,Peggy on the settle,A,"aa1, ab; aa1, ab."
518,Peggy on the settle,B,"aa1, a2b; aa1, cb1."
519,The five-leaved clover,A,"ab, cd; ab1, cd1."
519,The five-leaved clover,B,"Ac1Ab2, aAd1; Ac1Ab2, bAb3."
520,Colonel Fraser,A,"ab, a1c; ab, a1d."
520,Colonel Fraser,B,"aAc1, bAd1; cd, eAd1."
520,Colonel Fraser,C,"Ab1Ab2, Ab1Ac2; Ab1Ab2, Be1Ad1."
520,Colonel Fraser,D,"aa1, ab; a2a3, BeAc."
521,The boys of Portaferry,A,"aa1, a2b; aa1, a2b1."
521,The boys of Portaferry,B,"aa1, a2b; aa1, a3b1."
522,The clock in the steeple,A,"aa1, aa2; aa1, bc."
522,The clock in the steeple,B,"aa1, a2b; aa1, AbAc."
523,The new road,A,"ab, ab1; ab2, ac."
523,The new road,B,"aa1, a2b; cc1, a2b."
523,The new road,C,"ab, a1Bb1; a1b, Bb2Ac."
524,The reconciliation,A,"ab, ac; ab, dc1."
524,The reconciliation,B,"ab, ac; b1d, AdAc1."
525,Tear the calico,A,"ab, a1c; a2b1, c1d."
525,Tear the calico,B,"aAb1, aAc; aAb1, aAb2."
525,Tear the calico,C,"aAb, aAc; aAb, Ac1Ad."
526,Mary Grace,A,"ab, ab1; ab, cd."
526,Mary Grace,B,"aAa1, a1Ad; AaAb, AaAb1."
526,Mary Grace,C,"AaAb, AcAd; BaAa1, Ba1a."
527,Dillon Brown,A,"ab, ac; ab, ac."
527,Dillon Brown,B,"aa1, aAa1; aa1, Aa1b."
528,The miller's maid,A,"aa1, a2b; aa1, a2b."
528,The miller's maid,B,"ab, a1Ab; ab, cd."
529,The green branch,A,"aa1, a2b; aa1, a2b1."
529,The green branch,B,"ab, ac; ab1, de."
530,Far from home,A,"ab, ac; ab, c1d."
530,Far from home,B,"aAc2, bAc; AaAb, Ac1Ad1."
531,Colonel Rodney,A,"ab, a1b1; ab, cd."
531,Colonel Rodney,B,"ab, a1b1; a2Ab, AcAd1."
532,The ships are sailing,A,"ab, cd; ab, ca1."
532,The ships are sailing,B,"Ac1Ac2, Ac1a; Ac1Ac2, a1Ac3."
533,John O'Neill's reel,A,"ab, ac; ab, ac."
533,John O'Neill's reel,B,"aa1, Aa1Ac; aa1, bAa2."
534,Miss Thornton's reel,A,"ab, cd; ab, cd1."
534,Miss Thornton's reel,B,"aa1, ab; a2a1, Ac1b1."
535,The merry sisters,A,"aa1, ab; aa1, ac."
535,The merry sisters,B,"aa1, aa2; aa3, ba2."
535,The merry sisters,C,"Ac1Aa1, Ac1a; Ac1Aa1, bc."
536,The swallow's tail,A,"ab, cb1; ab1, de."
536,The swallow's tail,B,"ab, AcAb1; ab1, AdAe1."
537,Jacky Latin,A,"ab, ac; ab1, dc."
537,Jacky Latin,B,"aa1, aAc1; aa1, AdAc."
537,Jacky Latin,C,"aa1, aAc; aa1, AdAc2."
538,The daisy field,A,"ab, ac; ab1, ad."
538,The daisy field,B,"ab, a1c; a1b, Ad1Ac."
539,Tom Steele,A,"ab, a1c; ab1, c1c."
539,Tom Steele,B,"aAb2, aAc; ab, cAc."
540,Dillon's fancy,A,"ab, cd; ab, ef."
540,Dillon's fancy,B,"aAd1, aAc1; aAd1, bAf1."
541,The Sligo chorus,A,"ab, a1c; ab, c1d."
541,The Sligo chorus,B,"aa1, bc; aa2, Ac1Ad1."
542,The dogs among the bushes,A,"ab, ab1; ab, cd."
542,The dogs among the bushes,B,"ab, Ab2c; ab, Ad1c."
543,Peter Kennedy's fancy,A,"ab, cd; a1b, cd1."
543,Peter Kennedy's fancy,B,"Aa2a, Aa3b; Aa2a, cAd."
544,The Curragh races,A,"ab, ac; ab, ac."
544,The Curragh races,B,"Ab1Ab2, Ab1a; Ab1Ab2, bc."
545,Bonnie Kate,A,"ab, cc1; ab, cd."
545,Bonnie Kate,B,"ab, cd; ab, cd1."
546,London lasses,A,"ab, ac; ab, de."
546,London lasses,B,"ab, a1Ac; ac, AdAe."
547,Follow me down,A,"ab, a1c; ab, a1c1."
547,Follow me down,B,"aa1, a2Ac1; bc, Ab1Ac1."
548,Dan McCarty's fancy,A,"aa1, ab; aa1, ab1."
548,Dan McCarty's fancy,B,"ab, a1Ab1; ab1, cAb2."
549,The musical priest,A,"ab, a1b1; ab, a1b1."
549,The musical priest,B,"ab, a1c; a2b, dc."
549,The musical priest,C,"aBc1, aBc2; Aa2Bc1, BdBc3."
550,Ballinasloe fair,A,"ab, ac; ab, ac1."
550,Ballinasloe fair,B,"aa1, a2Ac1; a3a1, Aa1Ac."
551,The christening,A,"ab, ca1; db1, ce."
551,The christening,B,"ab, aa1; ab, cc1."
552,O'Dwyer's reel,A,"ab, a1b1; ab, cd."
552,O'Dwyer's reel,B,"ab, cAd; ab, dAd."
553,The miller's daughter,A,"ab, ac; a1b, de."
553,The miller's daughter,B,"ab, ac; c1a1, dAe1."
554,McFadden's handsome daughter,A,"ab, cd; ab, cd1."
554,McFadden's handsome daughter,B,"ab, ac; a1d, a2c1."
554,McFadden's handsome daughter,C,"ab, ac; ab, de."
555,Cunningham's fancy,A,"ab, ab1; ab, ab2."
555,Cunningham's fancy,B,"aAb, ab; aAb, AaAb2."
555,Cunningham's fancy,C,"BaAb, BaBb1; aAa, Ab3"
556,Mary O'Neill's fancy,A,"ab, cd; c1b, cd1."
556,Mary O'Neill's fancy,B,"aa1, a2Aa1; ab, cb1."
557,The Drogheda lasses,A,"ab, ac; ab, dc."
557,The Drogheda lasses,B,"ab, aAc; ab, Ad1c."
558,McFadden's own reel,A,"ab, cd; ae, fd."
558,McFadden's own reel,B,"ab, aAf1; a1b1, cd."
559,Johnny with the queer thing,A,"ab, a1c; ab, a1c1."
559,Johnny with the queer thing,B,"aa1, a2Ac1; aa1, a2Ac."
560,The blackberry blossom,A,"ab, a1c; ab, a1c1."
560,The blackberry blossom,B,"aa1, a2b; aa1, cb1."
561,Jim Kennedy's favorite,A,"ab, cd; ab, cd1."
561,Jim Kennedy's favorite,B,"ab, aAd1; ab, cAd2."
562,The flowing bowl,A,"ab, a1c; ab, a1c1."
562,The flowing bowl,B,"ab, aAc1; ab, cAc2."
563,Lovely Molly,A,"ab, cd; ab, cd."
563,Lovely Molly,B,"ab, a1Ac1; ab1, Aa1Ac1."
564,More luck to us,A,"ab, cd; eb, fg."
564,More luck to us,B,"aa1, Ag1Ad1; ab, AfAg2."
565,The woman of the house,A,"ab, ac; ab, de."
565,The woman of the house,B,"ab, aAc; ab, AdAe."
565,The woman of the house,C,"BaBb, BaBc1; Ae1a, AdAe."
566,Sweet Biddy of Ballyvourney,A,"ab, ac; ab, ac."
566,Sweet Biddy of Ballyvourney,B,"aa1, aAc; a2b, cAc."
567,Cahill's courtship,A,"aa1, a2b; aa1, a2b1."
567,Cahill's courtship,B,"ab, aAb1; ab, cAb."
568,Joe Cant's reel,A,"ab, ac; ab, ac."
568,Joe Cant's reel,B,"aAa1, aAc; aAa1, bc."
569,The snow on the hills,A,"ab, a1c; ab, dc1."
569,The snow on the hills,B,"ab, aAc1; ab1, cd."
570,Lawson's favorite,A,"ab, cd; ab1, c1d1."
570,Lawson's favorite,B,"ab, ac; ab, de."
571,Kiss the maid amid behind the barrel,A,"aa1, a2b; aa1, a2b."
571,Kiss the maid amid behind the barrel,B,"Aa3a, bAb; Aa3a1, cd."
571,Kiss the maid amid behind the barrel,C,"aa1, a2Ab; aa1, bAb."
571,Kiss the maid amid behind the barrel,A1,"cBa2, cb; aa1, a2b."
571,Kiss the maid amid behind the barrel,A2,"aa1, a2b; a3Ba, Bbb."
571,Kiss the maid amid behind the barrel,D,"Aa3Ba1, BcBd; CaCa1, Ca2Ab."
571,Kiss the maid amid behind the barrel,E,"CaCa1, CbAb; A1cBa2, A1cAb."
572,Roll her on the mountain,A,"ab, a1c; ab, a2d."
572,Roll her on the mountain,B,"aAc1, ab; aAc1, cd."
573,The Fermoy lasses,A,"aa1, ab; aa1, cb."
573,The Fermoy lasses,B,"ab, aAb; ab, cAb."
574,The happy days of youth,A,"ab, ac; ab, ac."
574,The happy days of youth,B,"aa1, ab; aa1, Ac1c."
575,Miss Monaghan,A,"ab, b1c; ab, b1d."
575,Miss Monaghan,B,"ab, Ab1c; ab, Ab1Ad."
575,Miss Monaghan,C,"ab, a1c; ab, dBb1."
576,The rose in the garden,A,"ab, a1c; ab, a2c."
576,The rose in the garden,B,"aa1, aAc; aa1, bc."
577,The old pensioner,A,"ab, a1c; ab, a1d."
577,The old pensioner,B,"aa1, ab; ac, a1b."
578,The reel of Mullinavat,A,"ab, b1c; ab, b2d."
578,The reel of Mullinavat,B,"ab, aAc1; AaAb, Ab1Ac."
578,The reel of Mullinavat,C,"AaAb, Ab2Ad; BaBb, Bb1a."
579,MacLean's favorite,A,"ab, ac; ab, ac1."
579,MacLean's favorite,B,"ab, ab1; ac, de."
580,The dancer's delight,A,"ab, ac; ab, ac1."
580,The dancer's delight,B,"aAc, ab; aAc, ac."
581,Trim the velvet,A,"aa1, aa2; aa1, aa2."
581,Trim the velvet,B,"ab, aAa2; a1b, cd."
581,Trim the velvet,C,"Bc1Bc2, Bc3Aa2; Bc1Bc2, Bc3Aa2."
581,Trim the velvet,D,"aa1, aAa2; aa1, bAa2."
582,Lough Allen,A,"aa1, a2b; aa1, cd."
582,Lough Allen,B,"ab, cAb1; ab, cAb2."
583,Jennie Pippin,A,"aa1, ab; aa1, ab1."
583,Jennie Pippin,B,"aa1, aAb2; ab, cAb1."
584,The Leitrim trush,A,"ab, cd; a1b1, cd1."
584,The Leitrim trush,B,"ab, a1c; ab, c1d."
585,The black haired lass,A,"ab, cd; cb, cd1."
585,The black haired lass,B,"ab, ac; ab1, dAd2."
586,My love is in America,A,"ab, ac; ab1, de."
586,My love is in America,B,"aAb, a1Ac; aAb1, AdAe."
587,The Dublin lasses,A,"ab, ab1; ab, cb1."
587,The Dublin lasses,B,"aa1, ab; aa1, b1c."
588,Captain Kelly's reel,A,"ab, ac; db, d1e."
588,Captain Kelly's reel,B,"ab, ac; ab, de."
589,Beamish's goat,A,"aa1, ab; ac, c1b1."
589,Beamish's goat,B,"Ac2a, Ac2Ab2; Ac2b, cd."
590,Casey the whistler,A,"ab, ab1; ab, ab1."
590,Casey the whistler,B,"ab, ac; ab1, c1d."
591,Downing's reel,A,"aa1, a2b; a2c, a2b1."
591,Downing's reel,B,"aAb2, aAb1; aAb2, bAb1."
592,A cloudy morning,A,"ab, ac; de, d1f."
592,A cloudy morning,B,"ab, a1c; a1b1, AaAe1."
593,Thompson's reel,A,"ab, cb1; ab, cb2."
593,Thompson's reel,B,"ab, ac; ab, dAb3."
594,The merry harriers,A,"ab, ac; ab, ac1."
594,The merry harriers,B,"aa1, aAc2; aa1, aAc."
595,Pat Tuohy's reel,A,"ab, ac; ab, ac1."
595,Pat Tuohy's reel,B,"Ab1Ab2, Ab1a; Ab1b, cAc2."
596,The boys of Galway,A,"ab, ac; ab, c1d."
596,The boys of Galway,B,"aAb1, aAb2; aAb1, Ac2b."
597,The wedding,A,"ab, a1c; ab, a1c."
597,The wedding,B,"aa1, ab; aa2, Aa2Ac1."
598,The mason's apron,A,"ab, a1c; db, ce."
598,The mason's apron,B,"aa1, a2Ac1; a3Ab, AcAe1."
599,The Cashmere shawl,A,"ab, a1c; ab, a1c1."
599,The Cashmere shawl,B,"aa1, ab; aa1, cAc2."
600,The old grey gander,A,"ab, cd; ab, cd1."
600,The old grey gander,B,"ab, a1Ad1; ab, Aa1Ad1."
601,Johnny's welcome home,A,"ab, cd; ef, gh."
601,Johnny's welcome home,B,"ab, Ab1c; AeAf, AgAh1."
602,Jenny picking cockles,A,"ab, ab1; ac, db2."
602,Jenny picking cockles,B,"aAc1, aAa1; ab, AdAb2."
603,The Salamanca reel,A,"ab, a1c; de, fg."
603,The Salamanca reel,B,"aAf1, AeAe1; a1Af2, AfAg1."
604,The star of Kilkenny,A,"ab, a1a2; ab, a3c."
604,The star of Kilkenny,B,"aAa2, a1Aa2; aAa2, a1Aa2."
605,Kitty got a clinking coming from the races,A,"ab, a1c; ab, dc1."
605,Kitty got a clinking coming from the races,B,"Ad1a, Ad1Ac1; Ad1a, AdAc1."
606,Tie the bonnet,A,"ab, ac; ab, ac."
606,Tie the bonnet,B,"ab, aAc; ab, cAc."
607,Tie the ribbons,A,"ab, a1c; ab, a1d."
607,Tie the ribbons,B,"aAb1, aAc; aAb1, bAc1."
608,The rising sun,A,"ab, a1c; ab, a2c1."
608,The rising sun,B,"ab, ac; ab, de."
608,The rising sun,C,"ab, aBe1; ab1, Aa3c."
609,The strawberry blossom,A,"ab, a1c; ab1, b2c."
609,The strawberry blossom,B,"ab, ac; ab, de."
610,I have no money,A,"ab, ac; a1b, a1d."
610,I have no money,B,"Ad1Ad2, Ad1Ad3; Ad1Ad2, ab."
611,The first of March,A,"ab, ac; ab, ac1."
611,The first of March,B,"ab, ac; ab, dAc2."
612,Jack Dolan,A,"ab, a1c; ab, a1c."
612,Jack Dolan,B,"ab, ac; ab1, de."
613,Dr. Taylor,A,"ab, ac; ab, de."
613,Dr. Taylor,B,"aa1, a2b; a3a4, cd."
614,The money musk,A,"ab, cd; a1b, ce."
614,The money musk,B,"aa1, a2Ae; bc, de."
615,Your mother's fair pet,A,"ab, a1c; ab, a1c1."
615,Your mother's fair pet,B,"ab, aAc1; ab, a1Ac2."
616,Molly put the kettle on,A,"aa1, a2b; aa1, cb."
616,Molly put the kettle on,B,"ab, ac; ab, AaAb."
617,The boys of Cappoquin,A,"ab, ac; ab, ac."
617,The boys of Cappoquin,B,"aa1, bc; aa2, bc."
618,The magpie's nest,A,"ab, cd; ab, cd1."
618,The magpie's nest,B,"aa1, bAd; a2c, c1Ad1."
619,The threepenny bit,A,"ab, ac; ab, de."
619,The threepenny bit,B,"ab, a1Ac; a2c, AdAe."
620,How the money goes,A,"ab, ac; ab, ac1."
620,How the money goes,B,"aa1, ab; aa2, b1c."
621,The sailor's jacket,A,"ab, ac; ab, ac."
621,The sailor's jacket,B,"aa1, ab; Ab1Ab2, cb."
622,The ivy leaf,A,"ab, ac; ab, ac."
622,The ivy leaf,B,"ab, a1c; ab, de."
623,An ugly customer,A,"ab, ac; ab1, de."
623,An ugly customer,B,"Ad1Ac1, AdAe; Ada, bc."
624,The Dublin reel,A,"aa1, ab; aa1, ab1."
624,The Dublin reel,B,"ab, ac; a1b1, Aa1Ab."
624,The Dublin reel,C,"ab, Aa2Ab; ab, cAb2."
625,The sailor's return,A,"ab, a1c; de, a1f."
625,The sailor's return,B,"aa1, a2Aa2; Ad1Ae, Aa1Af."
626,Miss Johnson,A,"ab, ac; ab, de."
626,Miss Johnson,B,"ab, aAa1; ab, Ad1Aa2."
627,The mills are grinding,A,"ab, a1b1; ab, cd."
627,The mills are grinding,B,"aAc1, a1b; aAc1, AcAd."
628,Jerry Hayes,A,"ab, ac; ab, ac."
628,Jerry Hayes,B,"Ab1Aa1, Ab1Ac1; Ab1Aa1, aAc2."
629,The Belfast lasses,A,"ab, ac; ab, ac1."
629,The Belfast lasses,B,"ab, aAc; aAb, aAc1."
630,The lady behind the boat,A,"ab, cd; ab, cd1."
630,The lady behind the boat,B,"aa1, ab; a2c, Ab1d."
631,Touch me if you dare,A,"ab, ac; ab, a1d."
631,Touch me if you dare,B,"ab, aAc1; ab, Aa1Ad."
632,You rouge you dar'n't meddle me,A,"ab, ac; ab, ac1."
632,You rouge you dar'n't meddle me,B,"Ab1Aa1, Ab1Ac2; Ab1Aa1, AaAc3."
633,The flax in bloom,A,"ab, cb1; ab, de."
633,The flax in bloom,B,"Ac1a, Aa1Ab; Ac1a, bc."
634,The Wexford lasses,A,"ab, ac; db, ef."
634,The Wexford lasses,B,"aAa1, aAc1; aAa1, Ae1b."
635,Pick your partner,A,"aa1, ab; aa1, ac."
635,Pick your partner,B,"Ab1a, a1b; Ab1a2, cb1."
636,The Sligo lasses,A,"ab, a1c; ab, a1c1."
636,The Sligo lasses,B,"Aa2a, Aa2b; ca, a1d."
637,McFadden's mishap,A,"ab, ac; a1b, de."
637,McFadden's mishap,B,"Aa1a, Aa1b; Aa2a1, cd."
638,Nellie O'Donovan,A,"ab, ac; ab, a1c1."
638,Nellie O'Donovan,B,"ab, ab1; ab, Aa2b1."
639,On the sly,A,"ab, ab1; ab, a1b2."
639,On the sly,B,"ab, cb; ab1, Aa1d."
640,The four courts No. 1,A,"aa1, ab; aa2, cd."
640,The four courts No. 1,B,"aa1, aAd; aa1, bAd1."
640,The four courts No. 1,C,"Ac1a, Ac1Ad1; Ac2a1, BbAd2."
641,The four courts No. 2,A,"aa1, ab; aa1, ab."
641,The four courts No. 2,B,"ab, a1Ab; ab, a2Ab."
641,The four courts No. 2,C,"ab, aAb; a1b1, a1Ab."
641,The four courts No. 2,D,"aBb1, aAb; aBb1, aAb."
642,The man of the house,A,"aa1, ab; aa1, ab."
642,The man of the house,B,"ab, ab1; ab2, Ab1c."
643,Julia Delaney,A,"ab, ac; ab, ac1."
643,Julia Delaney,B,"aAa1, a1Ac2; ab, cd."
644,The highway to Limerick,A,"ab, a1c; ab, a1c."
644,The highway to Limerick,B,"ab, aAb1; ac, Aa1Ac."
645,Col. McBain,A,"aa1, ab; aa2, cd."
645,Col. McBain,B,"Aca, bc; Ad1a, dAd2."
646,The collier's reel,A,"ab, cd; a1b, c1e."
646,The collier's reel,B,"Ab1Ac2, Ab1a; bc, Ac1Ae."
647,The maid that dare not tell,A,"aa1, a2b; aa1, a2b."
647,The maid that dare not tell,B,"aAb1, aAa3; ab, cAb."
648,The pigeon on the gate,A,"aa1, bc; aa1, de."
648,The pigeon on the gate,B,"aa1, Ab1Ac1; aa1, bc."
649,Lord McDonald's reel,A,"ab, ac; db, dc."
649,Lord McDonald's reel,B,"aa, ab; a1a1, cd."
