Tune,Title,Part,Structure
389,Maguire's kick,B,"ab, aAb2; a1b1, Aa2Ab."
389,Maguire's kick,C,"AaAa1, Aa2Ab; AaAa3, Aa4Ab1."
390,The bunch of roses,A,"aa1, a2a3; aa1, ba4."
390,The bunch of roses,B,"Aa5a, bb1; Ab1a1, Ab2Aa4."
391,The humors of Ballinafauna,A,"ab, cc1; a1b1, b2a2."
391,The humors of Ballinafauna,B,"aAc2, a1Ab3; aAc2, Ab4Aa2."
392,Kiss me sweetheart,A,"ab, aa1; ab, ca2."
392,Kiss me sweetheart,B,"Ab1Ac1, Aa3Aa1; Ab1Ac1, Ac2Aa2."
393,What ails you?,A,"ab, a1a2; ab, b1a3."
393,What ails you?,B,"Ab2Aa4, Ab3Aa5; Ab2Aa4, ab."
394,Get up old woman and shake yourself,A,"ab, a1b1; aa2, a3b."
394,Get up old woman and shake yourself,B,"Aa3Ab2, Aa3Ab; Aa3Aa2, Aa3Ab."
395,Child of my heart,A,"ab, ac; ab, a1c."
395,Child of my heart,B,"Aa2a, Aa2Ac1; Aa2Ab1, Aa1Ac."
396,The northern road,A,"aa1, ab; ac, c1a2."
396,The northern road,B,"Ac2Aa3, Ac2Aa4; aAa5, a1Aa2."
396,The northern road,B1,"Ac2Aa3, Ac2Aa4; bb1, Ac1Aa2."
397,Come in from the rain,A,"aa1, a2b; ab1, b2a3."
397,Come in from the rain,B,"Ab3Ab3, aAb4; Ab3Ab3, Aa4Aa3."
398,Behind the bush in the garden,A,"aa, bb1; ca1, a2b2."
398,Behind the bush in the garden,B,"Ac1Ab3, Ac1Aa3; Ac1Ab3, Aa2Ab2."
398,Behind the bush in the garden,B1,"Ac1Ab3, Ac1Aa3; AcAa1, Aa2Ab2."
399,The runaway jig,A,"aa1, a2b; aa1, cb1."
399,The runaway jig,A1,"aa1, a2b; aa1, cb2."
399,The runaway jig,B,"Ac1Aa3, Ac2Ac2; Ac1Aa3, Aa4Ab2."
399,The runaway jig,B1,"Ac1Aa3, Ac2Ac2; Ac1Aa3, Aa4Ab1."
400,The mariner's frock,A,"ab, a1a2; ca3, c1a4."
400,The mariner's frock,B,"Ac2Ac3, Ac4Aa5; Ac5Aa3, Ac1Aa4."
401,The humors of Castleoliver,A,"aa1, ab; a2a3, a4b1."
401,The humors of Castleoliver,B,"Ab2a, Aa1a1; Ab2a, Aa1Ab3."
401,The humors of Castleoliver,B1,"Ab2a, Aa1a1; Ab2a, Aa1Aa5."
402,The lady of the lake,A,"aa1, ab; aa1, b1a1."
402,The lady of the lake,B,"Aa2a, Aa2Aa3; Aa2a, Ab2Aa3."
403,A morning in summer,A,"ab, b1b2; ab, a1a2."
403,A morning in summer,B,"Ab3a, Ab4Aa3; Ab5a1, Ab1Ab2."
404,I'm a silly old man,A,"aa1, a2b; aa1, b1a3."
404,I'm a silly old man,B,"Aa4Ab2, aAb3; bb1, b2Aa3."
405,Good night,A,"aa1, aa2; ab, ca2."
405,Good night,B,"aAa1, a1Aa2; aAb, AcAa2."
406,The lovely lad,A,"aa1, ba2; ca3, c1a1."
406,The lovely lad,B,"Ac2Ac3, Ac4Ac5; Ac6Ac7, Ac8Aa4."
407,Carbray's frolics,A,"ab, b1b1; ab, a1c."
407,Carbray's frolics,B,"Ac1Ab2, Ab1Ab1; Ac1Ab2, Aa1Ac."
408,Cahill's workshop,A,"ab, a1b1; ab2, cb3."
408,Cahill's workshop,A1,"ab, a1b1; ab2, ca2."
408,Cahill's workshop,B,"Ab4Ab, Ab5Ab1; Ab4Ab2, AcAb3."
408,Cahill's workshop,B1,"Ab4Ab, Ab5Ab1; Ab4Ab2, AcAa2."
409,The shady lane,A,"aa1, a2b; aa1, ca3."
409,The shady lane,B,"Ab1Ab2, Ac1Ab3; Ab1Ab2, AcAc2."
409,The shady lane,B1,"Ab1Ab2, Ac1Ab3; Ab1Ab2, AcAa3."
410,Barrack hill,A,"ab, ab1; ab, b2a1."
410,Barrack hill,B,"Ab3Aa1, aa; Ab3Aa1, a1Aa1."
410,Barrack hill,B1,"Ab3Aa1, aa; a2Aa2, a3a1."
411,The rocky road to Dublin,A,"ab, ab1; ab, ab1."
411,The rocky road to Dublin,B,"Ab2Ab3, Ab2a; Ab2Ab3, ba."
411,The rocky road to Dublin,C,"aa1, a2Ba; aa1, BbBa."
412,Hardy man the fiddler,A,"ab, ac; ab, ac."
412,Hardy man the fiddler,B,"aAc, aAc1; aAc, a1Ac1."
413,The swaggering jig,A,"ab, ac; ab, ac."
413,The swaggering jig,B,"aAb1, aAc1; aAb1, bAc."
414,Tea in the morning,A,"ab, ac; ab, ac."
414,Tea in the morning,B,"aAb, aAc; aAb, a1Ac."
415,Will you come down to Limerick,A,"aa1, ab; aa1, ab."
415,Will you come down to Limerick,B,"aAb1, a1Ab2; aAb1, bAb2."
415,Will you come down to Limerick,C,"ab, aAb; ab, a1Ab."
416,The rakes of Westmeath,A,"aa1, bc; aa1, bc."
416,The rakes of Westmeath,B,"aa1, aAc; aa1, Ac1Ac."
417,The humors of Ballymanus,A,"aa1, aa2; aa1, aa2."
417,The humors of Ballymanus,B,"aa1, aAa2; aa1, aAa2."
417,The humors of Ballymanus,C,"aa1, aAa2; aa1, aAa2."
418,Roudledum,A,"ab, ca1; ab, cd."
418,Roudledum,B,"aAb1, ab; aAb1, aAd1."
419,Yellow legs,A,"aa1, ab; aa1, ab."
419,Yellow legs,B,"aa1, a2Ab; aa1, a2Ab."
419,Yellow legs,C,"Aa2Aa3, ab; Aa2Aa3, ab."
419,Yellow legs,D,"aa1, aAb1; aa1, aAb1."
420,Give us a drink of water,A,"ab, ab1; ab, ab1."
420,Give us a drink of water,B,"Aa1a, Aa2b; Aa1a, cb."
421,My mind will never be "aisy",A,"ab, ab1; ab, ab1."
421,My mind will never be "aisy",B,"aAb, bb1; aAb, cb1."
422,The fox hunters' jig,A,"aa1, aa2; aa1, aa2."
422,The fox hunters' jig,B,"Aa3a, bAa4; Aa3a, bAa4."
422,The fox hunters' jig,C,"Aa5Aa6, Aa5Aa7; Aa5Aa6, Aa5Aa7."
422,The fox hunters' jig,D,"aBa, BbAa4; aBa, BbAa4."
423,The boys of Ballysadare,A,"ab, a1c; ab, dc."
423,The boys of Ballysadare,B,"Ac1Aa2, aAc2; Ac1Aa2, AdAc."
424,A whack at the wigs,A,"aa1, ab; aa1, ab."
424,A whack at the wigs,A1,"cd, c1b1; aa1, ab."
424,A whack at the wigs,A2,"aa1, ab; A1cA1d, A1c1b1."
425,The Irish girl,A,"ab, ac; ab, ac."
425,The Irish girl,B,"aa1, a2Ac1; a1a1, a2b."
426,Sir Philip McHugh,A,"ab, ab1; ab, ab1."
426,Sir Philip McHugh,B,"aa1, aAb1; aa1, aAb1."
427,Terry heigh ho the grinder,A,"aa1, ab; aa1, ab."
427,Terry heigh ho the grinder,B,"ab, aAa1; ab, cAa1."
428,Top the candle!,A,"aa1, ab; aa1, ab."
428,Top the candle!,B,"Aa2a, bAb; Aa2a, cd."
429,Barney Brallaghan,A,"aa1, ab; aa1, ab."
429,Barney Brallaghan,B,"aa1, aAb1; aa1, aAb1."
429,Barney Brallaghan,C,"aAb1, bAb2; aAb1, b1Ab3."
430,Tipperary Hills,A,"aa1, a2b; aa1, a2b."
430,Tipperary Hills,B,"Ab1a, Ab1Ab2; Ab1a, Ab1Ab2."
431,Dever the dancer,A,"aa1, ab; aa1, ab."
431,Dever the dancer,B,"ab, aAb; ab, cAb."
432,I'm the boy for bewitching them,A,"aa1, a2b; aa1, a2b."
432,I'm the boy for bewitching them,B,"ab, ac; ab, a1Ab1."
433,Hunting the hare,A,"ab, ac; ab, ac."
433,Hunting the hare,B,"Aa1Ab1, aAc1; Aa1Ab1, aAc1."
434,The kid on the mountain,A,"ab, ac; ab, ac."
434,The kid on the mountain,B,"ab, aAc; ab, aAc."
434,The kid on the mountain,C,"Ac1a, Ac1Ac2; Ac1a, Ac1Ac2."
434,The kid on the mountain,D,"Aa1Ca1, Aa1Ac2; Aa1Ca1, Aa1Ac2."
434,The kid on the mountain,E,"aAb1, aAc; aAb1, aAc."
434,The kid on the mountain,F,"aCa2, aAc; aCa2, aAc."
435,The hawthorn,A,"aa1, a2b; aa1, a2b."
435,The hawthorn,B,"aa1, aAb1; aa1, bAa1."
436,Up and down again,A,"aa1, ab; aa1, ab."
436,Up and down again,B,"aa1, aAb1; aa1, aAb1."
437,Another jig will do,A,"aa1, ab; aa1, ab."
437,Another jig will do,B,"aAb1, aAb; aAb1, Aa2Ab."
438,Dublin streets,A,"aa1, ab; aa1, ab."
438,Dublin streets,B,"Aa2a, Aa2b; Aa2a, cAb."
439,Dress her out in fine clothes,A,"ab, ac; ab, ac."
439,Dress her out in fine clothes,B,"Aa1Aa2, Aa1a; Aa1a1, ba2."
440,Jerry Houlihan,A,"aa1, ab; aa1, ab."
440,Jerry Houlihan,B,"aa1, aAb; aa1, aAb."
440,Jerry Houlihan,C,"ab, cAb; ab, cAb."
440,Jerry Houlihan,D,"Ba2Cb1, Ba2Ab1; Ba2Cb1, Ba2Ab1."
440,Jerry Houlihan,E,"aa1, aAb; aa1, aAb."
440,Jerry Houlihan,F,"aa1, aAb; aa1, aAb."
441,Moll Roe,A,"ab, ab1; ab, a1b1."
441,Moll Roe,B,"Aa1Ab1, Aa1Ab1; Aa1Ab1, Aa1Ab1."
442,Come up stairs with me,A,"ab, ac; ab, ac."
442,Come up stairs with me,B,"aAb, aAc; aAb, AaAc."
443,A fig for a kiss,A,"aa1, ab; aa1, ab."
443,A fig for a kiss,B,"ab, ac; ab, a1Ab."
444,Gurty's Frolics,A,"ab, a1c; ab, a1c."
444,Gurty's Frolics,B,"aa1, aAc; aa1, aAc."
444,Gurty's Frolics,C,"Ab1Ab2, Ab1Ac1; Ab1Ab2, Ab1Ac1."
444,Gurty's Frolics,D,"Ba2Ba3, Ba2Ac1; Ba2Ba3, Ba2Ac1."
444,Gurty's Frolics,E,"aa1, aAc1; aa1, aAc1."
444,Gurty's Frolics,F,"aa1, a2Ac1; aa1, a2Ac1."
444,Gurty's Frolics,G,"ab, a1Ac1; ab, a1Ac1."
444,Gurty's Frolics,H,"Ea2a, Ga2Gb1; Ea2a, Ga2Gb1."
444,Gurty's Frolics,I,"aEa3, Ba4Ac; aEa3, Ba4Ac."
445,Cahiramee,A,"aa1, bb1; aa1, b2b3."
445,Cahiramee,B,"aAa2, Ab2Ab1; aAa2, Ab2Ab3."
446,Spatter the dew,A,"aa1, ab; aa1, ab."
446,Spatter the dew,B,"Aa2a, Aa2Ab; Aa2a, bAb."
446,Spatter the dew,C,"aa1, a2b; aa1, cAb1."
446,Spatter the dew,D,"Ab2Aa1, Ab2Ab; Ab2a, Bb1Ab."
447,Comb your hair and curl it,A,"ab, ac; ab, ac."
447,Comb your hair and curl it,B,"Aa1a, Ac1Ac2; Aa1a1, bAc2."
448,Drops of brandy,A,"aa1, aa2; aa1, a3a2."
448,Drops of brandy,B,"aa1, aAa2; aa1, a2Aa2."
449,Open the door for three,A,"aa1, bc; aa1, bc1."
449,Open the door for three,B,"ab, AbAc1; ab, AbAc1."
450,I have a wife of my own,A,"ab, a1c; ab1, a1c."
450,I have a wife of my own,B,"aAa2, bAc; aAa2, cAc."
451,The highway to Kilkenny,A,"aa1, ab; aa1, ac."
451,The highway to Kilkenny,B,"aa1, ba2; AaAa1, AaAb."
451,The highway to Kilkenny,C,"AaAa1, AaAc; BaBa1, Ab1Ac."
452,Last night's fun,A,"ab, ab1; ab, ab2."
452,Last night's fun,B,"aa1, aAb1; ab, cAb1."
453,Ride a mill,A,"ab, ac; ab, dc1."
453,Ride a mill,B,"aAc2, aAc1; aAc2, a1Ab1."
453,Ride a mill,C,"aa1, aAc3; aa1, bBa2."
454,The rakes of Sollohod,A,"ab, ac; ab, ac."
454,The rakes of Sollohod,B,"Ac1Aa1, Ac1Ab1; Ac1Aa1, aAb2."
455,The dusty miller,A,"ab, a1b1; ab, ab1."
455,The dusty miller,B,"Ab2Ab3, Ab2Aa2; Ab2Ab3, Ab2Aa2."
456,The girl who broke my heart,A,"ab, cb1; ab, cb2."
456,The girl who broke my heart,B,"aa1, ab; aa2, Ac1Ab3."
457,The humors of Westport,A,"aa1, a2b; aa1, a3b1."
457,The humors of Westport,B,"aa1, aAb2; aa1, bAb."
458,The broken pledge,A,"aa1, bc; a2a1, bd."
458,The broken pledge,B,"Aa2a, bAc1; Aa2a, cAd."
459,Repeal of the union,A,"ab, a1c; ab, a2c."
459,Repeal of the union,B,"aa1, aAc; aa1, bAc."
460,The Milliner's daughter,A,"aa1, ab; aa1, ab."
460,The Milliner's daughter,B,"aa1, ab; a2b1, Ab1b."
461,Paddy Ryan's dream,A,"ab, cc1; ab, cd."
461,Paddy Ryan's dream,B,"aa1, a2b; aa1, cb1."
462,Music in the glen,A,"ab, a1c; ab, de."
462,Music in the glen,B,"aAa2, Aa2a; Ac1a, Ad1Ac2."
462,Music in the glen,C,"Ac"
463,The peeler's jacket,A,"ab, cd; ab, cd1."
463,The peeler's jacket,B,"Ac1Ab1, Ac1Ad1; Ac1Ab1, aAd."
464,The silver tip,A,"ab, ac; ab, ac."
464,The silver tip,B,"ab, Aa1a1; ab, ca1."
465,The bank of Ireland,A,"ab, ac; ab, ac1."
465,The bank of Ireland,B,"ab, ab1; a1b, Ac2Ac3."
466,Take your choice,A,"ab, ac; ab, a1b1."
466,Take your choice,B,"ab, a1Ac1; a2b, Ab2Ab1."
467,All hands around,A,"ab, ac; ab, de."
467,All hands around,B,"Aa1Ab1, Aa1a; Aa1Ab2, AdAe."
468,The avonmore,A,"ab, a1c; ab1, dc."
468,The avonmore,B,"Aa2Ab, Aa3Ac; Aa2Ab1, AdAc."
469,The Bantry lasses,A,"aa1, a2b; aa1, a2b."
469,The Bantry lasses,B,"ab, aAb; ab1, Ab1Ab."
470,The merry days of easter,A,"ab, ab1; ab, ab2."
470,The merry days of easter,B,"ab, ac; Ab3b, a1d."
471,My Maryanne,A,"ab, ac; ab, aa1."
471,My Maryanne,B,"aAb1, a1b; aAb2, Ac1b."
472,Leave my way,A,"ab, a1b1; a2b2, cb3."
472,Leave my way,B,"Ab4a, bAa3; b1a1, a2Ab3."
473,A rainy day,A,"ab, a1c; a2d, eb1."
473,A rainy day,B,"Aa3Ad1, Aa4Ae1; Aa5Ad1, aAe2."
474,Miss Crawford,A,"aa1, ab; aa1, ab1."
474,Miss Crawford,B,"ab, aAb1; Aa2b, cd."
475,The morning star,A,"ab, ac; ab, ac."
475,The morning star,B,"Ab1Aa1, Ab1Ac1; Ab1Aa1, Aa2Aa3."
476,The bucks of Oranmore,A,"ab, a1c; ab, dc1."
476,The bucks of Oranmore,B,"Aa2Ab, Aa3Ac; Aa2b1, AdAa4."
476,The bucks of Oranmore,C,"Ac2a, Ac2a1; Ac2a, Ac2a2."
476,The bucks of Oranmore,D,"Aa5Ab1, Aa5Ca2; Aa5Ab1, aAc."
477,The Mourne Mountains,A,"aa1, ba2; aa1, bc."
477,The Mourne Mountains,B,"Aa3Aa4, Ab1Ac1; Aa3Aa4, Ab1Ac."
478,The bunch of green rushes,A,"ab, a1b1; ab, a1b1."
478,The bunch of green rushes,B,"aa1, aAa2; a2a3, bAb2."
479,The spinning wheel,A,"ab, cb1; ab, cb1."
479,The spinning wheel,B,"aAc1, aAc2; aAc1, aAc2."
479,The spinning wheel,C,"Ac3Ab1, Ac3a; Ac3Ab2, Ba1a."
479,The spinning wheel,D,"Ac2a, Ac2b; Ac2a, Ac2b."
480,Maude Miller,A,"ab, ac; ab, ac1."
480,Maude Miller,B,"ab, ab1; ab2, b3Ac."
481,The green mountain,A,"ab, cd; ab, ce."
481,The green mountain,B,"Ad1Aa1, ab; ca1, AcAe1."
482,The flogging reel,A,"aa1, a2a3; aa1, a2a3."
482,The flogging reel,B,"ab, a1Aa3; ab, b1Aa3."
482,The flogging reel,C,"Ba2Ba3, Ba4Ba5; Ba2a, Bb1Aa3."
483,Kate Kelly's fancy,A,"ab, a1a2; a3b, a4c."
483,Kate Kelly's fancy,B,"Aa4Ab1, Aa4Ac; aAb1, "
484,The new demesne,A,"ab, ac; ab, ac1."
484,The new demesne,B,"aa1, aAc1; aa1, a1Ac2."
485,The college grove,A,"ab, cd; c1b, c2d1."
485,The college grove,B,"aa1, a2b; a3a4, cd."
485,The college grove,C,"Bb1Bb2, Bb1Bb3; Bb1Bb2, BcBd."
485,The college grove,D,"Ba3Ba4, Ba3Bb3; Ba5Ba6, BcBd."
486,Miss McDonald,A,"aa1, bb1; aa1, bb1."
486,Miss McDonald,B,"aa1, ab; AaAa1, AbAb1."
486,Miss McDonald,C,"AaAa1, AbAb1; BaBa1, BaBb."
486,Miss McDonald,D,"aBa2, aBa3; bBa2, Ab2c."
486,Miss McDonald,E,"Bba, b1b; b1a, b1b1."
487,Buckley's fancy,A,"ab, ac; ab1, de."
487,Buckley's fancy,B,"Ac1Aa1, Ac2Ac3; Ac1Aa1, Ac1Ae1."
488,Craig's reel,A,"ab, ab1; ab, a1b1."
488,Craig's reel,B,"ab, aa1; bAb2, b1"
489,The new mail-coach,A,"ab, ab1; ab, ab1."
489,The new mail-coach,B,"ab, a1c; ab, dAb1."
490,Sheehan's reel,A,"ab, cb1; ad, b2b3."
490,Sheehan's reel,B,"Aa1a, Aa2a; Aa1a1, Ab2Ab3."
491,The first month of summer,A,"ab, a1b1; ab2, a2c."
491,The first month of summer,B,"aa1, ab; ab1, cb2."
492,The bloom of youth,A,"aa1, a2b; aa1, ab1."
492,The bloom of youth,B,"ab, aAb1; ab, cAb1."
493,Johnny's wedding,A,"aa1, ab; aa1, cc1."
493,Johnny's wedding,B,"Aa2Aa3, Aa2Ac1; Aa2Aa3, AcAc1."
494,The youngest daughter,A,"ab, ab1; ab, ab1."
494,The youngest daughter,B,"aAb2, ab; aAb2, Ab3Ab1."
495,The star of Munster,A,"aa1, bc; a2a1, b1d."
495,The star of Munster,B,"Ac1Ac2, aAc3; Ac1Ac2, bAc4."
496,The Macroom lasses,A,"ab, ab1; ab, ab2."
496,The Macroom lasses,B,"ab, a1c; a2b1, Aa1Ab3."
497,My love is fair and handsome,A,"ab, ac; ab, ad."
497,My love is fair and handsome,B,"ab, aAc1; a1c, Aa1Ac2."
498,Kitty Losty's reel,A,"ab, cd; ab, cd."
498,Kitty Losty's reel,B,"aa1, a2Ad; aa1, bAd."
499,Captain O'Neill,A,"ab, ac; ab, ac1."
499,Captain O'Neill,B,"aa1, a2b; aa1, Ac2b1."
500,The chorus reel,A,"aa1, ab; aa1, ab1."
500,The chorus reel,B,"aa1, aAb1; aa2, bAb2."
500,The chorus reel,C,"aa1, aa1; aa1, ab."
500,The chorus reel,D,"Bb1a, BbAb3; Bb1a, BbAb3."
501,A bright May morning,A,"ab, ac; ab, ac."
501,A bright May morning,B,"ab, cAc1; ab, a1Ac2."
502,Toss the feathers,A,"ab, cd; ab, b1e."
502,Toss the feathers,B,"Ac1Ac2, Ac3Ac2; aAd1, Ac4Ad."
503,The boys of Ballinchalla,A,"aa1, a2a3; aa1, ba4."
503,The boys of Ballinchalla,B,"Ab1Ab1, aa; Ab1a1, bc."
504,The ewe reel,A,"ab, ac; ab, ac1."
504,The ewe reel,B,"Ab1Ab2, Ab1a; bc, Aa1Ac."
505,The templehouse,A,"aa1, a2b; aa1, a2b."
505,The templehouse,B,"aa1, a2a3; a2a1, Aa3Ab."
506,The messenger,A,"ab, a1c; ab, a1c1."
506,The messenger,B,"Ab1Ab2, Ab3a; Ab1b, a1Ac2."
507,The day we paid the rent,A,"aa1, ab; aa1, ab1."
507,The day we paid the rent,B,"ab, ac; ab, dc1."
508,Over the bridge to Peggy,A,"aa1, a2b; aa2, a1c."
508,Over the bridge to Peggy,B,"aa1, a2Ab1; a2Ab2, Ab3b."
509,The ladie's pantalettes,A,"ab, a1b1; ab, a1a2."
509,The ladie's pantalettes,B,"Ab2a, Ab3Aa2; Ab2a, bAa3."
510,Jim Moore's fancy,A,"aa1, bc; aa1, de."
510,Jim Moore's fancy,B,"Ab1Ac1, Ab2Ae1; Ab3Ac1, Aa2Ae."
511,The new policeman,A,"aa1, bc; aa1, bc."
511,The new policeman,B,"ab, aa1; ab, a2a3."
512,The flower of the flock,A,"ab, a1c; ab, a1c1."
512,The flower of the flock,B,"Ac2Ab1, Ac2Ab2; Ac3Ab, Aa1Ac4."
513,The green fields of America,A,"ab, cb; ab1, cd."
513,The green fields of America,B,"aAc1, AaAb; Ab2Ab3, AcAd."
514,The boyne hunt,A,"ab, ac; ab, ac."
514,The boyne hunt,B,"aAb1, aAc; aAb1, bAc."
514,The boyne hunt,C,"Ba1a, Ba1Ac; Ba1a, BbAc."
515,The bush in bloom,A,"ab, ac; ab, ad."
515,The bush in bloom,B,"aAa1, ab; Aa2c, Aa3d."
516,The mountain lark,A,"ab, ac; ab, ad."
516,The mountain lark,B,"ab, ac; ab, dAc."
517,The steam packet,A,"ab, cb1; ab, cb1."
517,The steam packet,B,"ab, ab1; ab2, cb1."
518,Peggy on the settle,A,"aa1, ab; aa1, ab."
518,Peggy on the settle,B,"aa1, a2b; aa1, cb1."
519,The five-leaved clover,A,"ab, cd; ab1, cd1."
519,The five-leaved clover,B,"Aa1Ab2, Ac1Ad1; Aa1Ab2, aAd2."
520,Colonel Fraser,A,"ab, a1c; ab, a1d."
520,Colonel Fraser,B,"aAc1, a1Ad; Ad1d1, bAd."
520,Colonel Fraser,C,"Ab1Ab2, Ab1Aa2; Ab1Ab2, Bb1Ad."
520,Colonel Fraser,D,"aa1, aAa2; a2a3, BbAc."
521,The boys of Portaferry,A,"aa1, a2b; aa1, a2b1."
521,The boys of Portaferry,B,"aAb2, a1Ab3; aAb2, a2b."
522,The clock in the steeple,A,"aa1, aa2; aa1, bc."
522,The clock in the steeple,B,"aa1, a2Ac1; aa1, AbAc."
523,The new road,A,"ab, ab1; ab2, ac."
523,The new road,B,"aa1, a2b; cc1, a2b."
523,The new road,C,"Aa1a, Bb1Bb1; Bb1a, Aa2Ac."
524,The reconciliation,A,"ab, ab1; ab, cd."
524,The reconciliation,B,"ab, ab1; b2Ab2, AcAd."
525,Tear the calico,A,"ab, ac; ab1, c1a1."
525,Tear the calico,B,"Aa1Ab1, Aa1Ac; Aa1Ab1, Aa1Ab2."
525,Tear the calico,C,"Aa1Ab, Aa1Ac; Aa1Ab, Ac1Aa1."
526,Mary Grace,A,"ab, ab1; ab, cd."
526,Mary Grace,B,"Ac1Aa1, Ac2Ad; AaAb, AaAb1."
526,Mary Grace,C,"AaAb, AcAd; Ac1Aa1, Ac2a."
527,Dillon Brown,A,"ab, aa1; ab, aa1."
527,Dillon Brown,B,"aa1, aAa; aa1, Aa1a1."
528,The miller's maid,A,"aa1, a2b; aa1, a2b."
528,The miller's maid,B,"aAa3, Aa4Ab; aAa3, bAb1."
529,The green branch,A,"aa1, a2b; aa1, a2b."
529,The green branch,B,"ab, ab1; ab2, b3b4."
530,Far from home,A,"ab, ac; ab, c1d."
530,Far from home,B,"Ad1Ac2, aAc; AaAb, Ac1Ad2."
531,Colonel Rodney,A,"ab, a1b1; ab, cd."
531,Colonel Rodney,B,"ab, a1b1; a2Ab, AcAd1."
532,The ships are sailing,A,"ab, cb1; ab, ca1."
532,The ships are sailing,B,"Ac1Ac2, Ac1Ab2; Ac1Ac2, Aa2Ac3."
533,John O'Neill's reel,A,"ab, ac; ab, ac."
533,John O'Neill's reel,B,"Aa1a, Aa2Ac; Aa1a, Ab1Aa3."
534,Miss Thornton's reel,A,"ab, cd; ab, cd1."
534,Miss Thornton's reel,B,"aa1, ab; a2a1, Ad2b1."
535,The merry sisters,A,"aa1, ab; aa1, ac."
535,The merry sisters,B,"Aa1Ac1, Aa1Ac2; Aa1a, bAc2."
535,The merry sisters,C,"Ac3Aa2, Ac3Ab1; Ac3Aa2, aAc4."
536,The swallow's tail,A,"ab, a1b1; ab1, cd."
536,The swallow's tail,B,"aAb, Aa1Ab1; aAb1, AcAd1."
537,Jacky Latin,A,"ab, ac; ab1, dc."
537,Jacky Latin,B,"Ad1Ab2, Ad1Ac1; Ad1Ab2, AdAc."
537,Jacky Latin,C,"aAb3, aAc; aAb3, AdAc2."
538,The daisy field,A,"ab, ac; ab1, ac1."
538,The daisy field,B,"Ab2Aa1, Ab3Ab4; Ab3Aa1, aAc."
539,Tom Steele,A,"ab, a1a2; ab1, ca2."
539,Tom Steele,B,"Ab2Ab, Ab2Aa2; Ab2b1, Ac1Aa2."
540,Dillon's fancy,A,"ab, cd; ab, ef."
540,Dillon's fancy,B,"aa1, aAc1; aa1, Ae1Af1."
541,The Sligo chorus,A,"aa1, a2b; aa1, b1c."
541,The Sligo chorus,B,"aa1, bAb2; aa, Ab1Ac1."
542,The dogs among the bushes,A,"ab, ab1; ab, b2b3."
542,The dogs among the bushes,B,"Aa1a, Ab4b; Aa1a, a1b."
543,Peter Kennedy's fancy,A,"ab, cd; a1b, cd1."
543,Peter Kennedy's fancy,B,"Aa2Ad2, Aa3Ad3; Aa2Ad2, Ac1Ad."
544,The Curragh races,A,"ab, ac; ab, ac."
544,The Curragh races,B,"Ab1Ab2, Ab1a; Ab1Ab2, Aa1a1."
545,Bonnie Kate,A,"aa1, bb1; aa1, bc."
545,Bonnie Kate,B,"ab, cAc1; ab, cd."
546,London lasses,A,"ab, ac; ab, b1c1."
546,London lasses,B,"ab, a1Ac; ac, Ab1Ac1."
547,Follow me down,A,"ab, a1c; ab, a1c1."
547,Follow me down,B,"Aa2a, a1Ac1; bAa3, Ab1Ac1."
548,Dan McCarty's fancy,A,"aa1, ab; aa1, ab1."
548,Dan McCarty's fancy,B,"aa1, a2Ab1; aa1, bAb2."
549,The musical priest,A,"ab, ab1; ab, ab1."
549,The musical priest,B,"Aa1a, Aa2b; Aa1a, cb."
549,The musical priest,C,"Bc1Bb1, Bc1Bb2; Aa3Bb1, BcBb3."
550,Ballinasloe fair,A,"ab, ac; ab, ac1."
550,Ballinasloe fair,B,"aa1, a2Ac1; aa1, Aa1Ac."
551,The christening,A,"aa1, ba2; a3a4, bc."
551,The christening,B,"aa1, aa2; aa1, bb1."
552,O'Dwyer's reel,A,"ab, a1b1; ab, cd."
552,O'Dwyer's reel,B,"Ac1Ad1, Ab2Ad; Ac1Ad1, Ac2Ad."
553,The miller's daughter,A,"ab, ac; a1b, de."
553,The miller's daughter,B,"aAb1, aAe1; a1Ab1, bAe2."
554,McFadden's handsome daughter,A,"ab, cd; ab, cd1."
554,McFadden's handsome daughter,B,"Aa1a, Aa1b; ca1, b1b2."
554,McFadden's handsome daughter,C,"Ad2a, Ad2b; Ad2a, b1Bc1."
555,Cunningham's fancy,A,"ab, ab1; ab, ab2."
555,Cunningham's fancy,B,"aAb, ab; aAb, AaAb2."
555,Cunningham's fancy,C,"BaAb, BaBb1; Bb2Aa, Ab3"
556,Mary O'Neill's fancy,A,"ab, a1b1; a1b, a1b2."
556,Mary O'Neill's fancy,B,"Ab3a, a1Aa2; Ab3b, cb1."
557,The Drogheda lasses,A,"ab, ac; ab, dc."
557,The Drogheda lasses,B,"ab, aAc; ab, Ad1Ab1."
558,McFadden's own reel,A,"ab, a1a2; ac, a3a2."
558,McFadden's own reel,B,"aAa4, ab; a1Aa5, a2c."
559,Johnny with the queer thing,A,"ab, a1c; ab, a1c1."
559,Johnny with the queer thing,B,"aa1, a2Ac1; aa1, a2Ac."
560,The blackberry blossom,A,"ab, a1b1; ab, a1b2."
560,The blackberry blossom,B,"aa1, a2Ab2; aa1, Aa2Ab3."
561,Jim Kennedy's favorite,A,"ab, a1c; ab, a1c1."
561,Jim Kennedy's favorite,B,"aAb1, aAc1; aAb1, Ac2Ac3."
562,The flowing bowl,A,"ab, a1b1; ab, a1b2."
562,The flowing bowl,B,"ab, aAb2; ab, b1Ab3."
563,Lovely Molly,A,"ab, aa1; ab, aa1."
563,Lovely Molly,B,"Ab1a, Ab2Aa1; Ab1a1, Aa2Aa1."
564,More luck to us,A,"ab, a1c; a2b, de."
564,More luck to us,B,"aa1, Ae1Ac1; aAb1, AdAe2."
565,The woman of the house,A,"ab, ac; ab, a1d."
565,The woman of the house,B,"aAd1, aAc1; aAd1, Aa1Ad."
565,The woman of the house,C,"BaAd1, BaAc2; Ad2Ad3, Aa1Ad."
566,Sweet Biddy of Ballyvourney,A,"ab, ac; ab, ac."
566,Sweet Biddy of Ballyvourney,B,"aa1, aAc; a2b, cAc."
567,Cahill's courtship,A,"aa1, a2b; aa1, a2b1."
567,Cahill's courtship,B,"Aa3Aa4, Aa3Ab1; Aa3Aa4, Ab2Ab."
568,Joe Cant's reel,A,"aa1, aa2; aa1, aa2."
568,Joe Cant's reel,B,"aAa3, aAa2; aAa3, bAa4."
569,The snow on the hills,A,"aa1, a2b; aa1, cb1."
569,The snow on the hills,B,"ab, aAb1; ab1, cAb2."
570,Lawson's favorite,A,"ab, cd; ab1, c1d1."
570,Lawson's favorite,B,"aa1, ab; aa1, Ac2a2."
571,Kiss the maid amid behind the barrel,A,"aa1, a2b; aa1, a2b."
571,Kiss the maid amid behind the barrel,B,"Aa3Aa4, Aa5Ab; Aa3Aa6, ab."
571,Kiss the maid amid behind the barrel,C,"aAb1, a1Ab; aAb1, bAb."
571,Kiss the maid amid behind the barrel,A1,"Cb1c, Cb1b; aa1, a2b."
571,Kiss the maid amid behind the barrel,A2,"aa1, a2b; a3a4, a5b."
571,Kiss the maid amid behind the barrel,D,"Aa3Aa6, BaBb; CaAb1, Ca1Ab."
571,Kiss the maid amid behind the barrel,E,"CaAb1, CbAb; Cb1A1c, Cb1Ab."
572,Roll her on the mountain,A,"ab, a1c; ab, a2d."
572,Roll her on the mountain,B,"aAc1, ab; aAc1, b1Ad1."
573,The Fermoy lasses,A,"aa1, ab; aa1, cb."
573,The Fermoy lasses,B,"aAb1, aAb; aAb1, a1Ab."
574,The happy days of youth,A,"ab, ab1; ab, ab1."
574,The happy days of youth,B,"Ab2a, Ab2b; Ab2a, Ab3Ab4."
575,Miss Monaghan,A,"ab, b1c; ab, b1c1."
575,Miss Monaghan,B,"ab, Ab1Ac2; ab, Ab1Ac1."
575,Miss Monaghan,C,"ab, Aa1c; ab, Bb1Bb2."
576,The rose in the garden,A,"ab, a1b1; ab, a2b1."
576,The rose in the garden,B,"Ab2Ab3, Ab2Ab1; Ab2Ab3, Aa3a."
577,The old pensioner,A,"ab, a1c; ab, a1d."
577,The old pensioner,B,"aa1, aa2; aa1, a1a2."
578,The reel of Mullinavat,A,"ab, b1c; ab, b2c1."
578,The reel of Mullinavat,B,"ab, aAc2; AaAb, Ab1Ac."
578,The reel of Mullinavat,C,"AaAb, Ab2Ac1; BaBb, Bb1a."
579,MacLean's favorite,A,"ab, aa1; ab, ac."
579,MacLean's favorite,B,"aa1, aAc1; ab, Ac2Aa2."
580,The dancer's delight,A,"ab, ab1; ab, ab2."
580,The dancer's delight,B,"aAb1, ab; aAb1, ac."
581,Trim the velvet,A,"aa1, aa2; aa1, aa2."
581,Trim the velvet,B,"aa1, aAa2; aa1, bAa2."
581,Trim the velvet,C,"Bb1Aa3, Bb2Aa2; Bb1Aa3, Bb2Aa2."
581,Trim the velvet,D,"Ba2Ba3, Ba2Aa2; Ba2Ba3, Bb3Aa2."
582,Lough Allen,A,"aa1, a2b; aa1, cd."
582,Lough Allen,B,"ab, a1Ab1; ab, a1Ab2."
583,Jennie Pippin,A,"aa1, ab; aa1, ab1."
583,Jennie Pippin,B,"Ab2a, Ab2Ab3; Ab2a1, bAb1."
584,The Leitrim trush,A,"ab, a1c; ab1, a1c1."
584,The Leitrim trush,B,"aa1, aa2; aa1, Ac2Ac3."
585,The black haired lass,A,"ab, ac; ab, ac1."
585,The black haired lass,B,"Aa1a, Aa1b; Aa1a1, b1Ac2."
586,My love is in America,A,"ab, ac; ab1, de."
586,My love is in America,B,"Ad1Ab, Ad2Ac; Ad1Ab1, AdAe."
587,The Dublin lasses,A,"ab, ab1; ab, cb1."
587,The Dublin lasses,B,"Ab2a, Ab2b; Ab2a, b1c."
588,Captain Kelly's reel,A,"ab, ab1; cb, c1a1."
588,Captain Kelly's reel,B,"ab, aAb2; ab, b1c."
589,Beamish's goat,A,"aa1, ab; ac, c1b1."
589,Beamish's goat,B,"Ac2Ac3, Ac2Ab2; Ac2Ab3, ab."
590,Casey the whistler,A,"ab, ab1; ab, ab1."
590,Casey the whistler,B,"ab, ac; ab1, c1b2."
591,Downing's reel,A,"aa1, a2b; a2c, a2b1."
591,Downing's reel,B,"aAb2, aAb1; aAb2, bAb1."
592,A cloudy morning,A,"ab, ac; ab1, a1d."
592,A cloudy morning,B,"Ad1Ad2, ab; aAd3, Aac."
593,Thompson's reel,A,"ab, cb1; ab, cb2."
593,Thompson's reel,B,"aAc1, aAc2; aAc1, bAb3."
594,The merry harriers,A,"ab, ac; ab, ac1."
594,The merry harriers,B,"aa1, aAc2; aa1, aAc."
595,Pat Tuohy's reel,A,"ab, ab1; ab, ac."
595,Pat Tuohy's reel,B,"Ab2Ac1, Ab2a; Ab2Ac2, ba1."
596,The boys of Galway,A,"ab, ac; ab, c1a1."
596,The boys of Galway,B,"aAb1, aAb2; aAb1, Ab3b."
597,The wedding,A,"ab, a1c; ab, a1c."
597,The wedding,B,"aa1, aAc1; aa2, Aa2Ac2."
598,The mason's apron,A,"ab, a1c; a2b, cd."
598,The mason's apron,B,"aa1, a2Ac1; aAb, AcAd1."
599,The Cashmere shawl,A,"ab, a1b1; ab, a1c."
599,The Cashmere shawl,B,"aa1, aAc1; aa1, bAc2."
600,The old grey gander,A,"aa1, ba2; aa1, bc."
600,The old grey gander,B,"ab, a1Ac; ab, Ab1Ac."
601,Johnny's welcome home,A,"ab, cd; ed1, fg."
601,Johnny's welcome home,B,"Ab1Ad2, Ab2Ad; AeAd1, AfAg1."
602,Jenny picking cockles,A,"ab, ab1; ab2, a1b3."
602,Jenny picking cockles,B,"ab, aAa2; ab1, Aa1Ab3."
603,The Salamanca reel,A,"ab, a1c; b1d, ef."
603,The Salamanca reel,B,"aAe1, AdAd1; a1Ad2, AeAf1."
604,The star of Kilkenny,A,"ab, a1a2; ab, a3a4."
604,The star of Kilkenny,B,"aAa4, a1Aa4; aAa4, a1Aa4."
605,Kitty got a clinking coming from the races,A,"ab, a1c; ab, dc1."
605,Kitty got a clinking coming from the races,B,"Ad1a, Ad1Ac1; Ad1a, AdAc1."
606,Tie the bonnet,A,"ab, ac; ab, ac."
606,Tie the bonnet,B,"ab, aAc; ab, Aa1Ac."
607,Tie the ribbons,A,"ab, a1c; ab, a1c."
607,Tie the ribbons,B,"aAb1, aAc; aAb1, Ac1Ac2."
608,The rising sun,A,"ab, a1c; ab, a2c1."
608,The rising sun,B,"Ab1a, Ab1b; Ab1a, cAa3."
608,The rising sun,C,"aBb1, aAa4; aAb2, Aa5b."
609,The strawberry blossom,A,"ab, a1c; ab1, b2c."
609,The strawberry blossom,B,"ab, aAc1; ab, cd."
610,I have no money,A,"ab, ab1; ab, ac."
610,I have no money,B,"Ac1Ac2, Ac1Ac3; Ac1Ac2, aAa1."
611,The first of March,A,"ab, ac; ab, ac1."
611,The first of March,B,"aAb1, ab; aAb1, cAc2."
612,Jack Dolan,A,"ab, ac; ab, ac."
612,Jack Dolan,B,"Ac1a, Ac1b; Ac1a1, cd."
613,Dr. Taylor,A,"ab, ab1; ab, cd."
613,Dr. Taylor,B,"aa1, a2Ad1; a2a1, Ac1b."
614,The money musk,A,"ab, ca1; a2b, cd."
614,The money musk,B,"Aa3a, bAd; cAb1, de."
615,Your mother's fair pet,A,"ab, a1c; ab, a1c1."
615,Your mother's fair pet,B,"ab, aAc1; ab, a1Ac2."
616,Molly put the kettle on,A,"aa1, a2b; aa1, cb."
616,Molly put the kettle on,B,"Ac1Aa3, Ac1Ab1; Ac1Aa3, AaAb."
