Tune,Title,Part,Structure
1,Shandon bells,A,"ab, a1c; ab, db1."
1,Shandon bells,A1,"ab, a1c; ab, dc1."
1,Shandon bells,B,"Aa2Ad1, Aa3Ac2; Aa2Ad1, AdAc1."
2,The piper's picnic,A,"aa1, ab; aa1, a2c."
2,The piper's picnic,B,"aAc1, a1Ac2; Ac3b, cAc."
3,Hartigan's fancy,A,"aa1, ab; aa1, ca2."
3,Hartigan's fancy,B,"Aa3Ab, Aa4Ab1; Ab2Ab, Ac1Aa2."
4,The yellow flail,A,"aa1, a2a3; a4a5, a6b."
4,The yellow flail,B,"aa1, a2Aa7; aa3, Aa6Ab."
4,The yellow flail,C,"Ba4Ab1, Aa3Aa3; Aa4Aa5, Aa6Ab."
5,Kitty's rambles,A,"ab, a1a2; ab, a1c."
5,Kitty's rambles,B,"aa1, a2Aa3; Ab1a3, Aa1Ac."
5,Kitty's rambles,C,"aAa1, a1Ac1; a2Ab, Aa1Ac."
5,Kitty's rambles,D,"Ca3Aa4, Ca4Ba4; Ab2Ca5, Aa1Ac."
6,Doctor O'Neill,A,"ab, b1c; ab, b1d."
6,Doctor O'Neill,B,"Aa1Ac1, Ab2Ac; Aa1Ac1, Ab2Ad."
6,Doctor O'Neill,C,"Aa2a, a1Ac2; Aa2a, a1Ac3."
6,Doctor O'Neill,D,"Ac4Ac5, Aa3Ac6; Ac4Ac5, Ab2Ad."
6,Doctor O'Neill,E,"aAc7, aAc6; aAc7, Ab1Ad."
7,Denis Delaney,A,"ab, ac; ab, ab1."
7,Denis Delaney,B,"aAa1, Ac1Ac; aAa1, Ac1Ab1."
7,Denis Delaney,C,"Aa1Ab2, Aa1Ac2; BaAa1, Ac1Ab1."
8,The walls of Liscarroll,A,"aa1, bb1; aa1, ba2."
8,The walls of Liscarroll,B,"aa, a1Ab2; bb1, AbAa2."
9,The pipe on the hob,A,"aa1, bc; ad, c1b1."
9,The pipe on the hob,B,"Aa2a, AbAb2; Aa2a1, Ac1Ab1."
9,The pipe on the hob,C,"Aa3Ba2, Aa3Ba3; Aa3Aa4, Ac1Ab1."
10,Guiry's favorite,A,"aa1, bc; ac1, c2c3."
10,Guiry's favorite,B,"Aa2Ac4, Aa3Ac5; Aa2Ac4, Ac2Ac3."
11,Malowney's wife,A,"aa1, bb1; aa2, a3b2."
11,Malowney's wife,B,"Ab3a, AbAb1; Ab3a1, Aa3Ab2."
11,Malowney's wife,C,"Ba2Ba3, Ab4Ab1; Ba2Ba3, Ab4Ab2."
12,The gold ring,A,"aa1, aa2; aa3, ba1."
12,The gold ring,B,"aAa1, aAa2; aAa3, AbAa1."
12,The gold ring,C,"Aa4Ba1, Aa5Ba2; Aa4Ba1, Aa6Aa1."
12,The gold ring,D,"Ba3Ba3, Ba3Aa1; Ba3Ba3, Ba4Aa1."
12,The gold ring,E,"aAa1, bAa2; bb, AbAa1."
12,The gold ring,F,"Ba5Aa7, Ab1Aa2; Ba5Aa7, Ab1Aa1."
12,The gold ring,G,"aa1, Ab1Aa2; aa1, Ab1Aa1."
13,The humors of Bantry,A,"aa1, bc; aa1, bc1."
13,The humors of Bantry,B,"aa, Ab1Ac2; AaAa1, Ab2Ac1."
13,The humors of Bantry,B1,"aa, Ab1Ac2; Aa2Ac3, Ab3Ac1."
14,Off to the hunt,A,"ab, a1c; aa2, dc1."
14,Off to the hunt,B,"aa1, a2Aa3; Ad1Aa2, AdAc1."
15,The highway to Dublin,A,"ab, ab1; a1c, a2b2."
15,The highway to Dublin,B,"aAb, aAb1; a1Ac1, Aa2Ab2."
16,When sick is it tea you want?,A,"ab, a1c; ab, b1a2."
16,When sick is it tea you want?,B,"Ac1Ac2, Ac3Ab2; AaAb, Ab1Aa2."
17,The eavesdropper,A,"aa1, a2a3; aa1, a2a4."
17,The eavesdropper,B,"aa1, Aa2Aa5; a2a3, Aa2Aa4."
18,Saddle the pony,A,"ab, ac; ac1, b1b2."
18,Saddle the pony,B,"Ab3Ac2, Ab3Ab2; Ab3Ac1, Ab1Ab2."
19,Humors of Glendart,A,"ab, ab1; ab, a1b2."
19,Humors of Glendart,B,"Ab3a, Ab3a1; Ab3a2, Aa1Ab2."
20,Have a drink with me,A,"ab, ac; ab, ab1."
20,Have a drink with me,B,"Ab2Aa1, Ab2Ac1; Aa1Aa2, AaAb1."
21,The hag with the money,A,"ab, ab1; a1b, cd."
21,The hag with the money,B,"Ab2Ac1, Ab2Aa2; Ab2Aa2, Ac2Ad."
22,I know what you like,A,"ab, cc1; ab, ca1."
22,I know what you like,B,"Ab1Aa, Ab2a1; Ab1Ab1, AcAa1."
23,The night cap,A,"aa1, a2a3; aa1, a4a5."
23,The night cap,B,"Aa1a, a1a2; Aa1a3, Aa4Aa5."
24,The maid at the well,A,"ab, a1c; ab, a1c1."
24,The maid at the well,B,"Aa2Ab1, Aa1Ac; Aa2Ab1, Aa1Ac1."
25,Sergt. Early's jig,A,"ab, cd; a1b, c1a2."
25,Sergt. Early's jig,B,"Aa3Ad1, AcAd; Aa3Ad2, Ac1Aa2."
26,Castle Donovan,A,"ab, a1c; ab, a1a2."
26,Castle Donovan,B,"Aa3Aa1, Aa3Aa4; AaAb, Aa1Aa2."
27,Jackson's frieze coat,A,"aa1, ab; aa1, a2b."
27,Jackson's frieze coat,B,"aa1, a2a3; aa1, a2Aa3."
27,Jackson's frieze coat,C,"Ab1Ba4, Ba5Ba5; Ab1Ba4, Ab2Aa3."
28,Contentment is wealth,A,"ab, a1a2; cd, a3a4."
28,Contentment is wealth,B,"Aa5Ab1, Aa6Ab2; Aa5a, Ac1Aa4."
28,Contentment is wealth,C,"Ac2Aa4, Ac3Aa7; Ac4Ac5, Ac1Aa4."
29,Cherish the ladies,A,"aa1, a2b; aa3, ca4."
29,Cherish the ladies,B,"aAa5, Aa2Ab; aAa5, AcAa4."
29,Cherish the ladies,C,"BaAa5, aAb; Ba1b, Ac1Aa4."
29,Cherish the ladies,D,"Aa6Aa6, Ac2Ba2; Ba3Ab1, Ab2Ab3."
29,Cherish the ladies,E,"Aa7Ac3, Ab4Ba2; Ba3Ab1, Ab2Ab3."
29,Cherish the ladies,F,"aa1, aAb3; a2a3, Ab2Ab3."
30,Welcome to Cork,A,"aa1, bc; a2c1, a3d."
30,Welcome to Cork,B,"aa1, a2Aa4; aa1, Ab1Ad."
31,The widow Brady,A,"ab, aa1; ab, ca2."
31,The widow Brady,B,"Ac1Aa3, aAa4; Ac2a1, Ac3Aa2."
32,The basket of Turf,A,"aa1, a2b; aa1, cb."
32,The basket of Turf,B,"Ac1Ab1, Ac1Ab2; Ac1Ab1, AcAb."
33,Do you want anymore?,A,"ab, cb1; c1b, c2a1."
33,Do you want anymore?,B,"Ab2Ac3, Ab2Aa2; aa1, Ac2Aa1."
34,Galway Tom,A,"aa, aa1; aa, a2b."
34,Galway Tom,B,"Aa1Ab1, Aa2Ab2; Aa3a, Aa2Ab."
34,Galway Tom,B1,"Aa1Ab1, Aa2Ab2; Aa3a, Aa2Aa1."
34,Galway Tom,C,"Aa3Aa4, Aa3a; Aa3b, ca."
34,Galway Tom,D,"Ab3Ab1, Ab4Ab2; Aa3Ba, Aa2Ab."
34,Galway Tom,D1,"Ab3Ab1, Ab4Ab2; Aa3Ba, Aa2Aa1."
34,Galway Tom,E,"Aa4Aa4, Aa4Aa1; Aa4Ba1, Aa2Aa1."
35,Money in both pockets,A,"aa1, ab; aa1, cc1."
35,Money in both pockets,B,"aa1, aAa2; Ab1Ab2, bAc1."
36,Father Dollard's favorite,A,"ab, ab1; ab, b2c."
36,Father Dollard's favorite,B,"Aa1Ab3, Aa1Ac1; Aa1Ab2, aAc."
37,Tell her I am,A,"aa1, bc; aa1, b1c1."
37,Tell her I am,B,"Aa2a, Aa3Ac; Aa4a, Ab1Ac1."
38,The mountain boy,A,"aa1, a2b; aa1, cb."
38,The mountain boy,B,"Ac1Ac2, Ac3Aa3; Ac1Ac2, AcAb."
39,A visit to Ireland,A,"ab, a1b1; ab, a2b2."
39,A visit to Ireland,B,"Ab3Aa3, Aa1Ab1; Ab3Aa3, Aa2Ab2."
40,Jerry's beaver hat,A,"ab, b1c; ab, c1c2."
40,Jerry's beaver hat,B,"Aa1Ac3, Aa1Aa2; Aa1Ac3, Ac4Ac2."
41,The tempelhouse jig,A,"ab, a1b1; ab2, cc1."
41,The tempelhouse jig,B,"Ab3Ab4, Ab5Ab6; Ab3Ab7, AcAc1."
41,The tempelhouse jig,B1,"Ab3Ab4, Ab5Ab6; Ab8Ac2, AcAc1."
42,Move up to me,A,"ab, a1a2; ab, b1c."
42,Move up to me,B,"Ab2Ab, Ab2Ab3; Ab2Ab, Ab1Ac."
43,Paddy whack,A,"ab, a1c; dd1, ec1."
43,Paddy whack,B,"Aa2Ad2, Aa1Ac; Aa2Ad2, AeAc1."
43,Paddy whack,B1,"Aa2Ad2, Aa1Ac; AdAd1, AeAc1."
44,Nell Flaherty's drake,A,"ab, a1c; ab1, a1c1."
44,Nell Flaherty's drake,B,"Aa2Aa3, Aa4Ac; AaAb, Aa1Ac1."
45,Out with the boys,A,"ab, cd; ab, cd1."
45,Out with the boys,B,"Ac1Ac1, Ac1Ab1; Ac1Ac2, aAb2."
45,Out with the boys,C,"Aa1Aa1, Ac3Ba1; Aa2Aa1, BaAb2."
46,Katie's fancy,A,"ab, b1c; ab, b1d."
46,Katie's fancy,B,"Ab2Ac1, Ab3Ac2; AaAb, Ab1Ad."
46,Katie's fancy,C,"Ab4Ab5, Ab6Ad1; Ac3Ab7, Ad2Ad."
47,Paddy from Portlaw,A,"aa1, aa2; ab, a3a1."
47,Paddy from Portlaw,B,"Aa4Aa5, Aa4Ab1; aa1, Aa6Aa7."
48,The miller of Glanmire,A,"ab, a1c; a2b1, a3a4."
48,The miller of Glanmire,B,"Aa2Ab1, Aa1Ac; Aa2Ab1, Aa3Aa4."
49,The hare in the corn,A,"aa, bc; aa, bc1."
49,The hare in the corn,B,"Ab1Ab, AbAc; Ab1Ab, AbAc1."
49,The hare in the corn,C,"Bb1Ac2, AbAc; Bb1Ab, aAc2."
50,Daniel O'Rourke,A,"aa1, aa2; aa3, a4b."
50,Daniel O'Rourke,B,"ab, ab1; ab, a1b1."
50,Daniel O'Rourke,B1,"ab, ab1; ab, cAb."
50,Daniel O'Rourke,C,"aBb2, B1b1Ab1; aAb2, B1cAb."
51,O'Sullivan's march,A,"ab, ab1; ab, a1b2."
51,O'Sullivan's march,B,"Ab3a, Aa2b; Aa1Ab, Aa1Ab2."
52,Tobin's favorite,A,"ab, a1b1; ab2, cd."
52,Tobin's favorite,B,"Aa2Ac1, Aa1Ab1; AaAb2, AcAd."
53,Banish misfortune,A,"ab, cb1; ab, c1c2."
53,Banish misfortune,B,"Aa1Ab2, Aa2Ab3; Aa1Ab2, Ab4Ac2."
53,Banish misfortune,B1,"Aa1Ab2, Aa2Ab3; Ab5a, Ab4Ac2."
53,Banish misfortune,C,"Ac3Ac4, AaAb; Ac4Ac1, Ab4Ac2."
54,The wheels of the world,A,"ab, cb1; b2b, ca1."
54,The wheels of the world,B,"Ac1a, AcAb1; Ac1a, AcAa1."
54,The wheels of the world,B1,"Ac1a, AcAb1; Ab2Ab, AcAa1."
55,Kitty come over,A,"aa1, bc; aa1, bc1."
55,Kitty come over,B,"Ac2Ab1, Ac2Ac; AaAa1, AbAc1."
56,The humors of Cappa,A,"aa, a1a2; aa, ba3."
56,The humors of Cappa,B,"aAa2, Aa1Aa2; aAa2, AbAa3."
57,The blazing turf fire,A,"aa1, ab; ab1, b2b3."
57,The blazing turf fire,B,"aa1, aAa2; aa2, Ab2Ab3."
58,All covered with moss,A,"aa1, ab; a1c, c1d."
58,All covered with moss,A1,"aa1, ab; a1c, c1d."
58,All covered with moss,B,"Ab1Ab2, Ab1Ad; Ab1Ab3, Ad1Ad2."
58,All covered with moss,B1,"Ab1Ab2, Ab1Ad; Ab4Ad3, Ac2Ad."
59,The priest's leap,A,"ab, ac; ab1, b2b3."
59,The priest's leap,B,"Ab4Ab, Ab4Ac; Ab4Ab1, Ab2Ab3."
60,The book of rights,A,"ab, cd; ab, ca1."
60,The book of rights,B,"Aa2Aa3, Ab1Ad1; Ac1Ad1, AcAa1."
61,The humors of whiskey,A,"ab, cd; ab1, a1b2."
61,The humors of whiskey,B,"aa1, a2Ad1; aa1, a3Ab2."
62,Fiddler's heaven,A,"ab, ab1; ab2, cb3."
62,Fiddler's heaven,B,"Aa1Ac1, AcAc2; Aa1Ac3, Ac4a."
63,A night at the fair,A,"ab, b1b2; ab, cb."
63,A night at the fair,B,"Ab3Ab4, aAb5; Ab3Ab4, a1Ab."
64,Darby the driver,A,"aa1, ba2; a3a1, ba1."
64,Darby the driver,B,"aa, Ab1Ab2; ab, Ab3Aa1."
65,John White's mother,A,"ab, a1c; a2d, c1c2."
65,John White's mother,B,"Ad1Aa3, aa1; Ad1Ad2, bAc3."
66,The humors of Tralibane,A,"aa1, bc; aa1, b1d."
66,The humors of Tralibane,B,"Ac1a, Ac1Ad1; Ac1a1, a2Ad."
67,Connie the soldier,A,"ab, a1a2; ab, a3a4."
67,Connie the soldier,B,"Aa5Aa6, aAa7; Aa5Ab1, Aa3Aa4."
67,Connie the soldier,B1,"Aa5Aa6, aAa7; a1Ab1, Aa4"
68,Out on the ocean,A,"ab, b1a1; ab, b1a2."
68,Out on the ocean,B,"Aa3Aa3, Aa4Aa5; aAa6, Ab1Aa2."
69,Philip O'Neill,A,"aa1, a2b; aa1, a3a2."
69,Philip O'Neill,B,"Aa1a, a1Ab1; Aa1a, Aa3Aa2."
70,The besom in bloom,A,"ab, aa1; ac, da2."
70,The besom in bloom,B,"Ad1Ab1, AaAb; Ad1Ad2, AdAa2."
71,Courtney's favorite,A,"ab, ac; aa, b1c."
71,Courtney's favorite,A1,"ab, ac; aa, c1c2."
71,Courtney's favorite,B,"aAb, aAc; a1b, Ab2Ac."
72,The merry old woman,A,"ab, b1a1; a2b, a3b2."
72,The merry old woman,B,"Ab1Aa1, Ab3Ab4; Ab1Aa1, Aa4Ab2."
72,The merry old woman,B1,"Ab1Aa1, Ab3Ab4; Aa5a, Aa4Ab2."
73,Con Casey's jig,A,"aa1, ab; ac, b1c1."
73,Con Casey's jig,B,"Ab2a, Ab2Ac2; Ab2Ac, Ab1Ac1."
74,A trip to the cottage,A,"aa1, bb1; aa1, bb1."
74,A trip to the cottage,B,"aa1, ba2; aa1, Aa2a3."
75,Old man Dillon,A,"ab, cd; ae, b1c1."
75,Old man Dillon,B,"Ab2Ab2, Ac2Ad; Ab2Ab2, Ab1a."
75,Old man Dillon,B1,"Ab2Ab2, Ac2Ad; AaAe, Ab1Ac1."
76,Julia McMahon,A,"ab, a1a2; ab, a3a4."
76,Julia McMahon,B,"Aa5a, Aa6Aa2; Aa5Ab1, Aa3Aa4."
76,Julia McMahon,B1,"Aa5a, Aa6Aa2; Aa7Ab, Aa3Aa4."
77,Drive the cows home,A,"aa1, a2a3; bc, c1c2."
77,Drive the cows home,B,"Ac3Ac, Ac4Ac5; Ac3Ac, Ac1Ac2."
77,Drive the cows home,B1,"Ac3Ac, Ac4Ac5; Ab1Ab2, Ac1Ac2."
78,Happy to meet and sorry to part,A,"ab, cc1; a1b1, c2d."
78,Happy to meet and sorry to part,B,"Aa2Ac3, Aa2Ad1; ab, Aa1Ab1."
78,Happy to meet and sorry to part,B1,"Aa2Ac3, Aa2Ad1; ab, Ac4a1."
79,The joy of my life,A,"ab, a1b1; ab, a1c."
79,The joy of my life,B,"Ac1a, Abb1; Ac1a, Aa1Ac."
79,The joy of my life,B1,"Ac1a, Abb1; Ab2Ab, Aa1Ac."
80,The grumbling rustic,A,"ab, cc; ab, c1c1."
80,The grumbling rustic,B,"Aa1Ac2, AcAc; Aa1Ac2, Ac1Ac1."
80,The grumbling rustic,B1,"Aa1Ac2, AcAc; Ac2Ac3, Ac1Ac1."
81,The humors of Ballycastle,A,"ab, ab1; ab, b2c."
81,The humors of Ballycastle,B,"Ac1Ac2, aa1; Aa1Ab, Ab2Ac."
82,Doherty's fancy,A,"ab, ab1; ab, cb2."
82,Doherty's fancy,B,"ab, aa1; b1b2, AcAb2."
83,The girls of Banbridge,A,"aa1, a2b; aa1, cd."
83,The girls of Banbridge,B,"Aa3Ad1, Ac1Ab1; Aa3Ad1, AcAd."
84,Wellington's advance,A,"ab, ca1; ab, c1a2."
84,Wellington's advance,B,"Aa3a, a1Aa1; Aa4Aa5, Ac1Aa2."
85,The old man's delight,A,"aa1, a2a3; aa1, ba4."
85,The old man's delight,B,"Aa5a, AaAa1; Aa5a, Aa6Aa4."
86,Blackeyed Biddy,A,"ab, cd; ab, cd1."
86,Blackeyed Biddy,B,"Ac1a, Ad2Ab1; Ac2Ab, AcAd1."
87,The jolly Corkonian,A,"aa1, a2b; ab1, cd."
87,The jolly Corkonian,B,"Ad1Ab2, Ad2Ad3; Ad1a, Ac1Ad."
88,Willy Walsh's jig,A,"aa1, ab; aa1, cb1."
88,Willy Walsh's jig,B,"Ab2Ac1, Ab3Aa2; Ab2Ac1, AcAb1."
89,The boys of the town,A,"ab, ab1; ab2, b3b4."
89,The boys of the town,B,"ab, ab1; ab, Ab3Ab4."
89,The boys of the town,B1,"ab, ab1; a1b1, Ab3Ab4."
90,Petticoat loose,A,"ab, ab1; ab2, cb1."
90,Petticoat loose,A1,"ab, ab1; ab2, ca1."
90,Petticoat loose,B,"Ac1Aa2, aa1; Ac2Aa2, Ac3Aa1."
91,The tailor's thimble,A,"aa1, a2a3; aa1, a4a5."
91,The tailor's thimble,A1,"aa1, a2a3; aa1, a4b."
91,The tailor's thimble,B,"Aa6Aa7, A1b1a; A1b2A1b3, Aa4Aa5."
91,The tailor's thimble,B1,"Aa6Aa7, A1b1a; A1b2A1b3, Aa4A1b."
92,The humors of Ballingarry,A,"aa1, a2a3; aa1, ba3."
92,The humors of Ballingarry,B,"Ab1a, Aa4a1; Ab1a, Ab2Aa3."
93,Palm Sunday,A,"aa1, bc; dc1, d1a2."
93,Palm Sunday,B,"Ac2Aa3, Aa4Aa5; aAc1, Ad1Aa2."
94,The road to Lurgan,A,"aa1, ba2; aa1, b1a3."
94,The road to Lurgan,B,"aAa1, aAa4; aAa1, a1Aa3."
95,The sheep on the mountains,A,"ab, a1a1; ab1, a2a2."
95,The sheep on the mountains,B,"AaAb, Aa3Aa3; AaAb, Aa2a."
95,The sheep on the mountains,C,"Ba1Ab2, Aa1Aa1; Ba1Ab2, Aa2Aa2."
95,The sheep on the mountains,D,"Ba1Ab2, Aa1Aa1; Aa4Ab2, Aa2Aa2."
96,Our own little isle,A,"ab, a1c; ab, a1a2."
96,Our own little isle,B,"Aa3Ab1, Aa3Ac1; Ab2Ab1, Ac2Ac."
97,The straw seat,A,"aa1, ab; aa1, b1b2."
97,The straw seat,B,"Aa2Aa2, Aa3Aa3; Aa2Aa2, Ab1Ab3."
98,The flaxdresser,A,"aa1, a2a3; aa1, ba4."
98,The flaxdresser,B,"aAa5, aa1; Aa6Ab1, bAa7."
98,The flaxdresser,C,"aAa5, Ba2Aa8; aAa5, BbAa7."
99,The races at Carrick,A,"aa1, a2b; aa3, a2a4."
99,The races at Carrick,B,"Ab1Ab2, Aa5Aa1; Ab1Ab2, Aba."
100,Condon's frolics,A,"ab, a1c; ab, da2."
100,Condon's frolics,B,"Ac1Ab1, Ac2Ac3; Ac1Ab1, AdAa2."
101,The idle road,A,"aa1, bc; aa1, bc1."
101,The idle road,B,"Ab1Ac2, Ab1Ab2; AaAa1, AbAc1."
102,Billy Barlow,A,"aa1, a2a3; bb1, ca4."
102,Billy Barlow,B,"aAa1, a1Aa3; AbAb1, AcAa4."
103,A merry christmas,A,"ab, ac; ab, a1c1."
103,A merry christmas,B,"Ac2Ab1, Aa2Ab2; Ab3Ab4, Aa1Ac1."
104,Will you come home with me?,A,"aa1, bb; aa1, b1c."
104,Will you come home with me?,B,"aAb2, AbAb; aAb2, Ab1Ac."
105,The gobby o,A,"ab, a1b1; ac, a2a3."
105,The gobby o,B,"Ab2a, bAa4; Ab2a1, Aa2Aa3."
106,The humors of Mullinafauna,A,"aa1, bb1; a1c, a2c1."
106,The humors of Mullinafauna,B,"Ac2a, Ab2a1; a2a1, Aa2Ac1."
107,Father O'Carroll,A,"aa1, bc; da1, b1c1."
107,Father O'Carroll,B,"Ab2Ad1, aAc; a1Ad1, Ab1Ac1."
108,The rakes of Kildare,A,"aa1, bc; aa1, c1a1."
108,The rakes of Kildare,B,"Ab1Ab2, AbAc; Ab1Ab2, Ac1Aa1."
109,The tailor's wedding,A,"ab, a1c; ab, c1c."
109,The tailor's wedding,B,"Ac2Aa2, Ac2Ac3; Ac2Ab1, Ac1Ac."
110,My former wife,A,"ab, a1a2; ac, c1a3."
110,My former wife,B,"Aa4Ab1, Ac2a; Aa4Ab1, Ac1Aa3."
111,The sporting bachelor,A,"ab, b1b2; ab, b3b4."
111,The sporting bachelor,B,"Ab5Ab5, Ab6Ab7; aa1, Ab8b."
112,The first night in America,A,"aa1, a2a3; aa1, a2a4."
112,The first night in America,B,"Aa5Aa6, aAa7; Aa5Aa6, a1Aa4."
113,The best in the bag,A,"ab, ac; ab, b1a1."
113,The best in the bag,B,"Aa1a, Aa1Ac1; bAb, Ab1Aa1."
114,The maid on the green,A,"ab, cd; ab, b1c1."
114,The maid on the green,B,"Aa1Aa2, Aa3Ad1; Ab2Aa, AbAc1."
115,Stagger the buck,A,"ab, aa1; ac, ad."
115,Stagger the buck,B,"aAb, aAa1; aAc, AaAd."
116,Rory O'Moore,A,"aa1, a2b; aa3, b1a1."
116,Rory O'Moore,B,"aa1, Ab2Ab3; aa1, Ab2Ab4."
116,Rory O'Moore,B1,"aa1, Ab2Ab3; aa1, Ab2Ab3."
117,The highlander,A,"aa1, ab; a2a1, cb1."
117,The highlander,B,"aa1, a2Ab1; a3a1, a2Ab1."
118,Lannigan's ball,A,"aa1, a2a3; aa1, bb1."
118,Lannigan's ball,B,"Ab2Ab3, Ab2Ab4; Ab2Ab3, AbAb1."
119,Hide and go seek,A,"aa1, a2b; ab1, a3a4."
119,Hide and go seek,B,"Ab2Aa5, aAa6; Ab2Aa7, a1Aa8."
119,Hide and go seek,B1,"Ab2Aa5, aAa6; Ab3b, b1Aa8."
120,Fasten the leg in her,A,"ab, a1c; ab1, da2."
120,Fasten the leg in her,B,"Ac1Aa3, Aa1Ac; Ac1Aa3, Ad1Aa2."
121,The cliffs of Moher,A,"aa1, bb1; aa1, bc."
121,The cliffs of Moher,B,"aa, Ab2Aa2; aa, Ab2Ac1."
122,Charley the prayermaster,A,"ab, a1c; ab, aa2."
122,Charley the prayermaster,B,"Ab1Ac1, Aa3Ab2; Ab1Ab3, AaAa2."
123,Young Francis Mooney,A,"aa1, bb1; aa1, a2b2."
123,Young Francis Mooney,B,"Aa3Aa3, Aa4Ab3; Aa3Aa5, Ab4Ab5."
124,Grandfather's pet,A,"aa, bb1; aa, cd."
124,Grandfather's pet,B,"Aa1Ab2, Aa1a; Aa1Ab3, bAd1."
125,Wasn't she fond of me?,A,"ab, ab1; ab, cb2."
125,Wasn't she fond of me?,B,"AcAa1, AcAb2; AcAb3, Ab4Aa2."
126,Wise Nora,A,"ab, ab1; aa1, b2b3."
126,Wise Nora,B,"Aa2Ab, Aa2Ab3; Aa2Aa1, Ab2Ab3."
126,Wise Nora,C,"Ab4Ab5, Ab6Ab7; Ab4Aa1, Ab2Ab3."
126,Wise Nora,D,"aAb8, aAb3; aAb8, a1Ab3."
126,Wise Nora,E,"Da2a, bAb3; Da2a, a1Ab3."
126,Wise Nora,F,"aAb9, aAb3; aAb9, Da1Ab3."
127,The butcher's march,A,"ab, ab1; aa1, cb1."
127,The butcher's march,B,"aAb, aAb1; aAb, AcAb1."
128,Larry O'Gaff,A,"ab, cd; ab, cc1."
128,Larry O'Gaff,B,"Aa1Ab1, Aa2a; Ab2Ab, AcAc1."
128,Larry O'Gaff,B1,"Aa1Ab1, Aa2a; Ab2Ab3, AcAc1."
129,The cat in the corner,A,"ab, a1a1; ab, ca2."
129,The cat in the corner,B,"Aa3Aa3, Aa4Ab1; aAb2, a1Aa5."
130,Ballyhooley,A,"aa1, a2b; ca1, c1d."
130,Ballyhooley,B,"Ab1a, Ab1Ad1; Ac2Ac3, Ac4Ad."
131,The bow-legged tailor,A,"ab, a1c; ad, ec1."
131,The bow-legged tailor,B,"Ad1Ad2, Ab1Ac2; Ad1Ad3, Ae1Ac1."
132,Larry Grogan,A,"aa1, ba2; aa3, ba4."
132,Larry Grogan,B,"Ab1Ab2, Ab3Aa5; Ab1Ab2, Ab4Aa4."
133,The Killashandra lasses,A,"aa1, a2b; aa1, ca3."
133,The Killashandra lasses,B,"Ac1Ab1, Aa2Ab; Ac1Ab1, AcAa3."
133,The Killashandra lasses,B1,"Ac1Ab1, Aa2Ab; Aa4Ab2, AcAa3."
134,Young Tim Murphy,A,"ab, b1b2; ab, b3a1."
134,Young Tim Murphy,B,"Ab4a, a1Ab5; Ab6Aa2, Ab3Aa1."
135,Boiled goat's milk,A,"aa1, a2a3; aa1, bc."
135,Boiled goat's milk,B,"aAb1, ab; aAb1, AbAc."
136,(Tatter Jack Walsh),A,"ab, a1b1; a2b, a1c."
136,(Tatter Jack Walsh),B,"Aa3Aa3, aAb1; Aa2Ab, Aa1Ac."
136,(Tatter Jack Walsh),C,"Aa3Aa3, aAb1; Aa2Ab, Aa1Ac."
137,The victor's return,A,"aa, a1b; aa, a1b1."
137,The victor's return,B,"ab, aAa2; ab1, a1Ab1."
138,Snug in the blanket,A,"ab, ca1; ab, c1a1."
138,Snug in the blanket,B,"aa1, aa2; aAa2, Ac1Aa1."
138,Snug in the blanket,C,"BaAc2, BaAa1; BaAb1, Ac1Aa1."
139,How are you Kitty?,A,"aa, aa1; aa, ba2."
139,How are you Kitty?,B,"Aa1Aa1, AaAa2; Aa1Aa1, AbAa2."
139,How are you Kitty?,C,"Aa2a, AaAa1; Aa2a, Ab1Aa2."
140,The silken wallet,A,"aa1, a2a3; aa1, bb1."
140,The silken wallet,B,"ab, aa1; ab, Aa4b1."
140,The silken wallet,B1,"ab, aa1; Aa5Ab2, Aa6a2."
141,Behind the haystack,A,"ab, a1a1; ab, cc1."
141,Behind the haystack,B,"Ac2a, Aa1Aa1; Ac2a, AcAc1."
141,Behind the haystack,C,"Ab1Ab1, Aa1Aa1; Ab1Ab1, AcAc1."
142,The jolly old man,A,"ab, a1b1; ab, b2c."
142,The jolly old man,B,"aAb3, Aa2Ab1; Aa3Ab3, Ac1Ac."
142,The jolly old man,B1,"aAb3, Aa2Ab1; AaAb, Ab2Ac."
143,Handy with the stick,A,"ab, ca1; ab, ca2."
143,Handy with the stick,B,"ab, Ab1Aa; Aa3a1, AcAa2."
144,The house in the glen,A,"ab, cb1; ab, dd1."
144,The house in the glen,B,"Ac1Ad2, Ac1Ad1; Ac1Ab2, Ad3Ad1."
145,Jackson's bottle of brandy,A,"aa1, aa2; ab, a3a2."
145,Jackson's bottle of brandy,B,"aa1, Ab1Aa4; aa1, Aa3Aa2."
146,Jackson's morning brush,A,"aa1, bb1; aa1, b2c."
146,Jackson's morning brush,B,"Aa2Ab3, Ab4Ab1; Aa2Ab3, Ab5Ac."
146,Jackson's morning brush,C,"aa1, Ab4Ab1; aa1, Ab5Ac."
146,Jackson's morning brush,D,"CaCa1, Ab4Ab1; Ca2Ca3, Ab5Ac."
146,Jackson's morning brush,E,"Aa2Ca4, Aa2Ab1; Aa2Ca4, Bc1Ac."
147,Jackson's cravat,A,"aa1, ab; aa1, cb1."
147,Jackson's cravat,B,"Ac1a, a1Ab; Ac1a, Aa2Ab2."
148,The Kinnegad slashers,A,"aa1, aa2; aa3, a4a5."
148,The Kinnegad slashers,B,"aa1, aAa6; aa1, Aa4Aa5."
148,The Kinnegad slashers,C,"Aa7Aa1, Aa7Aa2; Aa7Aa3, Aa4Aa5."
149,The rakes of Clonmel,A,"ab, a1b1; b2c, a2b."
149,The rakes of Clonmel,B,"Aa3Ab3, aAb1; a1Ac, Aa2Ab."
149,The rakes of Clonmel,B1,"Aa3Ab3, aAb1; Ac1Aa4, Aa2Ab."
149,The rakes of Clonmel,C,"Ab1Ab4, aAc2; Ac1Ac3, Aa2Ab."
150,Nancy Hynes,A,"aa, bb1; ac, c1a1."
150,Nancy Hynes,B,"Ab2Ab3, Ab4Ab5; Ab2Ab3, aAb4."
150,Nancy Hynes,B1,"Ab2Ab3, Ab4Ab5; a1Aa1, AaAa2."
150,Nancy Hynes,C,"Aa3Aa4, AbAb1; AaAc, Ac1Aa1."
151,The pretty brown girl,A,"aa1, ab; aa2, ab."
151,The pretty brown girl,B,"Aa3Aa4, Ab1Aa5; Ab1Aa4, AaAb."
152,Jackson's fancy,A,"ab, a1b1; ab, ac."
152,Jackson's fancy,B,"Ab2a, Ab2Ac1; Ab2a, Ab3Ac."
153,Young Tom Ennis,A,"aa1, a2a3; aa1, a4a3."
153,Young Tom Ennis,B,"Aa5a, Aa5Aa6; Aa5a, Aa2a1."
154,The Antrim lasses,A,"ab, a1b1; a2c, c1d."
154,The Antrim lasses,B,"Ab2Ab2, Ab3Ab3; Ac2Ac, Ac1Ad."
155,Jackson's rambles,A,"ab, a1b1; ab, a2c."
155,Jackson's rambles,B,"Ac1Ab2, aAc2; Ac1Ab2, a1Ac3."
155,Jackson's rambles,B1,"Ac1Ab2, aAc2; Ab3Ab2, a1Ac3."
156,A draught of ale,A,"ab, ac; ab1, b2c1."
156,A draught of ale,B,"Ab3Ab, Ab3Ac; Ab3Ab1, Ab2Ac1."
157,The redhaired hag,A,"ab, cb1; ab2, a1a2."
157,The redhaired hag,B,"aAb2, Ac1Ab1; aAb3, Aa1Aa2."
158,The fairhaired boy,A,"aa1, bb1; aa1, ba2."
158,The fairhaired boy,B,"Aa3Ab2, AbAb1; Aa3Ab2, AbAa2."
158,The fairhaired boy,B1,"Aa3Ab2, AbAb1; AaAa1, AbAa2."
159,My darling asleep,A,"aa1, bc; aa1, ba2."
159,My darling asleep,B,"Ab1Ab2, AbAc; AaAa1, AbAa2."
160,The kneebuckle,A,"ab, a1b1; ab, cb1."
160,The kneebuckle,B,"aa1, aAb2; aa1, Aca."
160,The kneebuckle,C,"Ba1Ba, Ab2Ba; Ba1Ac, Ab1"
161,The sod of turf,A,"aa1, ab; aa1, a2c."
161,The sod of turf,B,"Aa3Aa1, Aa2Ab1; Aa3Aa1, Aa2Ac."
162,The tenpenny bit,A,"aa1, a2b; a3a1, cc1."
162,The tenpenny bit,B,"aAb1, aa1; Ab2a2, Ac2Ac1."
163,The fisherman's widow,A,"ab, cd; ab, c1b1."
163,The fisherman's widow,B,"Aa1Ab2, Aa1Ab3; Aa1Ab, Ac1Ab1."
163,The fisherman's widow,B1,"Aa1Ab2, Aa1Ab3; Ad1Ad2, Aa2Ab1."
164,The ladies of Carrick,A,"aa1, aa2; aa3, a4a2."
164,The ladies of Carrick,B,"aa1, aAa2; aa1, Aa4Aa2."
165,Charlie Stewart,A,"ab, b1a1; cb2, b3c1."
165,Charlie Stewart,B,"Aa2Ab3, Aa2Aa1; Aa2Ab3, aAc1."
166,Jack-of-all-trades,A,"ab, cc1; ab, cb1."
166,Jack-of-all-trades,B,"Ac2Ab2, aAb2; Ac3b, Ac4Ab1."
167,The boys of Ballinamore,A,"ab, ab1; ab, aa1."
167,The boys of Ballinamore,B,"ab, aAa2; ab, Ab2Ab1."
168,Miss Blair's fancy,A,"aa1, bc; aa1, b1d."
168,Miss Blair's fancy,B,"Ad1Ac1, Aa2Aa3; Ad1Ac1, Ab1Ad."
168,Miss Blair's fancy,B1,"Ad1Ac1, Aa2Aa3; Ab2Ac2, Ab1Ad."
169,Easter Sunday,A,"ab, b1a1; ab, ca2."
169,Easter Sunday,B,"ab, aAb2; aAa3, a1a2."
170,Jackson's rolling jig,A,"aa1, aa2; aa1, a3b."
170,Jackson's rolling jig,B,"Aa4Aa1, Aa4Ab1; Aa4Aa1, Aa3Ab."
171,The runaway bride,A,"aa1, bb1; aa1, a2a3."
171,The runaway bride,B,"aAa4, Aa5Ab1; AaAa1, Aa2Aa3."
172,Black Donald the piper,A,"aa1, ab; a2a1, a3b."
172,Black Donald the piper,B,"Aa4a, Aa4Ab; Aa4a, Aa3Ab."
173,The dandy bonnet,A,"ab, a1c; c1c2, da2."
173,The dandy bonnet,B,"Ad1Ac3, Aa3Ac4; Ad1a, Aa4Aa2."
174,The humors of Trim,A,"ab, ac; ab, c1c."
174,The humors of Trim,B,"AbAb1, b1Ac; AbAb2, Ac1Ac."
175,The end of the day,A,"aa1, bb1; aa1, b2c."
175,The end of the day,B,"Ac1Ac2, Ac1Ac3; Ac1Ac4, Ab2Ac."
176,Owen Malone,A,"aa, bb1; aa, cd."
176,Owen Malone,B,"Ad1a, Ad1Aa1; Ad1a, AcAd."
177,Bessy Murphy,A,"ab, b1b1; ab, a1a2."
177,Bessy Murphy,B,"Ab2Ab, Ab1Ab1; Ab2Ab, Aa1Aa2."
178,Paddy O'Rafferty,A,"ab, aa1; ab1, ba1."
178,Paddy O'Rafferty,B,"aAb, aAa1; aAb1, AbAa1."
178,Paddy O'Rafferty,C,"aAb2, aAa1; aAb1, Aa1a."
178,Paddy O'Rafferty,D,"Ab2Ca, Aa1Ca; Ab1Aa1, aAb3."
178,Paddy O'Rafferty,E,"DaAa1, DaCa1; AbAa1, DaAb3."
178,Paddy O'Rafferty,E1,"DaAa1, DaCa1; AbAa1, Da1Bb1."
178,Paddy O'Rafferty,F,"Bb1Aa1, Da2Ca1; AbAa1, Da1Bb1."
178,Paddy O'Rafferty,F1,"Bb1Aa1, Da2Ca1; AbAa1, "
179,I do not incline,A,"ab, cc1; ab, c2b1."
179,I do not incline,B,"Ab2Ab3, Ab4Ac1; AaAb, Ac2Ab1."
180,The Gaelic club,A,"aa1, a2b; ac, a3a4."
180,The Gaelic club,B,"Ab1Ab2, Ab1Aa5; AaAc, Aa3Aa4."
181,The market town,A,"ab, a1c; ab, c1b1."
181,The market town,B,"Aa2Ab1, Aa1Ac2; Aa2Ab1, Ac1Ab1."
181,The market town,B1,"Aa2Ab1, Aa1Ac2; Ac3Ab2, Ac1Ab1."
182,The humors of Castlelyons,A,"aa1, a2b; aa1, a2c."
182,The humors of Castlelyons,B,"Ab1Ab1, Aa2Ab; Ab1Ab1, Aa2Ac."
182,The humors of Castlelyons,B1,"Ab1Ab1, Aa2Ab; AaAc1, Aa2Ac."
183,The dancingmaster,A,"aa, a1a1; aa2, a1a."
183,The dancingmaster,B,"ab, ab1; ab, Aa1Aa."
184,Farewell to my troubles,A,"aa1, a2b; aa1, cd."
184,Farewell to my troubles,B,"Ac1Aa3, Aa4Ab1; Aa5Aa1, AcAd."
185,The tongs by the fire,A,"aa1, a2b; aa1, b1c."
185,The tongs by the fire,B,"aa1, Ac1b; Aa3b1, Ab2b2."
186,The thief of Lough Erne,A,"ab, a1a2; ab, a3a3."
186,The thief of Lough Erne,B,"Aa4Aa4, Aa5a; Aa4Aa4, AbAa3."
186,The thief of Lough Erne,B1,"Aa4Aa4, Aa5a; Aa4Ab1, AbAa4."
187,Scatter the mud,A,"aa1, aa2; aa3, bb1."
187,Scatter the mud,B,"aAb1, aAa2; a1b, AbAb1."
188,The priest and his boots,A,"ab, a1a2; a3b, cb1."
188,The priest and his boots,B,"aa1, Aa1Aa2; bb1, AcAb1."
189,The three little drummers,A,"ab, ab1; ab, ca1."
189,The three little drummers,B,"Aa2Aa3, Aa2Ac; Aa2Aa3, AcAa1."
189,The three little drummers,C,"Aa4Ab2, Aa4Ab2; Aa4Ab2, AcAa1."
190,O'Mahony's frolics,A,"ab, a1a1; ab, a2a3."
190,O'Mahony's frolics,B,"Aa4Aa5, Aa6Ab1; Aa4Aa7, Aa8Aa9."
190,O'Mahony's frolics,B1,"Aa4Aa5, Aa6Ab1; aa1, Aa2Aa3."
191,The Limerick tinker,A,"aa1, a2b; ac, b1b2."
191,The Limerick tinker,B,"Ab3a, Ab3Ab4; Ab3a1, Ab1Ab2."
191,The Limerick tinker,C,"Ac1Ba1, Ac1Ab5; Aa3Ac2, Ab1Ab2."
192,The boy from the mountain,A,"ab, aa1; aa2, b1a1."
192,The boy from the mountain,A1,"ab, aa1; aa2, b1a1."
192,The boy from the mountain,B,"Aa3Ab1, Aa3Aa4; Aa3a, Ab1Aa1."
192,The boy from the mountain,C,"Aa3Ab1, Aa3Aa4; Ba1Ba2, Ab1Aa1."
193,The woodcock,A,"aa, ab; aa, a1a1."
193,The woodcock,A1,"aa, ab; aa, a1a2."
193,The woodcock,B,"aAb1, AaAb2; aAb1, Aa1Aa1."
193,The woodcock,C,"Aa2Ab1, AaAb2; Aa2Ab1, Aa1Aa2."
194,Dunmanway lasses,A,"aa1, ab; aa1, a2b1."
194,Dunmanway lasses,B,"Aa3Ab2, Aa3a; a1Aa4, Aa5Ab1."
195,The boys of Ballinafad,A,"aa1, bc; ab1, de."
195,The boys of Ballinafad,B,"AaAb2, AaAa2; AaAb2, Ac1Ae."
196,Let it be so,A,"aa1, ab; aa1, cb."
196,Let it be so,B,"aAb1, a1Aa2; a2Ab2, AaAb."
197,The short grass,A,"ab, ac; ab, c1c2."
197,The short grass,B,"aAc3, a1Ac4; aAc3, Ac5b."
197,The short grass,B1,"aAc3, a1Ac4; Ac6a2, Ac1Ac2."
198,Miss Monroe's jig,A,"ab, ac; ab, a1a2."
198,Miss Monroe's jig,B,"Ab1Ab2, Aa1Ac1; Aa1Ac2, Aa1Aa2."
199,The spotted cow,A,"aa, ab; aa, a1b1."
199,The spotted cow,B,"aa, a1Ab1; a2a2, a3Ab1."
199,The spotted cow,C,"Ba4a, Ba4Ab; Ba4a, Aa1Ab1."
200,Daniel of the sun,A,"ab, a1a1; ab, a2a2."
200,Daniel of the sun,B,"aAb, Aa3Aa1; a1Ab, Aa2Aa2."
200,Daniel of the sun,C,"BaAb, Aa1Aa1; AaAb, Aa2Aa2."
201,Biddy's wedding,A,"ab, ab1; ab, cb1."
201,Biddy's wedding,B,"Aa1Ab2, Aa1Ab1; Aa1Ab3, AcAb1."
202,Paddy O'Carroll,A,"aa1, a2b; aa1, a2a3."
202,Paddy O'Carroll,B,"Aa4Ab1, Ab2a; Aa4Ab1, Aa2Aa3."
203,Haste to the wedding,A,"ab, a1a2; ab, cb1."
203,Haste to the wedding,B,"Aa3Aa4, Aa5Aa6; aAb, AcAb1."
204,The little house under the hill,A,"aa1, ab; aa2, a3b."
204,The little house under the hill,B,"Aa4Aa1, Aa4Ab; Aa4Ab1, Aa5Ab."
204,The little house under the hill,C,"Aa6Ab2, Aa6Ab; Aa6Ab2, Aa5Ab."
