Tune,Title,Part,Structure
617,The boys of Cappoquin,A,"ab, ab1; ab, ab1."
617,The boys of Cappoquin,B,"aa1, Ab2b; aa2, Ab2b."
618,The magpie's nest,A,"ab, ca1; ab, cd."
618,The magpie's nest,B,"aa1, Aa2Aa1; Ab1Ab2, a2Ad."
619,The threepenny bit,A,"ab, ac; ab, dc1."
619,The threepenny bit,B,"aAb1, aAc; aAb1, AdAc1."
620,How the money goes,A,"ab, ac; ab, ac1."
620,How the money goes,B,"aa1, ab; aa2, Ac2Ab1."
621,The sailor's jacket,A,"ab, ac; ab, ac."
621,The sailor's jacket,B,"aa1, aAc1; Ab1Ab2, bAc1."
622,The ivy leaf,A,"ab, aa1; ab, aa1."
622,The ivy leaf,B,"ab, a1Aa1; ab, cd."
623,An ugly customer,A,"ab, ac; ab1, c1c2."
623,An ugly customer,B,"aAc3, Ac1Ac2; Ac1b, cAb2."
624,The Dublin reel,A,"aa1, ab; aa1, ab1."
624,The Dublin reel,B,"aAb2, aAb3; a1Ab2, Aa1Ab."
624,The Dublin reel,C,"aAb4, Aa1Ab; aAb4, bAa2."
625,The sailor's return,A,"ab, a1c; de, a1e1."
625,The sailor's return,B,"aa1, a2Aa2; AdAe, Aa1Ae1."
626,Miss Johnson,A,"ab, aa1; ab, a2c."
626,Miss Johnson,B,"ab, aAa3; ab, cAa4."
627,The mills are grinding,A,"ab, a1b1; ab, cd."
627,The mills are grinding,B,"Aa2Ac1, Aa3Ad1; Aa2Ac1, AcAd."
628,Jerry Hayes,A,"aa1, ab; aa1, ab."
628,Jerry Hayes,B,"aa1, aa2; aa1, a3Ab1."
629,The Belfast lasses,A,"ab, ac; ab, ac1."
629,The Belfast lasses,B,"Ab1Ab, Ab1Ac; Ab1Ab, Ab1Ac1."
630,The lady behind the boat,A,"ab, cc1; ab, cd."
630,The lady behind the boat,B,"Ac2Ac3, Ac2a; bc, Ab1Ac4."
631,Touch me if you dare,A,"ab, ac; ab, a1c1."
631,Touch me if you dare,B,"aAb1, aAc2; aAb1, Aa1Ac1."
632,You rouge you dar'n't meddle me,A,"ab, ac; ab, ac1."
632,You rouge you dar'n't meddle me,B,"Ab1Aa1, Ab1Ac2; Ab1Aa1, AaAc3."
633,The flax in bloom,A,"ab, cb1; ab, de."
633,The flax in bloom,B,"Ae1Ab2, Aa1Ab; Ae1Ab2, aAe2."
634,The Wexford lasses,A,"ab, ac; ab, dc1."
634,The Wexford lasses,B,"Ab1Aa1, Ab1Ac2; Ab1Aa1, Ad1Ab2."
635,Pick your partner,A,"aa1, ab; aa1, ac."
635,Pick your partner,B,"Ab1Ac1, Ab1Ac2; Ab1Ac1, aAb2."
636,The Sligo lasses,A,"aa1, a2b; aa1, a2b1."
636,The Sligo lasses,B,"Aa3Ab2, Aa3a; Aa3Ab2, Ab3Ab4."
637,McFadden's mishap,A,"ab, ac; ab, de."
637,McFadden's mishap,B,"Aa1Ac1, Aa1Ac2; Aa1Ac3, Ad1Ac4."
638,Nellie O'Donovan,A,"aa1, ab; aa1, a2b1."
638,Nellie O'Donovan,B,"Ab2a, Ab2a1; Ab2a, Aa3a1."
639,On the sly,A,"ab, ab1; ab, a1b2."
639,On the sly,B,"ab, cb; ab1, Aa1d."
640,The four courts No. 1,A,"aa1, ab; aa2, cb1."
640,The four courts No. 1,B,"Aa3Ab2, Aa3Ab1; Aa3Ab2, Ab3Ab4."
640,The four courts No. 1,C,"Ac1a, Ac1Ab4; Ac2a, Ab3Ab5."
641,The four courts No. 2,A,"aa1, aa2; aa1, aa2."
641,The four courts No. 2,B,"Aa3a, Aa4Aa2; Aa3a, bAa2."
641,The four courts No. 2,C,"Aa1Ba1, Aa1Aa2; aBa1, a1Aa2."
641,The four courts No. 2,D,"Ca2Ba, Ca2Aa2; Ca2Ba, Ca2Aa2."
642,The man of the house,A,"aa1, ab; aa1, ab."
642,The man of the house,B,"Ab1a, Ab1a1; Ab1a2, Ab2Ab3."
643,Julia Delaney,A,"ab, ac; ab, ac1."
643,Julia Delaney,B,"aa1, a2Ac2; aa3, bAc."
644,The highway to Limerick,A,"ab, a1c; ab, a1c."
644,The highway to Limerick,B,"ab, aAb1; aAc1, Aa1Ac."
645,Col. McBain,A,"aa1, ab; aa2, cb1."
645,Col. McBain,B,"Aca, a1b; ca, a1d."
646,The collier's reel,A,"ab, a1b1; ab, cb2."
646,The collier's reel,B,"Ab3Ac1, Ab3Aa2; aAb4, AcAb2."
647,The maid that dare not tell,A,"aa1, a2b; aa1, a2b."
647,The maid that dare not tell,B,"aAb1, aAb2; aAb1, a1Ab."
648,The pigeon on the gate,A,"aa1, bc; aa1, de."
648,The pigeon on the gate,B,"Ae1Ae2, Ab1Ac1; Ae1Ae2, Ac2Ae3."
649,Lord McDonald's reel,A,"ab, ac; ab, ac."
649,Lord McDonald's reel,B,"aa, ab; a1a1, Ac1Ac2."
650,The maids of Mitchellstown,A,"ab, ab1; ab, ac."
650,The maids of Mitchellstown,B,"aa1, bAc1; aa1, bAb2."
651,Erin's hope,A,"ab, ac; ab, a1d."
651,Erin's hope,B,"ab, a1Ab; ab, cd."
652,Molly what ails you?,A,"ab, ac; ab1, ac1."
652,Molly what ails you?,B,"Aa1Ac2, Aa1Ac3; Aa1Ac2, AaAc4."
653,Tady's wattle,A,"aa1, a2b; aa1, a2b."
653,Tady's wattle,B,"Aa3a, Aa3Ab1; bAb2, cAb."
654,The old maids of Galway,A,"ab, a1b1; ab, a1b1."
654,The old maids of Galway,B,"Ab2Ab3, Ab2Ab1; Ab2Ab3, aAb1."
655,Miss McLeod's reel,A,"ab, ab1; ab2, b3c."
655,Miss McLeod's reel,B,"aAb, aAb4; a1Ab2, Ab5Ac1."
656,Sergt. Early's dream,A,"aa1, a2a3; a4a1, bc."
656,Sergt. Early's dream,B,"aAa3, a1b; aAa3, b1Ac1."
657,Push about the jorum,A,"ab, ac; ab, ac1."
657,Push about the jorum,B,"Ab1Ac2, Ab1Ac3; Ab1Ac2, ab."
658,Maurice Casey's fancy,A,"ab, ca; ab, ca1."
658,Maurice Casey's fancy,B,"Aa1a, Ac1Aa1; Aa1a, bb1."
659,Young Arthur Daly,A,"ab, a1b1; ab, a1b1."
659,Young Arthur Daly,B,"aa1, ab; Ab2Ab3, Aa1Ab1."
660,Considine's grove,A,"ab, ab1; ab, ab1."
660,Considine's grove,B,"aa1, aAb2; aa1, a2b."
661,Sleepy Maggie,A,"aa1, ab; aa1, ab."
661,Sleepy Maggie,B,"Aa2Ab1, Aa2Ab; Aa2Ab1, Aa3Ab2."
661,Sleepy Maggie,C,"Aa2Ab3, aAb3; AaAa1, AaAb."
661,Sleepy Maggie,D,"AaAa1, AaAb; Aa2Ab1, Aa2Ab."
661,Sleepy Maggie,E,"Aa2Ab1, Aa3Ab2; Aa2Ab3, CaAb3."
662,Drowsy Maggie,A,"aa1, ab; aa1, ab."
662,Drowsy Maggie,B,"aAb1, aAb; aAb1, bAb."
663,The plaid mantle,A,"ab, ac; ab, ac1."
663,The plaid mantle,B,"Ac2Ab, AcAc1; Ac2Ab, AaAc3."
664,The humors of Ballinacarrig,A,"ab, b1a1; ab, b1c."
664,The humors of Ballinacarrig,B,"aa1, a2Ac; aa1, bAc."
665,The harvest field,A,"ab, bc; ab, b1d."
665,The harvest field,B,"aAb1, aAd1; bb1, Aa1c."
666,The green groves of Erin,A,"aa1, ab; aa1, a2b1."
666,The green groves of Erin,B,"aa1, ab; a2a3, cb1."
667,The scolding wife,A,"aa1, ab; aa1, a2c."
667,The scolding wife,B,"Aa3Aa4, Aa3Ac; Aa3Aa4, aAc."
668,The mooncoin reel,A,"ab, cb; ab, cc1."
668,The mooncoin reel,B,"aa1, a2a3; aa1, bc."
669,Kiss me Kate,A,"ab, ac; ab, ad."
669,Kiss me Kate,B,"Ad1Aa1, Ad1a; a1Ad1, ba2."
670,Lord Gordon's reel,A,"aa1, bc; c1d, c2b1."
670,Lord Gordon's reel,B,"Aa2Ad1, Ab2Ac; Ac1Ad, Ac2Ab3."
671,Five miles away,A,"ab, a1c; ab, a1d."
671,Five miles away,B,"aa1, ab; aa1, b1Ad1."
672,Within a mile of Clonbur,A,"ab, a1c; ab, b1c."
672,Within a mile of Clonbur,B,"Aa2a, Aa2a1; Aa2a, Ab1Ac."
673,The Drummond lasses,A,"aa1, aa2; aa1, a3b."
673,The Drummond lasses,B,"Ab1a, Ab2Aa2; Ab1a, bAa2."
674,Johnny has gone to France,A,"ab, a1b1; ab, a1b2."
674,Johnny has gone to France,B,"aAb3, aAa2; a1b, b1Aa2."
675,The bonnie boy,A,"ab, ab1; ab, cd."
675,The bonnie boy,B,"Aa1Ab2, Aa1Ad; Aa1Ab, AcAd1."
676,Dooley's fancy,A,"ab, cd; ab, cb1."
676,Dooley's fancy,B,"aAb2, aAd1; Ad2Ab, bAa1."
677,The second wedding,A,"ab, ac; ab, ad."
677,The second wedding,B,"Ac1a, Ac1Ad1; Ac1a, Aa1Ab1."
678,The old schoolmaster,A,"ab, a1b1; ab2, a1b1."
678,The old schoolmaster,B,"Ab3Ab4, Ab5a; bAb4, Ab6Ab1."
679,Around the world for sport,A,"ab, ab1; ab, a1c."
679,Around the world for sport,B,"aAc1, a1Ac2; a2Ac3, a3Ab1."
680,Mickey by the fireside,A,"aa1, a2a3; aa1, a2b."
680,Mickey by the fireside,B,"aa1, aAb1; aAb2, bAb3."
681,The sailor's cravat,A,"aa1, ab; aa1, aa2."
681,The sailor's cravat,B,"Aa1a, bAb1; Aa1a, b1Aa3."
682,Coming over the hills,A,"ab, a1b1; ab, a1b1."
682,Coming over the hills,B,"aAb2, a1b; aAb2, a2b."
683,The reel of bogie,A,"ab, ac; ab, c1b1."
683,The reel of bogie,B,"ab, ab1; ac, Ab2d."
684,The Limerick lasses,A,"ab, ac; ab, ac1."
684,The Limerick lasses,B,"Ab1Ab2, Ab3Ab4; Ab1Ab5, aAb4."
684,The Limerick lasses,C,"aa1, ab; ac, b1b2."
685,Miss Wallace,A,"ab, cd; ab1, cd1."
685,Miss Wallace,B,"Ac1Ad2, Ac2Aa1; Ac1Ac3, aAd1."
686,The hornless cow,A,"ab, a1a2; ab, a1c."
686,The hornless cow,B,"Ab1Ac1, Ab1Ac2; Ab1Ac1, aAc2."
687,Jenny's welcome to Charley,A,"ab, a1c; ab, a1c1."
687,Jenny's welcome to Charley,B,"Aa2a, bc; Aa2a, dc."
687,Jenny's welcome to Charley,C,"Bb1Ba1, Bb2a; Bb1Ba1, Bd1Bc."
687,Jenny's welcome to Charley,D,"Ba2Ba3, BbCa1; b1Ba4, Aa3Ba1."
688,Tit for tat,A,"ab, cb1; ab, cd."
688,Tit for tat,B,"aa1, Aa1a2; aa1, bAd1."
689,The lightning flash,A,"ab, a1c; ab1, c1c2."
689,The lightning flash,B,"aAb2, aAc3; aAb3, Ac4Ac5."
690,Tim the market man,A,"ab, cd; ab, cd1."
690,Tim the market man,B,"aAb1, AcAd1; aAb1, AcAd2."
691,The ladies of Leinster,A,"ab, ac; ab, ad."
691,The ladies of Leinster,B,"ab, b1Ad; b2Ab1, Aa1Ad1."
692,Comely Jane Doowning,A,"aa1, ab; ac, db1."
692,Comely Jane Doowning,B,"Ad1Ac1, Ad1Ac2; Ad2Ac1, AcAd3."
693,The maid at the churn,A,"ab, a1a2; ab, a1c."
693,The maid at the churn,B,"aa1, aAc1; ab, cAa2."
694,A moonlight ramble,A,"ab, a1b1; ab, a1b1."
694,A moonlight ramble,B,"aAb, aAb1; aAb, bc."
695,Girls wil you take him?,A,"ab, ab1; ab, ab1."
695,Girls wil you take him?,B,"ab, a1Ab1; ab1, cAb1."
696,Bill Clancy's delight,A,"aa1, ab; aa1, ac."
696,Bill Clancy's delight,B,"aa1, aAb1; aa1, Ac1Ac2."
697,The jolly seven,A,"aa1, ab; aa1, cd."
697,The jolly seven,B,"Aa2Ab1, Aa2Ab; Aa2Ab1, AcAd1."
698,The Skibbereen lasses,A,"ab, ac; ab, a1c."
698,The Skibbereen lasses,B,"aAb, a1Ac; aAb, bAc."
699,The humors of Schull,A,"aa1, ba2; aa1, a3b1."
699,The humors of Schull,B,"Aa4a, a1b; Aa4a, b1Ab1."
700,After the sun goes down,A,"ab, ab1; ab, b2b1."
700,After the sun goes down,B,"Ab3a, Ab3Ab1; Ab3a1, Ab4Ab1."
701,Farewell to Erin,A,"ab, ac; ab, dc."
701,Farewell to Erin,B,"aAa1, a1Ac; Ad1Ab1, Ac1a2."
702,On the river bank,A,"ab, a1b; ab, a1c."
702,On the river bank,B,"aAb1, Aa2Ab2; aAb1, Aa2Ac1."
703,Fair-haired Mary,A,"ab, a1a2; ab, a1c."
703,Fair-haired Mary,B,"Ab1a, Aa3Ac1; a1a, a2Ac."
704,Pretty Peggy,A,"aa1, a2b; aa1, cd."
704,Pretty Peggy,B,"aa1, aAd1; a2Ad2, a3Ab1."
705,More power to your elvow,A,"ab, ab1; ab, ac."
705,More power to your elvow,B,"Aa1Aa2, Aa3Aa4; Aa5Ab, AaAc1."
706,Green garters,A,"ab, ac; ab, ad."
706,Green garters,B,"Ac1Ac2, Ac1Ac; Ac1Ac2, Ad1Ac3."
707,Jenny's wedding,A,"ab, b1c; db2, ef."
707,Jenny's wedding,B,"Aa1Ad1, Aa1Ab3; Aa1Ab4, Ae1Ac1."
708,The maid of Athlone,A,"ab, ac; ab, ac."
708,The maid of Athlone,B,"aa1, aAb1; aa1, ba1."
709,Keeper Hill,A,"aa1, ab; aa1, b1b2."
709,Keeper Hill,B,"ab, a1b1; ab, Aa2Ab3."
710,Good morning to your night cap,A,"ab, ac; ab, ac1."
710,Good morning to your night cap,B,"aAb1, aAc; aAb2, Ab3Ac1."
711,I'm waiting for you,A,"ab, b1c; db2, d1b3."
711,I'm waiting for you,B,"Ac1Aa1, ab; Ac1Aa1, cd."
712,O'Reilly's greyhound,A,"ab, a1c; ab, a1c."
712,O'Reilly's greyhound,B,"aa1, aAc1; ab, b1Ab."
713,Courting them all,A,"ab, cb1; ab, cb1."
713,Courting them all,B,"Ab2Ab3, Ab2Ab4; Ab2Ab3, AcAb1."
714,The green jacket,A,"ab, cd; c1b, cd1."
714,The green jacket,B,"aa1, a2Ad1; a3a4, bAd."
715,My honey in the house,A,"ab, ab1; ab, cb2."
715,My honey in the house,B,"aa1, Aa1Ab1; aa1, AcAb2."
716,McFadden's favorite,A,"ab, cd; a1b, cd1."
716,McFadden's favorite,B,"aAb1, a1Ab2; aAb1, bAa2."
717,The Callan lasses,A,"ab, ab1; ab, ab1."
717,The Callan lasses,B,"aa1, a2Ab1; aa1, bAb1."
718,Are you willing,A,"ab, ac; ab, b1c1."
718,Are you willing,B,"aa1, a2Ac1; a3a1, bAc1."
719,The traveller,A,"ab, cd; ab, ce."
719,The traveller,B,"Aa1Ab1, Aa1Ad; Aa1Ab1, Ab2Ab3."
720,Kiss the bride,A,"ab, a1c; ab, a1c1."
720,Kiss the bride,B,"aAb1, Aa1Ac; aAb1, Aa1Ac2."
721,Duffy the dancer,A,"aa1, ab; aa1, cb1."
721,Duffy the dancer,B,"Ab2Aa1, Ab2Ab1; Ab2Aa1, AcAb1."
722,Welcome home,A,"ab, a1b1; ab, a1c."
722,Welcome home,B,"Ab2Aa2, Ab2Ac1; Ab2Aa3, Aa1Ac2."
723,The linen cap,A,"ab, ac; ab1, dc."
723,The linen cap,B,"Aa1Ab, Aa1Ac; Aa1Ab1, AdAc."
724,The contradiction reel,A,"ab, a1c; ab, a1d."
724,The contradiction reel,B,"ab, ab1; ab, cAc1."
724,The contradiction reel,C,"Ba1Ba2, Ba3a; Ba4Ba5, Ba6a1."
724,The contradiction reel,D,"Bb2Bc1, Bb2Bc2; Bb2a, bBc3."
725,The smoky house,A,"aa1, aa2; aa1, bb1."
725,The smoky house,B,"ab, ac; a1b, Ab2d."
726,Mollie McCarthy,A,"aa1, ab; aa1, ab."
726,Mollie McCarthy,B,"Aa2a, Aa2a1; Aa2a, a2Ab."
727,Rolling down the hill,A,"aa1, bc; a2d, bc1."
727,Rolling down the hill,B,"Ab1a, Ab1Ad1; Ab1a, Ad2Ac."
728,The merry blacksmith,A,"aa1, bc; aa1, bd."
728,The merry blacksmith,B,"Aa2Aa, AbAc1; Aa3Aa, AbAd1."
729,Scotch Mary,A,"ab, ac; ab, ac1."
729,Scotch Mary,B,"aAb1, aAc1; aAb1, Ac2Ac3."
730,Within a mile of Dublin,A,"ab, ac; ab, ac1."
730,Within a mile of Dublin,B,"aAb1, aAc1; aAa1, Ab2b."
731,The Cameronian reel,A,"ab, ac; ab, ac1."
731,The Cameronian reel,B,"ab, cb; de, fAc2."
732,Winter apples,A,"aa1, ba2; aa1, bc."
732,Winter apples,B,"Ac1Ac2, Ac1a; bb1, a1Ab1."
733,The primrose lass,A,"ab, a1b1; ab, cb1."
733,The primrose lass,B,"Ab2a, Ab2a1; Ab2a, Ab3a2."
734,Shearing the sheep,A,"ab, ac; ab, ac1."
734,Shearing the sheep,B,"aAc2, a1Ac3; aAc2, Aa1Ac4."
735,Paddy's surprise,A,"ab, ac; ab1, dc1."
735,Paddy's surprise,B,"aAb2, aa1; aAb2, AdAc2."
736,Captain Byng,A,"ab, ac; ab1, dc1."
736,Captain Byng,B,"Aa1Aa2, Aa1Ac; Aa1Aa2, AdAc1."
737,The wind that shakes the barley,A,"aa1, ab; aa1, ab1."
737,The wind that shakes the barley,B,"aAb2, a1Ab3; aAb2, a2Ab3."
738,The piper's son,A,"ab, b1c; ab, b1d."
738,The piper's son,B,"Aa1a, Ac1Ad; Ac1a, Ab2Ad1."
739,Turkeys in the straw,A,"ab, cd; ab, c1e."
739,Turkeys in the straw,B,"Ac1Aa1, Ac2Ac3; Ac4Ad1, aAa2."
740,William White's reel,A,"ab, a1c; ab, a1c."
740,William White's reel,B,"ab, a1Ac1; a2b, Ac2Ac3."
741,Murtough Molly,A,"ab, cd; ab, ce."
741,Murtough Molly,B,"Aa1Ab1, Aa1Ac1; Aa1Ab1, Ac2Ad."
742,The field of oats,A,"ab, a1c; ab, a2a3."
742,The field of oats,B,"aa1, a2Ac1; aa1, aAc2."
743,The humors of Newcastle,A,"ab, ab1; ab, ab1."
743,The humors of Newcastle,B,"aa1, aAb2; aa1, bAb3."
744,Paddy Murphy's wife,A,"ab, ac; ab, ac."
744,Paddy Murphy's wife,B,"Ab1Ab2, Ab1a; Ab1Ab2, Aa1a1."
745,The girl with the laughing eyes,A,"ab, a1c; ab, a2d."
745,The girl with the laughing eyes,B,"aAb1, aAb2; aAb, Aa2Ad1."
746,Give us another,A,"ab, b1c; ab, b1c1."
746,Give us another,B,"ab, ac; ab, Ab1Ac."
747,The northern lasses,A,"aa1, bb1; ac, bd."
747,The northern lasses,B,"Aa2Ac1, Aa2a; Ac2b, b1a1."
747,The northern lasses,B1,"Aa2Ac1, Aa2a; Ac2b, b1c."
748,Clarkson's reel,A,"ab, cd; ab, c1d1."
748,Clarkson's reel,B,"Aa1Ad2, Aa1Ac2; Ac3Ad2, Ac4Ad."
749,Rakish Paddy,A,"ab, cb1; a1b2, c1b3."
749,Rakish Paddy,B,"Aa2Aa3, aa1; Aa2Ab4, a2Ab3."
750,The Mullingar races 1,A,"ab, cc1; ab, c2c3."
750,The Mullingar races 1,B,"Aa1a, Aa1Aa1; Aa1a, bAc4."
751,The jolly tinker,A,"ab, ac; ab, ac1."
751,The jolly tinker,B,"aAa1, a1Ab1; aAa1, a1Ab1."
751,The jolly tinker,C,"aa1, a2Ac1; aa1, a2Ac1."
751,The jolly tinker,D,"Ca3Ca3, aAc1; Ca3Ca3, aAc1."
751,The jolly tinker,E,"Ca4Ba2, Da1Ac1; CaBa2, Da2Ac."
752,The queen's shilling,A,"ab, a1c; ab, ac1."
752,The queen's shilling,B,"aa1, ab; a2b1, cAc."
753,Little Katie Kearney,A,"ab, ac; ab, ac."
753,Little Katie Kearney,B,"Ab1a, a1Ac; Ab1a, bAc1."
754,The maid in the sherry tree,A,"aa1, a2b; aa1, a2b."
754,The maid in the sherry tree,B,"aa1, aAb1; aAa3, Ab2Ab3."
755,The watchmaker,A,"ab, aa1; ab, aa1."
755,The watchmaker,B,"aa1, ab; Aa2Aa3, Ab1Aa1."
756,The same old story,A,"ab, b1b; cb, b1b."
756,The same old story,B,"Ac1Aa, Ab2Aa1; Ab2Ac2, Ab2Aa1."
756,The same old story,C,"Ac3Ac4, "
757,The fourpenny bit,A,"ab, cc1; ab1, b2d."
757,The fourpenny bit,B,"aAd1, bAb3; ab1, bc."
758,The jug of punch,A,"ab, a1b1; cd, ef."
758,The jug of punch,B,"Ac1Ae1, Aa2Aa3; Ac1Ae1, Ad1Af."
759,The grey plover,A,"ab, ac; ad, ef."
759,The grey plover,B,"Aa1Ae1, Aa1a; Aa1Ad, AeAf."
760,My sweetheart Jane,A,"ab, ab1; ab, ac."
760,My sweetheart Jane,B,"Ab2Ab3, Ab2Ab4; Ab2Ab3, aAc."
761,Kiss your partner,A,"ab, aa1; ab, ab1."
761,Kiss your partner,B,"ab, ac; ab, dAa2."
762,Corney is coming,A,"aa1, a2a3; aa1, a2b."
762,Corney is coming,B,"aa1, a2Ab; bb1, a3Ab."
763,The mountain rose,A,"ab, ac; ab, a1c1."
763,The mountain rose,B,"ab, a1c; ab, Aa1Ac1."
764,The green gates,A,"aa1, a2b; aa, bc."
764,The green gates,B,"aAa1, Aa2Ab; aAa3, AbAc."
765,The western lasses,A,"aa1, ab; aa1, cd."
765,The western lasses,B,"aAa2, aAd1; a1Ab1, bAb2."
765,The western lasses,C,"Ad2Bb1, aBb2; Ad2Bb1, aAb2."
766,Rolling on the ryegrass,A,"aa1, a2b; aa1, a3b."
766,Rolling on the ryegrass,B,"aAa4, a1Ab1; aAa4, a2Ab1."
766,Rolling on the ryegrass,C,"Aa5a, a1Ab2; Aa5a, a2Ab1."
767,The four-hand reel,A,"aa1, ab; aa2, ab1."
767,The four-hand reel,B,"Aa3a, Aa3Ab1; a1b, b1Ab."
768,The flowers of Limerick,A,"ab, a1c; ad, ea2."
768,The flowers of Limerick,B,"Aa3Ab1, Ad1Ac1; Aa4Ad, AeAa2."
768,The flowers of Limerick,C,"Aa5a, Ae1Ab2; Ad2Ad3, AeAa6."
768,The flowers of Limerick,D,"aAd4, Ad5Ac2; Ad6Ad3, AeAa7."
769,The piper's despair,A,"ab, cb; ab, c1d."
769,The piper's despair,B,"Ac2Ac2, Ac3Ac4; Ac2Ac2, Aa1a."
770,The Edenderry reel,A,"aa1, ab; aa1, ab."
770,The Edenderry reel,B,"Ab1Ab2, Ab1Ab; Ab1b1, b2Ab."
771,The old bog ground,A,"aa1, ab; aa1, ab."
771,The old bog ground,B,"Ab1a, bAb; Ab1a, b1Ab2."
772,The absent-minded woman,A,"ab, ac; ab1, b2b3."
772,The absent-minded woman,B,"Ab4Ab5, Ab4Ac1; Ab4Ab5, aa1."
773,The hag by the fire,A,"aa1, ab; aa1, ab1."
773,The hag by the fire,B,"aAb2, a1Ab1; a2Ab2, a3Ab1."
774,Johnny Allen's reel,A,"ab, ab1; ab2, cc1."
774,Johnny Allen's reel,B,"aAb3, aAc1; aAb2, Acb."
775,The maid of Feakle,A,"ab, ab1; ab, cb2."
775,The maid of Feakle,B,"Aa1a, Aa1Ab2; Aa1a, Aa2b."
776,The humors of Scarriff,A,"ab, ac; ab, ac."
776,The humors of Scarriff,B,"aa1, aAa1; aa1, bAc."
777,The rambler in Cork,A,"ab, a1c; ab, a1b1."
777,The rambler in Cork,B,"ab, aAc1; ab, Aa2Ac."
778,The maids of Kilmallock,A,"ab, b1c; ab, b1c1."
778,The maids of Kilmallock,B,"Ac2a, Ac2Ac1; Ac3a, bAc."
779,The heather breeze,A,"aa1, ab; aa1, cb1."
779,The heather breeze,B,"aa1, aAb1; aa1, a2Ab1."
779,The heather breeze,C,"aa1, a2Ab1; a2a1, bc."
780,Cooleen bridge,A,"ab, a1b1; a2a3, cb2."
780,Cooleen bridge,B,"Ab3Ab4, Aa4Aa5; Ac1Aa6, Aa5Ab5."
781,Captain Rock,A,"aa1, a2a3; a4b, cd."
781,Captain Rock,B,"aa1, Ab1Ad; a2b, Ab1Ad."
782,The tinker's reel,A,"ab, aa1; ab, ac."
782,The tinker's reel,B,"aa1, ab; aAb1, Aa1c."
783,The maids of Tulla,A,"ab, a1c; ab, c1d."
783,The maids of Tulla,B,"Aa2Ab1, Aa3a; Aa2Ab1, Ac1Ad."
784,The Gaelic revival,A,"ab, cd; b1c1, c2e."
784,The Gaelic revival,B,"Aa1a, Ac3a1; Ab2a2, a3Ac4."
784,The Gaelic revival,C,"aAb, ab; ab1, Ac2Ae."
784,The Gaelic revival,D,"Ab3Ca1, aAd1; a1Ab4, Cb2b."
785,A ha'porth of tea,A,"ab, a1c; ab, a1c."
785,A ha'porth of tea,B,"aa1, a2Ac; aa1, bAc."
786,Over the moor to Maggie,A,"ab, cd; ab, d1a1."
786,Over the moor to Maggie,B,"aAb, Ac1Ad2; a1Ab, Ad3Aa2."
786,Over the moor to Maggie,C,"Ba2Ba3, AcAd4; Ab1a, Ad1Aa3."
787,Bunker Hill,A,"ab, cd; ab, ed."
787,Bunker Hill,B,"Aa1a, a1Ae1; Ab1Ab2, AeAd1."
787,Bunker Hill,C,"Aa2Aa1, Aa3a; Aa2Ab3, AeAd."
788,The king of the clans,A,"ab, cb1; dd1, b2e."
788,The king of the clans,B,"aAb3, AcAb1; a1Ab4, Ad2Ae."
789,Boil the breakfast early,A,"ab, ab1; ab, a1b1."
789,Boil the breakfast early,B,"aa1, aAb1; aAb2, Aa1Ab1."
790,The maid I ne'er forgot,A,"aa1, a2b; a3a1, a4b1."
790,The maid I ne'er forgot,B,"Aa5a, Aa2b; cAa1, Aa2Ab1."
791,The honeymoon reel,A,"ab, a1c; ab1, a2c1."
791,The honeymoon reel,B,"aAb, Aa1Ac2; aAb1, Aa2Ac3."
792,The cup of tea,A,"ab, ab1; ab, a1b2."
792,The cup of tea,B,"aa1, aAb2; ab, a2Ab2."
792,The cup of tea,C,"aa1, a2Ab2; aa1, Aa2Ab3."
793,Come west along the road,A,"ab, ac; ab, ac1."
793,Come west along the road,B,"Aa1a, Aa1a1; Aa1a, Ab1Ac2."
794,The long strand,A,"ab, a1c; ab1, de."
794,The long strand,B,"aa1, bb1; a2c, Adb2."
795,The teetotaler's fancy,A,"ab, a1c; ab, a1c1."
795,The teetotaler's fancy,B,"Aa2Ac2, Aa3Ac3; Aa2Ac2, aAb1."
796,Kitty in the lane,A,"ab, ac; ab, a1d."
796,Kitty in the lane,B,"aAa2, aAd1; aa1, Aa3Ac1."
797,The Chicago reel,A,"ab, cb1; a1b, de."
797,The Chicago reel,B,"Ab1a, bAe1; b1a1, b2Ae2."
798,Mrs. Delaney,A,"ab, a1c; ab1, dc1."
798,Mrs. Delaney,B,"Aa2a, Aa3Ac2; Aa2b, a1Ac3."
799,Mayor Harrison's fedora,A,"ab, a1c; ab1, c1d."
799,Mayor Harrison's fedora,B,"aAb2, a1b; aAc2, Ac1Ad1."
800,Miss Fahey's fancy,A,"ab, cd; a1b1, ec1."
800,Miss Fahey's fancy,B,"Ad1a, Ad1a1; Ae1Ae2, Aa2Ad2."
801,Clancy's fancy reel,A,"ab, a1c; a2b, cd."
801,Clancy's fancy reel,B,"Aa3a, Aa4Ac1; Aa3a1, AcAd1."
802,The shaskeen reel,A,"ab, cb1; a1b, c1d."
802,The shaskeen reel,B,"Ad1Ab2, AcAb3; Ad1Ab2, Ac1Ad2."
803,Peter Street,A,"ab, a1b1; ab, cd."
803,Peter Street,B,"Aa2Ab2, AaAb; Ac1Ac1, aAc2."
804,Pay the girl her fourpence,A,"ab, a1c; ad, a2c."
804,Pay the girl her fourpence,B,"aAc1, aAc1; aAc1, a1a1."
805,Farewell to Ireland,A,"ab, a1b1; a2b2, cd."
805,Farewell to Ireland,B,"Aa3a, Ac1Ad1; ba1, a2Ad2."
805,Farewell to Ireland,C,"Aa4a, bBb1; Aa4Ba1, Ba2Ad3."
806,Chief O'Neill's favorite,A,"ab, cd; ab, c1e."
806,Chief O'Neill's favorite,B,"AcAd1, Aa1Ad; AaAb, Ac1Ae1."
807,The Greencastle hornpipe,A,"ab, ab1; ab, cd."
807,The Greencastle hornpipe,B,"aa1, a2a3; Ab2a4, bAd1."
808,The Cloone hornpipe,A,"aa1, a2b; ab1, b2c."
808,The Cloone hornpipe,B,"Aa2Ac1, Ab3Ac2; Ab4a, Ab2Ac."
809,The Kildare fancy,A,"aa1, ba2; aa1, ba3."
809,The Kildare fancy,B,"Ab1a, Ab2Aa4; Ab1a, Ab3Aa3."
810,Dunphy's hornpipe,A,"ab, a1b1; ab, cb2."
810,Dunphy's hornpipe,B,"Ac1Aa2, Ab3Ab4; Ab5Aa3, Ac2Ab6."
811,The rights of man,A,"ab, cc1; ab, c2d."
811,The rights of man,B,"Aa1a, Ad1Ac3; Ab1Ac4, Ac2Ad2."
812,Slievenamon,A,"ab, cd; b1b2, c1a1."
812,Slievenamon,B,"aAc2, a1Ab3; aAb4, Ab5Aa1."
813,Hennessy's hornpipe,A,"ab, a1b1; ab, cd."
813,Hennessy's hornpipe,B,"Aa2Ad1, Ac1Ad2; Ac2Ac3, AcAd3."
814,The quarrelsome piper,A,"aa1, bb1; aa1, ba2."
814,The quarrelsome piper,B,"Aa3Aa4, Aa5Aa6; AaAa1, AbAa7."
815,The Devil's dream,A,"aa1, a2a3; aa1, bc."
815,The Devil's dream,B,"Aa4Aa5, Aa2Aa3; Aa4Aa5, AbAc."
815,The Devil's dream,C,"Aa6a, bAa7; Aa6a1, AbAc."
816,The Liverpool hornpipe,A,"ab, cb1; ab, de."
816,The Liverpool hornpipe,B,"Ac1Ab2, AcAb1; AaAb, AdAe."
816,The Liverpool hornpipe,C,"Ac2Ab3, Ac3Ab4; AaAb5, Ac4Ae."
817,The Tinware lass,A,"ab, a1a2; a3b, a4c."
817,The Tinware lass,B,"Ac1Ab1, aAa2; Aa3Ab, Aa4Ac2."
818,Hillside cottage,A,"aa1, a2b; aa1, a3b1."
818,Hillside cottage,B,"Aa4Aa5, Aa4Aa6; Aa7Aa8, Aa3Ab2."
819,The heather glen,A,"aa1, bc; aa1, bc1."
819,The heather glen,B,"Aa2Ac2, Aa3a; Aa4Aa1, Aba1."
820,Limerick Junction,A,"ab, b1c; ab, da1."
820,Limerick Junction,B,"Ad1a, a1Ac1; Ad1a2, bAa2."
821,The top of the morning,A,"aa1, a2b; aa1, b1a3."
821,The top of the morning,B,"Aa4Aa5, Aa6Aa7; AaAa1, Ab1Aa."
822,Hick's hornpipe,A,"ab, a1b1; a2b, cc1."
822,Hick's hornpipe,B,"Ac2Ac3, Aa3Ab2; Ac2Ac3, Ac4Aa4."
823,Bantry Bay,A,"ab, cb1; c1a1, ab2."
823,Bantry Bay,B,"Aa2Ab3, Ab4Ab5; Ac1Aa1, AaAb2."
824,The boys from Scart,A,"ab, cd; ab, cd1."
824,The boys from Scart,B,"Aa1Ad2, Aa2a; Aa1Ad2, a1Ad3."
825,Fisher's hornpipe,A,"aa1, bc; aa1, dc1."
825,Fisher's hornpipe,B,"aa1, a2a3; a4a5, Ad1Ac2."
826,No.1 The sailor's hornpipe,A,"aa, bb; aa, ca1."
826,No.1 The sailor's hornpipe,B,"aAb1, Ac1b; aAb1, Acc."
827,No.2 The sailor's hornpipe,A,"aa1, ba1; aa1, cb1."
827,No.2 The sailor's hornpipe,B,"Ab2Ab3, AbAa1; AaAa1, Aca."
828,The Wicklow hornpipe,A,"ab, cd; ab, c1b1."
828,The Wicklow hornpipe,B,"Ac2a, Aa1Ad1; Aa2Ab2, Ac1a1."
829,Miss Brown's fancy,A,"ab, cd; ab1, ef."
829,Miss Brown's fancy,B,"Ab2Af1, Ac1Ac2; Ab2a, Ad1Af2."
830,The men from Mallow,A,"aa1, a2b; aa1, ca3."
830,The men from Mallow,B,"Aa4Aa5, Ac1a; Aa4Aa1, AcAa3."
830,The men from Mallow,C,"Aa4Aa5, Ac1Ba; aa1, Acb."
831,McCarty's hornpipe,A,"aa1, a1b; ca, dd1."
831,McCarty's hornpipe,B,"aAa, Aa1Aa1; AbAc, AaAd."
831,McCarty's hornpipe,C,"Ad1Ba1, Aa2Aa2; Ab1Ac, AaAd."
831,McCarty's hornpipe,C1,"Ad1Ba1, Aa2Aa2; Ab1Ac, AaAd."
831,McCarty's hornpipe,D,"Ad1Ba2, "
832,Big Dan O'Mahony,A,"ab, a1b1; ab, cd."
832,Big Dan O'Mahony,B,"Aa2a, Aa1Ab; a1a2, bAd1."
832,Big Dan O'Mahony,C,"Ba1Ba2, Aa1Ab1; Ac1a, Bb1Ad2."
833,The trumpet hornpipe,A,"aa1, a2a3; aa4, a5a6."
833,The trumpet hornpipe,A1,"aa1, a2a3; aa4, a5a7."
833,The trumpet hornpipe,B,"Aa8a, Aa9Aa10; Aa11b, b1Aa12."
834,The Mullingar races 2,A,"aa1, a2a3; aa1, a4b."
834,The Mullingar races 2,B,"aa1, Aa5a2; Aa6Aa7, Ab1Ab."
835,The Kilkenny hornpipe,A,"ab, ca1; ab, c1b1."
835,The Kilkenny hornpipe,B,"Aa2Ab2, Aa3a; AaAb, Ac1Ab1."
836,Jerry Daly's hornpipe,A,"ab, cd; ab, cd1."
836,Jerry Daly's hornpipe,B,"Ac1a, Aa1a1; Aa2Ab1, AcAd1."
837,The banks of the Ilen,A,"ab, ac; ab, ac."
837,The banks of the Ilen,B,"Ac1a, Ac1Ac1; a1Ab1, AaAc2."
838,Kit O'Mahony's hornpipe,A,"ab, b1c; ab2, b3c."
838,Kit O'Mahony's hornpipe,B,"Ab4Ab3, Ab5a; Aa1b, Ab3Ac1."
839,The boys of Ballysimon,A,"ab, cd; a1b, cd."
839,The boys of Ballysimon,B,"aa1, aAb1; AaAb, AcAd1."
839,The boys of Ballysimon,C,"Ab2a, Ac1Ad; Ac1Ab3, Ac1Ad."
839,The boys of Ballysimon,D,"Baa, BaAa2; Aa3a1, AcAd1."
840,Fair and forty,A,"ab, cc1; ab, cb1."
840,Fair and forty,B,"aa1, aAc2; aa1, Aa1b."
841,The slipper hornpipe,A,"ab, a1b1; ab, ca2."
841,The slipper hornpipe,B,"Aa3Ab2, aAb1; AaAb, Ac1Aa4."
842,O'Dwyer's hornpipe,A,"aa1, a2a3; aa1, a4a5."
842,O'Dwyer's hornpipe,B,"aa1, bAa6; ca1, Aa3Aa7."
842,O'Dwyer's hornpipe,C,"Aa8a, a1Aa3; Aa8a, Aa4Aa5."
842,O'Dwyer's hornpipe,D,"Aa9Aa9, Aa10Aa11; aBa2, Aa3Aa12."
843,The Groves hornpipe,A,"ab, a1b1; ab, b2a2."
843,The Groves hornpipe,B,"Aa3Ab3, Ab4Ab5; Aa3Ab6, Ab2Aa4."
843,The Groves hornpipe,C,"Aa5Aa6, Aa7Aa8; Aa5Aa8, Aa9Aa10."
843,The Groves hornpipe,D,"Aa11Aa12, Aa11Aa9; Aa11Aa13, Aa9Aa14."
843,The Groves hornpipe,E,"Ab7Ab8, Ab7Aa15; Aa16Aa17, Ab2Aa10."
844,The first of June,A,"aa1, a2b; ab1, cd."
844,The first of June,B,"aAa3, Ab2a1; a2Ab3, Ac1Ad1."
845,The last of the twins,A,"aa1, ba2; aa1, bc."
845,The last of the twins,B,"Ac1Aa3, Aba; Ac1Aa3, AbAc1."
846,Kitty's wedding,A,"ab, ca1; ab, cc1."
846,Kitty's wedding,B,"ab, Ac1c; ab, Ac1d."
847,The harvest home,A,"ab, a1b1; ab, cd."
847,The harvest home,B,"aa, Aa1Ab2; AaAb, AcAd1."
848,The echo,A,"ab, a1b1; ab, b2c."
848,The echo,B,"aAb3, Aa1Ab1; aAb3, Ab2Ac1."
849,Murray's hornpipe,A,"ab, b1b2; ab, b3a1."
849,Murray's hornpipe,A1,"ab, b1b2; ab, b3a2."
849,Murray's hornpipe,B,"aAa3, a1Aa4; Ab4Ab4, Ab5Aa5."
849,Murray's hornpipe,B1,"aAa3, a1Aa4; Ab4Ab4, Ab5Aa6."
850,McDermott's hornpipe,A,"aa1, a2a3; aa1, a4b."
850,McDermott's hornpipe,B,"Aa5Aa6, Aa5Ab1; Aa5Aa6, Aa7Aa3."
851,Glengariff hornpipe,A,"ab, b1c; ab2, b3a1."
851,Glengariff hornpipe,B,"aAb4, Aa2b; AaAb2, Ab3Aa3."
852,The Sweep's hornpipe,A,"ab, a1a2; ab, a3c."
852,The Sweep's hornpipe,B,"Ab1Ac1, aa1; Ab1Ac1, Ac2Ac3."
852,The Sweep's hornpipe,C,"Ab2a, a1a2; Ab2a3, Ab3Ac."
853,Galway Bay,A,"aa1, bc; a2a3, a4d."
