Tune,Title,Part,Structure
205,Breeches Mary,A,"ab, b1b2; ab, b3c."
205,Breeches Mary,B,"Ab4Ac1, Ab4Ab2; Ab4Ac1, Ab3Ac."
206,Jimmy O'Brien's jig,A,"ab, cb; ab, c1c2."
206,Jimmy O'Brien's jig,B,"Aa1Ac3, Aa1a; Aa1Ac3, Ac1Ac2."
206,Jimmy O'Brien's jig,C,"aa1, aBa1; aa1, Ac1Ac2."
207,I will if I can,A,"aa1, ab; ac, c1b1."
207,I will if I can,B,"Aa2Ab2, Aa2Ab; Aa2Ac, c1Ab3."
208,Miss Wiseman's fancy,A,"ab, cc1; ab, c2a1."
208,Miss Wiseman's fancy,B,"aa1, bAb1; aa1, Ac2Aa1."
208,Miss Wiseman's fancy,C,"aAb, BbAb2; a1Ab, Ac2Aa1."
209,Green sleeves,A,"aa1, a2b; aa1, ca3."
209,Green sleeves,B,"Aa4Ab1, Aa5Aa6; Aa4Aa1, AcAa3."
210,The miners of Wicklow,A,"ab, b1b2; ab3, b4b5."
210,The miners of Wicklow,A1,"ab, b1b2; ab3, a1c."
210,The miners of Wicklow,B,"A1c1Aa2, A1c2Aa3; Aa4Ab6, Aa1A1c."
210,The miners of Wicklow,B1,"A1c1Aa2, A1c2Aa3; Aa4Ab6, Ab4Ab5."
211,My brother Tom,A,"ab, ac; ab, b1c."
211,My brother Tom,B,"Ab2a, Ab3Ac1; Ab2a, AbAc."
211,My brother Tom,B1,"Ab2a, Ab3Ac1; a1a2, Ab4Ac."
212,Paddy's resource,A,"ab, cc1; ab, ca1."
212,Paddy's resource,B,"Ab1Ac2, AbAc2; Ab2Ac3, Aa2a."
213,Before I was married,A,"ab, ab1; ab, a1b1."
213,Before I was married,B,"Ab2a, bAb3; Ab2a, bAb3."
214,The old grey goose,A,"ab, cb1; b2d, eb."
214,The old grey goose,B,"Ab1a, a1a2; aAd1, AeAb."
214,The old grey goose,C,"Ae1Ba3, Ab2Ae2; Aa1Ba4, AeAb."
214,The old grey goose,D,"Ab3Ab, Ab3Ab4; Ab3Ab5, AeAb."
214,The old grey goose,E,"Aa2Ab6, Aa2Ab7; Aa2Ad1, AeAb."
214,The old grey goose,F,"Ba5Ab, Ac1Ab1; Ab2Ad2, AeAb8."
215,Hinchy's delight,A,"ab, a1c; ab, a1c1."
215,Hinchy's delight,B,"Aa2Aa2, Aa3Ac2; Ab1Ac3, Aa4Ac1."
215,Hinchy's delight,C,"Ac4Ac5, Aa1Ac; Ac4Ab2, Aa1Ac1."
216,Come now or stay,A,"ab, cc1; ab, b1a1."
216,Come now or stay,B,"aa1, Aa2b; aa1, Ac2Aa3."
217,Buttermilk Mary,A,"ab, cd; b1b2, c1d1."
217,Buttermilk Mary,B,"Ac2Aa1, Ad2Ad3; Ac3Ac4, Ad4Ad1."
218,The Connachtman's rambles,A,"aa1, a2b; ac, db1."
218,The Connachtman's rambles,B,"Aa3Ad1, Aa3Ad2; aAc1, AdAb1."
219,Father Fielding's favorite,A,"ab, cb1; ab2, c1b3."
219,Father Fielding's favorite,B,"Ab4a, Ab4a1; a2Aa1, a3Ab3."
220,Father Tom's wager,A,"ab, cd; ab, cd1."
220,Father Tom's wager,B,"Ac1Aa1, Ad2Ad3; Ac1Aa2, Aa3Ad1."
221,Bryan O'Lynn,A,"ab, ab1; ab, cb1."
221,Bryan O'Lynn,B,"Aa1Aa2, Ac1a; Aa1Aa2, Aa3Ab1."
222,O'Gallagher's frolics,A,"aa1, bc; aa1, b1b2."
222,O'Gallagher's frolics,B,"Aa2Aa3, Ac1Aa4; Aa5Ac2, Ab1Ab2."
223,The rambler from Clare,A,"ab, cb1; ab, b2a1."
223,The rambler from Clare,B,"aAc1, Ab3Ac1; aAc2, Ab2Aa1."
224,Biddy Maloney,A,"aa1, bb1; ac, dc1."
224,Biddy Maloney,B,"Aa2Ac2, Ad1a; Ab2Ab3, Ad2Ac1."
224,Biddy Maloney,C,"Ad3Ab4, Ad1Ba; Ab5Ab4, Ad2Ac1."
224,Biddy Maloney,D,"Ab6Ac3, Ab7Ad4; Ac4Ba1, AdAc1."
224,Biddy Maloney,E,"aa, Ad1Ba; aa, bAb8."
224,Biddy Maloney,F,"Aa3Ac5, Ab9Eb1; Aa3Eb2, Eb3Ab8."
224,Biddy Maloney,G,"Aa4Ab10, Ad1Ba; Aa4Ab10, AdAc1."
225,The newmarried couple,A,"ab, cc1; ab, c2a1."
225,The newmarried couple,B,"AcAc3, AcAc1; Ac4Ab, Ac2Aa1."
226,Tim Hogan's jig,A,"aa1, ab; aa1, cb."
226,Tim Hogan's jig,B,"Ac1Ab1, Ac2Ab2; Ac1Ab3, AcAb."
226,Tim Hogan's jig,C,"aAc3, aAc4; aAc3, AcAb."
227,Dick Sullivan's favorite,A,"ab, ac; ab, a1c."
227,Dick Sullivan's favorite,B,"Ab1Aa2, Ab2a; Ab1Ac1, Aa1Ac."
227,Dick Sullivan's favorite,C,"Aa3Ac2, Aa3Ac3; Aa3Ac1, Aa1Ac."
228,Come to dinner,A,"ab, a1c; ab1, a2a."
228,Come to dinner,B,"Ab2a, a1Aa1; Ab2a, a1Aa."
229,The jolly jocker,A,"ab, ac; a1d, c1c."
229,The jolly jocker,B,"Ad1Aa1, Ad1a; Ad1Aa1, Ad2Ac."
230,Mixing the punch,A,"ab, cb1; b2b3, de."
230,Mixing the punch,B,"Ac1Ac2, ab; Aa1b1, AdAe."
231,Finerty's frolic,A,"ab, ca1; ab1, c1a1."
231,Finerty's frolic,B,"Ac2Ac3, Aa2Aa3; Ab2Ab1, Ac1Aa1."
232,Old as the hills,A,"ab, ab1; cb, de."
232,Old as the hills,B,"Ab2Aa1, Ac1Aa2; Ab3a, Ad1Ab2."
232,Old as the hills,C,"Aa1Ac1, Aa2Ab3; BaAd1, Aa3"
233,Long John's wedding,A,"ab, aa1; ab, a1c."
233,Long John's wedding,B,"Aa2Ac1, Aa1Aa2; Aa3Ab1, Aa1Ac."
234,Kit O'Mahoney's jig,A,"aa1, bc; a2d, b1c1."
234,Kit O'Mahoney's jig,B,"Ac2Ab1, Ac2Aa3; Aa4Ad1, Ab1Ac1."
234,Kit O'Mahoney's jig,C,"Aa5Ac3, Ab2Ab3; Aa5a, Ab1Ac1."
234,Kit O'Mahoney's jig,D,"Ab4Ab1, Ac2Ab5; Ab6Ab7, Ab1Ac1."
235,The humors of Drinagh,A,"ab, ac; ab, b1d."
235,The humors of Drinagh,B,"Ab1Ab2, Ab1Ab2; Ab2Ab3, Ab1Ad."
235,The humors of Drinagh,C,"aAc1, aAc2; aAb, Ab1Ad."
235,The humors of Drinagh,D,"Ab2Ab4, Ab2Ad1; Ab2Ab3, Ab5Ad1."
236,The gallowglass,A,"ab, a1b1; aa2, a3b."
236,The gallowglass,B,"aAb, Aa1Ab1; aAb2, Aa3Ab."
236,The gallowglass,C,"BaAb, Aa1Ab1; Ba1a, a1Ab."
237,The Fardown farmer,A,"ab, ab1; ab, cd."
237,The Fardown farmer,B,"Ab2Ac1, Ab2Ab3; Ab2Ac1, AcAd."
238,The old horned sheep,A,"ab, ac; ab, b1b2."
238,The old horned sheep,B,"Ab3Ab3, Ab3Ab4; Ab3Ab5, Ac1Ac2."
239,The Laccarue boys,A,"ab, ca1; ab, c1d."
239,The Laccarue boys,B,"Ab1Ab, Aa2Ad1; Ab2Ab, Ac1Ad."
240,The lark in the morning,A,"ab, a1c; c1d, ed1."
240,The lark in the morning,B,"aa1, aa1; a1Ab1, AeAd1."
241,Sergt. Stack's favorite,A,"aa1, a2a3; aa1, ba4."
241,Sergt. Stack's favorite,B,"aAa5, ab; ab1, Aa2Aa6."
242,The ruins of Killmallock,A,"ab, ca1; ab1, b2d."
242,The ruins of Killmallock,B,"Aa2Ac1, Aa3Aa4; Aa2Ac1, Aa4Ad1."
243,The Mountaineers' march,A,"aa1, ba1; aa1, bc."
243,The Mountaineers' march,B,"Aa2Aa3, Aa2a; Aa2Aa4, Ab1Ac."
244,The top of Cork road,A,"ab, cb; ab, ca1."
244,The top of Cork road,B,"Ac1Ab1, Aa2Ac2; Aa3Ac, Aa1Ac1."
244,The top of Cork road,C,"Ab1Aa2, Ac2Aa3; AcAa1, "
245,The Monaghan jig,A,"aa1, aa2; aa1, a3a4."
245,The Monaghan jig,B,"ab, a1Aa4; ab, Aa3Aa4."
245,The Monaghan jig,C,"Aa5Bb1, Aa5Aa6; Aa5Bb1, Aa3Aa4."
246,The mooncoin jig,A,"ab, a1b1; ab, cb1."
246,The mooncoin jig,B,"Ab2Ab3, Ab2Ab4; Ab2a, a1Ab1."
246,The mooncoin jig,C,"Aa2Ab5, Aa3Ab1; Aa2a, Ac1Ab1."
247,The bashful maid,A,"ab, a1c; ab, b1c1."
247,The bashful maid,B,"Aa2Ab2, Aa1Ac; Aa2Ab3, Ab1Ac1."
248,The Barrowstown races,A,"ab, a1b1; ac, c1a2."
248,The Barrowstown races,B,"Aa3Ab2, Aa4Ab2; Aa5Ac, Ac1Aa2."
248,The Barrowstown races,C,"Aa1Ab3, Ab4Ab5; Ac2a, Ac1Aa2."
248,The Barrowstown races,D,"Aa6Ab6, Ca1a; Ca2Ca3, Ac1Aa2."
249,The flitch of Bacon,A,"ab, ab1; ab, cb1."
249,The flitch of Bacon,B,"Aa1Ac1, Aa1Ac2; Aa1Ac1, AcAb1."
250,Paddy in London,A,"aa1, bc; aa1, b1c1."
250,Paddy in London,B,"Aa2Ab2, AbAc; Aa2Ab2, Ab1Ac1."
250,Paddy in London,B1,"Aa2Ab2, AbAc; AaAa1, Ab1Ac1."
250,Paddy in London,C,"Ac2Ab3, AbAc; Ab4Aa1, Ab1Ac1."
251,The angry peeler,A,"aa1, bb1; aa1, bc."
251,The angry peeler,B,"Aa2Ab2, AbAc1; Aa2Ab2, Aa3Ac2."
252,The cook in the kitchen,A,"ab, ac; ab, a1a1."
252,The cook in the kitchen,B,"Aa2Aa3, AaAc; Aa2a1, Aa1Aa1."
252,The cook in the kitchen,C,"Ab1Ba2, Aa1Ac; Ab1Ba2, Aa1Aa1."
253,The humors of Dingle,A,"aa1, a2b; ac, a3d."
253,The humors of Dingle,B,"Ad1Ad2, aAd3; Ad1Ad4, Ad5Ad."
254,The absent-minded man,A,"ab, cd; ab, b1d1."
254,The absent-minded man,B,"Ad2Ad2, Ad3Ad3; Ad4Ad5, Ab2Ad6."
255,Felix the wrestler,A,"aa1, a2b; aa1, b1b2."
255,Felix the wrestler,B,"Aa3a, Aa4a1; Aa3a, Ab1Ab2."
255,Felix the wrestler,B1,"Aa3a, Aa4a1; Aa5a2, Ab3Ab2."
256,The night dance,A,"ab, ac; c1b1, c2c3."
256,The night dance,B,"aAb2, ab; a1Aa1, b1Ac."
256,The night dance,C,"Ab3Ab, Ab3Ac; Ac1Ab1, Ac2Ac3."
257,Morgan Rattler,A,"aa1, aa2; aa1, ba2."
257,Morgan Rattler,B,"Ab1Ab2, aAa3; Ab1Ab2, Ab3Aa2."
257,Morgan Rattler,C,"Aa4Aa5, Aa4Aa2; Aa4Aa1, AaAa2."
257,Morgan Rattler,D,"Ba1Ab4, BaAa3; Ba1Ab4, Ab5Aa2."
257,Morgan Rattler,E,"Ba1Ab4, BaAa3; aa1, Ab5Aa2."
257,Morgan Rattler,F,"Da1Ab4, Da1Aa3; Ab6Ab7, Ab8Aa2."
257,Morgan Rattler,G,"Aa6Aa6, Aa6Aa2; Aa6a, AbAa2."
257,Morgan Rattler,H,"Ea2Ab9, Ea2Aa7; Ea2Ea1, Ab3Aa7."
257,Morgan Rattler,I,"Ea3Ga1, Ea3Aa7; Ea3Aa1, AaAa7."
257,Morgan Rattler,J,"Aa1Ba2, Aa1Aa2; Aa1Ba2, AbAa2."
257,Morgan Rattler,K,"aa1, aAa2; aa2, Aa8Aa2."
258,Wallop the potlid,A,"aa1, ab; aa1, a2b1."
258,Wallop the potlid,B,"Ab2Aa3, aAa4; a1a2, bb1."
258,Wallop the potlid,C,"Aa5Ab3, Aa5Ab4; Aa5Aa5, Aa6Ba3."
258,Wallop the potlid,D,"Aa5Aa6, Aa5Ab4; Aa5Aa6, Aa7Bb2."
258,Wallop the potlid,E,"BaAa3, Ba4Aa4; Ba1Ba2, BbBb1."
258,Wallop the potlid,F,"Ab5Aa3, Ba4a; Bb3Bb4, Bb5Bb1."
259,Paddy's whiskers,A,"ab, cb1; ab, c1d."
259,Paddy's whiskers,B,"Ac2Ab2, Ac3Ab3; AaAb4, Ac1Ad."
260,The Frieze Breeches,A,"aa1, a2b; aa1, a3c."
260,The Frieze Breeches,B,"Ac1Ab1, Aa2Ab; Ac1Ab1, Aa3Ac."
260,The Frieze Breeches,C,"Ac1Ab1, Bc1Ab1; Aa4Ab1, Aa3Ac."
260,The Frieze Breeches,D,"Ac2Aa5, Ac3Ab1; Ac2Aa5, Aa3Ac."
260,The Frieze Breeches,E,"aAa6, a1Ab2; aAa6, bAc4."
260,The Frieze Breeches,F,"Ab2Ab1, Aa2Ab; Ab2Ab1, Aa3Ac."
260,The Frieze Breeches,G,"Ea2Ea3, Ac1Ab1; Ea2Aa7, Aa3Ac."
260,The Frieze Breeches,H,"Ea4Ea3, Ac1Ab1; Aa6Ab1, Aa3Ac."
261,The humors of Ayle House,A,"ab, a1b1; a1c, b2b1."
261,The humors of Ayle House,B,"Ab3Ab4, Ab3Ab1; Ab3Ac, Ab2Ab1."
262,Bold John O'Leary,A,"ab, cb1; aa1, de."
262,Bold John O'Leary,B,"aAa2, a1Aa; Ac1Ab2, AaAe1."
263,The humors of Cavan,A,"ab, ca1; ab, ca2."
263,The humors of Cavan,B,"Ab1Aa3, Ab1Aa; Ab1Ac1, Ab2Aa4."
264,The banks of Lough Gowna,A,"ab, aa1; ab, b1b2."
264,The banks of Lough Gowna,B,"Ab3Aa2, Ab3Ab4; Ab3Aa2, Ab1Ab5."
265,The twopenny jig,A,"ab, a1b1; ab2, cb3."
265,The twopenny jig,A1,"ab, a1b1; ab2, cb4."
265,The twopenny jig,B,"aa1, Aa1Ab1; aa1, AcAb4."
265,The twopenny jig,B1,"aa1, Aa1Ab1; Ac1a1, AcAb3."
266,The green meadow,A,"aa1, ab; aa1, cb."
266,The green meadow,B,"aa1, aAb; ab, Ac1Ab."
266,The green meadow,B1,"aa1, aAb; a2b1, Ac1Ab."
267,The merry maiden,A,"aa1, ab; aa1, cb1."
267,The merry maiden,B,"aAc1, a1Aa2; aAc1, AcAb1."
268,Blue bonnets jig,A,"aa1, a2b; aa1, cd."
268,Blue bonnets jig,B,"Aa3Ac1, aAd1; Aa3Ac1, Ac2Ad."
269,The field of flowers,A,"ab, ab1; ac, ab2."
269,The field of flowers,B,"Aa1Ab3, Aa2Ab4; Aa1Ac, AaAb2."
270,The glens of Mayo,A,"ab, a1b1; ac, ab2."
270,The glens of Mayo,B,"Ab3Ab4, Aa2Ab5; Ab3Ab6, Aa3a."
271,I'll neither spin nor weave,A,"ab, b1b2; ab, ab3."
271,I'll neither spin nor weave,B,"Ab4Aa1, Ab5Aa; Ab4Aa1, AaAb3."
272,Jackson's maid,A,"ab, cc1; ab, cd."
272,Jackson's maid,B,"aa1, a2Ad1; a3Ab, AcAd."
273,The Kilfinane jig,A,"ab, a1b1; cc1, c2d."
273,The Kilfinane jig,B,"Ab2Ab3, Ab2Ac3; Ab2Ac4, Ac2Ad."
274,Walk out of it Hogan,A,"aa1, ab; ab1, a2b."
274,Walk out of it Hogan,B,"Aa3Aa3, Aa3Ab; aAa4, Aa3Ab."
274,Walk out of it Hogan,C,"Ab2Bb1, Ab2a; a1Bb2, Aa5Aa6."
274,Walk out of it Hogan,D,"Aa7Aa3, Aa7a; Aa7b, Aa3Ab."
274,Walk out of it Hogan,E,"Aa8Aa9, Aa8Da1; Aa8Bb1, Aa3Ab."
275,The boys of Comanore,A,"aa1, aa2; a3a1, bc."
275,The boys of Comanore,B,"aAb1, bAb2; aAb1, Ab3Ac."
276,The barefoot boy,A,"aa1, aa2; ab, cc1."
276,The barefoot boy,B,"Ac2Ab1, AcAc3; Ac2Ab1, AcAc1."
276,The barefoot boy,B1,"Ac2Ab1, AcAc3; ac1, Ab2Aa3."
277,The onehorned cow,A,"aa1, ab; aa1, a2b1."
277,The onehorned cow,B,"Aa3Aa4, Aa3Ab2; Aa3Aa4, Aa2Ab1."
278,Sweet Biddy Daly,A,"aa1, bc; aa1, bc1."
278,Sweet Biddy Daly,B,"aa1, a2Aa2; aa1, AbAc1."
279,The geese in the bogs,A,"aa1, ab; aa1, a2b1."
279,The geese in the bogs,B,"Ab2Ab1, Aa1Ab3; Ab2Ab4, Aa2Ab1."
279,The geese in the bogs,B1,"Ab2Ab1, Aa1Ab3; Ab2Ab4, Aa2Ab."
280,Going to Donnybrook,A,"ab, ca1; ab, cb1."
280,Going to Donnybrook,B,"aAc1, aa1; aa2, Ac2Ab1."
280,Going to Donnybrook,B1,"aAc1, aa1; aa2, bAc3."
281,Wallop the spot,A,"ab, aa1; ab, ca1."
281,Wallop the spot,B,"Aa2Aa3, Aa2Aa1; Aa2Ac1, Aa4Aa1."
281,Wallop the spot,C,"Ac2Aa5, Ab1Aa1; Ac2Ac3, Ac4Aa1."
281,Wallop the spot,D,"Ac5a, Ab2Aa1; Ac5a, Aa6Aa1."
282,Take it easy,A,"ab, ac; ab, db1."
282,Take it easy,B,"aa1, aAb1; aa1, Ad1Ab1."
282,Take it easy,C,"Aa1Aa2, Aa1Ab2; Aa1Aa2, Ad2Ab1."
283,The man who died and rose again,A,"ab, ac; ad, c1c."
283,The man who died and rose again,B,"Ad1Aa1, Ad1Ac1; Aa2Ad, Ac1Ac."
284,Kitty of Oulart,A,"aa, bb1; aa, b2c."
284,Kitty of Oulart,B,"Ab3Aa1, Ac1Aa2; Ab3Aa1, Ab2Ac."
284,Kitty of Oulart,C,"aAa3, Ab4Ac2; aAa3, Ab4Ac."
285,Strop the razor 1st setting,A,"ab, aa1; ab1, ca1."
285,Strop the razor 1st setting,B,"Aa2Ac1, Aa3Aa1; Aa2Ac1, AcAa1."
286,Strop the razor 2nd setting,A,"aa1, a2b; aa1, cb."
286,Strop the razor 2nd setting,B,"Ac1Ac2, Ac1Ab; Ac1Ac2, aAb."
286,Strop the razor 2nd setting,C,"Aa3Ab1, BaAb; Aa3Ab1, BaAb."
286,Strop the razor 2nd setting,D,"Aa4Aa4, Aa4Ab; Aa4Ac, AcAb."
287,Gillan's apples,A,"aa1, a2b; ac, da3."
287,Gillan's apples,B,"aa1, a2a3; aa4, AdAa3."
287,Gillan's apples,C,"Ad1Aa4, Ad1Ab1; Ad1Ac, AdAa3."
287,Gillan's apples,D,"Ba5a, Ba6Aa1; Ba5b, AdAa3."
288,The Gudgeon of Maurice's Car,A,"aa1, ab; aa1, ca2."
288,The Gudgeon of Maurice's Car,B,"aAa1, aAb; Aa3Aa1, AcAa2."
289,The humors of Ballydehob,A,"aa, aa1; aa, a1a2."
289,The humors of Ballydehob,B,"aAa3, Aaa1; aAa3, Aa1Aa2."
290,The luck penny,A,"ab, a1c; ad, a2b1."
290,The luck penny,B,"Aa3Aa4, Aa5Ab2; Aa6Aa4, aAb1."
290,The luck penny,C,"Ac1Ba1, Ac2Ba2; Ac1Aa4, BaAb1."
291,The Blarney pilgrim,A,"aa1, bc; aa1, ba2."
291,The Blarney pilgrim,B,"Aa3Ac1, Aa3Ab1; Ac2Ac1, AbAa4."
291,The Blarney pilgrim,C,"Bb1Aa1, AbAc; Bb1Aa1, AbAa2."
292,The dairy maid,A,"ab, cd; c1c2, eb."
292,The dairy maid,B,"Ae1Ab1, Ac3Ad; Ac1Ac2, AeAb."
293,How much has she got?,A,"ab, ab1; ac, a1b2."
293,How much has she got?,B,"aAa2, a1b; aAc, Aa1Ab2."
294,The rivals,A,"ab, aa1; a2a3, b1a4."
294,The rivals,B,"Aa5Aa2, aAa6; Aa5a1, Ab1Aa4."
294,The rivals,C,"Aa5Aa2, BaAa6; BaBa1, Ab1Aa4."
295,All alive,A,"ab, a1b1; a2c, db."
295,All alive,B,"aa1, a2a3; aa4, Ad1Ab."
296,Barney O'Neill,A,"ab, a1c; ab, b1a2."
296,Barney O'Neill,B,"Ac1Ac2, Ac3Ab2; Ab3Ab4, Ab1Aa2."
297,Johnny the jumper,A,"aa1, a2a3; aa, ba3."
297,Johnny the jumper,B,"Ab1a, Ab2Aa3; Ab1Aa1, AbAa3."
298,Paddy "go easy",A,"ab, ab1; ac, b2b1."
298,Paddy "go easy",B,"Aa1Ab3, Ab4Ab5; Ab6Ac1, aAb1."
298,Paddy "go easy",C,"Aa2Ab, Aa2Ab1; Aa2Ac, Ab2Ab1."
299,Be easy you rogue!,A,"aa1, aa2; ab, aa3."
299,Be easy you rogue!,B,"Aa1Ab, Aa1Aa2; AaAb1, AaAa3."
299,Be easy you rogue!,C,"Aa4a, AaBb1; bAb2, AaAa3."
299,Be easy you rogue!,D,"Aa2Aa1, Aa2Aa2; Aa2Ab1, AaAa3."
300,Apples in winter,A,"ab, cd; a1d1, ea2."
300,Apples in winter,B,"Ac1Ae1, Ac2a; Ac1Ad2, Ac3Ae2."
300,Apples in winter,B1,"Ac1Ae1, Ac2a; a1Ab1, AeAa2."
301,The humors of Castle Comer,A,"aa1, a2a3; aa4, ba5."
301,The humors of Castle Comer,B,"Aa6Aa7, Aa2Aa3; Aa6Aa7, AbAa5."
302,The black rogue,A,"aa1, aa2; aa, a3a2."
302,The black rogue,B,"Aa4Aa5, Aa4Aa6; Aa1Aa7, AaAa2."
303,The ranting rake,A,"aa1, ba2; aa1, ba."
303,The ranting rake,B,"Aa3Aa4, Ab1a; Aa5a1, Aa6Aa."
304,The blooming meadows,A,"ab, b1b2; ac, c1a1."
304,The blooming meadows,B,"ab, a1b1; ab, Ac1Aa1."
304,The blooming meadows,B1,"ab, a1b1; Ab3a2, Ac1Aa1."
305,Delaney's drummers,A,"ab, a1c; ab1, b2a2."
305,Delaney's drummers,B,"Ab3Ab4, Ab5Ab6; Ab7Ab4, Ab2Aa2."
305,Delaney's drummers,B1,"Ab3Ab4, Ab5Ab6; Ab8Ac1, Ab2Aa2."
306,Crabs in the skillet,A,"ab, cc1; ab, c2c3."
306,Crabs in the skillet,A1,"ab, cc1; ab, c2b1."
306,Crabs in the skillet,B,"Ac4Ac5, Ac6Ab1; Ac4Ac5, Ac6a."
306,Crabs in the skillet,B1,"Ac4Ac5, Ac6Ab1; Ac4Ac5, Ac6Ac3."
306,Crabs in the skillet,C,"Ab2Ab3, AcAc1; Ab2Ab4, Ac2Ac3."
306,Crabs in the skillet,C1,"Ab2Ab3, AcAc1; Ab2Ab4, Ac2Ab1."
307,The woeful widow,A,"aa1, a2b; aa1, a2b1."
307,The woeful widow,B,"aAa3, AaAa1; aAa3, Aa1Ab2."
308,The cat and the bacon,A,"ab, ab1; ab, b2b3."
308,The cat and the bacon,B,"Ab4Ab5, Ab1a; AaAb, Aa1Aa2."
309,The galloping young thing,A,"ab, ac; ab1, b2d."
309,The galloping young thing,B,"Ab3Ab1, Ab3Ad1; Ab3Ab1, Ab2Ad."
310,The bridal jig,A,"ab, b1c; ab, b1b2."
310,The bridal jig,B,"Ab3Ab4, Aa1Ab5; Ab3Ab4, Aa1Aa2."
310,The bridal jig,B1,"Ab3Ab4, Aa1Ab5; Ab3Ab4, Aa1Ab6."
311,The man in the moon,A,"ab, a1c; ab1, dd1."
311,The man in the moon,B,"aAb2, a1Ac1; aAc1, AdAd1."
312,Come with me now,A,"aa1, a2b; aa3, cd."
312,Come with me now,B,"aAd1, aAb1; aAa3, AcAd."
313,The frost is all over,A,"ab, a1a2; ab, a1a3."
313,The frost is all over,B,"Aa4Aa5, Aa4Aa6; Aa4Aa5, aa1."
313,The frost is all over,C,"Aa4Aa5, Aa4Aa6; Ba2Ba3, BaAa7."
314,Sally Magee,A,"ab, ca1; ab1, c1a2."
314,Sally Magee,B,"aAb2, aAc2; aAb2, Ac1Aa2."
315,The red rose,A,"ab, ca1; ab, ca2."
315,The red rose,B,"Ab1Ab2, AcAa1; Ab1Ab, AcAa2."
316,The humors of Glynn,A,"aa1, ba2; ab1, b2a1."
316,The humors of Glynn,B,"Aa3Aa4, aAa2; AaAb1, Ab2Ab1."
317,The Irishwoman,A,"ab, a1b1; ab, b2a2."
317,The Irishwoman,B,"Ab3Ab4, Ab5Ab6; Aa3Aa4, Ab2Aa2."
318,The merry huntsman,A,"aa1, aa2; aa3, a4a2."
318,The merry huntsman,B,"ab, ab1; ab, Aa4b1."
318,The merry huntsman,B1,"ab, ab1; ab, Aa4b2."
319,The fairy jig,A,"ab, cb1; ab2, c1a1."
319,The fairy jig,B,"aa1, AcAb1; aa1, AcAa1."
320,The piper's welcome,A,"ab, a1b1; ab, cb1."
320,The piper's welcome,B,"Ac1Aa2, Ac1Ac2; Ac1Aa2, AaAb1."
320,The piper's welcome,C,"aAb, aAb1; Ab2Ab, Ab1Ab1."
321,Oh! Hag you have killed me,A,"ab, cc; ab1, c1c1."
321,Oh! Hag you have killed me,B,"Ac2Ab, AcAc; Ac3Ab, Ac1Ac1."
322,The full moon,A,"aa, bb1; aa, ca1."
322,The full moon,B,"Ab2Aa, Ab3Ab3; AaAa, AcAa1."
323,Yesterday morning,A,"ab, cd; ab, c1a1."
323,Yesterday morning,B,"Aa2a, AcAd; AaAb, Ac1Aa1."
324,Castletown Conners,A,"ab, ca1; ab, de."
324,Castletown Conners,B,"Ac1Ab1, Ac1Ae1; Ac1Ab1, AdAe."
325,Martin's onehorned cow,A,"ab, ac; ab, b1c1."
325,Martin's onehorned cow,B,"Ac2Ab, Ab2Ac3; Ac2Ab, Ab1Ac1."
326,Ollistrun jig,A,"ab, ab; ab1, cb2."
326,Ollistrun jig,B,"aAb3, aAb1; aAb3, Ac1Ab1."
327,Stay where you are,A,"ab, cb; b1b, cc1."
327,Stay where you are,A1,"b2b, cb; b1b, cc1."
327,Stay where you are,B,"Ab2Ab3, aAb3; Ab4Ab3, a1Ac1."
327,Stay where you are,B1,"Ab2Ab3, aAb3; Ab4Ab3, a1Ac1."
327,Stay where you are,C,"Ab2Ac2, Ab5Ac2; Ab1Ac2, aAc1."
327,Stay where you are,C1,"Ab2Ac2, Ab5Ac2; Ab1Ac2, aAc1."
327,Stay where you are,D,"a"
328,Miss Walsh's fancy,A,"aa, ab; aa, b1a1."
328,Miss Walsh's fancy,B,"Ab1a, Ab1b; Ab1a, Ab1Aa1."
328,Miss Walsh's fancy,C,"Aa2Bb1, Aa2Bb2; Aa2Bb1, Ab1Aa1."
329,Humors of Clare,A,"aa1, a2b; aa1, cd."
329,Humors of Clare,A1,"aa1, a2b; aa1, cd1."
329,Humors of Clare,B,"Ad2Ac1, Ad2Ab; Ad2Ac1, AcAd."
329,Humors of Clare,B1,"Ad2Ac1, Ad2Ab; Ad2Ac1, AcAd1."
329,Humors of Clare,C,"Aa3Aa1, aAb; Aa3Aa1, AcAd."
329,Humors of Clare,C1,"Aa3Aa1, aAb; Aa3Aa1, AcAd1."
330,The queen of the fair,A,"ab, cc1; ab, c2d."
330,The queen of the fair,B,"Ac3a, AbAc2; Ac3a, Ac4Ad."
330,The queen of the fair,C,"Ac5Ac5, Ab1Ac3; Ac5Ac6, Ab2Ad."
330,The queen of the fair,C1,"Ac5Ac5, Ab1Ac3; Ac7Ac3, Ab2Ad."
331,The foot of the mountain,A,"aa1, aa2; aa1, ba3."
331,The foot of the mountain,B,"Ab1Ab1, Ab2Ab3; Ab3Ab1, Ab1Ab."
331,The foot of the mountain,C,"Aa3Ab1, Ab1Ab2; Ab3Ab3, Ab1Ab1."
331,The foot of the mountain,D,"AbAa3, "
332,The maids of Ballinacarty,A,"ab, b1a; a1b, cb2."
332,The maids of Ballinacarty,B,"Aa2Aa2, Ac1a; Aa2Aa2, Ac2Aa3."
333,Miss Downing's fancy,A,"aa1, aa2; aa3, a4b."
333,Miss Downing's fancy,A1,"aa1, aa2; aa3, a4c."
333,Miss Downing's fancy,B,"Aa5Aa6, A1c1A1c2; Aa5Aa6, Ab1Aa7."
333,Miss Downing's fancy,B1,"Aa5Aa6, A1c1A1c2; Aa5Aa6, Ab1Ab."
334,When you go home,A,"ab, ab1; aa1, b2b1."
334,When you go home,B,"Ab3Ab4, Ab3Ab1; Ab3Aa1, Ab2Ab1."
335,Friends of my heart,A,"ab, ca1; ab1, c1b2."
335,Friends of my heart,B,"aAc2, a1Ac3; a2Aa2, Ab3Ab2."
336,Down the river,A,"aa1, bc; aa2, de."
336,Down the river,B,"aAc1, a1Ab1; a2Aa3, Ac2Ae."
337,Come along with me,A,"ab, a1a2; aa1, cd."
337,Come along with me,B,"aa1, aAa3; a2Aa2, AcAd."
338,Cronin's Frolics,A,"aa1, a2a1; aa1, a2b."
338,Cronin's Frolics,B,"aAa3, a1Aa1; AaAa1, Aa4Ab."
338,Cronin's Frolics,C,"Ba2Ba, Ba2a; a1Aa5, Aa2Ab."
338,Cronin's Frolics,D,"Ca2Aa6, Ca3Ba3; aAa1, Aa4Ab."
339,The belles of Liscarroll,A,"ab, a1a2; ab1, b2c."
339,The belles of Liscarroll,A1,"ab, a1a2; ab1, b2c1."
339,The belles of Liscarroll,B,"Aa3a, Ac2Ab3; Aa3Aa4, Ab2a1."
339,The belles of Liscarroll,B1,"Aa3a, Ac2Ab3; Aa3Aa4, Ab2Ac3."
339,The belles of Liscarroll,C,"Ac4Aa5, Ac5Ab4; Aa6Ab5, Ba2Ba3."
340,Munster Bacon,A,"ab, cd; c1c2, b1d1."
340,Munster Bacon,B,"Ad2Ad3, Ab2Ab3; aa1, Ab4Ad1."
341,Billy McCormick,A,"ab, a1c; ab1, c1c2."
341,Billy McCormick,B,"Aa2Aa2, Ac3Aa3; Aa4Ab2, Ac1Ac2."
342,The chorus jig,A,"ab, a1c; ab, c1b1."
342,The chorus jig,B,"aa1, aAc; aa1, Ac2Ab1."
342,The chorus jig,C,"BaBa1, BaAa2; Ab2Ab3, Ac1Ab1."
342,The chorus jig,D,"Aa3Ab4, Aa3Ac; Aa3Ab4, Ac1Ab1."
342,The chorus jig,E,"Aa3Ab4, Aa3Aa2; Ac3Ac4, Ac1Ab1."
343,Church Hill,A,"ab, aa1; ab, a2a1."
343,Church Hill,B,"aAa3, aAa1; a1Aa1, bAa1."
344,The stolen purse,A,"aa1, bc; aa1, b1d."
344,The stolen purse,B,"Ac1Aa1, AbAc; AaAa1, Ab1Ad."
344,The stolen purse,C,"aAa1, AbAc2; aa1, Ab1Ad."
345,The trip to Galway,A,"ab, cd; ad1, b1e."
345,The trip to Galway,B,"aa1, a2Ae1; Ab1Ab2, Ad2Ae."
346,Miss Douglas,A,"aa1, ba2; aa1, ba3."
346,Miss Douglas,B,"aAa4, Aa5a1; aAa4, Aa5Aa6."
346,Miss Douglas,B1,"aAa4, Aa5a1; AaAa1, AbAa3."
347,The maid of Kinsale,A,"aa1, bc; aa1, b1c1."
347,The maid of Kinsale,B,"Ac2Aa2, Aa1Ac3; Aa3Ab2, Ab3Ac1."
348,The flowers of Dungarvan,A,"ab, cb1; b2d, d1b3."
348,The flowers of Dungarvan,B,"aAd2, Aa1Ad3; a1Ad4, Ac1Ab3."
349,Miss Grant's jig,A,"ab, a1b1; ac, b2d."
349,Miss Grant's jig,B,"Ad1Aa2, Ab3Ac; Ad2Ac1, Ab2Ad."
350,Don't be teasing,A,"ab, ac; ab1, da1."
350,Don't be teasing,B,"Aa2Ac1, Aa2Ad1; Aa2Ab2, aAa1."
351,Clancy's frolics,A,"aa1, bb1; a2a1, cd."
351,Clancy's frolics,B,"Aa3Aa4, Aa3Ab2; Aa3Aa4, AcAd."
352,The powers of punch,A,"aa1, a2b; b1c, de."
352,The powers of punch,B,"Ae1Ab2, Ae1Aa3; Ab1Ac, AdAe."
352,The powers of punch,C,"Ab3Ab1, Ac1Aa4; Ad1Ab1, AdAe."
352,The powers of punch,D,"Ac2Ad2, Ac3Ae2; Ac4Ad3, AdAe."
353,The yellow wattle,A,"aa1, a2a3; a2a1, bb1."
353,The yellow wattle,B,"aa, aa1; aa, a1Ab1."
353,The yellow wattle,C,"Ab2Ab2, Ab2Ba2; Ab2Ab2, Ab3Ab1."
353,The yellow wattle,D,"Ba3Aa4, Ba3Ba2; Ba3Aa4, Ab3Ab1."
354,The lads of Dunse,A,"ab, a1a2; ab, a1a3."
354,The lads of Dunse,B,"aAb1, Aa1Aa2; aAb1, Aa1Aa3."
354,The lads of Dunse,C,"BaAb1, Aa1Aa2; Ba1Ab1, Ab2Aa3."
355,The lasses of Dunse,A,"ab, cb1; ab, c1b2."
355,The lasses of Dunse,B,"Ac2Ac3, Aca; Ac4Ac5, Aa1Ab3."
356,Portpatrick,A,"ab, ac; ab, a1b1."
356,Portpatrick,B,"Aa2Aa3, Ab2Ac; Ac1Ab, Aa1Ab1."
357,The Hibernian jig,A,"aa, a1a2; bc, a3c1."
357,The Hibernian jig,B,"Aa4Aa5, Aa6Ac2; aa1, Ab1Aa7."
358,Go to the Devil and shake yourself,A,"ab, a1a2; ab, b1a3."
358,Go to the Devil and shake yourself,B,"Aa4Aa5, Aa6Ab2; AaAb, Ab1Aa3."
359,May be I will,A,"ab, a1c; ad, a1e."
359,May be I will,B,"Ad1Ac1, Aa2Ad2; aAc2, Ac3Ae."
360,The market girl,A,"aa1, a2b; a2a3, cb1."
360,The market girl,B,"Ab2Ac1, aAb1; a1Ab3, Ac2Ab1."
361,The Drogheda weavers,A,"aa1, aa2; aa1, ba2."
361,The Drogheda weavers,B,"Ab1a, Ab2Aa2; Ab1a, Ab3Aa2."
362,The Hollyford jig,A,"ab, cb1; ab, c1b2."
362,The Hollyford jig,B,"Aa1Ab3, AcAb1; Ab4Ab3, Ac1Ab2."
362,The Hollyford jig,C,"Aa2Ab5, Ac2a; Ac3Aa3, Aa1Ab2."
363,Nell Kennedy,A,"ab, ac; ab, a1b1."
363,Nell Kennedy,B,"aAc1, ab; aAc1, Aa1Ab1."
363,Nell Kennedy,B1,"aAc1, ab; Aa2Aa1, Ac2Ab1."
364,Three halfpence a day,A,"aa1, a2b; aa1, a3b."
364,Three halfpence a day,B,"Aa4a, Aa4Ab1; Aa5a1, Aa3Ab."
365,Merry Mary,A,"ab, a1b1; ab, cb2."
365,Merry Mary,B,"Ab3Ab, Aa1Ab1; Ab3Ab, AcAb2."
366,Bolt the door,A,"ab, b1c; c1b, b1c."
366,Bolt the door,A1,"b2b, b1c; c1b, b1c."
366,Bolt the door,B,"Ab2Ab3, Ac2Ac; Ac1Ab, Ac2Ac."
366,Bolt the door,C,"Ac3Ab4, Ac2Ac; Ac1Ab, Ac4Ac5."
366,Bolt the door,D,"Aa1"
367,Ask my father,A,"ab, b1c; c1b, b1c2."
367,Ask my father,A1,"c3b, b1c; c1b, b1c2."
367,Ask my father,B,"Aa1Ab2, Ab3Ac; Ac1Ab2, Ab3Ac2."
367,Ask my father,B1,"Aa1Ab2, Ab3Ac; Ac1Ab2, Ab3Ac2."
367,Ask my father,C,"Aa2"
368,With all my heart,A,"ab, ab1; ab2, cb1."
368,With all my heart,B,"aAb, aAb1; aAb2, AcAb1."
369,Get up early,A,"aa1, bb1; aa1, b2c."
369,Get up early,B,"Ac1a, Ac2Ab2; Ac1a, Ab2Ac."
369,Get up early,B1,"Ac1a, Ac2Ab2; Ac1a1, Ab2Ac."
370,Dan Rogers' jig,A,"ab, ac; ab, ac."
370,Dan Rogers' jig,B,"ab, aAc1; ab, ac."
371,Tie the petticoat tighter,A,"aa, bb; aa, b1b1."
371,Tie the petticoat tighter,B,"aAa, Aa1Aa1; aAa, Aa2Aa2."
371,Tie the petticoat tighter,B1,"aAa, Aa1Aa1; a1a2, Ab1Ab1."
372,Trip it up stairs,A,"aa1, bb; ab1, b2b2."
372,Trip it up stairs,B,"Ab3Aa2, Ab4Ab4; Aa3a, Ab2Ab2."
372,Trip it up stairs,C,"Ab5Ab6, aa1; Aa4Ba1, Ab2Ab2."
373,Sergt. Cahill's favorite,A,"ab, a1b1; ab, a1b2."
373,Sergt. Cahill's favorite,B,"aa, Aa1Ab1; AaAb, Aa1Ab2."
374,Moll in the wad,A,"ab, ac; ab, a1c."
374,Moll in the wad,B,"Aa1Aa1, Aa1Ac; Aa1a, Aa2Ac."
375,Tim the thatcher,A,"ab, aa1; ac, dc1."
375,Tim the thatcher,B,"Ad1Ab1, Ad1a; Ad1Aa2, AdAc1."
376,Is it the priest you want?,A,"ab, ab1; ab, a1b2."
376,Is it the priest you want?,B,"aAb3, a1Ab4; aAb3, Aa1Ab2."
377,Whiskey and water,A,"aa, aa1; aa, a1b."
377,Whiskey and water,B,"aAa2, aAa2; Aa1Aa3, Aa1Aa4."
377,Whiskey and water,B1,"aAa2, aAa2; Aa1Aa, Aa1Ab."
378,The humors of Limerick,A,"aa1, ab; aa1, a1b."
378,The humors of Limerick,B,"Aa2Ab1, Aa2Ab2; Aa2Ab1, Aa1Ab."
379,Stack the rags,A,"aa1, aa2; aa1, bb1."
379,Stack the rags,B,"Aa1Aa2, Aa3Aa2; Aa1Aa2, Aa4Aa5."
379,Stack the rags,C,"Aa3Aa2, Aa3Ab2; Aa6Ab3, AaAa2."
380,Tip the Cruiskeen,A,"aa1, bb; aa1, b1b1."
380,Tip the Cruiskeen,B,"Aa2a, AbAb; Aa2a, Ab1Ab1."
381,Tatter the road,A,"ab, b1c; ab, c1a1."
381,Tatter the road,B,"Ab2Aa1, Ab3Aa2; Ab4Aa1, aAb."
382,Huish the cat,A,"aa1, aa2; aa1, ba2."
382,Huish the cat,B,"AbAb1, AbAa2; AbAb1, Aa1Aa2."
383,The bucks of Westmeath,A,"ab, ab1; ab, cb1."
383,The bucks of Westmeath,B,"AcAc1, AcAb1; Ab1Ac2, AcAb1."
383,The bucks of Westmeath,C,"aa, aAb1; aa, AcAb1."
384,The beauties of Ireland,A,"aa1, ab; aa1, ab1."
384,The beauties of Ireland,A1,"ca2, cc1; aa1, ab."
384,The beauties of Ireland,A2,"aa1, ab1; A1ca2, A1cb2."
385,Off she goes!,A,"aa1, ab; aa1, a2b1."
385,Off she goes!,B,"Ab2Ab3, Ab2Ab4; Ab2Ab3, Aa2Ab1."
386,Smash the windows,A,"ab, b1c; ab, c1d."
386,Smash the windows,B,"Ab2Ac2, Ab3Ac3; Ab4Ab5, aAd1."
386,Smash the windows,C,"Ba1Ab6, Ab7Ac4; Ba2Ab5, BaAd."
387,Ellis' jig,A,"aa1, aa1; a2b, a3a4."
387,Ellis' jig,B,"Aa5Aa1, Aa5Aa6; Aa2Ab, Aa3Aa4."
388,Lock the door,A,"aa1, ab; aa1, a2c."
388,Lock the door,B,"aAb1, ab; aAb2, Aa2Ac."
388,Lock the door,C,"Ac1Aa3, Ac1Ab; Ac1Aa3, Ab3Ac."
389,Maguire's kick,A,"aa1, a2b; aa1, ab1."
