Tune,Title,Part,Structure
210,The miners of Wicklow,A1,"ab, cc1; ab1, a1d."
210,The miners of Wicklow,B,"A1d1Aa2, A1d2Aa3; Aa4Ab4, Aa1A1d."
210,The miners of Wicklow,B1,"A1d1Aa2, A1d2Aa3; Aa4Ab4, Ab2Ab3."
211,My brother Tom,A,"ab, ac; ab, b1c."
211,My brother Tom,B,"Ab2a, Ab3Ac1; Ab2a, AbAc."
211,My brother Tom,B1,"Ab2a, Ab3Ac1; a1b, Ab4Ac."
212,Paddy's resource,A,"ab, cc1; ab, cb1."
212,Paddy's resource,B,"Ab2Ac2, Ab3Ab4; Ab5Ac3, Aa1a."
213,Before I was married,A,"ab, a1b1; ab, a2b1."
213,Before I was married,B,"ab, cAb2; ab, c1Ab2."
214,The old grey goose,A,"ab, cb1; dd1, eb."
214,The old grey goose,B,"aa1, a2a3; a4Ad2, AeAb."
214,The old grey goose,C,"Ae1Ad3, Ba5a; a1Ad4, AeAb."
214,The old grey goose,D,"Ab2Ab, Ac1Ab3; Ad5Ab4, AeAb."
214,The old grey goose,E,"Aa1Ab5, Aa1Ab6; Aa1Ad2, AeAb."
214,The old grey goose,F,"Ca2Ab, Ac2Ab1; Ad6Ad7, AeAb7."
215,Hinchy's delight,A,"ab, a1c; ab, a1b1."
215,Hinchy's delight,B,"Aa2Aa3, Aa4Ac1; aAc2, Aa5Ab1."
215,Hinchy's delight,C,"Ba1Ba2, Aa1Ac; Ba1a, Aa1Ab1."
216,Come now or stay,A,"ab, cd; ab, b1a1."
216,Come now or stay,B,"aa1, bc; aa1, Ac1Aa2."
217,Buttermilk Mary,A,"ab, cd; b1b2, ed1."
217,Buttermilk Mary,B,"Ac1Aa1, Ad2Ad3; aa1, Ad4Ad1."
218,The Connachtman's rambles,A,"aa1, a2b; ac, db1."
218,The Connachtman's rambles,B,"aAc1, aAd1; a1Ac2, AdAb1."
219,Father Fielding's favorite,A,"ab, cb1; ab2, c1b3."
219,Father Fielding's favorite,B,"aa1, aa2; a3Aa1, bAb3."
220,Father Tom's wager,A,"ab, cd; ab, ce."
220,Father Tom's wager,B,"aAa1, bAd1; aAa2, Aa3Ae."
221,Bryan O'Lynn,A,"ab, ac; ab, dc."
221,Bryan O'Lynn,B,"Aa1Ab1, Ac1Ac2; Aa1Ab1, Aa2Ac."
222,O'Gallagher's frolics,A,"aa1, bc; aa1, db1."
222,O'Gallagher's frolics,B,"Aa2a, Ac1Ac2; a1Ad1, AdAb1."
223,The rambler from Clare,A,"ab, cd; ab, ed1."
223,The rambler from Clare,B,"aAc1, Ae1Ae2; aAc2, AeAd1."
224,Biddy Maloney,A,"aa1, bc; ad, ec1."
224,Biddy Maloney,B,"Ac2Ad1, Ae1Ac3; Ac4a, Ae2Ac1."
224,Biddy Maloney,C,"aBa1, Ae1Ac3; Ba2Ba1, Ae2Ac1."
224,Biddy Maloney,D,"aa1, a2a3; a4a5, AeAc1."
224,Biddy Maloney,E,"aa, Ae1Ac3; aa, bAd2."
224,Biddy Maloney,F,"Ae3a, bBa3; Ae3a1, Eb1Ad2."
224,Biddy Maloney,G,"Aa2Ab1, Ae1Ac3; Aa2Ab1, AeAc1."
225,The newmarried couple,A,"ab, cd; ab, c1a1."
225,The newmarried couple,B,"AcAc2, AcAd; Ad1Ab1, Ac1Aa1."
226,Tim Hogan's jig,A,"aa1, ab; aa1, cb."
226,Tim Hogan's jig,B,"Ac1Ab1, Ac2a; Ac1Ab2, AcAb."
226,Tim Hogan's jig,C,"aAc3, aAc4; aAc3, AcAb."
227,Dick Sullivan's favorite,A,"ab, ac; ab, dc."
227,Dick Sullivan's favorite,B,"Ab1a, a1b; Ab1Ac1, AdAc."
227,Dick Sullivan's favorite,C,"aa1, a2Ac2; a2Ac1, AdAc."
228,Come to dinner,A,"ab, a1c; ab1, da."
228,Come to dinner,B,"Ab2a, a1b; Ab2a, a1Aa."
229,The jolly jocker,A,"ab, ac; a1d, c1c."
229,The jolly jocker,B,"ab, ac; ab, dAc2."
230,Mixing the punch,A,"ab, cb1; de, fg."
230,Mixing the punch,B,"aAg1, a1Ae1; Aa1b, Af1Ag."
231,Finerty's frolic,A,"ab, ca1; ab1, c1a1."
231,Finerty's frolic,B,"Ac2Ac3, aAa2; Ab2Ab1, Ac1Aa1."
232,Old as the hills,A,"ab, a1b1; cb, de."
232,Old as the hills,B,"Ab2Ae1, Ac1Aa2; Ab3a, bAb2."
232,Old as the hills,C,"Ae1Ac1, Aa2Ab3; BaBb, a"
233,Long John's wedding,A,"ab, aa1; ab, a1c."
233,Long John's wedding,B,"aAc1, Aa2Ab1; a1Ab2, Aa1Ac."
234,Kit O'Mahoney's jig,A,"aa1, bc; de, b1c1."
234,Kit O'Mahoney's jig,B,"aAb1, aa1; Ad1Ae1, Ab1Ac1."
234,Kit O'Mahoney's jig,C,"Ba1Ac2, Ab2Ab3; Ba1a, Ab1Ac1."
234,Kit O'Mahoney's jig,D,"Ab4Ab1, BaBa2; Ab5Ab6, Ab1Ac1."
235,The humors of Drinagh,A,"ab, ac; ab, b1d."
235,The humors of Drinagh,B,"Aa1a, Aa1a; a1a2, Ab1Ad."
235,The humors of Drinagh,C,"aBa1, aAc1; aAb, Ab1Ad."
235,The humors of Drinagh,D,"Ac2Ab2, Ac2Ad1; Ba3Ab3, Ab4Ad1."
236,The gallowglass,A,"ab, a1b1; ac, a2b."
236,The gallowglass,B,"aAb, Aa1Ab1; aAb2, Aa2Ab."
236,The gallowglass,C,"BaAb, Aa1Ab1; aa1, bAb."
237,The Fardown farmer,A,"ab, ab1; ab, cd."
237,The Fardown farmer,B,"Ab2a, Ab2b; Ab2a, AcAd."
238,The old horned sheep,A,"ab, ac; ab, b1d."
238,The old horned sheep,B,"Ab2Ad1, Ab2Ad2; Ab2Ab3, Ac1Ac2."
239,The Laccarue boys,A,"ab, cd; ab, c1e."
239,The Laccarue boys,B,"aAb, Aa1Ae1; a1Ab, Ac1Ae."
240,The lark in the morning,A,"ab, a1c; c1d, ed1."
240,The lark in the morning,B,"aa1, aa1; Ad2Ab1, AeAd1."
241,Sergt. Stack's favorite,A,"ab, a1c; ab, de."
241,Sergt. Stack's favorite,B,"ab, ac; ad, Aa2b1."
242,The ruins of Killmallock,A,"ab, ca1; ab1, de."
242,The ruins of Killmallock,B,"Aa2Ac1, Aa3Aa4; Aa2Ac1, Aa4Ae1."
243,The Mountaineers' march,A,"aa1, ba1; aa1, bc."
243,The Mountaineers' march,B,"aAa2, a1b; a1Aa3, Ab1Ac."
244,The top of Cork road,A,"ab, cb; ab, cd."
244,The top of Cork road,B,"Ac1Ab1, Ad1Ac2; Aa1Ac, AdAc1."
244,The top of Cork road,C,"Ab1Ad1, Ac2Aa1; AcAd, "
245,The Monaghan jig,A,"aa1, aa2; aa1, bc."
245,The Monaghan jig,B,"aAb1, a1Ac; aAb1, AbAc."
245,The Monaghan jig,C,"aAc1, aAc2; aAc1, AbAc."
246,The mooncoin jig,A,"ab, a1b1; ab, cb1."
246,The mooncoin jig,B,"Ab2a, Ab2Ab3; Ab2b, b1Ab1."
246,The mooncoin jig,C,"Aa2Ab4, Aa3Ab1; Aa2a, Ab5Ab1."
247,The bashful maid,A,"ab, a1c; ab, dc1."
247,The bashful maid,B,"aAb1, Aa1Ac; aAb2, Ad1Ac1."
248,The Barrowstown races,A,"ab, a1b1; a2c, c1a3."
248,The Barrowstown races,B,"Aa4Ab2, Aa5Ab2; Aa6Ac, Ac1Aa3."
248,The Barrowstown races,C,"ab, cAb3; c1a1, Ac1Aa3."
248,The Barrowstown races,D,"ab, b1c; Ca2Ca3, Ac1Aa3."
249,The flitch of Bacon,A,"ab, ac; ab, dc."
249,The flitch of Bacon,B,"aAd1, aAd2; aAd1, AdAc."
250,Paddy in London,A,"aa1, bc; aa1, b1c1."
250,Paddy in London,B,"Aa2Ab2, AbAc; Aa2Ab2, aAc1."
250,Paddy in London,B1,"Aa2Ab2, AbAc; AaAa1, Ab1Ac1."
250,Paddy in London,C,"aAb3, AbAc; Ba1Aa1, Ab1Ac1."
251,The angry peeler,A,"aa1, bc; a2a1, bc1."
251,The angry peeler,B,"Aa3Ab1, AbAc2; Aa3Ab1, Aa4Ac3."
252,The cook in the kitchen,A,"ab, a1c; ab, de."
252,The cook in the kitchen,B,"aa1, a2Ac; aAe1, AdAe."
252,The cook in the kitchen,C,"Ab1Ad1, AdAc; Ab1Ad1, AdAe."
253,The humors of Dingle,A,"aa1, bb1; ac, a2b2."
253,The humors of Dingle,B,"ab, b1c; aAa3, c1Ab2."
254,The absent-minded man,A,"ab, cd; ab, b1d1."
254,The absent-minded man,B,"Ad2Ad2, Ad3Ad3; Ad4Ad5, Ad6Ad7."
255,Felix the wrestler,A,"aa1, a2b; aa1, b1a3."
255,Felix the wrestler,B,"aa1, a2a3; aa1, Ab1Aa3."
255,Felix the wrestler,B1,"aa1, a2a3; bb1, Ab2Aa3."
256,The night dance,A,"ab, ac; dc1, ec2."
256,The night dance,B,"ab, ab1; a1c, dAc."
256,The night dance,C,"Bd1Ab, Bd1Ac; Ad1Ac1, AeAc2."
257,Morgan Rattler,A,"ab, aa1; ab, ca1."
257,Morgan Rattler,B,"Ac1Ac2, aAa2; Ac1Ac3, a1Aa1."
257,Morgan Rattler,C,"Aa3Aa4, Aa3Aa1; Aa3Aa5, AaAa1."
257,Morgan Rattler,D,"Ba2Ac4, BaAa2; Ba2Ac4, Ba3Aa1."
257,Morgan Rattler,E,"Ba2Ac4, BaAa2; aa1, Ba3Aa1."
257,Morgan Rattler,F,"Da1Ac4, Da1Aa2; aa1, a2Aa1."
257,Morgan Rattler,G,"aa, aAa1; aAb1, AcAa1."
257,Morgan Rattler,H,"Fa3Fa4, Fa3Aa6; Ea2Ea1, Ba1Aa6."
257,Morgan Rattler,I,"aAb1, aAa6; aAa5, AaAa6."
257,Morgan Rattler,J,"AbBa4, AbAa1; AbBa4, AcAa1."
257,Morgan Rattler,K,"aa1, aAa1; aa2, Aa7Aa1."
258,Wallop the potlid,A,"aa1, ab; aa1, a2c."
258,Wallop the potlid,B,"Ab1a, a1a2; Ab2a3, bAc1."
258,Wallop the potlid,C,"Aa3a, Aa3Ab3; Aa3Bb1, a1Ac2."
258,Wallop the potlid,D,"Aa3Ca1, Aa3Ab3; Aa3Ca1, aBb2."
258,Wallop the potlid,E,"Ba1Ba, Ac3Ba2; Ab2Ba3, Bb3Ac1."
258,Wallop the potlid,F,"Ab4Ba, Ac3Ba4; aBb4, Bb5Ac1."
259,Paddy's whiskers,A,"ab, cd; ab, c1e."
259,Paddy's whiskers,B,"Ae1Ab1, Ae2Ab2; AaAb3, Ac1Ae."
260,The Frieze Breeches,A,"ab, a1b1; ab, a2c."
260,The Frieze Breeches,B,"Ab2Ab3, Aa1Ab1; Ab2Ab3, Aa2Ac."
260,The Frieze Breeches,C,"Ab2Ab3, Ac1Ab3; Aa3Ab3, Aa2Ac."
260,The Frieze Breeches,D,"Ac2Ab4, aAb3; Ac2Ab4, Aa2Ac."
260,The Frieze Breeches,E,"Da1Ab5, Da2Ab6; Da1Ab5, aAc3."
260,The Frieze Breeches,F,"Ab6Ab3, Ac4Ab1; Ab6Ab3, Aa2Ac."
260,The Frieze Breeches,G,"Da3Ab7, Ab2Ab3; Da3Ab8, Aa2Ac."
260,The Frieze Breeches,H,"Da4Ab7, Ab2Ab3; Ab5Ab3, Aa2Ac."
261,The humors of Ayle House,A,"ab, cd; cc1, ed1."
261,The humors of Ayle House,B,"Ab1Ac2, Ab1Ad1; Ab1Ac1, Ae1Ad1."
262,Bold John O'Leary,A,"ab, cd; aa1, d1e."
262,Bold John O'Leary,B,"aAa2, a1Aa3; Ac1Ab1, AaAe1."
263,The humors of Cavan,A,"ab, ca1; ab, ca2."
263,The humors of Cavan,B,"aAa3, aAa4; aAc1, a1Aa5."
264,The banks of Lough Gowna,A,"ab, ac; ab, b1b2."
264,The banks of Lough Gowna,B,"Ab3a, Ab3Ab4; Ab3a, Ac1Ab5."
265,The twopenny jig,A,"ab, a1b1; ab2, cb3."
265,The twopenny jig,A1,"ab, a1b1; ab2, cb4."
265,The twopenny jig,B,"aa1, Aa1Ab1; aa1, AcAb5."
265,The twopenny jig,B1,"aa1, Aa1Ab1; Ac1a1, AcAb3."
266,The green meadow,A,"aa1, ab; aa1, cb."
266,The green meadow,B,"aa1, aAb; ab, Ac1Ab."
266,The green meadow,B1,"aa1, aAb; Ac2b1, Ac1Ab."
267,The merry maiden,A,"aa1, ab; aa1, cb1."
267,The merry maiden,B,"aAc1, a1b; aAc1, AcAb1."
268,Blue bonnets jig,A,"aa1, a2b; aa1, cd."
268,Blue bonnets jig,B,"aAc1, a1Ad1; aAc1, Ac2Ad."
269,The field of flowers,A,"ab, ab1; ac, ab2."
269,The field of flowers,B,"Aa1Ab3, Aa2a; bAc, AaAb2."
270,The glens of Mayo,A,"ab, a1b1; ac, ad."
270,The glens of Mayo,B,"Ad1Ab2, Ad2Ab3; Ad1Ab4, aAd3."
271,I'll neither spin nor weave,A,"ab, cc1; ab, ab1."
271,I'll neither spin nor weave,B,"aAa1, Ab2Aa; aAa1, AaAb1."
272,Jackson's maid,A,"ab, cc1; a1b, cd."
272,Jackson's maid,B,"aa1, a2Ad1; a3Ab, AcAd."
273,The Kilfinane jig,A,"ab, b1c; de, e1f."
273,The Kilfinane jig,B,"Ab2a, Ab2Ac1; Ab2a1, Ae1Af."
274,Walk out of it Hogan,A,"aa1, ab; ab1, a2b."
274,Walk out of it Hogan,B,"Aa3Aa3, Aa3Ab2; aAa4, Aa3Ab."
274,Walk out of it Hogan,C,"ab, ac; c1d, Aa5Aa6."
274,Walk out of it Hogan,D,"Ab3Aa7, Ab3Cd1; Ab3a, Aa8Ab."
274,Walk out of it Hogan,E,"Ca1Ca1, Ca1Cd2; Ca1Cb, Aa8Ab."
275,The boys of Comanore,A,"aa1, ab; b1a1, cd."
275,The boys of Comanore,B,"ab, cAb2; ab, Ac1Ad."
276,The barefoot boy,A,"ab, aa1; ab1, cd."
276,The barefoot boy,B,"Ac1a, AcAa2; Ac1a, AcAd."
276,The barefoot boy,B1,"Ac1a, AcAa2; ba1, a2Ad1."
277,The onehorned cow,A,"aa1, ab; ab1, a2c."
277,The onehorned cow,B,"Aa3Aa4, Aa3Ac1; Aa3Aa4, Aa2Ac."
278,Sweet Biddy Daly,A,"ab, cd; ab, cd1."
278,Sweet Biddy Daly,B,"aa1, bAa1; aa1, AcAd1."
279,The geese in the bogs,A,"ab, ab1; ab2, a1b3."
279,The geese in the bogs,B,"aAb3, bc; ad, Aa1Ab3."
279,The geese in the bogs,B1,"aAb3, bc; ad, Aa1Ab1."
280,Going to Donnybrook,A,"ab, cc1; ab, cb1."
280,Going to Donnybrook,B,"aa1, a2Ab2; aa3, bAb1."
280,Going to Donnybrook,B1,"aa1, a2Ab2; aa3, b1Ac2."
281,Wallop the spot,A,"ab, ac; ab, dc."
281,Wallop the spot,B,"Aa1Aa2, Aa1Ac1; Aa1Ad1, Aa3Ac1."
281,Wallop the spot,C,"Ad2Ab1, Ab2Ac; Ad2Ad3, aAc."
281,Wallop the spot,D,"ab, Ab3Ac; ab, cAc."
282,Take it easy,A,"ab, ac; ab, de."
282,Take it easy,B,"aa1, aAd1; aa1, Ad2Ae."
282,Take it easy,C,"Aa1Aa2, Aa1a; Aa1Aa2, Ad3Ae."
283,The man who died and rose again,A,"ab, ac; ad, ec1."
283,The man who died and rose again,B,"Aa1Ab1, Aa1Ad1; Ad2Ad, AeAc1."
284,Kitty of Oulart,A,"aa, bc; aa, dc1."
284,Kitty of Oulart,B,"ab, Ac2b1; ab, AdAc1."
284,Kitty of Oulart,C,"Ac3Ad1, Ad2Ac4; Ac3Ad1, Ad2Ac1."
285,Strop the razor 1st setting,A,"ab, aa1; ab1, ca1."
285,Strop the razor 1st setting,B,"Aa2Ac1, Aa3Aa1; Aa2Ac1, AcAa1."
286,Strop the razor 2nd setting,A,"aa1, a2b; aa1, cb."
286,Strop the razor 2nd setting,B,"Ac1a, Ac1Ab; Ac1a1, bAb."
286,Strop the razor 2nd setting,C,"aa1, BbAb; aa1, BbAb."
286,Strop the razor 2nd setting,D,"aa, a1Ab; a1Ac, AcAb."
287,Gillan's apples,A,"aa1, bb1; a2c, de."
287,Gillan's apples,B,"aa1, a2a3; aa4, AdAe."
287,Gillan's apples,C,"Ad1Aa3, Ad1Ab2; Ad1Ac, AdAe."
287,Gillan's apples,D,"ab, a1b1; ac, AdAe."
288,The Gudgeon of Maurice's Car,A,"aa1, ab; aa1, cb1."
288,The Gudgeon of Maurice's Car,B,"aAa1, aAb; Aa2Aa1, AcAb1."
289,The humors of Ballydehob,A,"aa, aa1; aa, ba2."
289,The humors of Ballydehob,B,"aAa3, AaAb1; aAa3, AbAa2."
290,The luck penny,A,"ab, a1c; ad, a2b1."
290,The luck penny,B,"Aa3Aa4, Aa5a; Aa6Aa4, a1Ab1."
290,The luck penny,C,"ab, a1b1; aAa4, Ba1Ab1."
291,The Blarney pilgrim,A,"ab, b1c; ab, b1a1."
291,The Blarney pilgrim,B,"Aa2a, Aa2a1; a2a, bAa3."
291,The Blarney pilgrim,C,"aAb2, Ab1Ac; aAb2, Ab1Aa1."
292,The dairy maid,A,"ab, cd; c1c2, eb1."
292,The dairy maid,B,"aAb2, Ac3Ad; Ac1Ac2, AeAb1."
293,How much has she got?,A,"ab, ab1; ac, a1b2."
293,How much has she got?,B,"ab, a1b1; aAc, Aa1Ab2."
294,The rivals,A,"ab, aa1; a2a3, b1a4."
294,The rivals,B,"aAb2, a1Aa5; a2b, Ab1Aa4."
294,The rivals,C,"Ba3Ab3, Ba1Aa5; Bb1Bb, Ab1Aa4."
295,All alive,A,"ab, a1b1; cd, eb2."
295,All alive,B,"aa1, a2a3; aa4, Ae1Ab2."
296,Barney O'Neill,A,"ab, a1c; ab, b1d."
296,Barney O'Neill,B,"aa1, a2a3; a4Ab2, Ab1Ad."
297,Johnny the jumper,A,"aa1, a2b; aa3, cb."
297,Johnny the jumper,B,"Ac1Ab1, Ac2Ab; Ac1a, AcAb."
298,Paddy "go easy",A,"ab, ab1; ac, db1."
298,Paddy "go easy",B,"aa1, a2a3; a4a5, Ad1Ab1."
298,Paddy "go easy",C,"Aa1Ab, Aa1Ab1; Aa1Ac, AdAb1."
299,Be easy you rogue!,A,"ab, ab1; ac, ab2."
299,Be easy you rogue!,B,"Aa1Ab3, Aa1Ab1; AaAc1, AaAb2."
299,Be easy you rogue!,C,"ab, AaAb4; cAc2, Aa1Ab2."
299,Be easy you rogue!,D,"aAb, aAb1; aAc1, AaAb2."
300,Apples in winter,A,"ab, cd; a1d1, ef."
300,Apples in winter,B,"Ac1a, Ac2b; Ac1c, Ac3Af1."
300,Apples in winter,B1,"Ac1a, Ac2b; b1Ab1, AeAf."
301,The humors of Castle Comer,A,"ab, a1a2; ab1, cd."
301,The humors of Castle Comer,B,"ab, Aa1Aa2; ab, AcAd."
302,The black rogue,A,"aa1, aa2; aa, a3a2."
302,The black rogue,B,"Aa4Aa5, Aa4a; Aa1b, AaAa2."
303,The ranting rake,A,"ab, b1c; ab, b1a."
303,The ranting rake,B,"aAa1, Ac1b; a1b1, Ab2Aa."
304,The blooming meadows,A,"ab, cb1; ad, d1a1."
304,The blooming meadows,B,"Ac1a, Ac2a1; Ac1a, Ad1Aa1."
304,The blooming meadows,B1,"Ac1a, Ac2a1; Ab2Ad2, Ad1Aa1."
305,Delaney's drummers,A,"ab, cd; a1b1, b2e."
305,Delaney's drummers,B,"Ab3Ab4, Ab5Ad1; Ab6Ab4, Ab2Ae."
305,Delaney's drummers,B1,"Ab3Ab4, Ab5Ad1; Ab7Ad2, Ab2Ae."
306,Crabs in the skillet,A,"ab, cc1; ab, c2d."
306,Crabs in the skillet,A1,"ab, cc1; ab, c2d1."
306,Crabs in the skillet,B,"Ac3Ac4, Ac5Ad1; Ac3Ac4, Ac5Ad2."
306,Crabs in the skillet,B1,"Ac3Ac4, Ac5Ad1; Ac3Ac4, Ac5Ad."
306,Crabs in the skillet,C,"Ab1Ab2, AcAc1; Ab1a, Ac2Ad."
306,Crabs in the skillet,C1,"Ab1Ab2, AcAc1; Ab1a, Ac2Ad1."
307,The woeful widow,A,"ab, a1c; ab, dc1."
307,The woeful widow,B,"aAb1, AaAb; aAb1, AbAc2."
308,The cat and the bacon,A,"ab, ab1; ab, b2c."
308,The cat and the bacon,B,"Ab3a, Ab1b; AaAb, a1Ac1."
309,The galloping young thing,A,"ab, ac; ab1, b2d."
309,The galloping young thing,B,"Ab3Ab1, Ab3Ad1; Ab3Ab1, Ab2Ad."
310,The bridal jig,A,"ab, cd; ab, cb1."
310,The bridal jig,B,"aAb2, Aa1Ac1; aAb2, Aa1a1."
310,The bridal jig,B1,"aAb2, Aa1Ac1; aAb2, Aa1Ab3."
311,The man in the moon,A,"ab, a1c; ab1, de."
311,The man in the moon,B,"aAb2, a1Ac1; a2b, AdAe."
312,Come with me now,A,"aa1, a2b; aa3, cd."
312,Come with me now,B,"aAd1, aAb1; aAa3, AcAd."
313,The frost is all over,A,"ab, ca1; ab, cc1."
313,The frost is all over,B,"Aa2Aa3, Aa2a; Aa2Aa3, bAc2."
313,The frost is all over,C,"Aa2Aa3, Aa2Ba; Ba1Ba2, BbBb1."
314,Sally Magee,A,"ab, cd; ab1, c1a1."
314,Sally Magee,B,"aAb2, aAc2; aAb2, Ac1Aa1."
315,The red rose,A,"ab, ca1; ab1, cd."
315,The red rose,B,"aAa2, AcAa1; aAb1, AcAd."
316,The humors of Glynn,A,"ab, cb1; ab2, db."
316,The humors of Glynn,B,"Aa1Ab3, aAb1; AaAb2, AdAb."
317,The Irishwoman,A,"ab, a1b1; ab, ca2."
317,The Irishwoman,B,"aAb2, Ab3Ab4; Aa3b, Ac1Aa2."
318,The merry huntsman,A,"aa1, aa2; aa3, ba2."
318,The merry huntsman,B,"Ab1a, Ab1a1; Ab1a, Ab2a1."
318,The merry huntsman,B1,"Ab1a, Ab1a1; Ab1a, Ab2a2."
319,The fairy jig,A,"ab, cd; ab1, ed1."
319,The fairy jig,B,"Ad2Ad3, Ae1Ad; Ad2Ad3, Ae1Ad1."
320,The piper's welcome,A,"ab, cb1; ab, db1."
320,The piper's welcome,B,"aa1, a2Ac1; aa1, AaAb1."
320,The piper's welcome,C,"aAb, aAb1; Ab2Ab, Ba3Ab1."
321,Oh! Hag you have killed me,A,"ab, cc; ab1, c1c1."
321,Oh! Hag you have killed me,B,"aAb2, AcAc; bAb2, Ac1Ac1."
322,The full moon,A,"aa1, bb1; aa, cd."
322,The full moon,B,"Ab2Aa1, Ad1Ad1; AaAa, AcAd."
323,Yesterday morning,A,"ab, cd; ab, c1e."
323,Yesterday morning,B,"Aa1a, Ac2Ad; AaAb, Ac1Ae."
324,Castletown Conners,A,"ab, ca1; ab, de."
324,Castletown Conners,B,"Ac1Ab1, Ac1a; Ac1Ab1, AdAe."
325,Martin's onehorned cow,A,"ab, ac; ab, b1c1."
325,Martin's onehorned cow,B,"aAb2, a1Ac2; aAb2, Ab1Ac1."
326,Ollistrun jig,A,"ab, ab1; ab2, cb3."
326,Ollistrun jig,B,"aAb4, aAc1; aAb4, Ac2Ac1."
327,Stay where you are,A,"ab, cb; a1b, cd."
327,Stay where you are,A1,"b1b, cb; a1b, cd."
327,Stay where you are,B,"Ab1a, ba; a1a, b1Ad1."
327,Stay where you are,B1,"Ab1a, ba; a1a, b1Ad1."
327,Stay where you are,C,"Ab1Ac1, Ac2Ac1; Aa1a, a1Ad."
327,Stay where you are,C1,"Ab1Ac1, Ac2Ac1; Aa1a, a1Ad."
327,Stay where you are,D,"a"
328,Miss Walsh's fancy,A,"aa, ab; aa, b1c."
328,Miss Walsh's fancy,B,"Ab1a, Ab1b; Ab1a, Ab1Ac."
328,Miss Walsh's fancy,C,"Aa1a, Aa1Bb1; Aa1a, Ab1Ac."
329,Humors of Clare,A,"ab, b1c; ab, b2d."
329,Humors of Clare,A1,"ab, b1c; ab, b2d1."
329,Humors of Clare,B,"aAb3, aAc; aAb3, Ab2Ad."
329,Humors of Clare,B1,"aAb3, aAc; aAb3, Ab2Ad1."
329,Humors of Clare,C,"Aa1Ab, Ba1Ac; Aa1Ab, Ab2Ad."
329,Humors of Clare,C1,"Aa1Ab, Ba1Ac; Aa1Ab, Ab2Ad1."
330,The queen of the fair,A,"ab, cc1; ab1, c2d."
330,The queen of the fair,B,"ab, Ab1Ac3; a1b, Ac4Ad."
330,The queen of the fair,C,"aa, bBa1; aa1, cAd."
330,The queen of the fair,C1,"aa, bBa1; Ba2Ba1, cAd."
331,The foot of the mountain,A,"aa1, aa2; aa3, ba4."
331,The foot of the mountain,B,"Ab1Ab1, Ab2Ab3; Ab3Ab1, Ab1Ab."
331,The foot of the mountain,C,"Aa4Ab1, Ab1Ab2; Ab3Ab3, Ab1Ab1."
331,The foot of the mountain,D,"AbAa4, "
332,The maids of Ballinacarty,A,"ab, ca; a1b, db1."
332,The maids of Ballinacarty,B,"Aa2Aa2, ab; Aa2Aa2, a1c."
333,Miss Downing's fancy,A,"aa1, ab; aa2, a3c."
333,Miss Downing's fancy,A1,"aa1, ab; aa2, a3b1."
333,Miss Downing's fancy,B,"Aa4a, bAb2; Aa4a, Ac1Aa5."
333,Miss Downing's fancy,B1,"Aa4a, bAb2; Aa4a, Ac1Ac."
334,When you go home,A,"ab, ac; aa1, c1c2."
334,When you go home,B,"Ab1Aa2, Ab1Ac2; Ab1Aa1, Ac1Ac2."
335,Friends of my heart,A,"ab, ca1; ab1, c1b2."
335,Friends of my heart,B,"aAc2, a1Ac3; a2Aa2, Ab3Ab2."
336,Down the river,A,"aa1, bc; aa2, de."
336,Down the river,B,"aAc1, a1Ab1; a2Ac2, Ac3Ae."
337,Come along with me,A,"ab, a1a2; a3b1, cd."
337,Come along with me,B,"ab, aAa4; Ac1Ab2, AcAd."
338,Cronin's Frolics,A,"aa1, a2a1; aa1, a2b."
338,Cronin's Frolics,B,"aa1, a2Aa3; AaAa4, Aa5Ab."
338,Cronin's Frolics,C,"Ba3Ba4, Ba5a; Ba6Aa6, Aa2Ab."
338,Cronin's Frolics,D,"Ba7Aa7, Ba8Ba9; aAa4, Aa5Ab."
339,The belles of Liscarroll,A,"ab, a1c; ab1, b2d."
339,The belles of Liscarroll,A1,"ab, a1c; ab1, b2d1."
339,The belles of Liscarroll,B,"Aa2a, Ad2Ab3; Aa3b, Ab2a1."
339,The belles of Liscarroll,B1,"Aa2a, Ad2Ab3; Aa3b, Ab2Ad3."
339,The belles of Liscarroll,C,"Ad4Aa4, Ad5Ab4; Ab5Ab6, Ba2Ba3."
340,Munster Bacon,A,"ab, cd; c1c2, b1d1."
340,Munster Bacon,B,"aa1, ba2; cc1, dAd1."
341,Billy McCormick,A,"ab, a1c; ab1, dd1."
341,Billy McCormick,B,"Ac1Aa2, aAa3; Aa4Ab2, AdAd1."
342,The chorus jig,A,"ab, a1c; ab, c1b1."
342,The chorus jig,B,"ab, aAc; ab, Ac2Ab1."
342,The chorus jig,C,"BaBb, BaAa2; Ab2Ab3, Ac1Ab1."
342,The chorus jig,D,"ab, aAc; ab, Ac3Ab1."
342,The chorus jig,E,"DaDb, DaAa3; Bb1Ab4, Ac1Ab1."
343,Church Hill,A,"ab, aa1; ab, a2a1."
343,Church Hill,B,"aa1, aAa1; a2a3, bAa1."
344,The stolen purse,A,"aa1, bc; aa1, c1d."
344,The stolen purse,B,"Aa2Aa1, AbAc; Aa3Aa1, Ac1Ad."
344,The stolen purse,C,"aAa1, AbAc2; aa1, Ac1Ad."
345,The trip to Galway,A,"ab, cd; ad1, b1e."
345,The trip to Galway,B,"aAd2, a1Ad3; Ab1b, Ad4Ae."
346,Miss Douglas,A,"aa1, bc; aa1, bc1."
346,Miss Douglas,B,"ab, b1Ac2; ab, b1Ac3."
346,Miss Douglas,B1,"ab, b1Ac2; Aa2Aa1, Ab1Ac1."
347,The maid of Kinsale,A,"ab, cd; a1b, c1d1."
347,The maid of Kinsale,B,"aAb1, Ac2Ad2; Aa2Ab2, Ac3Ad1."
348,The flowers of Dungarvan,A,"ab, cd; b1e, b2d1."
348,The flowers of Dungarvan,B,"aAe1, bc; a1Ae2, Ac1Ad1."
349,Miss Grant's jig,A,"ab, cb1; a1d, b2c1."
349,Miss Grant's jig,B,"Ac2a, Ab3Ad; Ac3Ad1, a1Ac1."
350,Don't be teasing,A,"ab, ac; ab1, de."
350,Don't be teasing,B,"Aa1Ac1, Aa1Ac2; Aa1Ab2, aAe."
351,Clancy's frolics,A,"aa1, bb1; ca1, de."
351,Clancy's frolics,B,"Ac1Ac2, Ac1Ac3; Ac1Ac2, AdAe."
352,The powers of punch,A,"aa1, bc; c1d, ef."
352,The powers of punch,B,"aAc2, aAa2; Ac1Ad, AeAf."
352,The powers of punch,C,"Ac3Ac1, Ad1Aa3; Ad2Ac1, AeAf."
352,The powers of punch,D,"Ad3Ae1, Ad4Af1; Ba1Ae2, AeAf."
353,The yellow wattle,A,"aa1, a2b; a2a1, cb1."
353,The yellow wattle,B,"aa, aAb2; aa, a1Ab1."
353,The yellow wattle,C,"aAb3, aAb4; aAb3, Ac1Ab1."
353,The yellow wattle,D,"aa1, aAb5; aa1, Ac1Ab1."
354,The lads of Dunse,A,"ab, cd; ab, cd1."
354,The lads of Dunse,B,"aAb1, AcAd; aAb1, AcAd1."
354,The lads of Dunse,C,"BaAb1, AcAd; Ac1Ab2, Ac2Ad1."
355,The lasses of Dunse,A,"ab, cb1; ab, c1b2."
355,The lasses of Dunse,B,"Ac2Ac3, Aca; Ac4Ac5, bAb3."
356,Portpatrick,A,"ab, ac; ab, de."
356,Portpatrick,B,"aa1, a2Ac; Ac1Ab, AdAe."
357,The Hibernian jig,A,"aa1, bc; de, b1c1."
357,The Hibernian jig,B,"aAb2, Aa2Ae1; bb1, b2Ac2."
358,Go to the Devil and shake yourself,A,"ab, a1c; ab, da2."
358,Go to the Devil and shake yourself,B,"Aa3Aa4, Aa5Aa6; AaAb, AdAa2."
359,May be I will,A,"ab, cd; a1e, a2f."
359,May be I will,B,"Ae1Af1, Ac1Ae2; aAc2, Ad1Af."
360,The market girl,A,"aa1, a2b; aa3, cb1."
360,The market girl,B,"aAc1, a1Ab1; a2b, Ac2Ab1."
361,The Drogheda weavers,A,"aa1, aa2; aa1, ba2."
361,The Drogheda weavers,B,"ab, Ab1Aa2; ab, Ab2Aa2."
362,The Hollyford jig,A,"ab, cb1; a1b, b2b3."
362,The Hollyford jig,B,"Aa2Ab4, AcAb1; Ab5Ab4, Ab2Ab6."
362,The Hollyford jig,C,"aAb7, Ac1b; cAa3, Ab8Ab3."
363,Nell Kennedy,A,"ab, a1c; ab, c1d."
363,Nell Kennedy,B,"aAc2, aAd1; aAc2, Ac1Ad."
363,Nell Kennedy,B1,"aAc2, aAd1; bAa2, Ac3Ad."
364,Three halfpence a day,A,"ab, a1c; ab, c1c."
364,Three halfpence a day,B,"Aa2Ab1, aa1; Aa3Aa4, Ac1Ac."
365,Merry Mary,A,"ab, a1b1; ab, cb2."
365,Merry Mary,B,"aAb, Aa1Ab1; aAb, AcAb2."
366,Bolt the door,A,"ab, b1c; c1b, b1c."
366,Bolt the door,A1,"b2b, b1c; c1b, b1c."
366,Bolt the door,B,"Ab2a, Ac2Ac; Ac1Ab, Ac2Ac."
366,Bolt the door,C,"Ac3Ab3, Ac2Ac; Ac1Ab, Ac4Ac5."
366,Bolt the door,D,"Aa1"
367,Ask my father,A,"ab, b1c; c1b, b1c2."
367,Ask my father,A1,"c3b, b1c; c1b, b1c2."
367,Ask my father,B,"Aa1Ab2, Ab3Ac; Ac1Ab2, Ab3Ac2."
367,Ask my father,B1,"Aa1Ab2, Ab3Ac; Ac1Ab2, Ab3Ac2."
367,Ask my father,C,"Aa2"
368,With all my heart,A,"ab, ab1; ab2, cb1."
368,With all my heart,B,"aAb3, aAb4; aAb2, AcAb4."
369,Get up early,A,"aa1, bb1; aa1, b2c."
369,Get up early,B,"Ac1a, Ab3Ab2; Ac1a, Ab2Ac."
369,Get up early,B1,"Ac1a, Ab3Ab2; Ac1a1, Ab2Ac."
370,Dan Rogers' jig,A,"ab, ac; ab, ac1."
370,Dan Rogers' jig,B,"ab, ac; ab, ac1."
371,Tie the petticoat tighter,A,"aa, bb; aa, b1b1."
371,Tie the petticoat tighter,B,"aAa1, bb; aAa1, b1b1."
371,Tie the petticoat tighter,B1,"aAa1, bb; a1a2, Ab1Ab1."
372,Trip it up stairs,A,"ab, cc; ad, c1c1."
372,Trip it up stairs,B,"aa1, Ac2Ac2; Ad1Ab1, Ac1Ac1."
372,Trip it up stairs,C,"Ba2Ba3, Ba4Aa1; Ad2Ad3, Ac1Ac1."
373,Sergt. Cahill's favorite,A,"ab, a1b1; ab, a2c."
373,Sergt. Cahill's favorite,B,"aa, Aa2Ab1; AaAb, Aa2Ac."
374,Moll in the wad,A,"ab, ac; ab, dc."
374,Moll in the wad,B,"Ad1Ad1, AdAc; Ad1Ad2, Ad3Ac."
375,Tim the thatcher,A,"ab, ac; ad, ed1."
375,Tim the thatcher,B,"Aa1Ac1, Aa1a; Aa1Ad2, AeAd1."
376,Is it the priest you want?,A,"ab, ab1; ab, a1b2."
376,Is it the priest you want?,B,"aAb3, a1Ab4; aAb3, Aa1Ab2."
377,Whiskey and water,A,"aa, aa1; aa, a1b."
377,Whiskey and water,B,"aAa2, aAb1; Aa2Aa3, Aa2Aa4."
377,Whiskey and water,B1,"aAa2, aAb1; Aa2Aa5, Aa1Ab."
378,The humors of Limerick,A,"aa1, ab; aa1, a1b."
378,The humors of Limerick,B,"Aa2a, Aa2a1; Aa2a, Aa1Ab."
379,Stack the rags,A,"aa1, aa2; aa1, bb1."
379,Stack the rags,B,"Aa1Ab2, Aa3Aa2; Aa1Ab2, Aa4Aa5."
379,Stack the rags,C,"Aa3Ab2, Aa3Ab3; aa1, AaAa2."
380,Tip the Cruiskeen,A,"aa1, bb; aa1, b1b1."
380,Tip the Cruiskeen,B,"Aa2a, AbAb; Aa2a, Ab1Ab1."
381,Tatter the road,A,"ab, b1c; a1b, c1b2."
381,Tatter the road,B,"Ab3a, a1a2; a3a, a4Ab."
382,Huish the cat,A,"aa1, aa2; aa1, ba2."
382,Huish the cat,B,"Ab1Aa3, Ab1Aa2; Ab1Aa3, Aa4Aa2."
383,The bucks of Westmeath,A,"ab, ab1; ab, cb1."
383,The bucks of Westmeath,B,"Ac1Ac2, Ac1Ab1; Ab2Ac3, AcAb1."
383,The bucks of Westmeath,C,"aa, aAb1; aa, AcAb1."
384,The beauties of Ireland,A,"aa1, ab; aa1, ab1."
384,The beauties of Ireland,A1,"cd, c1c2; aa1, ab."
384,The beauties of Ireland,A2,"aa1, ab1; A1cA1d, A1c1b2."
385,Off she goes!,A,"ab, ab1; ab, cb2."
385,Off she goes!,B,"aa1, ab; aa1, AcAb2."
386,Smash the windows,A,"ab, a1c; ab, c1d."
386,Smash the windows,B,"aAc2, a1Ac3; a2a3, bAd1."
386,Smash the windows,C,"Bb1Ab1, Ab2Ac4; Bb2Bb3, BbAd."
387,Ellis' jig,A,"aa1, aa1; a2b, a3c."
387,Ellis' jig,B,"Aa4Aa1, Aa4a; Aa2Ab, Aa3Ac."
388,Lock the door,A,"aa1, ab; aa1, a2c."
388,Lock the door,B,"ab, ab1; aAb1, Aa2Ac."
388,Lock the door,C,"aa1, aAb; aa1, Ab2Ac."
389,Maguire's kick,A,"aa1, a2b; aa1, ac."
389,Maguire's kick,B,"ab, aAc1; a1Aa3, Aa2Ac2."
389,Maguire's kick,C,"AaAa1, Aa2Ab; AaBb1, aAc."
390,The bunch of roses,A,"aa1, a2b; aa1, ca3."
390,The bunch of roses,B,"Aa4a, bb1; Ac1Ac2, Ac3Aa3."
391,The humors of Ballinafauna,A,"ab, cc1; a1b1, b2a2."
391,The humors of Ballinafauna,B,"aAc2, Ab3b; aAc2, b1Aa2."
392,Kiss me sweetheart,A,"ab, ac; ab, da1."
392,Kiss me sweetheart,B,"Ab1Ad1, Ac1Ac; Ab1Ad1, Ad2Aa1."
393,What ails you?,A,"ab, a1a2; ab, b1a3."
393,What ails you?,B,"Ab2Aa4, aAa5; Ab2Aa4, a1b."
394,Get up old woman and shake yourself,A,"ab, a1b1; ac, a2b."
394,Get up old woman and shake yourself,B,"Aa3Ab2, Aa3Ab; Aa3Ac, Aa2Ab."
395,Child of my heart,A,"ab, ac; ab, dc."
395,Child of my heart,B,"Ad1a, Ad1a1; Ad1Ab1, AdAc."
396,The northern road,A,"aa1, ab; ac, c1a2."
396,The northern road,B,"aAa3, a1Aa4; a2Aa5, a3Aa2."
396,The northern road,B1,"aAa3, a1Aa4; bb1, Ac1Aa2."
397,Come in from the rain,A,"ab, a1c; ab1, c1b2."
397,Come in from the rain,B,"aa, Ab3Ac2; aa, bAb2."
398,Behind the bush in the garden,A,"aa, bb1; ca1, a2b2."
398,Behind the bush in the garden,B,"Ac1a, Ac1Ab3; Ac1a, bAb2."
398,Behind the bush in the garden,B1,"Ac1a, Ac1Ab3; AcAa1, Aa2Ab2."
399,The runaway jig,A,"ab, a1c; ab, db1."
399,The runaway jig,A1,"ab, a1c; ab, db2."
399,The runaway jig,B,"Ad1Aa2, Aa3Aa3; Ad1Aa2, Ac1Ab2."
399,The runaway jig,B1,"Ad1Aa2, Aa3Aa3; Ad1Aa2, Ac1Ab1."
