Tune,Title,Part,Structure
400,The mariner's frock,A,"ab, a1c; da2, d1c1."
400,The mariner's frock,B,"Ad2Aa3, aAb1; Ad3Aa2, Ad1Ac1."
401,The humors of Castleoliver,A,"aa1, ab; a2a3, cb1."
401,The humors of Castleoliver,B,"Ab2Ac1, Aa1Ab3; Ab2Ac1, Aa1Ab4."
401,The humors of Castleoliver,B1,"Ab2Ac1, Aa1Ab3; Ab2Ac1, Aa1Aa4."
402,The lady of the lake,A,"ab, ac; ab, db1."
402,The lady of the lake,B,"ab, Aa1b1; ab, Ab2b2."
403,A morning in summer,A,"ab, b1b2; ab, a1a2."
403,A morning in summer,B,"Ab3a, Ab4Aa3; Ab5Ab6, Ab1Ab2."
404,I'm a silly old man,A,"ab, b1b2; ab, b3a1."
404,I'm a silly old man,B,"Aa2a, bAb4; ca1, c1Aa1."
405,Good night,A,"ab, ab1; ab2, cb1."
405,Good night,B,"aAb, a1Ab1; aAb2, AcAb1."
406,The lovely lad,A,"aa1, ba2; ca3, c1a1."
406,The lovely lad,B,"Ac2Ac3, Ac4Ac5; Ac6Ac7, Ac8Aa4."
407,Carbray's frolics,A,"ab, b1b1; ab, a1c."
407,Carbray's frolics,B,"aa1, Ab1Ab1; aa1, Aa1Ac."
408,Cahill's workshop,A,"ab, a1b1; ab2, cb3."
408,Cahill's workshop,A1,"ab, a1b1; ab2, cb4."
408,Cahill's workshop,B,"Ab5Ab, Ab6Ab1; Ab5Ab2, AcAb3."
408,Cahill's workshop,B1,"Ab5Ab, Ab6Ab1; Ab5Ab2, AcAb4."
409,The shady lane,A,"aa1, a2b; aa1, cb1."
409,The shady lane,B,"Ab2Ab3, Ac1Ab4; Ab2Ab3, AcAc2."
409,The shady lane,B1,"Ab2Ab3, Ac1Ab4; Ab2Ab3, AcAb1."
410,Barrack hill,A,"ab, ab1; ab, b2a1."
410,Barrack hill,B,"Ab3a, a1a2; Ab3a, bAa1."
410,Barrack hill,B1,"Ab3a, a1a2; Ab4a3, a4c."
411,The rocky road to Dublin,A,"ab, ac; ab, ac."
411,The rocky road to Dublin,B,"Ab1Ab2, Ab1Ac1; Ab1Ab2, aAc1."
411,The rocky road to Dublin,C,"aa1, a2Ac1; aa3, BaAc1."
412,Hardy man the fiddler,A,"ab, ac; ab, ac."
412,Hardy man the fiddler,B,"aAc, aAc1; aAc, a1Ac1."
413,The swaggering jig,A,"ab, ac; ab, ac."
413,The swaggering jig,B,"ab, a1Ac1; ab, cAc."
414,Tea in the morning,A,"ab, ac; ab, ac."
414,Tea in the morning,B,"aAb, aAc; aAb, bAc."
415,Will you come down to Limerick,A,"ab, ac; ab, ac."
415,Will you come down to Limerick,B,"ab, a1Ac1; ab, cAc1."
415,Will you come down to Limerick,C,"ab, aAc; ab, a1Ac."
416,The rakes of Westmeath,A,"aa1, bc; aa1, bc."
416,The rakes of Westmeath,B,"aa1, aAc; aa1, bAc."
417,The humors of Ballymanus,A,"aa1, ab; aa1, ab."
417,The humors of Ballymanus,B,"aa1, bAb; aa1, bAb."
417,The humors of Ballymanus,C,"aa1, aAb; aa1, aAb."
418,Roudledum,A,"ab, cd; ab, ce."
418,Roudledum,B,"ab, a1c; ab, a1Ae1."
419,Yellow legs,A,"aa1, ab; aa1, ab."
419,Yellow legs,B,"aa1, a2Ab1; aa1, a2Ab1."
419,Yellow legs,C,"aa1, bc; aa1, bc."
419,Yellow legs,D,"aa1, aAb2; aa1, aAb2."
420,Give us a drink of water,A,"ab, ab1; ab, ab1."
420,Give us a drink of water,B,"aa1, Aa1b; aa1, cb."
421,My mind will never be "aisy",A,"ab, ac; ab, ac."
421,My mind will never be "aisy",B,"Ac1Ab, aAc2; Ac1Ab, bAc2."
422,The fox hunters' jig,A,"aa1, ab; aa1, ab."
422,The fox hunters' jig,B,"ab, a1Ab1; ab, a1Ab1."
422,The fox hunters' jig,C,"Aa2Aa3, Aa2Ab2; Aa2Aa3, Aa2Ab2."
422,The fox hunters' jig,D,"aBb, Ba1Ab1; aBb, Ba1Ab1."
423,The boys of Ballysadare,A,"ab, a1c; ab, dc."
423,The boys of Ballysadare,B,"aAa2, a1Ac1; aAa2, AdAc."
424,A whack at the wigs,A,"aa1, ab; aa1, ab."
424,A whack at the wigs,A1,"cd, c1b1; aa1, ab."
424,A whack at the wigs,A2,"aa1, ab; A1cA1d, A1c1b1."
425,The Irish girl,A,"ab, ac; ab, ac."
425,The Irish girl,B,"ab, b1Ac1; b2b, b1c."
426,Sir Philip McHugh,A,"ab, ab1; ab, ab1."
426,Sir Philip McHugh,B,"aa1, aAb1; aa1, aAb1."
427,Terry heigh ho the grinder,A,"aa1, ab; aa1, ab."
427,Terry heigh ho the grinder,B,"ab, aAa1; ab, cAa1."
428,Top the candle!,A,"ab, a1c; ab, a1c."
428,Top the candle!,B,"ab, a1Ac; ab, cd."
429,Barney Brallaghan,A,"aa1, ab; aa1, ab."
429,Barney Brallaghan,B,"aa1, aAb1; aa1, aAb1."
429,Barney Brallaghan,C,"aAb1, bAb2; aAb1, cAb3."
430,Tipperary Hills,A,"aa1, a2b; aa1, a2b."
430,Tipperary Hills,B,"Ab1a, Ab1Ab2; Ab1a, Ab1Ab2."
431,Dever the dancer,A,"ab, ac; ab, ac."
431,Dever the dancer,B,"ab, aAc; ab, cAc."
432,I'm the boy for bewitching them,A,"ab, cd; ab, cd."
432,I'm the boy for bewitching them,B,"ab, ac; ab, de."
433,Hunting the hare,A,"ab, ac; ab, ac."
433,Hunting the hare,B,"ab, a1Ac1; ab, a1Ac1."
434,The kid on the mountain,A,"ab, ac; ab, ac."
434,The kid on the mountain,B,"ab, aAc; ab, aAc."
434,The kid on the mountain,C,"ab, aAc1; ab, aAc1."
434,The kid on the mountain,D,"aCb1, aAc1; aCb1, aAc1."
434,The kid on the mountain,E,"aAb1, aAc; aAb1, aAc."
434,The kid on the mountain,F,"aCb2, aAc; aCb2, aAc."
435,The hawthorn,A,"aa1, bc; aa1, bc."
435,The hawthorn,B,"aa1, ab; aa1, cAa1."
436,Up and down again,A,"aa1, ab; aa1, ab."
436,Up and down again,B,"aa1, aAb1; aa1, aAb1."
437,Another jig will do,A,"ab, ab1; ab, ab1."
437,Another jig will do,B,"ab, aAb1; ab, Aa1Ab1."
438,Dublin streets,A,"aa1, a2b; aa1, a2b."
438,Dublin streets,B,"Aa3a, Aa3b; Aa3a, cAb."
439,Dress her out in fine clothes,A,"ab, ac; ab, ac."
439,Dress her out in fine clothes,B,"aAa1, ab; a1a2, cc1."
440,Jerry Houlihan,A,"aa1, ab; aa1, ab."
440,Jerry Houlihan,B,"aa1, aAb; aa1, aAb."
440,Jerry Houlihan,C,"ab, cAb; ab, cAb."
440,Jerry Houlihan,D,"Ba2Ca1, Ba2Ab1; Ba2Ca1, Ba2Ab1."
440,Jerry Houlihan,E,"aa1, aAb2; aa1, aAb2."
440,Jerry Houlihan,F,"aa1, aAb2; aa1, aAb2."
441,Moll Roe,A,"ab, ab1; ab, a1b1."
441,Moll Roe,B,"Aa1Ab1, Aa1Ab1; Aa1Ab1, Aa1a."
442,Come up stairs with me,A,"ab, ac; ab, ac."
442,Come up stairs with me,B,"aAb, aAc; aAb, AaAc."
443,A fig for a kiss,A,"aa1, ab; aa1, ab."
443,A fig for a kiss,B,"ab, ac; ab, dAb."
444,Gurty's Frolics,A,"ab, a1c; ab, a1c."
444,Gurty's Frolics,B,"aa1, aAc; aa1, aAc."
444,Gurty's Frolics,C,"aAb1, a1Ac1; aAb1, a1Ac1."
444,Gurty's Frolics,D,"Ba2Ba3, Ba2Ac1; Ba2Ba3, Ba2Ac1."
444,Gurty's Frolics,E,"aAb2, aAc1; aAb2, aAc1."
444,Gurty's Frolics,F,"aa1, a2Ac1; aa1, a2Ac1."
444,Gurty's Frolics,G,"aCa2, a1Ac1; aCa2, a1Ac1."
444,Gurty's Frolics,H,"aCa3, Ga2b; aCa3, Ga2b."
444,Gurty's Frolics,I,"ab, cAc; ab, cAc."
445,Cahiramee,A,"aa1, bb1; aa1, b2b3."
445,Cahiramee,B,"aAa2, Ab4Ab1; aAa2, Ab2Ab3."
446,Spatter the dew,A,"aa1, ab; aa1, ab."
446,Spatter the dew,B,"aa1, aAb; aa1, bAb."
446,Spatter the dew,C,"ab, b1c; ab, dAb1."
446,Spatter the dew,D,"aAa1, aAb; ab, Bb1Ab."
447,Comb your hair and curl it,A,"ab, ac; ab, ac1."
447,Comb your hair and curl it,B,"ab, a1Ac2; ab1, cd."
448,Drops of brandy,A,"aa1, ab; aa2, cb1."
448,Drops of brandy,B,"aa1, aAb; aa2, bAb1."
449,Open the door for three,A,"aa1, bc; aa1, bd."
449,Open the door for three,B,"ab, AbAd; ab, AbAd."
450,I have a wife of my own,A,"ab, a1c; ab1, a1c."
450,I have a wife of my own,B,"aAa2, bAc; aAa2, cAc."
451,The highway to Kilkenny,A,"ab, ac; ab, ad."
451,The highway to Kilkenny,B,"Ab1Ab2, aa1; AaAb, AaAc."
451,The highway to Kilkenny,C,"AaAb, AaAd; Ab1Ab2, aAd."
452,Last night's fun,A,"ab, ab1; ab, ab2."
452,Last night's fun,B,"aa1, aAb1; ab, cAb1."
453,Ride a mill,A,"ab, ac; ab1, dc1."
453,Ride a mill,B,"aAc2, bAc1; aAc2, cd."
453,Ride a mill,C,"aa1, aAc3; aa1, bc."
454,The rakes of Sollohod,A,"ab, ac; ab, ac."
454,The rakes of Sollohod,B,"Ac1Aa1, Ac1Ab1; Ac1Aa1, aAb2."
455,The dusty miller,A,"ab, cb1; ab, a1b1."
455,The dusty miller,B,"Ab2Ab3, Ab2a; Ab2Ab3, Ab4a1."
456,The girl who broke my heart,A,"ab, cb1; ab, cb2."
456,The girl who broke my heart,B,"aa1, ab; aa2, Ac1Ab3."
457,The humors of Westport,A,"aa1, a2b; aa1, a3b1."
457,The humors of Westport,B,"aa1, aAb2; aa1, bAb."
458,The broken pledge,A,"ab, cd; a1b, ce."
458,The broken pledge,B,"Aa1a, bc; Aa1a, dAe1."
459,Repeal of the union,A,"ab, a1c; ab, dc1."
459,Repeal of the union,B,"aa1, aAc1; aa1, bAc1."
460,The Milliner's daughter,A,"ab, ac; ab, ac."
460,The Milliner's daughter,B,"ab, aAb1; a1Ac1, cAb1."
461,Paddy Ryan's dream,A,"ab, cc1; ab, cd."
461,Paddy Ryan's dream,B,"aa1, a2b; aa1, cAb1."
462,Music in the glen,A,"ab, a1c; ab, de."
462,Music in the glen,B,"ab, ba; Ac1a, b1Ac2."
462,Music in the glen,C,"Ac"
463,The peeler's jacket,A,"ab, cd; ab, cd1."
463,The peeler's jacket,B,"Ac1Ab1, Ac1Ad2; Ac1Ab1, aAd."
464,The silver tip,A,"ab, ac; ab, ac."
464,The silver tip,B,"ab, cb1; ab, db1."
465,The bank of Ireland,A,"ab, ac; ab, ac1."
465,The bank of Ireland,B,"ab, aAc2; cb, Ac3Ac4."
466,Take your choice,A,"ab, ac; ab, db1."
466,Take your choice,B,"ab, cAc1; db, Ab2Ab1."
467,All hands around,A,"ab, ac; ab, de."
467,All hands around,B,"Aa1Ab1, Aa1a; Aa1Ab2, AdAe."
468,The avonmore,A,"ab, a1c; ab1, dc."
468,The avonmore,B,"Aa2Ab, Aa3Ac; Aa2Ab1, AdAc."
469,The Bantry lasses,A,"ab, cd; ab, cd."
469,The Bantry lasses,B,"ab, aAd; ab1, Ad1Ad."
470,The merry days of easter,A,"ab, ab1; ab, ab2."
470,The merry days of easter,B,"ab, ac; db1, a1e."
471,My Maryanne,A,"ab, ac; ab, ad."
471,My Maryanne,B,"ab, a1c; aAb1, dc."
472,Leave my way,A,"ab, a1b1; a2b2, cd."
472,Leave my way,B,"Ab3a, Ad1Aa3; ba1, a2Ad2."
473,A rainy day,A,"ab, cd; c1e, ff1."
473,A rainy day,B,"Aa1Ae1, Aa2Af2; Aa3Ae1, aAf3."
474,Miss Crawford,A,"ab, ac; ab, ac1."
474,Miss Crawford,B,"ab, aAc1; cb1, de."
475,The morning star,A,"ab, ac; ab, ac."
475,The morning star,B,"ab, a1c; ab, Aa1d."
476,The bucks of Oranmore,A,"ab, a1c; ab, dc1."
476,The bucks of Oranmore,B,"Aa2Ab1, aAc; Aa2b, Adc."
476,The bucks of Oranmore,C,"aa1, aAc2; aa1, ab."
476,The bucks of Oranmore,D,"Ab2Ab3, Ab2Ac2; Ab2Ab3, aAc."
477,The Mourne Mountains,A,"aa1, bc; aa1, bd."
477,The Mourne Mountains,B,"Aa2Aa3, Ab1a; Aa2Aa3, Ab1Ad1."
478,The bunch of green rushes,A,"ab, cb1; ab, cb1."
478,The bunch of green rushes,B,"aa1, aAa1; a2a3, bAb2."
479,The spinning wheel,A,"ab, cb1; ab, cb1."
479,The spinning wheel,B,"aAc1, aAc2; aAc1, aAc2."
479,The spinning wheel,C,"Ac3Ab1, Ac3a; Ac3Ab2, ba."
479,The spinning wheel,D,"Ac2a, Ac2b; Ac2a, Ac2b."
480,Maude Miller,A,"ab, ac; ab, ac1."
480,Maude Miller,B,"ab, ab1; ab2, b3Ac."
481,The green mountain,A,"ab, cd; ab1, ce."
481,The green mountain,B,"Aa1a, bc; de, AcAe1."
482,The flogging reel,A,"aa1, a2b; aa1, a2b."
482,The flogging reel,B,"aAb1, a1Ab; a2Ab1, bAb."
482,The flogging reel,C,"aa1, a2a3; ab, BbAb."
483,Kate Kelly's fancy,A,"ab, a1a2; a3b, a4c."
483,Kate Kelly's fancy,B,"Aa4Ab1, Aa4Ac; aAb1, "
484,The new demesne,A,"ab, ac; ab, ad."
484,The new demesne,B,"aa1, aAd; aa1, bAd1."
485,The college grove,A,"ab, cd; c1b, ef."
485,The college grove,B,"ab, cAf1; dd1, ef."
485,The college grove,C,"aa1, aAf2; aa1, BeBf."
485,The college grove,D,"BdBd1, BdAf2; Bd2Bd3, BeBf."
486,Miss McDonald,A,"aa1, bc; aa1, bc."
486,Miss McDonald,B,"aa1, ab; AaAa1, AbAc."
486,Miss McDonald,C,"AaAa1, AbAc; BaBa1, BaBb."
486,Miss McDonald,D,"ab, ab1; b2b, Ab1b3."
486,Miss McDonald,E,"Bb1a, bc; b1a, b1c1."
487,Buckley's fancy,A,"ab, ac; ab1, de."
487,Buckley's fancy,B,"ab, a1b1; ab, aAe1."
488,Craig's reel,A,"ab, a1c; ab, dc."
488,Craig's reel,B,"ab, aa1; bc, Ac1"
489,The new mail-coach,A,"ab, ab1; ab, ab2."
489,The new mail-coach,B,"ab, cd; ab, eAb3."
490,Sheehan's reel,A,"ab, cd; ae, fb1."
490,Sheehan's reel,B,"Aa1Ad1, Aa2Ad1; Aa1Ad2, AfAb1."
491,The first month of summer,A,"ab, a1c; ab1, a2c1."
491,The first month of summer,B,"ab, ac; ad, ec1."
492,The bloom of youth,A,"ab, cd; ab, ae."
492,The bloom of youth,B,"ab, aAe1; ab, cAe."
493,Johnny's wedding,A,"aa1, ab; aa1, cc1."
493,Johnny's wedding,B,"aa1, aAc1; aa1, AcAc1."
494,The youngest daughter,A,"ab, ab1; ab, ab1."
494,The youngest daughter,B,"aAb2, ab; aAb2, cAb1."
495,The star of Munster,A,"ab, cd; eb, c1f."
495,The star of Munster,B,"Ac2Ad1, Ae1Ad2; Ac2Ad1, aAd3."
496,The Macroom lasses,A,"ab, ac; ab, ac1."
496,The Macroom lasses,B,"ab, a1Ac2; a2b1, cAc3."
497,My love is fair and handsome,A,"ab, ac; ab, ad."
497,My love is fair and handsome,B,"ab, aAc1; a1c, Aa1Ac2."
498,Kitty Losty's reel,A,"ab, cd; ab, cd."
498,Kitty Losty's reel,B,"ab, b1Ad; ab, cAd."
499,Captain O'Neill,A,"ab, ac; ab, ac1."
499,Captain O'Neill,B,"aa1, a2b; aa3, Ac2b1."
500,The chorus reel,A,"aa1, ab; aa1, ab1."
500,The chorus reel,B,"aa1, aAb1; aa2, bAb2."
500,The chorus reel,C,"ab, ac; ab, ac1."
500,The chorus reel,D,"Bb1a, BbAb3; Bb1a, BbAb3."
501,A bright May morning,A,"ab, ac; ab, ac."
501,A bright May morning,B,"ab, cAc1; ab, a1Ac2."
502,Toss the feathers,A,"ab, cd; ab, ef."
502,Toss the feathers,B,"Ac1a, ba; cd, Ac2Ad."
503,The boys of Ballinchalla,A,"aa1, a2a3; aa1, bc."
503,The boys of Ballinchalla,B,"Ac1Ac1, Ac2Ac2; Ac1Ac3, ab."
504,The ewe reel,A,"ab, ac; ab, ac1."
504,The ewe reel,B,"Ab1Ab2, Ab1a; bc, Aa1Ac."
505,The templehouse,A,"ab, cd; ab, cd."
505,The templehouse,B,"ab, cAa1; c1b, Aa2Ad."
506,The messenger,A,"ab, a1c; ab, a1c1."
506,The messenger,B,"ab, a1c; ab1, c1Ac2."
507,The day we paid the rent,A,"aa1, ab; aa1, ab1."
507,The day we paid the rent,B,"ab, ac; ab, dc1."
508,Over the bridge to Peggy,A,"aa1, a2b; a3a1, a4c."
508,Over the bridge to Peggy,B,"aa1, a2Ab1; bAb2, Ab3c."
509,The ladie's pantalettes,A,"ab, a1c; ab, a1c1."
509,The ladie's pantalettes,B,"Ab1a, Ab2Ac1; Ab1a, bAc2."
510,Jim Moore's fancy,A,"aa1, bc; aa1, de."
510,Jim Moore's fancy,B,"aAc1, a1b; b1Ac1, cAe."
511,The new policeman,A,"aa1, bc; aa1, bc."
511,The new policeman,B,"ab, ac; ab, da1."
512,The flower of the flock,A,"ab, a1c; ab, a1c1."
512,The flower of the flock,B,"Ac2Ab1, Ac2a; bAb, Aa1Ac3."
513,The green fields of America,A,"ab, cb; ab1, cd."
513,The green fields of America,B,"aAc1, AaAb; bAb2, AcAd."
514,The boyne hunt,A,"ab, ac; ab, ac."
514,The boyne hunt,B,"ab, aAc; ab, cAc."
514,The boyne hunt,C,"aa1, aAc; aa1, BcAc."
515,The bush in bloom,A,"ab, ac; ab, ad."
515,The bush in bloom,B,"aAa1, ab; Aa2c, Aa3d."
516,The mountain lark,A,"ab, ac; ab, ad."
516,The mountain lark,B,"ab, ac; ab, dAc."
517,The steam packet,A,"ab, cb1; ab, cb1."
517,The steam packet,B,"ab, ab1; ac, db1."
518,Peggy on the settle,A,"aa1, ab; aa1, ab."
518,Peggy on the settle,B,"aa1, a2b; aa1, cb1."
519,The five-leaved clover,A,"ab, cd; ae, cd1."
519,The five-leaved clover,B,"Aa1Ab1, aAd1; Aa2Ab1, bAd2."
520,Colonel Fraser,A,"ab, a1c; ab, a1d."
520,Colonel Fraser,B,"ab, a1Ad; cb1, dAd."
520,Colonel Fraser,C,"ab, a1c; aAb1, Bd1Ad."
520,Colonel Fraser,D,"aa1, aCc; a2a3, BdAc."
521,The boys of Portaferry,A,"aa1, a2b; aa1, a2c."
521,The boys of Portaferry,B,"aa1, a2Ab1; aa1, a3b."
522,The clock in the steeple,A,"ab, ab1; ab, cb1."
522,The clock in the steeple,B,"aAb2, a1Ab2; aAb2, AcAb1."
523,The new road,A,"ab, ac; ab1, ac1."
523,The new road,B,"aa1, a2b; cc1, a2b."
523,The new road,C,"Aa1a, bc; ba1, Aa2Ac1."
524,The reconciliation,A,"ab, ab1; ab, cd."
524,The reconciliation,B,"ab, ac; de, AcAd1."
525,Tear the calico,A,"ab, a1c; db1, d1c1."
525,Tear the calico,B,"Ad2Ab2, Ad2Ac; Ad2Ab2, Ad2a."
525,Tear the calico,C,"aAb, aAc; aAb, Ad1Ac1."
526,Mary Grace,A,"ab, ab1; ab, cd."
526,Mary Grace,B,"Ac1Aa1, Ac2Ad; AaAb, AaAb1."
526,Mary Grace,C,"AaAb, AcAd; Ac1Aa1, Ac2a."
527,Dillon Brown,A,"ab, aa1; ab, aa1."
527,Dillon Brown,B,"aa1, aAa2; aa1, bc."
528,The miller's maid,A,"aa1, a2b; aa1, a2b."
528,The miller's maid,B,"aAa3, Aa4Ab; aAa3, bAb1."
529,The green branch,A,"aa1, a2b; aa1, a2b1."
529,The green branch,B,"ab, ab1; ab2, b3c."
530,Far from home,A,"ab, ac; ab, c1d."
530,Far from home,B,"Ad1Ac2, aAc; AaAb, Ac1Ad2."
531,Colonel Rodney,A,"ab, a1c; ab, c1d."
531,Colonel Rodney,B,"ab, a1b1; cAb, Ac1Ad1."
532,The ships are sailing,A,"ab, cc1; ab, ca1."
532,The ships are sailing,B,"Ac2Ac3, Ac2a; Ac2Ac3, bAc4."
533,John O'Neill's reel,A,"ab, ac; ab, ac."
533,John O'Neill's reel,B,"ab, Aa1Ac; ab, Ab1c."
534,Miss Thornton's reel,A,"ab, cd; ab, cd1."
534,Miss Thornton's reel,B,"ab, ac; db, Ad2c1."
535,The merry sisters,A,"aa1, ab; aa1, ac."
535,The merry sisters,B,"aa1, aAc1; aa2, bAc1."
535,The merry sisters,C,"Ac2Ab1, Ac2Ab2; Ac2Ab1, aAc3."
536,The swallow's tail,A,"ab, a1b1; ab1, cd."
536,The swallow's tail,B,"aAb, Aa1Ab1; aAb1, AcAd1."
537,Jacky Latin,A,"ab, ac; ab1, dc."
537,Jacky Latin,B,"Ad1a, Ad1Ac1; Ad1a, AdAc."
537,Jacky Latin,C,"aBa1, aAc; aBa1, AdAc2."
538,The daisy field,A,"ab, ac; ab1, ad."
538,The daisy field,B,"Ab2Aa1, Ab3Ad1; Ab3Aa1, aAc."
539,Tom Steele,A,"ab, a1c; ab1, dc."
539,Tom Steele,B,"aAb2, aAc; ab, Ad1Ac."
540,Dillon's fancy,A,"ab, cd; ab, ef."
540,Dillon's fancy,B,"aa1, aAc1; aa1, Ae1Af1."
541,The Sligo chorus,A,"ab, a1c; ab, c1d."
541,The Sligo chorus,B,"aa1, bAc2; aa2, Ac1Ad1."
542,The dogs among the bushes,A,"ab, ab1; ab, cd."
542,The dogs among the bushes,B,"ab, a1Ad1; ab, b1Ad1."
543,Peter Kennedy's fancy,A,"ab, cd; a1b, cd1."
543,Peter Kennedy's fancy,B,"aAd2, a1Ad3; a2Ad2, bAd."
544,The Curragh races,A,"ab, ac; ab, ac."
544,The Curragh races,B,"aa1, ab; aa1, Aa1b1."
545,Bonnie Kate,A,"ab, ca1; ab, cd."
545,Bonnie Kate,B,"ab, cAd1; a1b, cd."
546,London lasses,A,"ab, ac; ab, dc1."
546,London lasses,B,"ab, cAc; ad, AdAc1."
547,Follow me down,A,"ab, a1c; ab, a1c1."
547,Follow me down,B,"aa1, bAc1; cAa2, Ab1Ac1."
548,Dan McCarty's fancy,A,"aa1, ab; aa1, ab1."
548,Dan McCarty's fancy,B,"ab, a1Ab1; ab1, cAb2."
549,The musical priest,A,"ab, a1c; ab, a1c."
549,The musical priest,B,"Aa2a, Aa3Ac1; ba, cAc1."
549,The musical priest,C,"ab, ab1; a1b, Bcb2."
550,Ballinasloe fair,A,"ab, ac; ab, ad."
550,Ballinasloe fair,B,"ab, b1Ad; a1b, Aa1Ad1."
551,The christening,A,"aa1, bc; da2, bc1."
551,The christening,B,"ab, aAc2; ab, cAc3."
552,O'Dwyer's reel,A,"ab, a1b1; ab, cd."
552,O'Dwyer's reel,B,"aAd1, bAd; aAd1, Ac1Ad."
553,The miller's daughter,A,"ab, a1c; a2b1, de."
553,The miller's daughter,B,"aAb2, aAe1; a1b, cAe2."
554,McFadden's handsome daughter,A,"ab, cd; ab, cd1."
554,McFadden's handsome daughter,B,"Aa1a, Aa1b; cd, b1b2."
554,McFadden's handsome daughter,C,"ab, ac; ab, Ac1Bc1."
555,Cunningham's fancy,A,"ab, ab1; ab, ab2."
555,Cunningham's fancy,B,"aAb, ab; aAb, AaAb2."
555,Cunningham's fancy,C,"BaAb, BaBb1; aAa, Ab3"
556,Mary O'Neill's fancy,A,"ab, a1c; a1b, a1c1."
556,Mary O'Neill's fancy,B,"aa1, a2Aa2; ab, cb1."
557,The Drogheda lasses,A,"ab, ac; ab, dc."
557,The Drogheda lasses,B,"ab, aAc; ab, cAb1."
558,McFadden's own reel,A,"ab, cd; ae, c1d."
558,McFadden's own reel,B,"aAa1, aAd1; a1Aa2, bc."
559,Johnny with the queer thing,A,"ab, cd; ab, cd1."
559,Johnny with the queer thing,B,"ab, cAd1; ab1, cAd."
560,The blackberry blossom,A,"ab, a1b1; ab, a1b2."
560,The blackberry blossom,B,"ab, b1Ab2; ab, cAb3."
561,Jim Kennedy's favorite,A,"ab, cc1; ab, cd."
561,Jim Kennedy's favorite,B,"ab, aAd; ab, cAd1."
562,The flowing bowl,A,"ab, a1c; ab, a1c1."
562,The flowing bowl,B,"ab, aAc1; ab, cAc2."
563,Lovely Molly,A,"ab, ac; ab, ac."
563,Lovely Molly,B,"ab, a1Aa1; ab1, cAa1."
564,More luck to us,A,"ab, a1c; a2b, de."
564,More luck to us,B,"aAd1, Ae1Ac1; aAb1, AdAe2."
565,The woman of the house,A,"ab, ac; ab, de."
565,The woman of the house,B,"Ad1a, Ad1b; Ad1a, AdAe."
565,The woman of the house,C,"Ad1Ba, ab; cBa1, AdAe."
566,Sweet Biddy of Ballyvourney,A,"ab, ac; ab, ac."
566,Sweet Biddy of Ballyvourney,B,"ab, aAc; a1c, dAc."
567,Cahill's courtship,A,"aa1, a2b; aa1, a2b1."
567,Cahill's courtship,B,"aAa3, aAb1; aAa3, Ab2Ab."
568,Joe Cant's reel,A,"ab, ac; ab, ac."
568,Joe Cant's reel,B,"ab, aAc; ab, cb1."
569,The snow on the hills,A,"ab, a1b1; ab, cd."
569,The snow on the hills,B,"ab, aAd1; ab1, cAb2."
570,Lawson's favorite,A,"ab, cd; ab1, c1d1."
570,Lawson's favorite,B,"ab, ac; ab, de."
571,Kiss the maid amid behind the barrel,A,"ab, a1c; ab, a1c."
571,Kiss the maid amid behind the barrel,B,"aa1, bAc; aa2, cd."
571,Kiss the maid amid behind the barrel,C,"aAc1, a1Ac; aAc1, bAc."
571,Kiss the maid amid behind the barrel,A1,"Cb1d, Cb1c; ab, a1c."
571,Kiss the maid amid behind the barrel,A2,"ab, a1c; BaBa1, Bbc."
571,Kiss the maid amid behind the barrel,D,"BaBa2, BcBd; CaAc1, Ca1Ac."
571,Kiss the maid amid behind the barrel,E,"CaAc1, CbAc; Cb1A1d, Cb1Ac."
572,Roll her on the mountain,A,"ab, a1c; ab, a2d."
572,Roll her on the mountain,B,"aAc1, ab; aAc1, cb1."
573,The Fermoy lasses,A,"aa1, ab; aa1, cb1."
573,The Fermoy lasses,B,"ab, aAb; ab, cAb."
574,The happy days of youth,A,"ab, ac; ab, ac."
574,The happy days of youth,B,"aa1, ab; aa1, Ab1c."
575,Miss Monaghan,A,"ab, cd; ab, cd1."
575,Miss Monaghan,B,"ab, AcAd2; ab, AcAd1."
575,Miss Monaghan,C,"ab, cd; ab, Bb1Bb2."
576,The rose in the garden,A,"ab, a1c; ab, a2c."
576,The rose in the garden,B,"Ab1a, Ab1Ac; Ab1a, bc."
577,The old pensioner,A,"ab, a1c; ab, a1d."
577,The old pensioner,B,"aa1, ab; aa1, b1b."
578,The reel of Mullinavat,A,"ab, b1c; ab, b2c1."
578,The reel of Mullinavat,B,"ab, ac; AaAb, Ab1Ac."
578,The reel of Mullinavat,C,"AaAb, Ab2Ac1; BaBb, Bb1a."
579,MacLean's favorite,A,"ab, aa1; ab, ac."
579,MacLean's favorite,B,"ab, ab1; ab2, Ac1Aa2."
580,The dancer's delight,A,"ab, ab1; ab, ab2."
580,The dancer's delight,B,"aAb1, ab; aAb1, a1c."
581,Trim the velvet,A,"aa1, ab; aa1, ab."
581,Trim the velvet,B,"Ab1Ab2, Ab1Ab; Ab3Ab2, aAb."
581,Trim the velvet,C,"Ba1Aa2, aAb; Ba1Aa2, aAb."
581,Trim the velvet,D,"aAb4, aAb; aAb4, bAb."
582,Lough Allen,A,"aa1, a2b; aa1, cd."
582,Lough Allen,B,"ab, a1Ab1; ab, a1Ab2."
583,Jennie Pippin,A,"aa1, ab; aa1, ab1."
583,Jennie Pippin,B,"aa1, aAb2; ab, cAb1."
584,The Leitrim trush,A,"ab, cd; a1b1, cd1."
584,The Leitrim trush,B,"ab, a1c; ab, dAd2."
585,The black haired lass,A,"ab, a1c; a1b1, a1c1."
585,The black haired lass,B,"ab, a1c; a1b1, c1Ac2."
586,My love is in America,A,"ab, ac; ab1, de."
586,My love is in America,B,"aAb, a1Ac; aAb1, AdAe."
587,The Dublin lasses,A,"ab, ac; ab, dc."
587,The Dublin lasses,B,"aa1, a2b; aa1, b1c."
588,Captain Kelly's reel,A,"ab, ac; db, ef."
588,Captain Kelly's reel,B,"ab, aAb1; ab1, cd."
589,Beamish's goat,A,"ab, ac; ab1, b2c1."
589,Beamish's goat,B,"Aa1a, Aa1Ac2; Aa1b, cd."
590,Casey the whistler,A,"ab, ac; ab, ac."
590,Casey the whistler,B,"ab, ac; ab1, c1d."
591,Downing's reel,A,"ab, a1c; a1d, a1c1."
591,Downing's reel,B,"aAc2, aAc1; aAc2, bAc1."
592,A cloudy morning,A,"ab, ac; a1d, ef."
592,A cloudy morning,B,"aAe1, bc; bd, AaAd1."
593,Thompson's reel,A,"ab, cb1; ab, cb2."
593,Thompson's reel,B,"ab, ac; ab, dAb3."
594,The merry harriers,A,"ab, ac; ab, ac1."
594,The merry harriers,B,"aa1, aAc2; aa1, aAc."
595,Pat Tuohy's reel,A,"ab, ac; ab, ac1."
595,Pat Tuohy's reel,B,"Ab1a, Ab1Ac2; Ab1a1, bAc2."
596,The boys of Galway,A,"ab, ac; ab, de."
596,The boys of Galway,B,"aAb1, aAb2; aAb1, Ad1Ae1."
597,The wedding,A,"ab, a1c; ab, a1c."
597,The wedding,B,"aa1, aAc1; ab, Aa2Ac2."
598,The mason's apron,A,"ab, a1c; a2b, cd."
598,The mason's apron,B,"aa1, a2Ac1; aAb, AcAd1."
599,The Cashmere shawl,A,"ab, cb1; ab, cc1."
599,The Cashmere shawl,B,"ab, ab1; ab, cAc2."
600,The old grey gander,A,"aa1, ba2; aa1, bc."
600,The old grey gander,B,"ab, a1Ac; ab, Ab1Ac."
601,Johnny's welcome home,A,"ab, cd; ef, gh."
601,Johnny's welcome home,B,"aAd1, bAd; AeAf, AgAh1."
602,Jenny picking cockles,A,"ab, ab1; ac, a1b2."
602,Jenny picking cockles,B,"ab, ac; ab1, Aa1Ab2."
603,The Salamanca reel,A,"ab, a1c; de, fg."
603,The Salamanca reel,B,"aAf1, Ae1Ae2; bAf2, AfAg1."
604,The star of Kilkenny,A,"ab, a1b1; ab, a2a3."
604,The star of Kilkenny,B,"aAb1, a1Ab1; aAb1, a1Ab1."
605,Kitty got a clinking coming from the races,A,"ab, cd; ab, ed1."
605,Kitty got a clinking coming from the races,B,"Ae1a, Ae1Ad1; Ae1a, AeAd1."
606,Tie the bonnet,A,"ab, ac; ab, ac."
606,Tie the bonnet,B,"ab, aAc; ab, Aa1Ac."
607,Tie the ribbons,A,"ab, a1c; ab, a1c."
607,Tie the ribbons,B,"aAb1, aAc; aAb1, bAc1."
608,The rising sun,A,"ab, a1c; ab, dc1."
608,The rising sun,B,"ab, ac; ab, de."
608,The rising sun,C,"aBe1, aBe2; a1Ab1, Bc1b."
609,The strawberry blossom,A,"ab, a1c; ab1, dc."
609,The strawberry blossom,B,"ab, aAc1; ab, cd."
610,I have no money,A,"ab, ac; a1b, a1c1."
610,I have no money,B,"ab, aAc2; ab, cd."
611,The first of March,A,"ab, ac; ab, ac1."
611,The first of March,B,"aAb1, ab; aAb1, cAc2."
612,Jack Dolan,A,"ab, a1c; ab, a1c."
612,Jack Dolan,B,"ab, ac; a1b1, de."
613,Dr. Taylor,A,"ab, ab1; ab, cd."
613,Dr. Taylor,B,"aa1, a2Ad1; a3a1, Acb."
614,The money musk,A,"ab, cd; a1b, ce."
614,The money musk,B,"ab, a1Ae; cAb1, de."
615,Your mother's fair pet,A,"ab, a1c; ab, a1c1."
615,Your mother's fair pet,B,"ab, aAc1; ab, cAc2."
616,Molly put the kettle on,A,"aa1, bc; aa1, dc."
616,Molly put the kettle on,B,"Ad1Aa2, Ad1Ac1; Ad1Aa2, AaAc."
617,The boys of Cappoquin,A,"ab, ac; ab, ac."
617,The boys of Cappoquin,B,"aa1, Ab1Ac1; aa2, Ab1Ac1."
618,The magpie's nest,A,"ab, cd; ab, cd1."
618,The magpie's nest,B,"aa1, Ab1Ad; Ab2Ab3, bAd1."
619,The threepenny bit,A,"ab, ac; ab, dc1."
619,The threepenny bit,B,"aAb1, Aa1Ac; a1Ab1, AdAc1."
620,How the money goes,A,"ab, ac; ab, ac1."
620,How the money goes,B,"aa1, ab; aa2, Ac2Ab1."
621,The sailor's jacket,A,"ab, ac; ab, ac."
621,The sailor's jacket,B,"aa1, aAc1; Ab1Ab2, bAc1."
622,The ivy leaf,A,"ab, aa1; ab, aa1."
622,The ivy leaf,B,"ab, a1Aa1; ab, cd."
623,An ugly customer,A,"ab, ac; ab1, dc1."
623,An ugly customer,B,"Ad1a, AdAc1; Adb, cAb2."
624,The Dublin reel,A,"aa1, ab; aa1, ac."
624,The Dublin reel,B,"ab, ab1; a1b2, Aa1Ab."
624,The Dublin reel,C,"aAb1, Aa1Ac1; aAb1, bAa2."
625,The sailor's return,A,"ab, a1c; de, a1e1."
625,The sailor's return,B,"aa1, Aa2Ac1; Ad1Ae, Aa1Ae1."
626,Miss Johnson,A,"ab, aa1; ab, cd."
626,Miss Johnson,B,"ab, aAa2; ab, cAa3."
627,The mills are grinding,A,"ab, a1b1; ab, cd."
627,The mills are grinding,B,"Aa2a, Aa3Ad1; Aa2a, AcAd."
628,Jerry Hayes,A,"aa1, ab; aa1, ab."
628,Jerry Hayes,B,"aa1, aAb1; a2b, a3Ab2."
629,The Belfast lasses,A,"ab, ac; ab, ac1."
629,The Belfast lasses,B,"Ab1Ab, Ab1Ac2; Ab1Ab, Ab2Ac1."
630,The lady behind the boat,A,"ab, cc1; ab, cd."
630,The lady behind the boat,B,"Ac2Ac3, Ac2a; bc, Ab1Ac1."
631,Touch me if you dare,A,"ab, ac; ab, a1c1."
631,Touch me if you dare,B,"ab, aAc2; ab, Aa1Ac1."
632,You rouge you dar'n't meddle me,A,"ab, ac; ab, ac1."
632,You rouge you dar'n't meddle me,B,"Ab1Aa1, Ab1a; Ab2Aa1, AaAc2."
633,The flax in bloom,A,"ab, cb1; ab, de."
633,The flax in bloom,B,"Ac1a, bAb; Ac1a, cAe1."
634,The Wexford lasses,A,"ab, a1c; ab, dc1."
634,The Wexford lasses,B,"Ad1a, Ad1Ac2; Ad1a, Ad2Ab1."
635,Pick your partner,A,"ab, ac; ab, ad."
635,Pick your partner,B,"aAd1, aAd2; aAd1, bAc1."
636,The Sligo lasses,A,"ab, a1c; ab, a1c1."
636,The Sligo lasses,B,"Aa2Ac2, Aa2a; Aa2Ac2, Ac3Ac4."
637,McFadden's mishap,A,"ab, ac; ab, de."
