Tune,Title,Part,Structure
637,McFadden's mishap,B,"Aa1a, Aa1Ac1; Aa2a1, Ad1a2."
638,Nellie O'Donovan,A,"ab, ac; ab, a1c1."
638,Nellie O'Donovan,B,"ab, ab1; ab, cb1."
639,On the sly,A,"ab, ac; ab, a1c1."
639,On the sly,B,"ab, cb; ab1, Aa1Ac2."
640,The four courts No. 1,A,"aa1, ab; aa2, cb1."
640,The four courts No. 1,B,"Aa3Ab2, Aa3Ab1; Aa3Ab2, aAb3."
640,The four courts No. 1,C,"aBa1, aAb3; bBa2, BaAb4."
641,The four courts No. 2,A,"aa1, ab; aa1, ab."
641,The four courts No. 2,B,"Aa2Ab1, aAb; Aa2Ab1, a1Ab."
641,The four courts No. 2,C,"aAb2, aAb; bAb3, b1Ab."
641,The four courts No. 2,D,"aAb4, aAb; aAb4, aAb."
642,The man of the house,A,"aa1, ab; aa1, ab."
642,The man of the house,B,"Ab1a, Ab1a1; Ab1a2, Ab2b."
643,Julia Delaney,A,"ab, ac; ab, ac1."
643,Julia Delaney,B,"aa1, a2Ac2; aa3, bAc."
644,The highway to Limerick,A,"ab, cd; ab, cd."
644,The highway to Limerick,B,"ab, aAb1; ac, AcAd."
645,Col. McBain,A,"aa1, ab; aa2, cb1."
645,Col. McBain,B,"Aca, Ac1b; ca1, de."
646,The collier's reel,A,"ab, a1c; a2b, db1."
646,The collier's reel,B,"aAd1, aAa3; bAb2, AdAb1."
647,The maid that dare not tell,A,"aa1, a2b; aa1, a2b."
647,The maid that dare not tell,B,"ab, aAb1; ab, cAb."
648,The pigeon on the gate,A,"aa1, bc; aa1, de."
648,The pigeon on the gate,B,"ab, a1c; ab, Ac1Ae1."
649,Lord McDonald's reel,A,"ab, ac; ab, ac."
649,Lord McDonald's reel,B,"aa1, ab; a2a3, Ac1Ac2."
650,The maids of Mitchellstown,A,"ab, ab1; ab, ac."
650,The maids of Mitchellstown,B,"ab, cAc1; ab, cAb2."
651,Erin's hope,A,"ab, a1c; ab, a2d."
651,Erin's hope,B,"ab, a1Ab; ab, cd."
652,Molly what ails you?,A,"ab, ac; a1b1, ad."
652,Molly what ails you?,B,"ab, aAc1; ab, AaAd1."
653,Tady's wattle,A,"ab, cd; ab, cd."
653,Tady's wattle,B,"aAb1, aAd1; bc, c1Ad."
654,The old maids of Galway,A,"ab, a1b1; ab, a1b1."
654,The old maids of Galway,B,"Ab2a, Ab2Ab1; Ab2a, bAb1."
655,Miss McLeod's reel,A,"ab, ab1; ab2, cd."
655,Miss McLeod's reel,B,"Ac1Ab, Ac1Ab3; Ac2a, Ab4Ad1."
656,Sergt. Early's dream,A,"ab, a1a2; a3b, cd."
656,Sergt. Early's dream,B,"aAa2, a1b; a2Aa2, cAd1."
657,Push about the jorum,A,"ab, ac; ab, ac1."
657,Push about the jorum,B,"ab, ab1; ab, cd."
658,Maurice Casey's fancy,A,"ab, ca; a1b, cd."
658,Maurice Casey's fancy,B,"ab, Ac1Ad; ab, cAd1."
659,Young Arthur Daly,A,"ab, a1b1; ab, a1b1."
659,Young Arthur Daly,B,"ab, ac; dAb2, Aa1Ab1."
660,Considine's grove,A,"ab, ab1; ab, ab1."
660,Considine's grove,B,"aa1, ab; aa1, cd."
661,Sleepy Maggie,A,"ab, ab1; ab, ab1."
661,Sleepy Maggie,B,"Aa1Ab2, aAb1; Aa1Ab2, bAb3."
661,Sleepy Maggie,C,"Aa2a, a1a2; AaAb, AaAb1."
661,Sleepy Maggie,D,"AaAb, AaAb1; Aa1Ab2, BaAb1."
661,Sleepy Maggie,E,"Aa1Ab2, BbAb3; Aa2Ca, Ca1Ca2."
662,Drowsy Maggie,A,"aa1, ab; aa1, ab."
662,Drowsy Maggie,B,"aAb1, aAb; aAb1, bAb."
663,The plaid mantle,A,"ab, ac; ab, ad."
663,The plaid mantle,B,"Ac1Ab, AcAd; Ac1Ab, AaAd1."
664,The humors of Ballinacarrig,A,"ab, ca1; ab, cd."
664,The humors of Ballinacarrig,B,"aa1, a2Ad; aa1, bAd."
665,The harvest field,A,"ab, b1c; ab, b2d."
665,The harvest field,B,"ab, ac; dd1, Aa1e."
666,The green groves of Erin,A,"ab, ac; ab, dc1."
666,The green groves of Erin,B,"ab, aAd1; a1b1, cd."
667,The scolding wife,A,"ab, ac; ab, de."
667,The scolding wife,B,"aAb1, aAc1; aAb1, a1Ae."
668,The mooncoin reel,A,"ab, cb1; ab1, cd."
668,The mooncoin reel,B,"aa1, a2a3; aa1, bAd1."
669,Kiss me Kate,A,"ab, ac; ab, ad."
669,Kiss me Kate,B,"Ad1a, Ad1b; cAd1, a1b1."
670,Lord Gordon's reel,A,"ab, cd; d1e, fc1."
670,Lord Gordon's reel,B,"aAb1, Ac2Ad; Ad1Ae, AfAc3."
671,Five miles away,A,"ab, a1c; ab, a1d."
671,Five miles away,B,"aa1, ab; aa1, b1Ad1."
672,Within a mile of Clonbur,A,"ab, a1c; ab, dc."
672,Within a mile of Clonbur,B,"aa1, aAb1; aa1, AdAc."
673,The Drummond lasses,A,"aa1, ab; aa1, cb1."
673,The Drummond lasses,B,"aa1, a2Ab; aa1, Ab2Ab."
674,Johnny has gone to France,A,"ab, a1b1; ab, a1b2."
674,Johnny has gone to France,B,"aAb3, ab; a1b1, cb."
675,The bonnie boy,A,"ab, ab1; ab, cd."
675,The bonnie boy,B,"aAb2, a1Ad; a1Ab, Acb."
676,Dooley's fancy,A,"ab, cd; ab, c1b1."
676,Dooley's fancy,B,"aAb2, aAd1; bAb, cAa1."
677,The second wedding,A,"ab, ac; ab, ad."
677,The second wedding,B,"Ac1a, Ac1Ad1; Ac1a, bAb1."
678,The old schoolmaster,A,"ab, a1c; ab1, a1c."
678,The old schoolmaster,B,"ab, cAc1; c1b, dAc."
679,Around the world for sport,A,"ab, ac; ab, dc1."
679,Around the world for sport,B,"aAc2, a1Ac3; a2Ac4, bAc5."
680,Mickey by the fireside,A,"aa1, a2b; aa1, a2b1."
680,Mickey by the fireside,B,"aa1, ab; aa2, cAb2."
681,The sailor's cravat,A,"ab, a1c; ab, ad."
681,The sailor's cravat,B,"ab, a1Ad1; ab, a2Ad2."
682,Coming over the hills,A,"ab, a1b1; ab, a1b1."
682,Coming over the hills,B,"aAb2, a1b; aAb2, a2b."
683,The reel of bogie,A,"ab, ac; ab, de."
683,The reel of bogie,B,"ab, ab1; aAd1, Ad2Ae1."
684,The Limerick lasses,A,"ab, ac; ab, ac1."
684,The Limerick lasses,B,"Ab1Ab2, Ab3Ac2; Ab4Ab5, aAc2."
684,The Limerick lasses,C,"aa1, ab; ac, db1."
685,Miss Wallace,A,"ab, cd; a1b1, cd1."
685,Miss Wallace,B,"Ac1Ad2, Ac2a; Ac1Ac3, bAd1."
686,The hornless cow,A,"ab, a1a2; ab, a1c."
686,The hornless cow,B,"Ac1Ac2, Ac1Ac3; Ac1Ac2, aAc3."
687,Jenny's welcome to Charley,A,"ab, cd; ab, cd1."
687,Jenny's welcome to Charley,B,"Aa1a, bc; Aa2a, dc."
687,Jenny's welcome to Charley,C,"Bb1Ba1, Bb2a; Bb1Ba1, Bd1Bc."
687,Jenny's welcome to Charley,D,"ab, BbCa1; a1b1, cd."
688,Tit for tat,A,"ab, cb1; ab, cd."
688,Tit for tat,B,"aa1, bc; aa1, dAd1."
689,The lightning flash,A,"ab, a1c; ab1, de."
689,The lightning flash,B,"aAb2, aAc1; aAb3, bAc2."
690,Tim the market man,A,"ab, cd; ab, cd1."
690,Tim the market man,B,"aAb1, AcAd1; a1Ab1, AcAd2."
691,The ladies of Leinster,A,"ab, ac; ab, ad."
691,The ladies of Leinster,B,"ab, b1Ad; b2Ab1, Aa1Ad1."
692,Comely Jane Doowning,A,"aa1, ab; ac, db1."
692,Comely Jane Doowning,B,"Ad1Ac1, Ad1Ac2; Ad2Ac1, Aca."
693,The maid at the churn,A,"ab, a1a2; ab, a1c."
693,The maid at the churn,B,"ab, aAc1; ac, dAa2."
694,A moonlight ramble,A,"ab, cd; ab, cd1."
694,A moonlight ramble,B,"aAb, aAd1; aAb, Ac1Ad2."
695,Girls wil you take him?,A,"ab, ab1; ab, ab1."
695,Girls wil you take him?,B,"ab, Aa1Ab1; ab1, cAb1."
696,Bill Clancy's delight,A,"aa1, ab; aa1, ac."
696,Bill Clancy's delight,B,"aa1, aAb1; aa1, Ac1Ac2."
697,The jolly seven,A,"aa1, ab; aa1, cd."
697,The jolly seven,B,"aAb1, aAb; aAb2, AcAd1."
698,The Skibbereen lasses,A,"ab, ac; ab, dc."
698,The Skibbereen lasses,B,"aAb, a1Ac; aAb, bAc."
699,The humors of Schull,A,"aa1, bc; aa1, db1."
699,The humors of Schull,B,"Aa2a, bAc1; Aa2a, cAb1."
700,After the sun goes down,A,"ab, ac; ab, b1c."
700,After the sun goes down,B,"Ab2a, Ab2Ac; Ab2a1, Ab3Ac."
701,Farewell to Erin,A,"ab, ac; ab, dc."
701,Farewell to Erin,B,"ab, b1Ac; cAb1, Ac1d."
702,On the river bank,A,"ab, a1b; ab, a1c."
702,On the river bank,B,"aAb1, Aa2Ab2; aAb1, Aa3Ac1."
703,Fair-haired Mary,A,"ab, a1c; ab, a1c1."
703,Fair-haired Mary,B,"ab, Aa2Ac2; a1b, cAc1."
704,Pretty Peggy,A,"aa1, a2b; aa1, cd."
704,Pretty Peggy,B,"aa1, aAd1; bc, de."
705,More power to your elvow,A,"ab, ab1; ab, ac."
705,More power to your elvow,B,"aAa1, a1b; Aa2Ab, AaAc1."
706,Green garters,A,"ab, ac; ab, ad."
706,Green garters,B,"Ac1Ac2, Ac1Ac; Ac1Ac2, aAc3."
707,Jenny's wedding,A,"ab, b1c; db2, ef."
707,Jenny's wedding,B,"Aa1Ad1, Aa1a; Aa1Ae1, Ab3a1."
708,The maid of Athlone,A,"ab, a1c; ab, a1c."
708,The maid of Athlone,B,"ab, ac; ab, dc1."
709,Keeper Hill,A,"aa1, ab; aa1, b1b2."
709,Keeper Hill,B,"ab, a1b1; ab, cd."
710,Good morning to your night cap,A,"ab, ac; ab, ac1."
710,Good morning to your night cap,B,"aAb1, a1Ac; a2Ab2, Ab3Ac1."
711,I'm waiting for you,A,"ab, b1c; de, fe1."
711,I'm waiting for you,B,"ab, Ae2c; ab, dAe3."
712,O'Reilly's greyhound,A,"ab, a1c; ab, a1c."
712,O'Reilly's greyhound,B,"aAb1, aAc1; ab, b1Ab."
713,Courting them all,A,"ab, cb1; ab, cb1."
713,Courting them all,B,"Ab2Ab3, Ab2Ab4; Ab2Ab3, AcAb1."
714,The green jacket,A,"ab, cd; c1b, ce."
714,The green jacket,B,"aa1, a2Ae; Ab1b, cAd."
715,My honey in the house,A,"ab, ab1; ab, cb2."
715,My honey in the house,B,"aa1, Aa1Ab1; aa1, AcAb2."
716,McFadden's favorite,A,"ab, cd; d1b, c1d2."
716,McFadden's favorite,B,"ab, a1c; ab, dAa1."
717,The Callan lasses,A,"ab, ab1; ab, a1b1."
717,The Callan lasses,B,"aa1, a2Ab1; aa1, bAb1."
718,Are you willing,A,"ab, ac; ab, b1d."
718,Are you willing,B,"aAb2, a1Ad; a2Ab2, bAd."
719,The traveller,A,"ab, cd; ab, ce."
719,The traveller,B,"aAe1, aAd; aAe1, Ab1b."
720,Kiss the bride,A,"ab, a1c; ab, a1c1."
720,Kiss the bride,B,"aAb1, Aa1Ac; aAb1, Aa1Ac2."
721,Duffy the dancer,A,"ab, ac; ab, dc1."
721,Duffy the dancer,B,"Ab1Ab, Ab1Ac1; Ab1Ab, AdAc1."
722,Welcome home,A,"ab, a1c; ab, a1c1."
722,Welcome home,B,"Ab1Aa2, Ab1Ab2; Ab1Aa3, Aa1Ac2."
723,The linen cap,A,"ab, ac; ab1, dc."
723,The linen cap,B,"Aa1Ab, Aa1Ac; Aa1Ab1, AdAc."
724,The contradiction reel,A,"ab, a1c; ab, a1d."
724,The contradiction reel,B,"ab, ab1; ab2, cAc1."
724,The contradiction reel,C,"ab, cd; ef, gd1."
724,The contradiction reel,D,"aBc1, aAc2; ab, cd."
725,The smoky house,A,"ab, ac; ab, b1d."
725,The smoky house,B,"ab, aAc1; cb, dAd1."
726,Mollie McCarthy,A,"aa1, ab; aa1, ab."
726,Mollie McCarthy,B,"ab, aAb1; ab, b1Ab."
727,Rolling down the hill,A,"ab, cd; a1b1, ce."
727,Rolling down the hill,B,"ab, aAd1; ab, cAd."
728,The merry blacksmith,A,"aa1, bc; aa1, bd."
728,The merry blacksmith,B,"aAa, AbAc1; bAa, AbAd1."
729,Scotch Mary,A,"ab, ac; ab, a1c1."
729,Scotch Mary,B,"aAb1, aAc1; aAb1, Ac2Ac3."
730,Within a mile of Dublin,A,"ab, ac; ab, ac1."
730,Within a mile of Dublin,B,"aAb1, ab; aAa1, Ab2c."
731,The Cameronian reel,A,"ab, ac; ab, ac1."
731,The Cameronian reel,B,"ab, cb; de, fg."
732,Winter apples,A,"aa1, ba2; aa1, bc."
732,Winter apples,B,"aa1, aa2; a3a4, bAb1."
733,The primrose lass,A,"ab, cb1; ab, db1."
733,The primrose lass,B,"aa1, ab; aa1, Ac1b1."
734,Shearing the sheep,A,"ab, ac; ab, a1c1."
734,Shearing the sheep,B,"aAc2, a1Ac3; aAc2, bc."
735,Paddy's surprise,A,"ab, ac; ab1, dc1."
735,Paddy's surprise,B,"aa1, aa2; aa1, AdAc2."
736,Captain Byng,A,"ab, ac; ab1, dc1."
736,Captain Byng,B,"Aa1Aa2, Aa1Ac; Aa1Aa2, AdAc1."
737,The wind that shakes the barley,A,"ab, ab1; ab, ac."
737,The wind that shakes the barley,B,"aa1, a2Ac1; aa1, bAc1."
738,The piper's son,A,"ab, cd; ab1, ce."
738,The piper's son,B,"Aa1a, a1Ae; a1a, bAe1."
739,Turkeys in the straw,A,"ab, cd; ab, c1e."
739,Turkeys in the straw,B,"Ac1Aa1, Ac2Ae1; ab, b1Aa2."
740,William White's reel,A,"ab, cd; ab, cd."
740,William White's reel,B,"ab, a1Ad1; cb, Ad2Ad3."
741,Murtough Molly,A,"ab, cd; ab, ce."
741,Murtough Molly,B,"Aa1Ab1, Aa1Ac1; Aa1Ab1, Ac2Ad."
742,The field of oats,A,"ab, a1c; ab, b1d."
742,The field of oats,B,"ab, cAd1; ab, a1Ac1."
743,The humors of Newcastle,A,"ab, ac; ab, ac."
743,The humors of Newcastle,B,"ab, aAb1; ab, cAc1."
744,Paddy Murphy's wife,A,"ab, ac; ab, ac."
744,Paddy Murphy's wife,B,"aa1, ab; aa1, Aa1b1."
745,The girl with the laughing eyes,A,"ab, a1c; ab, a2d."
745,The girl with the laughing eyes,B,"aAb1, ab; aAb2, Aa2Ad1."
746,Give us another,A,"ab, cd; ab, cd1."
746,Give us another,B,"ab, ac; a1b1, AcAd."
747,The northern lasses,A,"ab, cc1; ad, ce."
747,The northern lasses,B,"Aa1Ad1, Aa1a; Ad2b, ca1."
747,The northern lasses,B1,"Aa1Ad1, Aa1a; Ad2b, cd."
748,Clarkson's reel,A,"ab, cd; ab, c1e."
748,Clarkson's reel,B,"ab, aAc2; Ac3b, Ac4Ad."
749,Rakish Paddy,A,"ab, cb1; a1b2, c1d."
749,Rakish Paddy,B,"Aa2Ad1, aAc2; Aa2Ab3, a1Ad."
750,The Mullingar races 1,A,"ab, cc1; a1b1, c2d."
750,The Mullingar races 1,B,"Aa2a, Aa2b; Aa2a, cAd1."
751,The jolly tinker,A,"ab, a1c; ab, a1c1."
751,The jolly tinker,B,"aAa2, bAa3; aAa2, bAa3."
751,The jolly tinker,C,"Bb1a, a1Ac1; Bb1a, a1Ac1."
751,The jolly tinker,D,"aa1, a2Ac1; aa1, a2Ac1."
751,The jolly tinker,E,"Bb2Ba1, aAc1; Ca2Ba1, bAc."
752,The queen's shilling,A,"ab, cd; c1b, c1d1."
752,The queen's shilling,B,"Ac2a, a1b; cc1, dAd."
753,Little Katie Kearney,A,"ab, ac; ab, ac."
753,Little Katie Kearney,B,"aa1, a2Ac; aa1, bAc1."
754,The maid in the sherry tree,A,"ab, a1c; ab, a1c."
754,The maid in the sherry tree,B,"ab, aAc1; aAa2, Ab1Ac2."
755,The watchmaker,A,"ab, ac; ab, ac."
755,The watchmaker,B,"aa1, aAc1; Aa1b, Ab1Ac."
756,The same old story,A,"ab, cb; c1b, cb."
756,The same old story,B,"Ac2Aa, Ab1a; Ab1b, Ab1a."
756,The same old story,C,"ab, "
757,The fourpenny bit,A,"ab, cd; ab1, a1e."
757,The fourpenny bit,B,"ab, cAe1; ab1, cAd1."
758,The jug of punch,A,"ab, a1c; de, c1f."
758,The jug of punch,B,"Ad1Ac2, aAa2; Ad1Ac2, Ae1Af."
759,The grey plover,A,"ab, ac; ad, ef."
759,The grey plover,B,"ab, ab1; a1Ad, AeAf."
760,My sweetheart Jane,A,"ab, ab1; ab, ac."
760,My sweetheart Jane,B,"Aa1a, Aa2Ab2; Aa1a, bAc."
761,Kiss your partner,A,"ab, aa1; ab, aa2."
761,Kiss your partner,B,"ab, ac; ab, dAa3."
762,Corney is coming,A,"aa1, a2b; aa1, a2c."
762,Corney is coming,B,"aa1, a2Ac; Ab1Ab2, a3Ac."
763,The mountain rose,A,"ab, a1c; a2b, dc1."
763,The mountain rose,B,"ab, a1c; ab, AdAc1."
764,The green gates,A,"aa1, bc; aa1, cd."
764,The green gates,B,"ab, AbAc; ab1, AcAd."
765,The western lasses,A,"aa1, ab; aa1, cd."
765,The western lasses,B,"ab, ac; de, b1Ab1."
765,The western lasses,C,"ab, cBe1; ab, cAb1."
766,Rolling on the ryegrass,A,"aa1, bc; aa1, a2c."
766,Rolling on the ryegrass,B,"ab, a1Ac1; ab, a2Ac1."
766,Rolling on the ryegrass,C,"ab, cAc2; ab, b1Ac1."
767,The four-hand reel,A,"ab, ac; ad, ac1."
767,The four-hand reel,B,"ab, aAc1; b1c, a1Ac."
768,The flowers of Limerick,A,"ab, a1c; ad, ea2."
768,The flowers of Limerick,B,"Aa3Ab1, aAc1; Aa4Ad, AeAa2."
768,The flowers of Limerick,C,"Ba1a, Ae1Ab2; Ba2Ad1, Aeb."
768,The flowers of Limerick,D,"aAd2, Ad3b; Ad4Ad1, AeCb1."
769,The piper's despair,A,"ab, cb; ab, c1d."
769,The piper's despair,B,"Ac2Ac2, Aa1Ac3; Ac2Ac2, Aa2a."
770,The Edenderry reel,A,"aa1, ab; aa1, ab."
770,The Edenderry reel,B,"aAb1, aAb2; ab, a1Ab2."
771,The old bog ground,A,"ab, ac; ab, ac."
771,The old bog ground,B,"Ac1a, bAc; Ac1a, cAc2."
772,The absent-minded woman,A,"ab, a1c; ab1, db2."
772,The absent-minded woman,B,"aa1, aAc1; aa1, bAb3."
773,The hag by the fire,A,"aa1, ab; aa1, ab1."
773,The hag by the fire,B,"aAb2, bAb1; a1Ab2, cAb1."
774,Johnny Allen's reel,A,"ab, ab1; ac, de."
774,Johnny Allen's reel,B,"aAc1, aAe; aAc, AdAe1."
775,The maid of Feakle,A,"ab, ab1; ab, cd."
775,The maid of Feakle,B,"Aa1a, Aa1Ad; Aa1a, Aa2b."
776,The humors of Scarriff,A,"ab, ac; ab, ac."
776,The humors of Scarriff,B,"aa1, a2Ac1; aa1, bAc."
777,The rambler in Cork,A,"ab, a1c; ab, a1d."
777,The rambler in Cork,B,"ab, aAc1; ab, cAc."
778,The maids of Kilmallock,A,"ab, b1c; ab, b1c1."
778,The maids of Kilmallock,B,"ab, a1Ac1; Ac2b, cAc."
779,The heather breeze,A,"aa1, ab; aa1, cb1."
779,The heather breeze,B,"aa1, aAb1; aa1, Ac1Ab1."
779,The heather breeze,C,"aa1, a2Ab1; a3a1, bc."
780,Cooleen bridge,A,"ab, a1c; a2d, eb1."
780,Cooleen bridge,B,"aAc1, bc; Ae1Aa3, cAb2."
781,Captain Rock,A,"aa1, a2a3; a4b, cd."
781,Captain Rock,B,"aa1, Ab1Ad; a2b, a3Ad."
782,The tinker's reel,A,"ab, a1c; ab, a2c1."
782,The tinker's reel,B,"ab, ac; ad, eAc2."
783,The maids of Tulla,A,"ab, cd; ab1, d1e."
783,The maids of Tulla,B,"aAb2, a1a2; aAb3, Ad1Ae."
784,The Gaelic revival,A,"ab, cd; b1e, c1f."
784,The Gaelic revival,B,"aAe1, a1Ae2; bAe3, Ac2Ac3."
784,The Gaelic revival,C,"aAb, ab; ac, Ac1Af."
784,The Gaelic revival,D,"Bb1a, bAd1; cd, Cb1e."
785,A ha'porth of tea,A,"ab, a1c; ab, a1c."
785,A ha'porth of tea,B,"aa1, a2Ac; aa1, bAc."
786,Over the moor to Maggie,A,"ab, cd; ab, d1e."
786,Over the moor to Maggie,B,"aAb, Ac1b; cAb, Ad2Ae1."
786,Over the moor to Maggie,C,"Ba1Ba2, AcBb1; Ab1a, Ad1Ae2."
787,Bunker Hill,A,"ab, cd; a1b, ed."
787,Bunker Hill,B,"ab, a1c; Ab1Ab2, AeAd1."
787,Bunker Hill,C,"Ba2Aa2, Ba3a; Ba2Ab3, AeAd."
788,The king of the clans,A,"ab, cb1; de, fg."
788,The king of the clans,B,"aAe1, AcAb1; a1Ab2, Ad1Ag."
789,Boil the breakfast early,A,"ab, ab1; ab, a1b1."
789,Boil the breakfast early,B,"ab, aAb1; ac, Aa1Ab1."
790,The maid I ne'er forgot,A,"ab, cb1; db, a1b2."
790,The maid I ne'er forgot,B,"Aa2a, Acb; cAb3, AcAb2."
791,The honeymoon reel,A,"ab, a1c; ad, a2c1."
791,The honeymoon reel,B,"aAb, Aa1Ac2; a1Ad, Aa2Ac3."
792,The cup of tea,A,"ab, ac; ab, a1c1."
792,The cup of tea,B,"aa1, aAc1; ab, a2Ac1."
792,The cup of tea,C,"aa1, a2Ac1; aa1, bAc2."
793,Come west along the road,A,"ab, ac; ab, ac1."
793,Come west along the road,B,"ab, ab1; ab, Ab1Ac2."
794,The long strand,A,"ab, a1c; ab1, de."
794,The long strand,B,"ab, cd; a1e, AdAb2."
795,The teetotaler's fancy,A,"ab, a1c; ab1, a1d."
795,The teetotaler's fancy,B,"Ad1Ac1, Ad2Ac2; Ad1Ac1, aAc3."
796,Kitty in the lane,A,"ab, ac; ab, a1d."
796,Kitty in the lane,B,"aAa2, a1b; aAb1, cAc1."
797,The Chicago reel,A,"ab, cd; a1b1, ef."
797,The Chicago reel,B,"ab, a1c; a2b1, dAf1."
798,Mrs. Delaney,A,"ab, a1c; ad, ec1."
798,Mrs. Delaney,B,"Aa2a, Aa3Ac2; Aa4b, cAd1."
799,Mayor Harrison's fedora,A,"ab, a1c; a2b1, c1d."
799,Mayor Harrison's fedora,B,"aAb2, a1b; a2Ac2, Ac1Ad1."
800,Miss Fahey's fancy,A,"ab, cd; a1b1, ec1."
800,Miss Fahey's fancy,B,"ab, a1c; Ae1a2, Aa2Ad1."
801,Clancy's fancy reel,A,"ab, a1c; a2b, cd."
801,Clancy's fancy reel,B,"ab, Aa3Ac1; ac, AcAd1."
802,The shaskeen reel,A,"ab, cb1; a1b, de."
802,The shaskeen reel,B,"aAb2, Ac1Ab3; aAb2, AdAe1."
803,Peter Street,A,"ab, a1c; ab, de."
803,Peter Street,B,"Aa2a, AaAb; Ad1Ad1, bc."
804,Pay the girl her fourpence,A,"ab, cd; ae, a1d1."
804,Pay the girl her fourpence,B,"aAd2, a1b; a2Ad2, cb1."
805,Farewell to Ireland,A,"ab, cb1; db2, c1e."
805,Farewell to Ireland,B,"Aa1a, bAb3; cAb4, a1Ab5."
805,Farewell to Ireland,C,"aa1, bc; aAb4, Ba1c1."
806,Chief O'Neill's favorite,A,"ab, cd; ab, c1e."
806,Chief O'Neill's favorite,B,"Aca, Aa1Ad; AaAb, Ac1Ae1."
807,The Greencastle hornpipe,A,"ab, ab1; ab, cd."
807,The Greencastle hornpipe,B,"aa1, a2a3; ba4, b1Ad1."
808,The Cloone hornpipe,A,"ab, cd; ab1, eb2."
808,The Cloone hornpipe,B,"AcAb3, Ac1a; Ae1Ae2, AeAb2."
809,The Kildare fancy,A,"ab, cd; ab, ce."
809,The Kildare fancy,B,"ab, cAd1; ab, dAe."
810,Dunphy's hornpipe,A,"ab, cd; ab1, ef."
810,Dunphy's hornpipe,B,"aa1, bc; dd1, Ae1Af1."
811,The rights of man,A,"ab, cc1; ab, c2d."
811,The rights of man,B,"aa1, a2b; Ab1c, Ac2Ad1."
812,Slievenamon,A,"ab, cd; ef, f1g."
812,Slievenamon,B,"ab, b1c; aAf2, dAg."
813,Hennessy's hornpipe,A,"ab, a1c; ab, de."
813,Hennessy's hornpipe,B,"aAd1, bAe1; Ad2Ad3, AdAe2."
814,The quarrelsome piper,A,"ab, b1c; ab, b1d."
814,The quarrelsome piper,B,"ab, a1Ac1; AaAb, Ab1Ad1."
815,The Devil's dream,A,"aa1, bb1; aa1, cd."
815,The Devil's dream,B,"Ab2Ab3, AbAb4; Ab2Ab3, AcAd."
815,The Devil's dream,C,"ab, a1b1; ab2, AcAd."
816,The Liverpool hornpipe,A,"ab, cb1; ab, de."
816,The Liverpool hornpipe,B,"Ac1Ab2, AcAb1; AaAb, AdAe."
816,The Liverpool hornpipe,C,"aAb3, a1Ab4; AaAb5, bAe."
817,The Tinware lass,A,"ab, a1c; a2b, a3d."
817,The Tinware lass,B,"Ad1Ad2, aAc; Aa2Ab, Aa3Ad3."
818,Hillside cottage,A,"ab, cd; ab, c1e."
818,Hillside cottage,B,"aAa1, aAb1; Aa2b, Ac1Ae1."
819,The heather glen,A,"aa1, bc; aa1, bc1."
819,The heather glen,B,"Aa2Ac2, Aa3a; Aa4Aa1, Aba1."
820,Limerick Junction,A,"ab, b1c; a1b, de."
820,Limerick Junction,B,"ab, b1Ac1; ab2, a1Aa2."
821,The top of the morning,A,"aa1, bc; aa1, b1d."
821,The top of the morning,B,"Aa2Aa3, Aa4a; AaAa1, Ab1Ad1."
822,Hick's hornpipe,A,"ab, a1c; a2b, dc1."
822,Hick's hornpipe,B,"aa1, bAc2; aa1, Ad1c."
823,Bantry Bay,A,"ab, cd; c1e, ab1."
823,Bantry Bay,B,"aAe1, bb1; Ac1Ae, AaAb2."
824,The boys from Scart,A,"ab, cd; ab, ce."
824,The boys from Scart,B,"ab, a1c; ab, c1d."
825,Fisher's hornpipe,A,"aa1, bc; aa1, dc1."
825,Fisher's hornpipe,B,"aa1, ba2; a3a4, Ad1Ac2."
826,No.1 The sailor's hornpipe,A,"aa, bb; aa, ca1."
826,No.1 The sailor's hornpipe,B,"aa1, Ac1b; a2a1, Acc."
827,No.2 The sailor's hornpipe,A,"ab, cb; a1b, de."
827,No.2 The sailor's hornpipe,B,"Ac1Ac2, AcAb; AaAb, AdAe1."
828,The Wicklow hornpipe,A,"ab, cd; ab, c1e."
828,The Wicklow hornpipe,B,"Ac2Ae1, ab; Aa1Ab1, Ac1Ae2."
829,Miss Brown's fancy,A,"ab, cd; ab1, ef."
829,Miss Brown's fancy,B,"ab, a1c; ab1, Ad1Af1."
830,The men from Mallow,A,"ab, a1c; ab, de."
830,The men from Mallow,B,"Aa2Aa3, Ad1a; Aa2Ab1, AdAe."
830,The men from Mallow,C,"Aa2Aa3, Ad1Ba; aa1, AdAe1."
831,McCarty's hornpipe,A,"aa1, a1b; ca, dd1."
831,McCarty's hornpipe,B,"aAa, Aa1Aa1; AbAc, AaAd."
831,McCarty's hornpipe,C,"Ad1Ba1, aa; bAc, AaAd."
831,McCarty's hornpipe,C1,"Ad1Ba1, aa; bAc, AaAd."
831,McCarty's hornpipe,D,"Ad1Ba2, "
832,Big Dan O'Mahony,A,"ab, cb1; ab2, de."
832,Big Dan O'Mahony,B,"Ac1a, Ac2Ab; Ac3b, cAe1."
832,Big Dan O'Mahony,C,"Ac3Bb1, Ac2Ab3; ab, Bc1Ae2."
833,The trumpet hornpipe,A,"ab, a1b1; ab2, cd."
833,The trumpet hornpipe,A1,"ab, a1b1; ab2, ca2."
833,The trumpet hornpipe,B,"Aa3a, Aa4b; cc1, AdAa5."
834,The Mullingar races 2,A,"ab, a1c; ab1, de."
834,The Mullingar races 2,B,"aa1, Ac1b; Ac2Aa2, Ad1Ae."
835,The Kilkenny hornpipe,A,"ab, cd; ab, eb1."
835,The Kilkenny hornpipe,B,"aa1, a2a3; AaAb, AeAb1."
836,Jerry Daly's hornpipe,A,"ab, cd; ab, cd1."
836,Jerry Daly's hornpipe,B,"ab, a1b1; cd, AcAd1."
837,The banks of the Ilen,A,"ab, ac; ab, ac1."
837,The banks of the Ilen,B,"ab, ac; c1Ab1, Aa1Ac2."
838,Kit O'Mahony's hornpipe,A,"ab, b1c; ab2, b3c."
838,Kit O'Mahony's hornpipe,B,"Ab4Ab3, Ab5a; a1b, Ab3Ac1."
839,The boys of Ballysimon,A,"ab, cd; a1b, cd."
839,The boys of Ballysimon,B,"ab, aAb1; AaAb, AcAd1."
839,The boys of Ballysimon,C,"ab, Ac1Ad; cAb2, Ac1Ad."
839,The boys of Ballysimon,D,"Ba1Bb1, Ba2a; Aa2Cc1, AcAd1."
840,Fair and forty,A,"ab, cd; ab, ce."
840,Fair and forty,B,"aa1, ab; aa1, cAe1."
841,The slipper hornpipe,A,"ab, cd; ab, ef."
841,The slipper hornpipe,B,"ab, Ac1Ad; AaAb, Ae1Af1."
842,O'Dwyer's hornpipe,A,"aa1, a2b; aa1, ca3."
842,O'Dwyer's hornpipe,B,"ab, cAa4; b1b, Ab1Aa5."
842,O'Dwyer's hornpipe,C,"Aa6a, a1Ab1; Aa6a, AcAa3."
842,O'Dwyer's hornpipe,D,"aa, a1a2; bb1, Ab1Aa7."
843,The Groves hornpipe,A,"ab, a1b1; ab, ca2."
843,The Groves hornpipe,B,"Aa3a, a1a2; Aa3b, AcAa4."
843,The Groves hornpipe,C,"aBa3, bBa4; aBa4, b1Aa5."
843,The Groves hornpipe,D,"aa1, a2Cb1; aa3, Cb1Aa6."
843,The Groves hornpipe,E,"aa1, ab; cd, AcAa5."
844,The first of June,A,"ab, cd; ae, fg."
844,The first of June,B,"aAf1, Ac1Af2; bc, Af3Ag1."
845,The last of the twins,A,"ab, cd; ab, ce."
845,The last of the twins,B,"aa1, AcAd1; aa1, AcAd2."
846,Kitty's wedding,A,"ab, cd; ab, cc1."
846,Kitty's wedding,B,"ab, cAd1; ab, cd."
847,The harvest home,A,"ab, cb1; ab, de."
847,The harvest home,B,"aa, Acb; AaAb, AdAe1."
848,The echo,A,"ab, a1c; ab, de."
848,The echo,B,"aAb1, Aa1Ac; aAb1, AdAe1."
849,Murray's hornpipe,A,"ab, cb1; ab, dd1."
849,Murray's hornpipe,A1,"ab, cb1; ab, da1."
849,Murray's hornpipe,B,"Ad2Aa2, Ad3Aa3; aa, Ab2Aa4."
849,Murray's hornpipe,B1,"Ad2Aa2, Ad3Aa3; aa, Ab2b."
850,McDermott's hornpipe,A,"ab, cd; ab1, ef."
850,McDermott's hornpipe,B,"ab, ac; ab, dAd1."
851,Glengariff hornpipe,A,"ab, cd; ab1, ef."
851,Glengariff hornpipe,B,"Ac1Ac2, Ac3a; AaAb1, AeAf1."
852,The Sweep's hornpipe,A,"ab, cd; ab, ef."
852,The Sweep's hornpipe,B,"aAe1, bb1; aAe1, Ae2Ad1."
852,The Sweep's hornpipe,C,"aa1, a2a3; aa4, Ae3Af."
853,Galway Bay,A,"aa1, bc; a2a3, a4d."
853,Galway Bay,B,"aAc1, Aab; a1Ab1, Aa5Ad1."
854,Coming from the wedding,A,"ab, cd; ab, d1b1."
854,Coming from the wedding,B,"Ac1Ac2, Ac1Ab2; Ac1Ad2, Aa1Ab3."
855,Cronin's rambles,A,"ab, cd; ab, c1e."
855,Cronin's rambles,B,"aAd1, AcAd; ab, Ac1Ae1."
856,Murphy's hornpipe,A,"aa1, ba2; aa1, bc."
856,Murphy's hornpipe,B,"Aa3a, Ab1Aa2; AaAa1, AbAc1."
857,The fair maidens,A,"ab, a1c; ab, a1d."
857,The fair maidens,B,"ab, cb1; AaAb, Aa1Ad1."
858,The little stack of barley,A,"ab, cd; eb, c1d1."
858,The little stack of barley,B,"Ac2a, bAd; cAb1, dAd2."
859,Off to California,A,"ab, cb1; ab, cd."
859,Off to California,B,"Aa1Aa2, AcAb1; Aa3Ab, AcAd1."
860,Thirty years ago,A,"ab, cd; ab1, ef."
860,Thirty years ago,B,"Ab2Ad1, Ab2Ac1; Ab2a, AeAf1."
861,Youghal harbor,A,"ab, cc1; ab, c2d."
861,Youghal harbor,B,"aAa1, AcAc1; AaAb, Ac2Ad1."
862,Rogers O'Neill,A,"ab, cd; ab, c1e."
862,Rogers O'Neill,B,"ab, cd; ab1, eAe1."
862,Rogers O'Neill,C,"Aa1a, bAd1; Aa2Aa3, Be1Ae."
862,Rogers O'Neill,D,"ab, Be2c; aAa3, Be1Ae."
863,The night we made the match,A,"ab, a1b1; a2c, de."
863,The night we made the match,B,"aa1, a2a3; bc, Ad1Ae1."
864,The pleasures of hope,A,"ab, cb1; dc1, ef."
864,The pleasures of hope,B,"AeAe1, Ac2a; AdAc1, AeAf."
865,Byrne's hornpipe,A,"aa1, ba2; aa1, cd."
865,Byrne's hornpipe,B,"aa1, a2Ab1; AaAa1, AcAd1."
866,Whiskey you're the devil!,A,"ab, cd; ab, ce."
866,Whiskey you're the devil!,B,"Aa1Ab1, AcAd1; AaAb, AcAe1."
867,The scholar,A,"ab, ca1; ab, cd."
867,The scholar,A1,"ab, ca1; ab, cd1."
867,The scholar,B,"aAa2, a1Aa3; a2Aa2, bc."
867,The scholar,B1,"aAa2, a1Aa3; a2Aa2, bAd2."
868,The Soldier's joy,A,"ab, ab1; ab2, cb3."
868,The Soldier's joy,B,"ab, ac; b1Aa1, AcAb4."
869,The clover blossom,A,"ab, cd; ab, ef."
869,The clover blossom,B,"aa1, aAe1; ab, Ae2Af."
870,The Glasgow hornpipe,A,"ab, cd; ab, c1d1."
870,The Glasgow hornpipe,B,"AcAc2, AcAd; aAb1, Ac1Ad1."
871,Old man Quinn,A,"ab, ac; ab, dc1."
871,Old man Quinn,B,"aa1, Aa1Ac2; bAb1, AdAc3."
871,Old man Quinn,C,"Bb1a, bAc2; BbAb1, AdAc1."
872,The green banner,A,"ab, cd; ab, ef."
872,The green banner,B,"aAb1, bAc1; cAc2, dAf1."
873,The golden vale,A,"aa1, bc; aa1, de."
873,The golden vale,B,"aAb1, Ad1b; aAb1, AdAe1."
874,The honeysuckle,A,"ab, cd; ab, ef."
874,The honeysuckle,B,"ab, cAd; AaAb, AeAf."
875,The star hornpipe,A,"aa1, ba2; aa1, cd."
875,The star hornpipe,B,"Ab1Ab2, Ac1Ad1; AaAa1, AcAd2."
876,O'Connor's fancy,A,"ab, b1c; ab, b1c1."
876,O'Connor's fancy,B,"Aa1a, Aa2Ac2; a1b, Ab2Ac3."
877,Sault's own hornpipe,A,"ab, cd; ae, fg."
877,Sault's own hornpipe,B,"ab, cb1; a1d, ee1."
878,Tomorrow morning,A,"aa1, bc; aa1, bc1."
878,Tomorrow morning,B,"aa1, AbAc; AaAa1, AbAc1."
879,Clark's hornpipe,A,"ab, cd; ab1, ed1."
879,Clark's hornpipe,B,"aa1, bc; AaAb1, AeAd2."
880,The peacemaker,A,"ab, ac; ab1, dc1."
880,The peacemaker,B,"Ab2Ab3, Ab4Ac2; Ab2Ab1, AdAc3."
881,Father Dollard's hornpipe,A,"ab, cd; ab, c1a1."
