Tune,Title,Part,Structure
1,Shandon bells,A,"ab, a1c; ab, db1."
1,Shandon bells,A1,"ab, a1c; ab, de."
1,Shandon bells,B,"Aa2Ad1, aAc1; Aa2Ad1, AdA1e."
2,The piper's picnic,A,"aa1, ab; aa1, a2c."
2,The piper's picnic,B,"ab, cb1; b2d, eAc."
3,Hartigan's fancy,A,"ab, ab1; ab, cd."
3,Hartigan's fancy,B,"Aa1Ab1, Aa2Ad1; aAb1, Ac1Ad."
4,The yellow flail,A,"aa1, a2b; a3a4, a5c."
4,The yellow flail,B,"aa1, a2b; aAb1, Aa5Ac."
4,The yellow flail,C,"aAa6, AbAb2; Aa3Aa4, Aa5Ac."
5,Kitty's rambles,A,"ab, a1a2; a3b, a1c."
5,Kitty's rambles,B,"aa1, a2a3; Ab1Aa4, Aa1Ac."
5,Kitty's rambles,C,"aAa1, a1a2; Ab2Ab, Aa1Ac."
5,Kitty's rambles,D,"aBa4, a1Aa5; bCa3, Aa1Ac."
6,Doctor O'Neill,A,"ab, cd; ab, ce."
6,Doctor O'Neill,B,"Aa1Ad1, Ac1Ad; Aa1Ad1, Ac1Ae."
6,Doctor O'Neill,C,"Aa2a, bAe1; Aa2a, bAe2."
6,Doctor O'Neill,D,"Ac2Ad2, Aa3Ad3; Ac2Ad2, Ac1Ae."
6,Doctor O'Neill,E,"Cb1Ad4, Cb1Ad3; Cb1Ad4, AcAe."
7,Denis Delaney,A,"ab, ac; ab, a1b1."
7,Denis Delaney,B,"aAa2, Ac1Ac; aAa2, Ac1Ab1."
7,Denis Delaney,C,"Ac2Ab2, Ac2Ac3; BaAa2, Ac1Ab1."
8,The walls of Liscarroll,A,"ab, b1c; ab, b1d."
8,The walls of Liscarroll,B,"aa, Ad1b; cc1, Ab1Ad."
9,The pipe on the hob,A,"aa1, bc; ad, c1b1."
9,The pipe on the hob,B,"Aa2a, AbAb2; Aa2a1, Ac1Ab1."
9,The pipe on the hob,C,"Aa3Ba2, Aa3Ba3; Aa3Aa4, Ac1Ab1."
10,Guiry's favorite,A,"ab, cd; ab1, d1d2."
10,Guiry's favorite,B,"aAd3, Aa1Ad4; aAd3, Ad1Ad2."
11,Malowney's wife,A,"aa1, bc; ad, ec1."
11,Malowney's wife,B,"Ab1Ac2, AbAc; Ab1Ad1, AeAc1."
11,Malowney's wife,C,"Ad2a, Ab2Ac; Ad2a, Ab2Ac1."
12,The gold ring,A,"aa1, aa2; aa3, ba1."
12,The gold ring,B,"aAa1, aAa2; aAa3, AbAa1."
12,The gold ring,C,"Aa4a, Aa5a1; Aa4a, Aa6Aa1."
12,The gold ring,D,"aa, aAa1; aa, bAa1."
12,The gold ring,E,"aAa1, bAa2; bb, AbAa1."
12,The gold ring,F,"Ba1Ab1, Ab2Aa7; Ba1Ab1, Ab2Aa1."
12,The gold ring,G,"aa1, Ab2Aa7; aa1, Ab2Aa1."
13,The humors of Bantry,A,"ab, b1b2; ab, b1c."
13,The humors of Bantry,B,"aa, Ab3Ab4; AaAb, Aa1Ac."
13,The humors of Bantry,B1,"aa, Ab3Ab4; Aa2Ab5, Aa3Ac."
14,Off to the hunt,A,"ab, cc1; a1c2, de."
14,Off to the hunt,B,"Ac3Ac4, Aa2Ac5; Ac6Ac2, AdAe."
15,The highway to Dublin,A,"ab, ab1; cd, a1b2."
15,The highway to Dublin,B,"aAb, aAb1; a1Ad1, Aa1Ab2."
16,When sick is it tea you want?,A,"ab, a1c; ab, da2."
16,When sick is it tea you want?,B,"Ac1Ac2, Ac3Ac4; AaAb, AdAa2."
17,The eavesdropper,A,"aa1, a2a3; aa1, a2a4."
17,The eavesdropper,B,"ab, Aa2Aa5; a1b1, Aa2Aa4."
18,Saddle the pony,A,"ab, ac; ad, b1d1."
18,Saddle the pony,B,"aa1, aAd1; aAd, Ab1Ad1."
19,Humors of Glendart,A,"ab, ac; ab, dc1."
19,Humors of Glendart,B,"Ab1a, Ab1a1; bAc2, AdAc1."
20,Have a drink with me,A,"ab, ac; ab, ac1."
20,Have a drink with me,B,"aa1, aAc2; Aa1Aa2, AaAc1."
21,The hag with the money,A,"ab, cb1; b2b, de."
21,The hag with the money,B,"Ab3Ab4, Ab3a; Ab3a1, Ad1Ae."
22,I know what you like,A,"ab, cc1; ab1, ca1."
22,I know what you like,B,"aAa, Ab2a1; ab, AcAa1."
23,The night cap,A,"aa1, a2b; a3b1, a4a5."
23,The night cap,B,"ab, a1b1; ab2, Aa4Aa5."
24,The maid at the well,A,"ab, cc1; ab1, cd."
24,The maid at the well,B,"aAb2, AcAc1; aAb2, AcAd."
25,Sergt. Early's jig,A,"ab, cd; a1b, c1a2."
25,Sergt. Early's jig,B,"Aa3Ad1, Ac2Ad; Aa3Ad2, Ac1Aa2."
26,Castle Donovan,A,"ab, cd; a1b, ce."
26,Castle Donovan,B,"ab, aAe1; Aa1Ab, AcAe."
27,Jackson's frieze coat,A,"aa1, ab; aa1, cb."
27,Jackson's frieze coat,B,"aAc1, a1Aa2; aAc1, a1Aa3."
27,Jackson's frieze coat,C,"Ab1Ac2, Ac3Ac3; Ab1Ac2, Ab2Aa3."
28,Contentment is wealth,A,"ab, a1c; de, fg."
28,Contentment is wealth,B,"Af1Ab1, Af2Ab2; Af1a, Ad1Ag."
28,Contentment is wealth,C,"aAg, a1Ag1; Ad2Ad3, Ad1Ag."
29,Cherish the ladies,A,"ab, a1b1; ab2, cd."
29,Cherish the ladies,B,"aAb3, Aa1Ab1; aAb3, AcAd."
29,Cherish the ladies,C,"BaAb3, aAb1; bb1, Ac1Ad."
29,Cherish the ladies,D,"Aa2Aa2, aAb4; bBa1, Ab5Ab6."
29,Cherish the ladies,E,"Aa3Ac2, Da1Ab4; DbBa1, Ab7Ab6."
29,Cherish the ladies,F,"Ab8Ab9, Ab8Ab6; Ab10Ab11, Ab7Ab6."
30,Welcome to Cork,A,"aa1, bc; a2c1, a3d."
30,Welcome to Cork,B,"ab, a1a2; ab, b1Ad."
31,The widow Brady,A,"ab, aa1; ab, cd."
31,The widow Brady,B,"Ac1Aa2, aAa3; Ac2a1, Ac3Ad."
32,The basket of Turf,A,"aa1, a2b; a3a1, cb."
32,The basket of Turf,B,"Ac1Ab1, Ac1Ab2; Ac1Ab1, AcAb."
33,Do you want anymore?,A,"ab, cb1; c1b, c2a1."
33,Do you want anymore?,B,"Ab2Ac3, Ab2Aa2; aa1, Ac2Aa1."
34,Galway Tom,A,"aa, aa1; aa, a2b."
34,Galway Tom,B,"aa1, a2a3; a4a5, Aa2Ab."
34,Galway Tom,B1,"aa1, a2a3; a4a5, Aa2Aa1."
34,Galway Tom,C,"Aa3a, Aa3b; Aa4c, db."
34,Galway Tom,D,"Ab1Ba1, Ab2Ab3; Ba4Ba5, Aa2Ab."
34,Galway Tom,D1,"Ab1Ba1, Ab2Ab3; Ba4Ba5, Aa2Aa1."
34,Galway Tom,E,"aa, aAa1; aa1, Aa2Aa1."
35,Money in both pockets,A,"aa1, ab; aa1, cc1."
35,Money in both pockets,B,"aa1, ab; Ab1Ab2, cAc1."
36,Father Dollard's favorite,A,"ab, ab1; ab, b2c."
36,Father Dollard's favorite,B,"Aa1Ab3, Aa1Ac1; Aa1Ab2, aAc."
37,Tell her I am,A,"aa1, bc; aa1, b1c1."
37,Tell her I am,B,"Aa2a, Ab2Ac; Aa3a, Ab1Ac1."
38,The mountain boy,A,"aa1, bb1; aa1, b2b3."
38,The mountain boy,B,"aa1, bAa2; aa1, Ab2Ab3."
39,A visit to Ireland,A,"ab, cb1; ab, b2b3."
39,A visit to Ireland,B,"aAc1, AcAb1; aAc1, Ab2Ab3."
40,Jerry's beaver hat,A,"ab, cc1; ab, c2c3."
40,Jerry's beaver hat,B,"Ac4a, Ac4Aa1; Ac4a, bAc3."
41,The tempelhouse jig,A,"ab, a1c; ab1, de."
41,The tempelhouse jig,B,"Ab2Ab3, Ab4Ab5; Ab2Ab6, AdAe."
41,The tempelhouse jig,B1,"Ab2Ab3, Ab4Ab5; Ab7a, AdAe."
42,Move up to me,A,"ab, cc1; ab, b1d."
42,Move up to me,B,"Ab2Ab, Ab2Ab3; Ab2Ab, Ab1Ad."
43,Paddy whack,A,"ab, a1c; de, fc1."
43,Paddy whack,B,"ab, a1Ac; ab, AfAc1."
43,Paddy whack,B1,"ab, a1Ac; Ad1Ae, AfAc1."
44,Nell Flaherty's drake,A,"ab, a1c; ab1, a1c1."
44,Nell Flaherty's drake,B,"Aa2Aa3, Aa4Ac; AaAb, Aa1Ac1."
45,Out with the boys,A,"ab, cd; ab, ce."
45,Out with the boys,B,"Ac1Ac1, Ac1Ad1; Ac1Ae1, aAb1."
45,Out with the boys,C,"aa, Ac2Ba1; a1a, BaAb1."
46,Katie's fancy,A,"ab, b1c; ab, b1d."
46,Katie's fancy,B,"aAc1, a1Ac2; AaAb, Ab1Ad."
46,Katie's fancy,C,"Ab2Ab3, Ab4a; Ba2a1, bAd."
47,Paddy from Portlaw,A,"aa1, ab; ac, a2a1."
47,Paddy from Portlaw,B,"Aa3Aa4, Aa3Ab1; aa1, Aa5Ab2."
48,The miller of Glanmire,A,"ab, a1c; a2b1, a3d."
48,The miller of Glanmire,B,"Aa2Ab1, Aa1Ac; Aa2Ab1, Aa3Ad."
49,The hare in the corn,A,"aa, bc; aa, bc1."
49,The hare in the corn,B,"Ab1Ab2, AbAc; Ab1Ab2, AbAc1."
49,The hare in the corn,C,"aa1, AbAc; aAb, ba1."
50,Daniel O'Rourke,A,"aa1, aa2; aa3, bc."
50,Daniel O'Rourke,B,"Ab1Ab2, Ab1Ab3; Ab1Ab2, Ab4Ab3."
50,Daniel O'Rourke,B1,"Ab1Ab2, Ab1Ab3; Ab1Ab2, aAc."
50,Daniel O'Rourke,C,"ab, Ab5b1; ab2, B1aAc."
51,O'Sullivan's march,A,"ab, ac; ab, dc1."
51,O'Sullivan's march,B,"ab, cc1; dAb, AdAc1."
52,Tobin's favorite,A,"ab, a1b1; ab2, cd."
52,Tobin's favorite,B,"Aa2Ac1, Aa1Ab1; AaAb2, AcAd."
53,Banish misfortune,A,"ab, cb1; ab, dc1."
53,Banish misfortune,B,"Ab2a, Aa1Ab3; Aa2a, Ad1Ac1."
53,Banish misfortune,B1,"Ab2a, Aa1Ab3; Ad2b, Ad1Ac1."
53,Banish misfortune,C,"aAc2, AaAb; Ac2Ad3, Ad1Ac1."
54,The wheels of the world,A,"ab, cb1; db, cd1."
54,The wheels of the world,B,"Ac1a, AcAb1; Ac1a, AcAd1."
54,The wheels of the world,B1,"Ac1a, AcAb1; AdAb, AcAd1."
55,Kitty come over,A,"ab, cd; ab, cd1."
55,Kitty come over,B,"ab, aAd; AaAb, AcAd1."
56,The humors of Cappa,A,"aa, ba1; aa, cd."
56,The humors of Cappa,B,"aAa1, AbAa1; aAa1, AcAd."
57,The blazing turf fire,A,"ab, a1c; ac1, da2."
57,The blazing turf fire,B,"ab, ac; aAb1, AdAa2."
58,All covered with moss,A,"ab, ac; bb1, c1d."
58,All covered with moss,A1,"ab, ac; bb1, c1d."
58,All covered with moss,B,"Ac2Ac3, Ac2Ad; Ac2Ac4, Ad1Ad2."
58,All covered with moss,B1,"Ac2Ac3, Ac2Ad; aAb2, Ab3Ad3."
59,The priest's leap,A,"ab, ac; ab1, c1b2."
59,The priest's leap,B,"aAb, aAc; aAb1, Ac1Ab2."
60,The book of rights,A,"ab, cd; ab, ca1."
60,The book of rights,B,"Aa2Aa3, aAd1; Ac1Ad1, AcAa1."
61,The humors of whiskey,A,"ab, cd; a1b1, ef."
61,The humors of whiskey,B,"aa1, a2Ad1; aa1, a3Af."
62,Fiddler's heaven,A,"ab, ab1; ab2, cd."
62,Fiddler's heaven,B,"Ac1Ac2, AcAd1; Ac1Ac3, Ac4Ad2."
63,A night at the fair,A,"ab, cb1; ab, db."
63,A night at the fair,B,"Ab2Ab3, aAb4; Ab2Ab3, a1Ab."
64,Darby the driver,A,"aa1, ba2; a3a1, ba1."
64,Darby the driver,B,"aa, ba1; ac, Ab1Aa1."
65,John White's mother,A,"ab, cc1; a1d, c2e."
65,John White's mother,B,"Ad1a, bb1; Ad1Ab1, a1Ae1."
66,The humors of Tralibane,A,"aa1, bc; aa1, b1d."
66,The humors of Tralibane,B,"Ac1a, Ac1Ad1; Ac1b, Ab2Ad."
67,Connie the soldier,A,"ab, a1a2; ab, b1a3."
67,Connie the soldier,B,"aAa4, bAa5; aAb2, Ab1Aa3."
67,Connie the soldier,B1,"aAa4, bAa5; cAb2, Aa3"
68,Out on the ocean,A,"ab, b1c; ab, b1d."
68,Out on the ocean,B,"Aa1a, a1Aa2; Ac1Aa3, Ab1Ad."
69,Philip O'Neill,A,"aa1, a2b; a3a4, ca5."
69,Philip O'Neill,B,"ab, b1Ab1; ab, AcAa5."
70,The besom in bloom,A,"ab, aa1; ac, da2."
70,The besom in bloom,B,"Ad1Ab1, AaAb; Ad1Ad2, AdAa2."
71,Courtney's favorite,A,"ab, ac; a1a1, b1c1."
71,Courtney's favorite,A1,"ab, ac; a1a1, c2c3."
71,Courtney's favorite,B,"aAb, a1Ac; a2b, c1Ac."
72,The merry old woman,A,"ab, ca1; db1, eb2."
72,The merry old woman,B,"AcAa1, Ab3a; AcAa1, Ad1Ab2."
72,The merry old woman,B1,"AcAa1, Ab3a; Ad2Ae1, Ae2Ab2."
73,Con Casey's jig,A,"ab, ac; ab1, db2."
73,Con Casey's jig,B,"Ad1a, Ad1b; Ad1c, AdAb2."
74,A trip to the cottage,A,"aa1, bb1; aa1, b2c."
74,A trip to the cottage,B,"aa1, ba2; aa1, Aa2Ac1."
75,Old man Dillon,A,"ab, cd; ae, d1f."
75,Old man Dillon,B,"Ab1Ab1, aAd; Ab1Ab1, bAf1."
75,Old man Dillon,B1,"Ab1Ab1, aAd; AaAe, Ad1Af."
76,Julia McMahon,A,"ab, a1a2; ab, ca3."
76,Julia McMahon,B,"Aa4a, Aa5Aa2; Aa4Ab1, Ac1Aa3."
76,Julia McMahon,B1,"Aa4a, Aa5Aa2; bAb2, AcAa3."
77,Drive the cows home,A,"aa1, a2a3; bc, c1d."
77,Drive the cows home,B,"Ac2Ac, Ac3Ac4; Ac2Ac, Ac1Ad."
77,Drive the cows home,B1,"Ac2Ac, Ac3Ac4; Ab1Ab2, Ac1Ad."
78,Happy to meet and sorry to part,A,"ab, cc1; db1, ef."
78,Happy to meet and sorry to part,B,"Aa1Ac2, Aa1Af1; ab, AdAb1."
78,Happy to meet and sorry to part,B1,"Aa1Ac2, Aa1Af1; ab, Ac3a1."
79,The joy of my life,A,"ab, a1b1; ab, a1c."
79,The joy of my life,B,"Ac1a, Ab2b; Ac1a, Aa1Ac."
79,The joy of my life,B1,"Ac1a, Ab2b; Ab3Ab, Aa1Ac."
80,The grumbling rustic,A,"ab, cc; ab, c1c1."
80,The grumbling rustic,B,"Aa1Ac2, AcAc; Aa1Ac2, Ac1Ac1."
80,The grumbling rustic,B1,"Aa1Ac2, AcAc; Ac3Ac4, Ac1Ac1."
81,The humors of Ballycastle,A,"ab, ab1; ab, b2c."
81,The humors of Ballycastle,B,"aa1, bb1; a2Ab, Ab2Ac."
82,Doherty's fancy,A,"ab, ab1; ab, cb2."
82,Doherty's fancy,B,"ab, aAa1; b1b2, AcAb2."
83,The girls of Banbridge,A,"aa1, a2b; aa1, cd."
83,The girls of Banbridge,B,"Aa3Ab1, Aa4Ab2; Aa3Ab1, AcAd."
84,Wellington's advance,A,"ab, ca1; ab, c1a2."
84,Wellington's advance,B,"ab, b1Aa1; Aa3Aa4, Ac1Aa2."
85,The old man's delight,A,"aa1, a2b; a3a1, ca4."
85,The old man's delight,B,"aAb1, Aa3Aa1; aAb1, Aa5Aa4."
86,Blackeyed Biddy,A,"ab, cd; ab, cd1."
86,Blackeyed Biddy,B,"aa1, Ad2Ab1; bAb, AcAd1."
87,The jolly Corkonian,A,"ab, a1c; ab1, de."
87,The jolly Corkonian,B,"Ae1Ab2, Ae2a; Ae1Ab3, Ad1Ae."
88,Willy Walsh's jig,A,"aa1, ab; ac, db1."
88,Willy Walsh's jig,B,"Ab2Ad1, Ab3a; Ab2Ad1, AdAb1."
89,The boys of the town,A,"ab, ab1; ab2, b3c."
89,The boys of the town,B,"ab, ab1; ab, Ab3Ac."
89,The boys of the town,B1,"ab, ab1; a1b1, Ab3Ac."
90,Petticoat loose,A,"ab, ac; ab1, dc."
90,Petticoat loose,A1,"ab, ac; ab1, dc1."
90,Petticoat loose,B,"Ac1Aa1, Ac2a; Ad1Aa1, Ad2Ac1."
91,The tailor's thimble,A,"aa1, a2a3; aa1, a4b."
91,The tailor's thimble,A1,"aa1, a2a3; aa1, a4b1."
91,The tailor's thimble,B,"Aa5Aa6, Ab2a; Ab3Aa7, Aa4Ab."
91,The tailor's thimble,B1,"Aa5Aa6, Ab2a; Ab3Aa7, Aa4Ab1."
92,The humors of Ballingarry,A,"ab, a1c; ab, dc."
92,The humors of Ballingarry,B,"Ad1Ab1, aa1; Ad2Ab1, Ad3Ac."
93,Palm Sunday,A,"aa1, bc; dc1, eb1."
93,Palm Sunday,B,"Ac2Ab2, Ae1a; bAc1, AeAb1."
94,The road to Lurgan,A,"aa1, ba2; a3c, b1a4."
94,The road to Lurgan,B,"aAc1, aAa5; aAc1, a1Aa4."
95,The sheep on the mountains,A,"ab, a1a1; ac, a2a2."
95,The sheep on the mountains,B,"AaAb, Aa3Aa3; AaAb, Aa2a."
95,The sheep on the mountains,C,"Ba1Ab1, Aa1Aa1; Ba1Ab1, Aa2Aa2."
95,The sheep on the mountains,D,"Ba1Ab1, Aa1Aa1; Aa4Ab1, Aa2Aa2."
96,Our own little isle,A,"ab, cd; ab, cd1."
96,Our own little isle,B,"Ab1Ab2, Ab1Ad2; Ab3Ab2, Ac1Ad."
97,The straw seat,A,"aa1, ab; aa1, cb1."
97,The straw seat,B,"Aa2Aa2, Aa3Aa3; Aa2Aa2, AcAb2."
98,The flaxdresser,A,"aa1, a2b; aa1, cb1."
98,The flaxdresser,B,"aAa3, aa1; Aa4Ac1, Ab2Ab3."
98,The flaxdresser,C,"aAa3, Ba2Ab4; aAa3, Ab2Ab3."
99,The races at Carrick,A,"aa1, a2b; aa3, a2a4."
99,The races at Carrick,B,"Ab1a, Aa5Aa1; Ab1a1, Aba2."
100,Condon's frolics,A,"ab, a1c; ab, da2."
100,Condon's frolics,B,"Ac1Ab1, Ac2Ad1; Ac1Ab1, AdAa2."
101,The idle road,A,"aa1, bc; aa1, bd."
101,The idle road,B,"Ab1Ac1, aAb2; AaAa1, AbAd."
102,Billy Barlow,A,"aa1, a2a3; bb1, cd."
102,Billy Barlow,B,"Ad1Aa1, Ad2Aa3; AbAb1, AcAd."
103,A merry christmas,A,"ab, ac; ab, a1c1."
103,A merry christmas,B,"Ac2Ab1, Aa2Ab2; Aa3Ab3, Aa1Ac1."
104,Will you come home with me?,A,"aa1, bb; aa1, b1c."
104,Will you come home with me?,B,"aAb2, AbAb; aAb2, Ab1Ac."
105,The gobby o,A,"ab, cb1; ad, a1d1."
105,The gobby o,B,"Ad2a, bAa2; Ad2a1, Aa1Ad1."
106,The humors of Mullinafauna,A,"aa1, ba2; a1c, a3c1."
106,The humors of Mullinafauna,B,"ab, Ab1b1; b2b1, Aa3Ac1."
107,Father O'Carroll,A,"aa1, bc; da1, b1c1."
107,Father O'Carroll,B,"Ab2Ad1, aAc; bAd1, Ab1Ac1."
108,The rakes of Kildare,A,"ab, cd; a1b, d1e."
108,The rakes of Kildare,B,"Ac1Ab1, AcAd; Ac1Ab1, Ad1Ae."
109,The tailor's wedding,A,"ab, a1c; ab, dc."
109,The tailor's wedding,B,"Ac1Aa2, Ac1Ac2; Ac1Ab1, AdAc."
110,My former wife,A,"ab, a1a2; ac, c1a3."
110,My former wife,B,"Aa4Ab1, Ac2a; Aa4Ab1, Ac1Aa3."
111,The sporting bachelor,A,"ab, b1b2; ab, b3b4."
111,The sporting bachelor,B,"Ab5Ab5, aAb6; bb1, cd."
112,The first night in America,A,"aa1, a2a3; aa1, a2b."
112,The first night in America,B,"Aa4Aa5, aAa6; Aa4Aa5, a1Ab."
113,The best in the bag,A,"ab, a1c; ab, b1a2."
113,The best in the bag,B,"ab, ab1; cAb, Ab1Aa2."
114,The maid on the green,A,"ab, cd; ab, c1c2."
114,The maid on the green,B,"Aa1Aa2, Aa3Ad1; Ab1Aa, AbAc2."
115,Stagger the buck,A,"ab, aa1; ac, ad."
115,Stagger the buck,B,"aAb, aAa1; aAc, AaAd."
116,Rory O'Moore,A,"aa1, bc; aa2, c1a1."
116,Rory O'Moore,B,"Ab1Ab2, Ac2a; Ab1Ab2, Ac2Ac3."
116,Rory O'Moore,B1,"Ab1Ab2, Ac2a; Ab1Ab2, Ac2a."
117,The highlander,A,"aa1, ab; a2a1, cb1."
117,The highlander,B,"ab, a1Ab1; b1b, Ac1Ab1."
118,Lannigan's ball,A,"ab, a1a2; ab, cd."
118,Lannigan's ball,B,"Ac1Ac2, Ac1Ad1; Ac1Ac2, AcAd."
119,Hide and go seek,A,"aa1, a2b; ac, a3d."
119,Hide and go seek,B,"aAa4, a1Aa5; a2Aa6, Ab1Aa7."
119,Hide and go seek,B1,"aAa4, a1Aa5; Ab2b, b1Aa7."
120,Fasten the leg in her,A,"ab, a1c; ab1, da2."
120,Fasten the leg in her,B,"ab, Aa3Ac; ab, Ad1Aa2."
121,The cliffs of Moher,A,"ab, ca1; ab, cb1."
121,The cliffs of Moher,B,"Ab2Ab2, Ab3Aa2; Ab2Ab2, Ab3Ac1."
122,Charley the prayermaster,A,"ab, a1c; ab, aa2."
122,Charley the prayermaster,B,"Ac1a, bAb1; Ac1Ab2, AaAa2."
123,Young Francis Mooney,A,"aa1, bc; aa1, db1."
123,Young Francis Mooney,B,"Ad1Ad1, Aa2Ad2; Ad1Aa3, Ad3Ab2."
124,Grandfather's pet,A,"aa, bc; aa, de."
124,Grandfather's pet,B,"Aa1Ac1, Aa1a; Aa1Ab1, bAe1."
125,Wasn't she fond of me?,A,"ab, ab1; ab, cd."
125,Wasn't she fond of me?,B,"AcAa1, AcAd; AcAb2, Ab3a."
126,Wise Nora,A,"ab, ac; ad, c1c2."
126,Wise Nora,B,"Aa1Ab, Aa1Ac2; Aa1Ad, Ac1Ac2."
126,Wise Nora,C,"aAd1, a1Ac3; aAd, Ac1Ac2."
126,Wise Nora,D,"aa1, aAc2; aa1, a2Ac2."
126,Wise Nora,E,"Da3Ad2, aAc2; Da3Ad2, Ad3Ac2."
126,Wise Nora,F,"aAb1, aAc2; aAc4, Da2Ac2."
127,The butcher's march,A,"ab, ab1; aa1, cb1."
127,The butcher's march,B,"aAb, aAb1; aAb, AcAb1."
128,Larry O'Gaff,A,"ab, cd; ab, ce."
128,Larry O'Gaff,B,"ab, a1a2; Aa1Ab, AcAe."
128,Larry O'Gaff,B1,"ab, a1a2; Aa1Ab1, AcAe."
129,The cat in the corner,A,"ab, cc; ab, da1."
129,The cat in the corner,B,"Aa2Aa2, Aa3Ab1; Ac1a, bc."
130,Ballyhooley,A,"aa1, a2b; ca1, de."
130,Ballyhooley,B,"Ab1a, Ab1Ad1; Ac1Ac2, Ad2Ae."
131,The bow-legged tailor,A,"ab, a1c; ad, ef."
131,The bow-legged tailor,B,"Ad1Ad2, Ab1Af1; Ad3Ad4, Ae1Af."
132,Larry Grogan,A,"aa1, bc; aa2, b1b2."
132,Larry Grogan,B,"aAb3, a1b; aAb3, Ab4Ab2."
133,The Killashandra lasses,A,"aa1, a2b; aa1, cb1."
133,The Killashandra lasses,B,"Ac1Ac2, Aa2Ab; Ac1Ac2, AcAb1."
133,The Killashandra lasses,B1,"Ac1Ac2, Aa2Ab; Aa3a, AcAb1."
134,Young Tim Murphy,A,"ab, b1b2; ab, b3c."
134,Young Tim Murphy,B,"Ab4Ac1, Ab5Ab6; Ab7a, a1Ac."
135,Boiled goat's milk,A,"aa1, a2a3; aa1, bc."
135,Boiled goat's milk,B,"aAb1, a1b; aAb1, AbAc."
136,(Tatter Jack Walsh),A,"ab, cb1; c1b, cd."
136,(Tatter Jack Walsh),B,"Ab2Ab3, aAb1; Ac1Ab, AcAd1."
136,(Tatter Jack Walsh),C,"Ab2Ab3, aAb1; Ac1Ab, AcAd."
137,The victor's return,A,"aa1, a2b; aa1, a3b1."
137,The victor's return,B,"ab, aAa4; ab1, a1Ab1."
138,Snug in the blanket,A,"ab, cb1; ab, c1d."
138,Snug in the blanket,B,"aa1, aa2; ab, Ac1Ad."
138,Snug in the blanket,C,"BaAc2, BaAb1; BaBb1, Ac1Ad."
139,How are you Kitty?,A,"aa, a1b; aa1, cb1."
139,How are you Kitty?,B,"Aa1a, Aa1Ab2; Aa1a1, AcAb1."
139,How are you Kitty?,C,"ab, Aa1Ab3; ab, Ac1Ab1."
140,The silken wallet,A,"aa1, a2b; aa1, cb1."
140,The silken wallet,B,"ab, a1c; a1b, Aa3Ab2."
140,The silken wallet,B1,"ab, a1c; dd1, d2c1."
141,Behind the haystack,A,"ab, a1a1; ab, cc1."
141,Behind the haystack,B,"aa1, Aa1Aa1; aa1, AcAc1."
141,Behind the haystack,C,"Ab1Ab1, Aa1Aa1; Ab1Ab1, AcAc1."
142,The jolly old man,A,"ab, a1c; ab, b1d."
142,The jolly old man,B,"ab, Aa2Ac; Aa3b, Ad1Ad."
142,The jolly old man,B1,"ab, Aa2Ac; AaAb, Ab1Ad."
143,Handy with the stick,A,"ab, ca1; ab, ca2."
143,Handy with the stick,B,"ab, cAa; da1, AcAa2."
144,The house in the glen,A,"ab, cb1; ab, de."
144,The house in the glen,B,"aAd1, aAe; ab, Ad2Ae."
145,Jackson's bottle of brandy,A,"aa1, aa2; ab, a3b1."
145,Jackson's bottle of brandy,B,"aa1, Ab2Aa4; aa1, Aa3Ab1."
146,Jackson's morning brush,A,"ab, cc1; ab, c2d."
146,Jackson's morning brush,B,"aAc3, Ac4Ac1; aAc3, bAd."
146,Jackson's morning brush,C,"Ab1Ab2, Ac4Ac1; Ab1Ab2, BbAd."
146,Jackson's morning brush,D,"Ab1Ab2, Ac4Ac1; aAb3, BbAd."
146,Jackson's morning brush,E,"BaBa1, BaAc1; BaBa1, Ba2Ad."
147,Jackson's cravat,A,"aa1, ab; aa1, cb1."
147,Jackson's cravat,B,"ab, b1Ab; ab, Aa2Ab2."
148,The Kinnegad slashers,A,"aa1, ab; ac, db1."
148,The Kinnegad slashers,B,"aa1, a2Ab2; a3b, AdAb1."
148,The Kinnegad slashers,C,"Aa2Aa1, Aa3Ab; Aa3Ac1, AdAb1."
149,The rakes of Clonmel,A,"ab, a1b1; cc1, a2b."
149,The rakes of Clonmel,B,"aAb2, a1Ab1; bAc1, Aa2Ab."
149,The rakes of Clonmel,B1,"aAb2, a1Ab1; Ac2Aa3, Aa2Ab."
149,The rakes of Clonmel,C,"Ab3Ab4, Ac3Ab5; Ac2Ac4, Aa2Ab."
150,Nancy Hynes,A,"aa1, ba2; ac, c1d."
150,Nancy Hynes,B,"Ad1Ad2, Ad3Ad4; Ad1Ad2, aAd."
150,Nancy Hynes,B1,"Ad1Ad2, Ad3Ad4; a1Aa3, Aa1Ad5."
150,Nancy Hynes,C,"Ad6Aa4, AbAa2; AaAc, Ba2Ad."
151,The pretty brown girl,A,"ab, ab1; aa1, a2b1."
151,The pretty brown girl,B,"Aa3Aa4, aAa5; aAa6, Aa2Ab1."
152,Jackson's fancy,A,"ab, b1c; a1b, a1c1."
152,Jackson's fancy,B,"Ab2a, Ab2Ac2; Ab2a, Ab3Ac1."
153,Young Tom Ennis,A,"ab, a1c; ab1, dc."
153,Young Tom Ennis,B,"Aa2Ac1, Aa2Ad1; Aa2Ac1, Aa1Ac1."
154,The Antrim lasses,A,"ab, a1b1; a2c, de."
154,The Antrim lasses,B,"Ab2Ab2, Ab3Ab3; aAc, AdAe."
155,Jackson's rambles,A,"ab, a1c; ab, a2c1."
155,Jackson's rambles,B,"Ac2a, bAc3; Ac2a, b1Ac4."
155,Jackson's rambles,B1,"Ac2a, bAc3; a1a, b1Ac4."
156,A draught of ale,A,"ab, ac; ab1, c1c2."
156,A draught of ale,B,"aAb, aAc; aAb1, Ac1Ac2."
157,The redhaired hag,A,"ab, cb1; ab2, b3a1."
157,The redhaired hag,B,"aAb2, a1Ab1; aAb4, Ab3Aa1."
158,The fairhaired boy,A,"aa1, bb1; aa1, ba2."
158,The fairhaired boy,B,"Aa3Ab2, AbAb1; Aa3Ab2, AbAa2."
158,The fairhaired boy,B1,"Aa3Ab2, AbAb1; AaAa1, AbAa2."
159,My darling asleep,A,"aa1, bc; aa1, bd."
159,My darling asleep,B,"Ab1Ab2, AbAc; AaAa1, AbAd."
160,The kneebuckle,A,"ab, a1b1; ab, cb1."
160,The kneebuckle,B,"aa1, ab; aa1, Aca."
160,The kneebuckle,C,"Ba1Ba, BbBa; Ba1Ac, Ab1"
161,The sod of turf,A,"aa1, ab; aa1, a2c."
161,The sod of turf,B,"Aa3a, Aa2Ab1; Aa3a, Aa2Ac."
162,The tenpenny bit,A,"ab, a1c; a2b, de."
162,The tenpenny bit,B,"aAb1, aAe1; Ac1Ab2, Ae2Ae."
163,The fisherman's widow,A,"ab, cd; ab, a1b1."
163,The fisherman's widow,B,"Aa2Ab2, Aa2Ab3; Aa2Ab, Aa1Ab1."
163,The fisherman's widow,B1,"Aa2Ab2, Aa2Ab3; Ad1Ad2, Aa3Ab1."
164,The ladies of Carrick,A,"aa1, aa2; aa3, a4a2."
164,The ladies of Carrick,B,"aa1, aAa2; aa1, Aa4Aa2."
165,Charlie Stewart,A,"ab, b1a1; cb2, b3c1."
165,Charlie Stewart,B,"aAb3, aAa1; aAb3, bAc1."
166,Jack-of-all-trades,A,"ab, cc1; ab, cb1."
166,Jack-of-all-trades,B,"Ac2Ab2, aAb2; Ac3b, Ac4Ab1."
167,The boys of Ballinamore,A,"ab, a1c; ab, a1a2."
167,The boys of Ballinamore,B,"ab, ac; ab, dAc."
168,Miss Blair's fancy,A,"aa1, bc; aa2, b1d."
168,Miss Blair's fancy,B,"Ad1a, Aa3a1; ba, Ab1Ad."
168,Miss Blair's fancy,B1,"Ad1a, Aa3a1; b1Ac1, Ab1Ad."
169,Easter Sunday,A,"ab, ca1; a2b, da3."
169,Easter Sunday,B,"ab, ac; ad, a1c1."
170,Jackson's rolling jig,A,"ab, ac; ab, dc1."
170,Jackson's rolling jig,B,"Aa1Ab, Aa1Ac2; Aa1Ab, AdAc1."
171,The runaway bride,A,"aa1, bc; a2a1, da3."
171,The runaway bride,B,"aAa4, Aa5Ac; AaAa1, Ad1Aa3."
172,Black Donald the piper,A,"aa1, ab; a2a1, a3b."
172,Black Donald the piper,B,"Aa4a, Aa4Ab; Aa4a, Aa3Ab."
173,The dandy bonnet,A,"ab, a1c; c1c2, da2."
173,The dandy bonnet,B,"Ad1a, Ad2b; Ad1a1, cAa2."
174,The humors of Trim,A,"ab, ac; ab, c1c."
174,The humors of Trim,B,"AbAb1, b1Ac; AbAb2, Ac1Ac."
175,The end of the day,A,"ab, cc1; ab1, c2d."
175,The end of the day,B,"aAd1, aAd2; aa1, Ac2Ad."
176,Owen Malone,A,"aa, bc; aa, de."
176,Owen Malone,B,"aAc1, aAa1; aAc1, AdAe."
177,Bessy Murphy,A,"ab, b1c; ab, a1d."
177,Bessy Murphy,B,"Ab2Ab, Ab1Ac; Ab2Ab, Aa1Ad."
178,Paddy O'Rafferty,A,"ab, ac; ab1, bc."
178,Paddy O'Rafferty,B,"aAb2, aAc; aa1, AbAc."
178,Paddy O'Rafferty,C,"aAc1, aAc; aAb1, Aca."
178,Paddy O'Rafferty,D,"Ac1Ca, AcCa; Ab1Ac, aAb3."
178,Paddy O'Rafferty,E,"DaAc, DaCa1; AbAc, DaAb3."
178,Paddy O'Rafferty,E1,"DaAc, DaCa1; AbAc, aa1."
178,Paddy O'Rafferty,F,"E1a1Ac, Da1Ca2; AbAc, E1aE1a1."
178,Paddy O'Rafferty,F1,"E1a1Ac, Da1Ca2; AbAc, "
179,I do not incline,A,"ab, cc1; ab1, c2d."
179,I do not incline,B,"aa1, Ad1Ac1; AaAb, Ac2Ad."
180,The Gaelic club,A,"aa1, a2b; ac, c1d."
180,The Gaelic club,B,"aa1, aAd1; AaAc, Ac1Ad."
181,The market town,A,"ab, cc1; ab1, db2."
181,The market town,B,"Aa1a, AcAc2; Aa1a, AdAb2."
181,The market town,B1,"Aa1a, AcAc2; Ac3a1, AdAb2."
182,The humors of Castlelyons,A,"aa1, bc; aa1, bd."
182,The humors of Castlelyons,B,"Ac1Ac1, AbAc; Ac1Ac1, Ab1Ad."
182,The humors of Castlelyons,B1,"Ac1Ac1, AbAc; Aaa, AbAd."
183,The dancingmaster,A,"aa1, a2b; ab1, ba3."
183,The dancingmaster,B,"aAb2, ab; aAb2, AbAa3."
184,Farewell to my troubles,A,"ab, b1c; ab, de."
184,Farewell to my troubles,B,"aAa1, bAc1; Aa2Ab, AdAe."
185,The tongs by the fire,A,"aa1, bb1; aa1, b2c."
185,The tongs by the fire,B,"aa1, Ac1b; Ab3b1, a2b2."
186,The thief of Lough Erne,A,"ab, cc1; ab, c2c2."
186,The thief of Lough Erne,B,"Ac3Ac3, Ac4a; Ac3Ac3, AbAc2."
186,The thief of Lough Erne,B1,"Ac3Ac3, Ac4a; Ac3Ab1, AbAc2."
187,Scatter the mud,A,"aa1, ab; aa2, cd."
187,Scatter the mud,B,"aAd1, aAb; bAd2, AcAd."
188,The priest and his boots,A,"ab, b1c; db, ef."
188,The priest and his boots,B,"Ac1Ac2, Ab1Ac; Af1Af2, AeAf."
189,The three little drummers,A,"ab, ac; ab, c1d."
189,The three little drummers,B,"aAb1, aAc1; aAb1, Ac1Ad."
189,The three little drummers,C,"Ba1Ab2, Ba1Ab3; Ba1Ab2, Ac1Ad."
190,O'Mahony's frolics,A,"ab, cc; ab, c1a1."
190,O'Mahony's frolics,B,"Aa2Aa3, Aa4Ab1; Aa2a, a1b."
190,O'Mahony's frolics,B1,"Aa2Aa3, Aa4Ab1; cc1, Ac1Aa1."
191,The Limerick tinker,A,"aa1, a2b; ac, b1d."
191,The Limerick tinker,B,"ab, aAd1; ab1, Ab1Ad."
191,The Limerick tinker,C,"Ac1Bb1, Ac1Ab2; Aa3a, Ab1Ad."
192,The boy from the mountain,A,"ab, ac; aa1, b1c."
192,The boy from the mountain,A1,"ab, ac; aa1, b1c1."
192,The boy from the mountain,B,"Aa2Ab1, Aa2a; Aa2b, Ab1Aa3."
192,The boy from the mountain,C,"Aa2Ab1, Aa2Ba; ab, Ab1Ac."
193,The woodcock,A,"aa, a1b; aa, a2c."
193,The woodcock,A1,"aa, a1b; aa, a2d."
193,The woodcock,B,"aAb1, Aa1Ab2; aAb1, Aa2A1d1."
193,The woodcock,C,"aAb1, Aa1Ab2; aAb1, Aa2A1d."
194,Dunmanway lasses,A,"aa1, ab; aa1, cc1."
194,Dunmanway lasses,B,"Aa2a, Aa2a1; bAa3, Aa4Ac1."
195,The boys of Ballinafad,A,"aa1, bc; ad, d1d2."
195,The boys of Ballinafad,B,"AaAb1, Aa2Aa3; AaAb1, Ac1Ad2."
196,Let it be so,A,"ab, ab1; ab2, cd."
196,Let it be so,B,"aAb3, a1b; a2Ab4, AaAd."
197,The short grass,A,"ab, ac; ab, c1c2."
197,The short grass,B,"aAc3, a1Ac4; aAc3, bc."
197,The short grass,B1,"aAc3, a1Ac4; b1b2, Ac1Ac2."
198,Miss Monroe's jig,A,"ab, a1c; ab, a2c1."
198,Miss Monroe's jig,B,"Ab1Ab2, Aa3Ac2; Aa3Ac3, Aa2Ac1."
199,The spotted cow,A,"aa, ab; aa, cb1."
199,The spotted cow,B,"aa, a1Ab1; bb, cAb1."
199,The spotted cow,C,"Ac1a, Ac1Ab; Ac1a, AcAb1."
200,Daniel of the sun,A,"ab, cc; ab, c1c1."
200,Daniel of the sun,B,"aAb1, Ac2Ac; bAb1, Ac1Ac1."
200,Daniel of the sun,C,"aAb2, AcAc; AaAb, Ac1Ac1."
201,Biddy's wedding,A,"ab, ab1; ab, cb1."
201,Biddy's wedding,B,"Aa1a, Aa1Ab1; Aa2Ab2, AcAb1."
202,Paddy O'Carroll,A,"ab, a1b1; ab2, a1b3."
202,Paddy O'Carroll,B,"Aa2Ab4, ab; Aa2Ab4, Aa1Ab3."
203,Haste to the wedding,A,"ab, a1c; ab, dc1."
203,Haste to the wedding,B,"Aa2Aa3, Aa4Ac2; aAb, AdAc1."
204,The little house under the hill,A,"aa1, ab; aa2, a3b."
204,The little house under the hill,B,"aa1, aAb; aAb1, Aa4Ab."
204,The little house under the hill,C,"aa1, aAb; aa2, Aa5Ab."
205,Breeches Mary,A,"ab, cb1; ab, b2d."
205,Breeches Mary,B,"Ab3Ac1, Ab3Ab4; Ab3Ac1, Ab2Ad."
206,Jimmy O'Brien's jig,A,"ab, cb; a1b, c1d."
206,Jimmy O'Brien's jig,B,"aa1, aAd1; aa1, Ac1Ad."
206,Jimmy O'Brien's jig,C,"ab, aAd2; ab, Ac1Ad."
207,I will if I can,A,"ab, ab1; ac, c1b2."
207,I will if I can,B,"Ac2Ab3, Ac2Ab1; Ac2Ac, c1Ab4."
208,Miss Wiseman's fancy,A,"ab, cc1; ab, c2a1."
208,Miss Wiseman's fancy,B,"aa1, bc; aa1, Ac2Aa1."
208,Miss Wiseman's fancy,C,"aAb, bBc1; Aa2Ab, Ac2Aa1."
209,Green sleeves,A,"aa1, a2b; aa1, ca3."
209,Green sleeves,B,"aAb1, a1Aa4; aAa1, AcAa3."
210,The miners of Wicklow,A,"ab, cc1; ab1, b2b3."
